kode,nama,link_profil,alamat,kabupaten,kota,provinsi
69971820,SMA NEGERI 1 BATU KETULIS,https://sekolah.data.kemdikbud.go.id/index.php/Chome/profil/45270ADE-04B7-4F0F-A6E6-9B931445C492,Jl. SMA Batu Kebayan Kec. Batu Ketulis Kab. Lampung Barat Prov. Lampung,Kab. Lampung Barat,,Lampung
20539244,SMAS YAPITA,https://sekolah.data.kemdikbud.go.id/index.php/Chome/profil/D2F32311-1658-411C-91CF-9B934FF73E28,JL. ARIF RAHMAN HAKIM NO. 19 Keputih Kec. Sukolilo Kota Surabaya Prov. Jawa Timur,,Kota Surabaya,Jawa Timur
20100608,SMAS PGRI 12 JAKARTA,https://sekolah.data.kemdikbud.go.id/index.php/Chome/profil/45DF5A9B-7CE0-4153-A68C-9B956F6F6CB5,JL. TABAH I NO. 5 Kelapa Gading Barat Kec. Kelapa Gading Kota Adm. Jakarta Utara Prov. D.K.I. Jakarta,,Kota Adm. Jakarta Utara,D.K.I. Jakarta
20101353,SMAS FATAHILLAH,https://sekolah.data.kemdikbud.go.id/index.php/Chome/profil/C0A4C44F-C834-42DB-A52F-9BA53471E9C7,JL. DR. SEMERU RAYA NO. 1 Grogol Kec. Grogol Petamburan Kota Adm. Jakarta Barat Prov. D.K.I. Jakarta,,Kota Adm. Jakarta Barat,D.K.I. Jakarta
40405077,SMAN 18 KONAWE SELATAN,https://sekolah.data.kemdikbud.go.id/index.php/Chome/profil/18629324-E062-4EC6-A20D-9BA6CE3FA07C,JL. POROS KENDARI-PARASI PARASI Kec. Palangga Selatan Kab. Konawe Selatan Prov. Sulawesi Tenggara,Kab. Konawe Selatan,,Sulawesi Tenggara
70014798,SMA IT QOLBUN SALIM,https://sekolah.data.kemdikbud.go.id/index.php/Chome/profil/383989E1-02DB-4405-9ED0-9BB1721A60F7,Jln Merdeka Desa Talang Bulang Talang Bulang KEC. TALANG UBI Kab. Penukal Abab Lematang Ilir Prov. Sumatera Selatan,Kab. Penukal Abab Lematang Ilir,,Sumatera Selatan
60301899,SMA Yapis Nabire,https://sekolah.data.kemdikbud.go.id/index.php/Chome/profil/AFCD27A8-57A0-47C0-B6EB-9BB266693296,Jl. Ampera No 12 Karang Mulia Kec. Nabire Kab. Nabire Prov. Papua Tengah,Kab. Nabire,,Papua Tengah
70049298,SMA ISLAM TERPADU AL-FIRDAUS MAMOENTA,https://sekolah.data.kemdikbud.go.id/index.php/Chome/profil/BDF0AADF-FA97-4207-8A6B-9BB3C4F0A7A0,Jl. Pantai Mamonta Desa Seppong Kec. Bel... Seppong Kec. Belopa Utara Kab. Luwu Prov. Sulawesi Selatan,Kab. Luwu,,Sulawesi Selatan
69753914,SMAS DARUT TAUHID,https://sekolah.data.kemdikbud.go.id/index.php/Chome/profil/F9AD201F-F605-47C7-B852-9BB4A3C26075,JL. RAYA KATOL BARAT Katol Barat Kec. Geger Kab. Bangkalan Prov. Jawa Timur,Kab. Bangkalan,,Jawa Timur
30304280,SMAN 1 BANJARMASIN,https://sekolah.data.kemdikbud.go.id/index.php/Chome/profil/D5C3CC66-BF9A-4F34-99C9-9BB4BADDC78B,JL. MULAWARMAN NO. 25 Teluk Dalam Kec. Banjarmasin Tengah Kota Banjarmasin Prov. Kalimantan Selatan,,Kota Banjarmasin,Kalimantan Selatan
20402810,SMA NEGERI 1 PENGASIH,https://sekolah.data.kemdikbud.go.id/index.php/Chome/profil/482B2907-4B0A-4E80-AC39-9BB785ECF6BF,JL. KRT KERTODININGRAT 41 Margosari Kec. Pengasih Kab. Kulon Progo Prov. D.I. Yogyakarta,Kab. Kulon Progo,,D.I. Yogyakarta
20514349,SMAN 1 KESAMBEN,https://sekolah.data.kemdikbud.go.id/index.php/Chome/profil/4A7E9782-4A17-40B0-98DF-9BBA2CF150BD,JL. BROMO KOTAK POS 14 KESAMBEN Kesamben Kec. Kesamben Kab. Blitar Prov. Jawa Timur,Kab. Blitar,,Jawa Timur
69949668,SMA ISLAM AL QADIR QOMARUL HUDA MENEMENG,https://sekolah.data.kemdikbud.go.id/index.php/Chome/profil/503A4B74-6B9C-4F29-8DC6-9BBAB6858002,Menemeng MENEMENG Kec. Pringgarata Kab. Lombok Tengah Prov. Nusa Tenggara Barat,Kab. Lombok Tengah,,Nusa Tenggara Barat
30107350,SMAS SANTA URSULA,https://sekolah.data.kemdikbud.go.id/index.php/Chome/profil/4028DDDC-774D-4D3A-8356-9BC15B2EA560,JL.RAYA TIANG TANJUNG Tiang Tanjung Kec. Mempawah Hulu Kab. Landak Prov. Kalimantan Barat,Kab. Landak,,Kalimantan Barat
30108133,SMAN 1 SAJAD,https://sekolah.data.kemdikbud.go.id/index.php/Chome/profil/F9CF0F11-89F3-4059-9CFA-9BC279E79EBE,DESA TENGGULI KECAMATAN SAJAD Tengguli Kec. Sajad Kab. Sambas Prov. Kalimantan Barat,Kab. Sambas,,Kalimantan Barat
30402591,SMAN 1 BUNYU,https://sekolah.data.kemdikbud.go.id/index.php/Chome/profil/E2BB4D45-8E07-4AEC-8D01-9BC39BFD61A7,JL. Manunggal RT 11 Bunyu Barat Kec. Pulau Bunyu Kab. Bulungan Prov. Kalimantan Utara,Kab. Bulungan,,Kalimantan Utara
10208460,SMAN 1 LAGU BOTI,https://sekolah.data.kemdikbud.go.id/index.php/Chome/profil/902AC97D-FFD9-4DF8-A56B-9BC56FF09A27,JL. Sekolah No. 3 Laguboti Pasar Lagu Boti Kec. Lagu Boti Kab. Toba Prov. Sumatera Utara,Kab. Toba,,Sumatera Utara
69982031,SMAN 8 TAMBUN SELATAN,https://sekolah.data.kemdikbud.go.id/index.php/Chome/profil/FE948FD3-09B7-447B-8235-9BCBBADADFE6,Jl. Sasak Bakar Utama Tambun Kec. Tambun Selatan Kab. Bekasi Prov. Jawa Barat,Kab. Bekasi,,Jawa Barat
20233667,SMAS RIYADHUL JANNAH CIMENTENG,https://sekolah.data.kemdikbud.go.id/index.php/Chome/profil/8926AC47-8CF4-491A-B537-9BD015FF669F,Jl. Raya Cimenteng RT. 03 RW. 01 Cimenteng Kec. Cijambe Kab. Subang Prov. Jawa Barat,Kab. Subang,,Jawa Barat
69965480,SMA IT KHAZANAH KEBAJIKAN PALEMBANG,https://sekolah.data.kemdikbud.go.id/index.php/Chome/profil/B0142A68-6FF9-4064-9767-9BD5DB2749E1,Jl. Sematang Borang No. 1266 RT.25 RW.11 Sako Kec. Sako Kota Palembang Prov. Sumatera Selatan,,Kota Palembang,Sumatera Selatan
40300291,SMAS DDI MAROS,https://sekolah.data.kemdikbud.go.id/index.php/Chome/profil/B577497A-E517-4787-B75D-9BD61F333F3C,JL. TAQWA NO. 2 MAROS Alliritengae Kec. Turikale Kab. Maros Prov. Sulawesi Selatan,Kab. Maros,,Sulawesi Selatan
40311893,SMAN 6 MAKASSAR,https://sekolah.data.kemdikbud.go.id/index.php/Chome/profil/491A9F5C-427C-4DCC-83B2-9BD85204E283,JL.PROF.DRIR.SUTAMI NO.4 Bira Kec. Tamalanrea Kota Makassar Prov. Sulawesi Selatan,,Kota Makassar,Sulawesi Selatan
69875557,SMA NEGERI HARMONI,https://sekolah.data.kemdikbud.go.id/index.php/Chome/profil/3FF14A2E-EF39-433C-B6C0-9BD8DC503FF9,Jalan Trans Sulawesi Sulewana Kec. Pamona Utara Kab. Poso Prov. Sulawesi Tengah,Kab. Poso,,Sulawesi Tengah
69795838,SMA N 2 ULU BELU,https://sekolah.data.kemdikbud.go.id/index.php/Chome/profil/59118CCF-1E2B-40A6-AB9D-9BDBD38E63A5,Jl. Tanjung Baru Tanjung Baru Kec. Ulu Belu Kab. Tanggamus Prov. Lampung,Kab. Tanggamus,,Lampung
20540048,SMAS ANTARTIKA,https://sekolah.data.kemdikbud.go.id/index.php/Chome/profil/D78DE07A-E296-4CB9-9790-9BE2636EC2F8,JL. SIWALANPANJI NO. 6 Siwalan Panji Kec. Buduran Kab. Sidoarjo Prov. Jawa Timur,Kab. Sidoarjo,,Jawa Timur
69960753,SMA MUHAMMADIYAH KELAPA DUA,https://sekolah.data.kemdikbud.go.id/index.php/Chome/profil/0C045A81-4442-442D-95BA-9BE70A75B4C7,Dusun Kelapa Dua Kairatu Kec. Kairatu Kab. Seram Bagian Barat Prov. Maluku,Kab. Seram Bagian Barat,,Maluku
10101884,SMA NEGERI 1 RANTO PEUREULAK,https://sekolah.data.kemdikbud.go.id/index.php/Chome/profil/25E3724A-99D4-433E-9C33-9BE8098CD909,JL. RANTAU PEUREULAK Blang Barom Kec. Ranto Peureulak Kab. Aceh Timur Prov. Aceh,Kab. Aceh Timur,,Aceh
50219566,SMAN 1 ORONG TELU,https://sekolah.data.kemdikbud.go.id/index.php/Chome/profil/B21905F7-4C37-4AED-B007-9BE96238B987,JL. LINTAS LENANGGUAR-BATUROTOK KM. 30 Kelawis Kec. Orong Telu Kab. Sumbawa Prov. Nusa Tenggara Barat,Kab. Sumbawa,,Nusa Tenggara Barat
20331912,SMA SEPULUH NOPEMBER,https://sekolah.data.kemdikbud.go.id/index.php/Chome/profil/B25F1AC1-5447-41D2-87D8-9BE96507835A,JL. WONODRI SENDANG I NO. 4 Wonodri Kec. Semarang Selatan Kota Semarang Prov. Jawa Tengah,,Kota Semarang,Jawa Tengah
20305446,SMAS PGRI 1 KEBUMEN,https://sekolah.data.kemdikbud.go.id/index.php/Chome/profil/445A0AFC-BEDB-4266-89DA-9BECA65E8266,JL. KRAKATAU Bumirejo Kec. Kebumen Kab. Kebumen Prov. Jawa Tengah,Kab. Kebumen,,Jawa Tengah
20546978,SMA NEGERI 1 KEREK TUBAN,https://sekolah.data.kemdikbud.go.id/index.php/Chome/profil/35CD9855-FB98-4D96-88D2-9BEFED7A8687,Jl. Raya Kerek-Montong Jarorejo Kec. Kerek Kab. Tuban Prov. Jawa Timur,Kab. Tuban,,Jawa Timur
20240402,SMAS MEKARWANGI LEMBANG,https://sekolah.data.kemdikbud.go.id/index.php/Chome/profil/40109921-F198-44A8-975D-9C0D550965F6,JL. BUKAMANAH DESA LANGENSARI KEC. LEMBA... Langensari Kec. Lembang Kab. Bandung Barat Prov. Jawa Barat,Kab. Bandung Barat,,Jawa Barat
70051695,SMA IT MD FATHAHILLAH,https://sekolah.data.kemdikbud.go.id/index.php/Chome/profil/4AC845B6-BF9B-4D3B-8AF8-9C0FFBD95553,Jl. Pasanggrahan-Saguling RT.05 RW.08 Saguling Kec. Baregbeg Kab. Ciamis Prov. Jawa Barat,Kab. Ciamis,,Jawa Barat
30401681,SMAS MUHAMMADIYAH TARAKAN,https://sekolah.data.kemdikbud.go.id/index.php/Chome/profil/829C95FA-3C81-4BC0-9318-9C1485260681,LADANG III NO. 1 Pamusian Kec. Tarakan Tengah Kota Tarakan Prov. Kalimantan Utara,,Kota Tarakan,Kalimantan Utara
20217408,SMAN 1 DARANGDAN,https://sekolah.data.kemdikbud.go.id/index.php/Chome/profil/F3A18CFF-5078-4429-9BFA-9C1519105182,JL. RAYA  SAWIT BOJONG  KM. 1 DARANGDAN Sawit Kec. Darangdan Kab. Purwakarta Prov. Jawa Barat,Kab. Purwakarta,,Jawa Barat
70051978,SMA-IT Nurul Hidayah Assiddiqiyah,https://sekolah.data.kemdikbud.go.id/index.php/Chome/profil/E82129C1-1C2F-47D0-AC74-9C1FAAE2D650,Kp. Situgaru RT.002 RW.005 Desa Panjangj... Panjangjaya Kec. Mandalawangi Kab. Pandeglang Prov. Banten,Kab. Pandeglang,,Banten
20223052,SMAS HUTAMA,https://sekolah.data.kemdikbud.go.id/index.php/Chome/profil/7D9CDB1C-063D-41F1-8925-9C245DDB4161,JL. RAYA HANKAM NO.68 Jatirahayu Kec. Pondok Melati Kota Bekasi Prov. Jawa Barat,,Kota Bekasi,Jawa Barat
70055489,Sekolah Rakyat Menengah Atas Terintegrasi 14 Kaur,https://sekolah.data.kemdikbud.go.id/index.php/Chome/profil/A53C0CF4-F0B2-418B-9B79-9C292503731B,"Jl. Pondok Pusaka, Padang Petron, Kecama... Padang Petron Kec. Kaur Selatan Kab. Kaur Prov. Bengkulu",Kab. Kaur,,Bengkulu
10609398,SMAS XAVERIUS 5 BELITANG,https://sekolah.data.kemdikbud.go.id/index.php/Chome/profil/2F114E13-85D0-427B-8134-9C2C19A9AF99,Jln. Belitang Martapura BK. 9 OKU TIMUR ... Serbaguna Kec. Belitang Kab. Ogan Komering Ulu Timur Prov. Sumatera Selatan,Kab. Ogan Komering Ulu Timur,,Sumatera Selatan
10802988,SMAS ISLAM IBNU RUSYD KTB,https://sekolah.data.kemdikbud.go.id/index.php/Chome/profil/843AF27C-D0CD-4F99-98C0-9C3628EAF8DF,JL. SOEKARNO HATTA NO. 103 Tanjung Harapan Kec. Kotabumi Selatan Kab. Lampung Utara Prov. Lampung,Kab. Lampung Utara,,Lampung
70047311,SMA Mukhtar Syafaat,https://sekolah.data.kemdikbud.go.id/index.php/Chome/profil/BE869BE7-0067-4B89-8929-9C3A6AA1BED1,Jl. Prabumulih Baturaja Dusun II Lecah Kec. Lubai Ulu Kab. Muara Enim Prov. Sumatera Selatan,Kab. Muara Enim,,Sumatera Selatan
10212196,SMAS HARAPAN PADANG SIDIMPUAN,https://sekolah.data.kemdikbud.go.id/index.php/Chome/profil/8753A8CB-BC2B-435F-8108-9C3EAE3E2CA2,JL. RAYA ANGKOLA JULU Joring Natobang Kec. Angkola Julu Kota Padang Sidempuan Prov. Sumatera Utara,,Kota Padang Sidempuan,Sumatera Utara
10110564,SMA NEGERI 1 BUBON,https://sekolah.data.kemdikbud.go.id/index.php/Chome/profil/30760071-6DF7-48F8-B274-9C48084429F2,JL. MEULABOH - KUALA BHEE Layung Kec. Bubon Kab. Aceh Barat Prov. Aceh,Kab. Aceh Barat,,Aceh
10814062,SMAN 1 LABUHAN RATU,https://sekolah.data.kemdikbud.go.id/index.php/Chome/profil/9E1B038C-B261-4025-A15C-9C489F8B9014,JL. SUTAN LIYU KM 2 Labuhan Ratu Kec. Labuhan Ratu Kab. Lampung Timur Prov. Lampung,Kab. Lampung Timur,,Lampung
20606295,SMAS AL MUNAWAROH,https://sekolah.data.kemdikbud.go.id/index.php/Chome/profil/042A06FF-C9F0-4198-B34D-9C519D75010C,JL. H. LEMAN PINTU AIR NO. 45 GEREM RAYA Gerem Kec. Grogol Kota Cilegon Prov. Banten,,Kota Cilegon,Banten
20623136,SMAS ISLAM TERPADU ALIA TANGERANG,https://sekolah.data.kemdikbud.go.id/index.php/Chome/profil/65228260-C685-498C-ABFB-9C54735BE40E,PERUM DASANA INDAH BLOK SO RT. 05/16 Bojong Nangka Kec. Kelapa Dua Kab. Tangerang Prov. Banten,Kab. Tangerang,,Banten
10310900,SMAS EXCELLENT NURUL IKHLAS,https://sekolah.data.kemdikbud.go.id/index.php/Chome/profil/F135DB4A-6A7C-4DF8-92EA-9C58829A0C4A,PINCURAN TINGGI PANYALAIAN Kec. X Koto Kab. Tanah Datar Prov. Sumatera Barat,Kab. Tanah Datar,,Sumatera Barat
20339014,SMA RIFAIYAH KAYEN,https://sekolah.data.kemdikbud.go.id/index.php/Chome/profil/CBB223B8-8D13-485A-AF70-9C5D9B35C4F3,"JL. RAYA PATI - KAYEN KM. 12,2 SUNDOLUHU... Sundoluhur Kec. Kayen Kab. Pati Prov. Jawa Tengah",Kab. Pati,,Jawa Tengah
40201326,SMAN 1 PAMONA SELATAN,https://sekolah.data.kemdikbud.go.id/index.php/Chome/profil/D17840C8-7CB5-4080-A464-9C5DD47C0AD8,JL. S. PARMAN NO. 438 PASIR PUTIH Kec. Pamona Selatan Kab. Poso Prov. Sulawesi Tengah,Kab. Poso,,Sulawesi Tengah
20532170,SMAS MARYAM,https://sekolah.data.kemdikbud.go.id/index.php/Chome/profil/4A9A8B7C-C735-4E76-AE2C-9C6051D21BD0,JL. MANYAR SAMBONGAN 119 Kertajaya Kec. Gubeng Kota Surabaya Prov. Jawa Timur,,Kota Surabaya,Jawa Timur
20517817,SMAS NAHDLATUL ULAMA PAKIS,https://sekolah.data.kemdikbud.go.id/index.php/Chome/profil/054B392C-D474-4882-8D0A-9C64E1C896F0,JL. H. MUSTOFA 108 PAKIS Pakiskembar Kec. Pakis Kab. Malang Prov. Jawa Timur,Kab. Malang,,Jawa Timur
69879772,SMA TUNAS MUDA KAWASI,https://sekolah.data.kemdikbud.go.id/index.php/Chome/profil/83F25895-F455-49D0-A076-9C67A5F1BCC9,Jalan Siswa Kawasi Kec. Obi Kab. Halmahera Selatan Prov. Maluku Utara,Kab. Halmahera Selatan,,Maluku Utara
70031540,SMAN 14 KOTA JAMBI,https://sekolah.data.kemdikbud.go.id/index.php/Chome/profil/2F5E1F10-87AC-4BF7-A828-9C687896736B,Jln. Ismail Malik Mayang Mangurai Kec. Alam Barajo Kota Jambi Prov. Jambi,,Kota Jambi,Jambi
69856918,SMAS IT BAITURROHMAN,https://sekolah.data.kemdikbud.go.id/index.php/Chome/profil/22F55668-EA72-402F-8268-9C689752806A,Kp. Solokpandan 01/ 02 Sirnajaya Kec. Tarogong Kaler Kab. Garut Prov. Jawa Barat,Kab. Garut,,Jawa Barat
30208764,SMAN 1 BUKIT RAYA,https://sekolah.data.kemdikbud.go.id/index.php/Chome/profil/E2E9C89E-16BB-403E-BD65-9C6C1AA3D6D2,Jalan Raden Sura Rakit Tumbang Kajamei Kec. Bukit Raya Kab. Katingan Prov. Kalimantan Tengah,Kab. Katingan,,Kalimantan Tengah
20232311,SMA ISLAM TERPADU AL-MADINAH,https://sekolah.data.kemdikbud.go.id/index.php/Chome/profil/60187157-9D1C-4AC8-915D-9C6F8DE20A00,JL. SUKAHATI NO. 36 RT.3 RW.10 Karadenan Kec. Cibinong Kab. Bogor Prov. Jawa Barat,Kab. Bogor,,Jawa Barat
30402588,SMA BULUNGAN,https://sekolah.data.kemdikbud.go.id/index.php/Chome/profil/631480C3-E556-417F-BDDB-9C730CDB8FCA,JL. HAJI MASKUR Tanjung Selor Hilir Kec. Tanjung Selor Kab. Bulungan Prov. Kalimantan Utara,Kab. Bulungan,,Kalimantan Utara
69946362,SMAN 1 SUMBER MARGA TELANG,https://sekolah.data.kemdikbud.go.id/index.php/Chome/profil/DC3D68ED-3420-4F7A-954A-9C7437920848,Jalur 3 Sumber Jaya Kec. Sumber Marga Telang Kab. Banyuasin Prov. Sumatera Selatan,Kab. Banyuasin,,Sumatera Selatan
30103588,SMAS PGRI TUMBANG TITI,https://sekolah.data.kemdikbud.go.id/index.php/Chome/profil/210254A4-0ECE-425F-B232-9C74A9B94795,JL. DERMALA MERIAL NO. 12 TUMBANG TITI Tumbang Titi Kec. Tumbang Titi Kab. Ketapang Prov. Kalimantan Barat,Kab. Ketapang,,Kalimantan Barat
20529971,SMAN 1 GAYAM,https://sekolah.data.kemdikbud.go.id/index.php/Chome/profil/005CC059-DFE5-4677-B315-9C7561585BEC,Jl. Raya Banasem Gayam Kec. Gayam Kab. Sumenep Prov. Jawa Timur,Kab. Sumenep,,Jawa Timur
10404021,SMAS YLPI PEKANBARU,https://sekolah.data.kemdikbud.go.id/index.php/Chome/profil/EA9B8361-EAA0-4502-B0E2-9C75FB46B935,JL.KAHARUDDIN NASUTION KM 11 Simpang Tiga Kec. Bukit Raya Kota Pekanbaru Prov. Riau,,Kota Pekanbaru,Riau
69949263,SMA NEGERI 1 DANAU SELULUK,https://sekolah.data.kemdikbud.go.id/index.php/Chome/profil/7BB48829-75E0-45CE-A563-9C78C24BEF15,KM 121 Sampit - Pangkalan Bun Desa Asam Baru Kec. Danau Seluluk Kab. Seruyan Prov. Kalimantan Tengah,Kab. Seruyan,,Kalimantan Tengah
10220521,SMAN 1 SIBABANGUN,https://sekolah.data.kemdikbud.go.id/index.php/Chome/profil/E0786814-B25F-427E-B535-9C81BF449AED,JL. M. SORIMUDA Sibabangun Kec. Sibabangun Kab. Tapanuli Tengah Prov. Sumatera Utara,Kab. Tapanuli Tengah,,Sumatera Utara
50304935,SMAS MUHAMMADIYAH KUPANG,https://sekolah.data.kemdikbud.go.id/index.php/Chome/profil/4BB5874C-EEA6-4B7A-8D25-9C8B2C7C8F2A,JL. K.H. AHMAD DAHLAN NO. 17 A Kayu Putih Kec. Oebobo Kota Kupang Prov. Nusa Tenggara Timur,,Kota Kupang,Nusa Tenggara Timur
60205562,SMAN 9 HALMAHERA TIMUR,https://sekolah.data.kemdikbud.go.id/index.php/Chome/profil/C2346B26-434D-4859-A528-9C8EC4DA80B2,Jln. Trans Halmahera Dorosago Kec. Maba Utara Kab. Halmahera Timur Prov. Maluku Utara,Kab. Halmahera Timur,,Maluku Utara
20247152,SMAS INSAN CENDEKIA  AL KAUSAR,https://sekolah.data.kemdikbud.go.id/index.php/Chome/profil/6AB89A0B-9C8A-4F13-BA01-9C8F6D339E08,JL. HABIB BABAKAN JAYA  PARUNGKUDA-SUKAB... Babakanjaya Kec. Parungkuda Kab. Sukabumi Prov. Jawa Barat,Kab. Sukabumi,,Jawa Barat
69897285,SMAN 2 PENUKAL,https://sekolah.data.kemdikbud.go.id/index.php/Chome/profil/BAA3E218-AA8A-4197-B6EB-9C936E04E3BF,Jln.Lintas Sekayu Simpang Belimbing Desa... Mangkunegara Kec. Penukal Kab. Penukal Abab Lematang Ilir Prov. Sumatera Selatan,Kab. Penukal Abab Lematang Ilir,,Sumatera Selatan
20307677,SMA NEGERI 1 DUKUN,https://sekolah.data.kemdikbud.go.id/index.php/Chome/profil/A0CDBD23-3C73-4342-9A90-9C95AFB5369B,MUSUK Dukun Kec. Dukun Kab. Magelang Prov. Jawa Tengah,Kab. Magelang,,Jawa Tengah
20533608,SMA MUHAMMADIYAH 1 MALANG,https://sekolah.data.kemdikbud.go.id/index.php/Chome/profil/E71D19D9-61AF-48A0-A045-9C9833D61D39,JL. BRIGJEN S. RIADI 134 Oro Oro Dowo Kec. Klojen Kota Malang Prov. Jawa Timur,,Kota Malang,Jawa Timur
30203100,SMAN 1 SERUYAN HULU,https://sekolah.data.kemdikbud.go.id/index.php/Chome/profil/02AB148B-C6D3-4317-B059-9CA0B6247C5B,JL.CILIK RIWUT  NO. 5 Tumbang Manjul Kec. Seruyan Hulu Kab. Seruyan Prov. Kalimantan Tengah,Kab. Seruyan,,Kalimantan Tengah
10257790,SMAS HKBP LINTONGNIHUTA,https://sekolah.data.kemdikbud.go.id/index.php/Chome/profil/5629D72A-F8A3-48CA-B4A2-9CA1C269DBA1,JL. OLAHRAGA - LINTONGNIHUTA Sibuntuon Parpea Kec. Lintongnihuta Kab. Humbang Hasundutan Prov. Sumatera Utara,Kab. Humbang Hasundutan,,Sumatera Utara
30105066,SMAS MUHAMMADIYAH 1 PONTIANAK,https://sekolah.data.kemdikbud.go.id/index.php/Chome/profil/04535820-6593-43B3-8BBD-9CAC3F41C06F,JL. PARIT HAJI HUSEIN II Bansir Darat Kec. Pontianak Tenggara Kota Pontianak Prov. Kalimantan Barat,,Kota Pontianak,Kalimantan Barat
30104508,SMAN 2 NGABANG,https://sekolah.data.kemdikbud.go.id/index.php/Chome/profil/4979E14D-2C3A-4153-8382-9CB29237573B,JL. RAYA KM 14 PLASMA NGB Amboyo Utara Kec. Ngabang Kab. Landak Prov. Kalimantan Barat,Kab. Landak,,Kalimantan Barat
40200253,SMAN 1 BUKO SELATAN,https://sekolah.data.kemdikbud.go.id/index.php/Chome/profil/15CC9BD6-108B-448D-9B3D-9CBE53365099,DS. LUMBI-LUMBIA Lumbi-Lumbia Kec. Buko Selatan Kab. Banggai Kepulauan Prov. Sulawesi Tengah,Kab. Banggai Kepulauan,,Sulawesi Tengah
69901183,SMAN 3 SUNGAI KERUH,https://sekolah.data.kemdikbud.go.id/index.php/Chome/profil/76429BA4-42F3-42B5-BA41-9CC7EE2A69C2,Jalan Jirak - Sopa Rukun Rahayu Kec. Sungai Keruh Kab. Musi Banyuasin Prov. Sumatera Selatan,Kab. Musi Banyuasin,,Sumatera Selatan
10805058,SMAN 1 KOTA AGUNG,https://sekolah.data.kemdikbud.go.id/index.php/Chome/profil/6FD4306E-F58E-40C6-9600-9CD02BD05FE2,JL. BHAYANGKARA NO. 77 KOTAAGUNG Kuripan Kec. Kota Agung Kab. Tanggamus Prov. Lampung,Kab. Tanggamus,,Lampung
20511005,SMAN PUNUNG,https://sekolah.data.kemdikbud.go.id/index.php/Chome/profil/BDB4C1C1-6328-4D27-8D2D-9CD10DF20AB1,JL. RAYA SOLO NO. 27 Sooka Kec. Punung Kab. Pacitan Prov. Jawa Timur,Kab. Pacitan,,Jawa Timur
60302279,SMA NEGERI BOKONDINI,https://sekolah.data.kemdikbud.go.id/index.php/Chome/profil/F5572136-1F76-4479-991D-9CDB19DB8D87,MAIRINI Mairini Kec. Bokondini Kab. Tolikara Prov. Papua Pegunungan,Kab. Tolikara,,Papua Pegunungan
20322747,SMAS NU ALMUNAWIR GRINGSING,https://sekolah.data.kemdikbud.go.id/index.php/Chome/profil/3FBECE4A-A25E-4295-89CD-9CE0835E9C1D,JL. RAYA LAMA NO. 16 GRINGSING Gringsing Kec. Gringsing Kab. Batang Prov. Jawa Tengah,Kab. Batang,,Jawa Tengah
10609706,SMA XAVERIUS 03 PALEMBANG,https://sekolah.data.kemdikbud.go.id/index.php/Chome/profil/D1577476-43CD-4C62-ABC4-9CE2F9F8D057,JL. KOL ATMO NO. 132 PLG 17 Ilir Kec. Ilir Timur I Kota Palembang Prov. Sumatera Selatan,,Kota Palembang,Sumatera Selatan
69877298,SMA NAHDLATUN NASYIIN IV,https://sekolah.data.kemdikbud.go.id/index.php/Chome/profil/C9F82E85-4EB2-405C-9404-9CE7F09AF8A2,PASANGGAR Pasanggar Kec. Pegantenan Kab. Pamekasan Prov. Jawa Timur,Kab. Pamekasan,,Jawa Timur
10204058,SMA NEGERI 1 SEI SUKA,https://sekolah.data.kemdikbud.go.id/index.php/Chome/profil/A545FE36-0954-4C7D-919B-9CECBA78A7E1,JL. BERINGIN NO. 1 TG. GADING Perkebunan Sipare-Pare Kec. Sei Suka Kab. Batu Bara Prov. Sumatera Utara,Kab. Batu Bara,,Sumatera Utara
10107274,SMA NEGERI 1 PINTU RIME GAYO,https://sekolah.data.kemdikbud.go.id/index.php/Chome/profil/C922D65C-3F89-4C5D-8A27-9CEE64E4B52F,JL. TAKENGON - BIREUEN Blang Ara Kec. Pintu Rime Gayo Kab. Bener Meriah Prov. Aceh,Kab. Bener Meriah,,Aceh
60400377,SMAN 2 SORONG,https://sekolah.data.kemdikbud.go.id/index.php/Chome/profil/94DD4EC6-DC0D-4707-84A1-9CF0B767CC62,JL. SUNGAI MARUNI KOTA SORONG SAWAGUMU Kec. Sorong Utara Kota Sorong Prov. Papua Barat Daya,,Kota Sorong,Papua Barat Daya
69912759,SMA NEGERI 1 BEOGA,https://sekolah.data.kemdikbud.go.id/index.php/Chome/profil/6313E63D-64F2-457B-83A3-9CF955A323DE,Jalan Raya Yulokoma Beoga Yulokoma Kec. Beoga Kab. Puncak Prov. Papua Tengah,Kab. Puncak,,Papua Tengah
69753304,SMAN 2 KANDIS,https://sekolah.data.kemdikbud.go.id/index.php/Chome/profil/E219F600-4C23-4E2D-829B-9CF965EE823B,JL.SEKOLAH DUSUN GARUT DESA BELUTU Belutu Kec. Kandis Kab. Siak Prov. Riau,Kab. Siak,,Riau
20300601,SMA A. YANI KAWUNGANTEN,https://sekolah.data.kemdikbud.go.id/index.php/Chome/profil/51CD5AAC-1264-4A3B-82BB-9CFBBD05FFE1,JL. BELAKANG STASIUN KAWUNGANTEN Kawunganten Lor Kec. Kawunganten Kab. Cilacap Prov. Jawa Tengah,Kab. Cilacap,,Jawa Tengah
70043439,SMA IT DARUL MA ARIF SINJAI,https://sekolah.data.kemdikbud.go.id/index.php/Chome/profil/310A36A2-613E-42A4-B0A0-9D0A7ED8FA40,Jalan Poros Jatie - Mannanti Saotengah Kec. Tellu Limpoe Kab. Sinjai Prov. Sulawesi Selatan,Kab. Sinjai,,Sulawesi Selatan
70036570,SMA ISLAM TERPADU BINA UL UMMAH MALUK,https://sekolah.data.kemdikbud.go.id/index.php/Chome/profil/73A6E5F4-53BB-4FD9-A761-9D0CA36D064C,Jln. Kesehatan Nomor 9 Pasir Putih Kec. Maluk Kab. Sumbawa Barat Prov. Nusa Tenggara Barat,Kab. Sumbawa Barat,,Nusa Tenggara Barat
69888854,SMA NEGERI 1 LELEA,https://sekolah.data.kemdikbud.go.id/index.php/Chome/profil/F71DFC11-1E40-4B4E-9BE2-9D1387212667,Jl. Raya Utara Larangan - Tugu Telagasari Kec. Lelea Kab. Indramayu Prov. Jawa Barat,Kab. Indramayu,,Jawa Barat
20219793,SMAS REHOBOTH,https://sekolah.data.kemdikbud.go.id/index.php/Chome/profil/21C5B437-4927-4019-8C3B-9D1777ACE05A,JL. RD. DEWI SARTIKA No. 36-38 Balong Gede Kec. Regol Kota Bandung Prov. Jawa Barat,,Kota Bandung,Jawa Barat
10308340,SMAS ISLAM BOARDING SCHOOL R JANNAH,https://sekolah.data.kemdikbud.go.id/index.php/Chome/profil/C76C873A-4331-4A68-8C65-9D1D5DA2D8A2,JL. PROF. DR. HAMKA TIGO KOTO DIBARUAH Kec. Payakumbuh Utara Kota Payakumbuh Prov. Sumatera Barat,,Kota Payakumbuh,Sumatera Barat
20257671,SMAS ASHRIYAH NURUL IMAN,https://sekolah.data.kemdikbud.go.id/index.php/Chome/profil/D3F7385F-F273-4DB3-8E14-9D1E76C34C61,JL. NURUL IMAN NO. 1 RT 01/1 Warujaya Kec. Parung Kab. Bogor Prov. Jawa Barat,Kab. Bogor,,Jawa Barat
40200251,SMAN 1 BUKO,https://sekolah.data.kemdikbud.go.id/index.php/Chome/profil/77AE9C6D-38B9-44FD-B1D5-9D27B5AF1CA3,JL. SABOBOK NO. 1 Tataba Kec. Buko Kab. Banggai Kepulauan Prov. Sulawesi Tengah,Kab. Banggai Kepulauan,,Sulawesi Tengah
20103169,SMAS PGRI 1 JAKARTA,https://sekolah.data.kemdikbud.go.id/index.php/Chome/profil/734956E5-9F0B-457E-9554-9D28924D8264,JL. CIPINANG MUARA 1 Pondok Bambu Kec. Duren Sawit Kota Adm. Jakarta Timur Prov. D.K.I. Jakarta,,Kota Adm. Jakarta Timur,D.K.I. Jakarta
10800735,SMAS DBP SIDOMULYO,https://sekolah.data.kemdikbud.go.id/index.php/Chome/profil/7667ED22-6067-4CED-942B-9D2BB3D8A0ED,JL. NUGROHO NOTOSUSANTO 74 Sidorejo Kec. Sidomulyo Kab. Lampung Selatan Prov. Lampung,Kab. Lampung Selatan,,Lampung
69888773,SMAN 7 Elar,https://sekolah.data.kemdikbud.go.id/index.php/Chome/profil/71DBE0B2-5E2D-4541-916C-9D3331B4216C,Kembo Golo Lijun Kec. Elar Kab. Manggarai Timur Prov. Nusa Tenggara Timur,Kab. Manggarai Timur,,Nusa Tenggara Timur
10208701,SMAN 1 POLLUNG,https://sekolah.data.kemdikbud.go.id/index.php/Chome/profil/75642C4A-E4A6-4AE3-91A6-9D3B077E558F,JL. Mayor (Purn) C.Dj Marbun Huta Paung Kec. Pollung Kab. Humbang Hasundutan Prov. Sumatera Utara,Kab. Humbang Hasundutan,,Sumatera Utara
30202963,SMA NEGERI 1 LAMANDAU,https://sekolah.data.kemdikbud.go.id/index.php/Chome/profil/20E77A27-D37E-4172-8FDA-9D467FFC732F,JL.JENDERAL SUDIRMAN NO.05 RT.01 TAPIN B... Tapin Bini Kec. Lamandau Kab. Lamandau Prov. Kalimantan Tengah,Kab. Lamandau,,Kalimantan Tengah
20523823,SMAN KALISAT,https://sekolah.data.kemdikbud.go.id/index.php/Chome/profil/3BCBD8B6-2E75-4407-81E4-9D4B74AC917F,JALAN KI HAJAR DEWANTARA 42 Kalisat Kec. Kalisat Kab. Jember Prov. Jawa Timur,Kab. Jember,,Jawa Timur
69830706,SMAN 2 RAKIT KULIM,https://sekolah.data.kemdikbud.go.id/index.php/Chome/profil/32EA66A8-8292-4F56-81E1-9D4D09D4F6A3,JL. Sumber Rezeki Petonggan Kec. Rakit Kulim Kab. Indragiri Hulu Prov. Riau,Kab. Indragiri Hulu,,Riau
40308320,SMAN 7 MAROS,https://sekolah.data.kemdikbud.go.id/index.php/Chome/profil/3D75FA12-948A-40B5-93B4-9D4D66024EBD,JL. TOPOING MALLAWA Sabila Kec. Mallawa Kab. Maros Prov. Sulawesi Selatan,Kab. Maros,,Sulawesi Selatan
69773521,SMAN 3 BUNTA,https://sekolah.data.kemdikbud.go.id/index.php/Chome/profil/76725009-28FD-4F62-9479-9D4FD9538D1D,DESA TOIMA Toima Kec. Bunta Kab. Banggai Prov. Sulawesi Tengah,Kab. Banggai,,Sulawesi Tengah
10202659,SMA SWASTA ASSISI SIANTAR,https://sekolah.data.kemdikbud.go.id/index.php/Chome/profil/649307B9-14DE-4114-9083-9D53A79FC1B2,JL. ASAHAN KM. 6 Sejahtera Kec. Siantar Kab. Simalungun Prov. Sumatera Utara,Kab. Simalungun,,Sumatera Utara
10802067,SMAN 1 SEPUTIH SURABAYA,https://sekolah.data.kemdikbud.go.id/index.php/Chome/profil/56C702AA-887E-4F79-A918-9D59108BC868,JL. PENDIDIKAN GAYA BARU VIII Gaya Baru Delapan Kec. Seputih Surabaya Kab. Lampung Tengah Prov. Lampung,Kab. Lampung Tengah,,Lampung
