kode,nama,link_profil,alamat,kabupaten,kota,provinsi
20101323,SMAS PADINDI,https://sekolah.data.kemdikbud.go.id/index.php/Chome/profil/17A0C319-92D1-4EDD-9994-64ABEC76765F,JL. PREPEDAN  RT12 RW9 N0 38 Kamal Kec. Kali Deres Kota Adm. Jakarta Barat Prov. D.K.I. Jakarta,,Kota Adm. Jakarta Barat,D.K.I. Jakarta
69815435,SMA ISLAM NURUL HIDAYAH,https://sekolah.data.kemdikbud.go.id/index.php/Chome/profil/F8022445-E95B-401E-91A9-64ACD3F7565A,JL. PANGARANGAN DESA PANAONGAN DESA PANAONGAN Kec. Pasongsongan Kab. Sumenep Prov. Jawa Timur,Kab. Sumenep,,Jawa Timur
20220317,SMAS PGRI 1,https://sekolah.data.kemdikbud.go.id/index.php/Chome/profil/7BB32CFD-4080-4775-87CC-64AFDC235A92,JL. BINA MARGA 1/17 Baranangsiang Kec. Kota Bogor Timur Kota Bogor Prov. Jawa Barat,,Kota Bogor,Jawa Barat
40500912,SMAS TERPADU WIRA BHAKTI,https://sekolah.data.kemdikbud.go.id/index.php/Chome/profil/D1B21078-653D-4408-8AF1-64B505089C7F,JL. NANI WARTABONE Bubeya Kec. Suwawa Kab. Bone Bolango Prov. Gorontalo,Kab. Bone Bolango,,Gorontalo
10400350,SMA NEGERI 1 KAMPAR UTARA,https://sekolah.data.kemdikbud.go.id/index.php/Chome/profil/0395C750-815D-4C24-9BAB-64B615EB41F6,JL. RAYA BANGKINANG-PEMATANG KULIM KM 13 Muara Jalai Kec. Kampar Utara Kab. Kampar Prov. Riau,Kab. Kampar,,Riau
69893350,SMA JAGAT ARSY,https://sekolah.data.kemdikbud.go.id/index.php/Chome/profil/D737ECF1-F3F0-4AFB-9003-64B7A0EE5543,Jl.Yapen Raya No.21 Rawa Mekar Jaya BSD Rawa Mekar Kec. Serpong Kota Tangerang Selatan Prov. Banten,,Kota Tangerang Selatan,Banten
20219270,SMA TERPADU KRIDANUSANTARA,https://sekolah.data.kemdikbud.go.id/index.php/Chome/profil/A1BD573E-EA88-489F-8C89-64C01E38EF9B,JL. DESA CIPADUNG CIBIRU-BANDUNG Cipadung Kec. Cibiru Kota Bandung Prov. Jawa Barat,,Kota Bandung,Jawa Barat
30304285,SMAN 2 BANJARMASIN,https://sekolah.data.kemdikbud.go.id/index.php/Chome/profil/768B5A78-4C56-4271-8AE6-64CE1EB3D028,JL. MULAWARMAN NO. 21 Teluk Dalam Kec. Banjarmasin Tengah Kota Banjarmasin Prov. Kalimantan Selatan,,Kota Banjarmasin,Kalimantan Selatan
30304435,SMAS PGRI 1 BANJARMASIN,https://sekolah.data.kemdikbud.go.id/index.php/Chome/profil/93EC11A1-90BC-442E-AC11-64D3ABD2B580,JL. SULTAN ADAM Sungai Jingah Kec. Banjarmasin Utara Kota Banjarmasin Prov. Kalimantan Selatan,,Kota Banjarmasin,Kalimantan Selatan
10703505,SMA NEGERI 13 MUKOMUKO,https://sekolah.data.kemdikbud.go.id/index.php/Chome/profil/2D732EBD-0A76-4627-A184-64EAD6131139,"DESA SURIAN BUNGKAL, KEC. SELAGAN RAYA Surian Bungkal Kec. Selagan Raya Kab. Mukomuko Prov. Bengkulu",Kab. Mukomuko,,Bengkulu
10105389,SMA NEGERI 1 BANDA ACEH,https://sekolah.data.kemdikbud.go.id/index.php/Chome/profil/6EAE0980-B0E1-4749-BA42-64EC3C9A1136,JL. PROF. A. MAJID IBRAHIM I Punge Jurong Kec. Meuraxa Kota Banda Aceh Prov. Aceh,,Kota Banda Aceh,Aceh
20329844,SMA NEGERI 4 TEGAL,https://sekolah.data.kemdikbud.go.id/index.php/Chome/profil/16792E29-0978-4396-8AED-64ECBAA73029,JL. DR. SETIABUDI NO. 32 Panggung Kec. Tegal Timur Kota Tegal Prov. Jawa Tengah,,Kota Tegal,Jawa Tengah
20231290,SMA ISLAM DAARUL ARHAM,https://sekolah.data.kemdikbud.go.id/index.php/Chome/profil/857CEA21-6840-48B3-88A1-64F40CEB1583,Jl.Raya Tenjo -Parungpanjang Batok Kec. Tenjo Kab. Bogor Prov. Jawa Barat,Kab. Bogor,,Jawa Barat
60105429,SMA Negeri 12 Kepulauan Tanimbar,https://sekolah.data.kemdikbud.go.id/index.php/Chome/profil/D0C3B0B5-4AB2-4637-80E4-64F4426B4CD6,JL. MANGGA DUA LARAT Ritabel Kec. Tanimbar Utara Kab. Kepulauan Tanimbar Prov. Maluku,Kab. Kepulauan Tanimbar,,Maluku
69915781,SMA PERMATA MANDIRI,https://sekolah.data.kemdikbud.go.id/index.php/Chome/profil/655DDEA6-4D95-49C6-80EA-64FA94A7A5C0,Jalan Pengkolan Kondang Jampangkulon Tanjung Kec. Jampang Kulon Kab. Sukabumi Prov. Jawa Barat,Kab. Sukabumi,,Jawa Barat
69856893,SMA Negeri 1 Raijua,https://sekolah.data.kemdikbud.go.id/index.php/Chome/profil/C648BF46-B985-4DEC-88D7-64FC7B2DD3C4,Jl. Ledetalo Ledeunu Kec. Raijua Kab. Sabu Raijua Prov. Nusa Tenggara Timur,Kab. Sabu Raijua,,Nusa Tenggara Timur
70054113,SMA ISLAM ANNAJAH,https://sekolah.data.kemdikbud.go.id/index.php/Chome/profil/1E61E9A3-6137-4D85-97A9-65046216EDA7,"Jl. Ciledug Raya No. 10, RT. 001, RW. 00... Petukangan Selatan Kec. Pesanggrahan Kota Adm. Jakarta Selatan Prov. D.K.I. Jakarta",,Kota Adm. Jakarta Selatan,D.K.I. Jakarta
20317492,SMA NEGERI 1 GEBOG,https://sekolah.data.kemdikbud.go.id/index.php/Chome/profil/6FB1282A-625E-488E-B791-6516FDC1B887,JL. PR. SUKUN GEBOG Gondosari Kec. Gebog Kab. Kudus Prov. Jawa Tengah,Kab. Kudus,,Jawa Tengah
40307374,SMAS MUHAMMADIYAH 3 MAKASSAR,https://sekolah.data.kemdikbud.go.id/index.php/Chome/profil/500B4016-3CC1-4D62-9F7B-651BF95DB7E1,JL. URIF SUMOHARJO NO. 37 Karuwisi Utara Kec. Panakukkang Kota Makassar Prov. Sulawesi Selatan,,Kota Makassar,Sulawesi Selatan
20103197,SMAS ST ANTONIUS JAKARTA,https://sekolah.data.kemdikbud.go.id/index.php/Chome/profil/E2D4B2D2-76B2-4930-9CC7-6520B5A609A0,JL. DI PANJAITAN KAV. 46 Rawa Bunga Kec. Jatinegara Kota Adm. Jakarta Timur Prov. D.K.I. Jakarta,,Kota Adm. Jakarta Timur,D.K.I. Jakarta
20216943,SMAN 1 JALANCAGAK,https://sekolah.data.kemdikbud.go.id/index.php/Chome/profil/6BDCC45A-A007-4730-B84A-6525F6594565,Jl. Raya Jalancagak No. 061 Curugrendeng Kec. Jalancagak Kab. Subang Prov. Jawa Barat,Kab. Subang,,Jawa Barat
40403039,SMAN 1 MAWASANGKA TENGAH,https://sekolah.data.kemdikbud.go.id/index.php/Chome/profil/F3740BC8-24C7-45C7-8403-6527E02000CE,Jalan Poros Mawasangka-Wamengkoli No. 23... Lakorua Kec. Mawasangka Tengah Kab. Buton Tengah Prov. Sulawesi Tenggara,Kab. Buton Tengah,,Sulawesi Tenggara
69970379,SMAS INSAN KAMIL TARTILA,https://sekolah.data.kemdikbud.go.id/index.php/Chome/profil/B66F2DF7-8C43-463E-9B5B-652AC8348232,Jl Raya Legok Km.6 Legok Kec. Legok Kab. Tangerang Prov. Banten,Kab. Tangerang,,Banten
60200728,SMAS MUHAMMADIYAH KOTA TERNATE,https://sekolah.data.kemdikbud.go.id/index.php/Chome/profil/452D8418-89B1-4CB5-8706-653A31AEC92B,JL DELIMA Toboko Kec. Ternate Selatan Kota Ternate Prov. Maluku Utara,,Kota Ternate,Maluku Utara
69954194,SMA ISLAM AL - AZHAR 18 GRAND WISATA,https://sekolah.data.kemdikbud.go.id/index.php/Chome/profil/85D2EBCD-6412-4BBC-9107-653DA72CC0ED,"JL. Sunset Avenue, Tambun Selatan Lambangsari Kec. Tambun Selatan Kab. Bekasi Prov. Jawa Barat",Kab. Bekasi,,Jawa Barat
10100557,SMAN 1 PEUKAN PIDIE,https://sekolah.data.kemdikbud.go.id/index.php/Chome/profil/8E3F1ACB-C0BB-41C3-AE9A-6544D857DE07,DESA BLANG KULA Blangkula Kec. Pidie Kab. Pidie Prov. Aceh,Kab. Pidie,,Aceh
10210723,SMAS BUDI UTOMO,https://sekolah.data.kemdikbud.go.id/index.php/Chome/profil/3D24D926-532F-46F5-9C1C-654637FB8099,JL. JURUNG NO. 33 Pandau Hulu Ii Kec. Medan Area Kota Medan Prov. Sumatera Utara,,Kota Medan,Sumatera Utara
20540294,SMA DARUL ULUM 2 UNGGULAN BPPT,https://sekolah.data.kemdikbud.go.id/index.php/Chome/profil/28961A95-81FD-441D-B64D-654CC1871C81,Pondok Pesantren Darul Ulum Rejoso Peter... Peterongan Kec. Peterongan Kab. Jombang Prov. Jawa Timur,Kab. Jombang,,Jawa Timur
20603342,SMAS ISLAM AL-AZHAR BSD,https://sekolah.data.kemdikbud.go.id/index.php/Chome/profil/CD17DC38-2717-462D-BCDC-654FF79CC6BD,PUSPITA LOKA SEKTOR III.2 BSD Lengkong Gudang Kec. Serpong Kota Tangerang Selatan Prov. Banten,,Kota Tangerang Selatan,Banten
10505075,SMAN 8 TANJUNG JABUNG BARAT,https://sekolah.data.kemdikbud.go.id/index.php/Chome/profil/7AB87096-F5C9-4634-9A87-65527E178132,JL. BERINGIN KUALA TUNGKAL PATUNAS Kec. Tungkal Ilir Kab. Tanjung Jabung Barat Prov. Jambi,Kab. Tanjung Jabung Barat,,Jambi
10800676,SMAS PGRI 01 PADANG CERMIN,https://sekolah.data.kemdikbud.go.id/index.php/Chome/profil/DDEFFCEB-C963-469C-8ACA-6559486BD356,JL. Rawa Tunggal Desa Padang cermin Padang Cermin Kec. Padang Cermin Kab. Pesawaran Prov. Lampung,Kab. Pesawaran,,Lampung
20217762,SMAN 1 TEMPURAN,https://sekolah.data.kemdikbud.go.id/index.php/Chome/profil/4809D655-86F4-430D-9F4B-655B14C1081D,JL. Suryakencana Pagadungan Pagadungan Kec. Tempuran Kab. Karawang Prov. Jawa Barat,Kab. Karawang,,Jawa Barat
20269747,SMA NURUL FIKRI BOARDING SCHOOL LEMBANG,https://sekolah.data.kemdikbud.go.id/index.php/Chome/profil/E1E57C21-F38B-4396-B3EF-655C89AF37AB,JL. Raya Maribaya Timur RT/RW 003/03 Cibodas Kec. Lembang Kab. Bandung Barat Prov. Jawa Barat,Kab. Bandung Barat,,Jawa Barat
10800737,SMAS DARUL ULUM,https://sekolah.data.kemdikbud.go.id/index.php/Chome/profil/91CFE92D-F81F-465E-AB5D-655D81C9FB94,JL. UTAMA WAY SULAN Talang Way Sulan Kec. Way Sulan Kab. Lampung Selatan Prov. Lampung,Kab. Lampung Selatan,,Lampung
69883254,SMA CAHAYA RANCAMAYA,https://sekolah.data.kemdikbud.go.id/index.php/Chome/profil/79B3DC7D-AC14-4EFD-944B-65632B504723,"Jl. Rancamaya No.30, RT.01 RW.04 Bojongkerta Kec. Kota Bogor Selatan Kota Bogor Prov. Jawa Barat",,Kota Bogor,Jawa Barat
30109717,SMAN 3 SUI RAYA,https://sekolah.data.kemdikbud.go.id/index.php/Chome/profil/4D834754-9DAC-41FD-B82B-65678116D33B,DESA SUI ASAM Sungai Asam Kec. Sungai Raya Kab. Kubu Raya Prov. Kalimantan Barat,Kab. Kubu Raya,,Kalimantan Barat
60728420,SMAS GLOBE NATIONAL PLUS,https://sekolah.data.kemdikbud.go.id/index.php/Chome/profil/6EFB9595-C1D1-4B8C-9367-6568B10CCB44,"Komplek Green Garden Blok C No.16, Seray... Kampung Pelita Kec. Lubuk Baja Kota Batam Prov. Kepulauan Riau",,Kota Batam,Kepulauan Riau
20227455,SMAS YKBBB LELES,https://sekolah.data.kemdikbud.go.id/index.php/Chome/profil/5BDC52DF-5240-4EF4-82C6-656C8F2DF62B,JL. RAYA TUTUGAN LELES Haruman Kec. Leles Kab. Garut Prov. Jawa Barat,Kab. Garut,,Jawa Barat
69963723,SMA S AL-KHAZANAH,https://sekolah.data.kemdikbud.go.id/index.php/Chome/profil/F9F6A785-D8ED-49AE-98E6-656D96B48A7C,Jln. Lintas Halmahera Sofifi- Weda Kusu Kec. Oba Utara Kota Tidore Kepulauan Prov. Maluku Utara,,Kota Tidore Kepulauan,Maluku Utara
20319290,SMAN 1 GUNTUR,https://sekolah.data.kemdikbud.go.id/index.php/Chome/profil/AD69900C-9CB3-46D2-B6D6-656DD4011C63,JL. RAYA GUNTUR - DEMAK Guntur Kec. Guntur Kab. Demak Prov. Jawa Tengah,Kab. Demak,,Jawa Tengah
90101003,SMA Sekolah Indonesia Den Haag,https://sekolah.data.kemdikbud.go.id/index.php/Chome/profil/2903ACDA-5E1C-4497-8ABC-6570C8F7E829,"Rijksstraatweg 679, 2245 CB Wassenaar, T... Wassenaar Wassenaar Belanda Luar Negeri",,,
69774867,SMAN 11 ENREKANG,https://sekolah.data.kemdikbud.go.id/index.php/Chome/profil/83B2F888-3187-4856-B701-6575F9B48C42,JL. POROS KOTU - BAROKO Masalle Kec. Masalle Kab. Enrekang Prov. Sulawesi Selatan,Kab. Enrekang,,Sulawesi Selatan
10220522,SMAN 1 SIRANDORUNG,https://sekolah.data.kemdikbud.go.id/index.php/Chome/profil/43C8EFB8-4F10-4C2E-9EBD-657AA36EF745,JL. JEND. AHMAD YANI No. 26 Siordang Kec. Sirandorung Kab. Tapanuli Tengah Prov. Sumatera Utara,Kab. Tapanuli Tengah,,Sumatera Utara
10811206,SMAN 2 NEGERI BESAR,https://sekolah.data.kemdikbud.go.id/index.php/Chome/profil/D11A9092-64D0-400B-B6BC-6585214811E1,KP SRI BASUKI Sri Basuki Kec. Negeri Besar Kab. Way Kanan Prov. Lampung,Kab. Way Kanan,,Lampung
69774555,SMA ISLAM AL-AZHAR 8,https://sekolah.data.kemdikbud.go.id/index.php/Chome/profil/2D8C1DA1-0259-4BEF-AC91-6590A9BB29FB,Jalan Boulevard Utara Blok I Summarecon ... Marga Mulya Kec. Bekasi Utara Kota Bekasi Prov. Jawa Barat,,Kota Bekasi,Jawa Barat
60101448,SMA Negeri 4 Maluku Barat Daya,https://sekolah.data.kemdikbud.go.id/index.php/Chome/profil/D0776B24-C184-4E7A-B03E-6594F3D1752B,JL. URLOIKAY Wonreli Kec. Pulau-pulau Terselatan Kab. Maluku Barat Daya Prov. Maluku,Kab. Maluku Barat Daya,,Maluku
20521459,SMAN 1 PRONOJIWO,https://sekolah.data.kemdikbud.go.id/index.php/Chome/profil/5052F3D5-C5AA-44BD-850F-65965745792A,JL. AHMAD YANI PRONOJIWO PRONOJIWO Kec. Pronojiwo Kab. Lumajang Prov. Jawa Timur,Kab. Lumajang,,Jawa Timur
10220518,SMAS SW ST FRANSISKUS,https://sekolah.data.kemdikbud.go.id/index.php/Chome/profil/E8D7EDDD-990F-4B60-899D-65967B5B6336,JL. Prof. Mr. Dr. M. Hazairin Pasar Baru Kec. Pandan Kab. Tapanuli Tengah Prov. Sumatera Utara,Kab. Tapanuli Tengah,,Sumatera Utara
20534748,SMAN 1,https://sekolah.data.kemdikbud.go.id/index.php/Chome/profil/6E1C35F2-817C-4DA3-90EC-65982F3FF1F4,JL. IRIAN JAYA NO. 1 Kranggan Kec. Prajurit Kulon Kota Mojokerto Prov. Jawa Timur,,Kota Mojokerto,Jawa Timur
30100388,SMAN 1 SUBAH,https://sekolah.data.kemdikbud.go.id/index.php/Chome/profil/3752BCA4-C3DA-49EA-8031-65A035501D64,JL.RAYA SUBAH SATAI Balai Gemuruh Kec. Subah Kab. Sambas Prov. Kalimantan Barat,Kab. Sambas,,Kalimantan Barat
11002579,SMAS INTEGRAL HIDAYATULLAH,https://sekolah.data.kemdikbud.go.id/index.php/Chome/profil/D2F87123-0F6B-4847-BF6B-65AB8A6419B9,"KP. PASIR INDAH RT.01/16, KEL.KIBING Kibing Kec. Batu Aji Kota Batam Prov. Kepulauan Riau",,Kota Batam,Kepulauan Riau
20247160,SMAS MUTIARA,https://sekolah.data.kemdikbud.go.id/index.php/Chome/profil/9A413F61-5A23-486A-83ED-65ABCA6C916A,JL. BHAYANGKARA KM.1 PALABUHAN RATU Citepus Kec. Pelabuhan Ratu Kab. Sukabumi Prov. Jawa Barat,Kab. Sukabumi,,Jawa Barat
69971662,SMAS TRIDHARMA MKGR UNAAHA,https://sekolah.data.kemdikbud.go.id/index.php/Chome/profil/E7E79A78-3CA6-477D-ADFE-65AF49CC54E0,Jalan Bunggasi No. 207 Tumpas Kec. Unaaha Kab. Konawe Prov. Sulawesi Tenggara,Kab. Konawe,,Sulawesi Tenggara
40404151,SMAS DARUSSALAM,https://sekolah.data.kemdikbud.go.id/index.php/Chome/profil/A8C60281-66DD-4336-AF33-65B32F1F4959,JL. POROS KALIA-LIA Liabuku Kec. Bungi Kota Bau Bau Prov. Sulawesi Tenggara,,Kota Bau Bau,Sulawesi Tenggara
20103238,SMAS IGN SLAMET RIYADI,https://sekolah.data.kemdikbud.go.id/index.php/Chome/profil/B5DD49AA-1D78-47D0-81A2-65B5D1538A8A,JL. RAYA BOGOR KM.24 Cijantung Kec. Pasar Rebo Kota Adm. Jakarta Timur Prov. D.K.I. Jakarta,,Kota Adm. Jakarta Timur,D.K.I. Jakarta
20326491,SMAS MUHAMMADIYAH BUMIAYU,https://sekolah.data.kemdikbud.go.id/index.php/Chome/profil/DF355A72-55C5-4BBA-9484-65B7300A6B01,JL. KH. A. DAHLAN KM. 1 BUMIAYU Kalierang Kec. Bumiayu Kab. Brebes Prov. Jawa Tengah,Kab. Brebes,,Jawa Tengah
20603356,SMAS YUPPENTEK 3,https://sekolah.data.kemdikbud.go.id/index.php/Chome/profil/31008045-460C-4E54-B75F-65BBD576A0FE,Jl. Raya PLP No. 47 Serdang Wetan Kec. Legok Kab. Tangerang Prov. Banten,Kab. Tangerang,,Banten
20540058,SMAS KEMALA BHAYANGKARI 3,https://sekolah.data.kemdikbud.go.id/index.php/Chome/profil/B7C961A0-CA31-4AD1-8648-65BF48D311B4,JL. BHAYANGKARI NO. 36 C Porong Kec. Porong Kab. Sidoarjo Prov. Jawa Timur,Kab. Sidoarjo,,Jawa Timur
69861153,SMA SWASTA BABUL ISTIQAMAH,https://sekolah.data.kemdikbud.go.id/index.php/Chome/profil/CD694D2B-6DF6-47F1-8114-65C89062F31A,"Jln. Letkol BB Djalal, Kecamatan Susoh, ... Padang Hilir Kec. Susoh Kab. Aceh Barat Daya Prov. Aceh",Kab. Aceh Barat Daya,,Aceh
40102616,SMAS WIRAKARYA MANADO,https://sekolah.data.kemdikbud.go.id/index.php/Chome/profil/9A9AE2DE-FAB5-4B7B-A5FE-65C96AE4520C,JL. RANOTANA WERU LK III Ranotana Weru Kec. Wanea Kota Manado Prov. Sulawesi Utara,,Kota Manado,Sulawesi Utara
20252192,SMA NEGERI  1 KADUPANDAK,https://sekolah.data.kemdikbud.go.id/index.php/Chome/profil/E0DF462E-EA8C-45AA-AE05-65C97364A5EE,JL. SILIWANGI NO. 1 Kadupandak Kec. Kadupandak Kab. Cianjur Prov. Jawa Barat,Kab. Cianjur,,Jawa Barat
20318347,SMAS PGRI JEPARA,https://sekolah.data.kemdikbud.go.id/index.php/Chome/profil/52193D99-E136-442E-89BE-65CA63E96A39,"Jl. Ratu Kalinyamat, Demaan VI,Kec. Jepa... Demaan Kec. Jepara Kab. Jepara Prov. Jawa Tengah",Kab. Jepara,,Jawa Tengah
70041021,SMA NEGERI RESTORASI AIMOLI,https://sekolah.data.kemdikbud.go.id/index.php/Chome/profil/608246F8-FB83-40C5-8DD0-65CE13E95197,Jl. Nanat Seyeng Aimoli Kec. Alor Barat Laut Kab. Alor Prov. Nusa Tenggara Timur,Kab. Alor,,Nusa Tenggara Timur
69728420,SMAN INSANA TENGAH,https://sekolah.data.kemdikbud.go.id/index.php/Chome/profil/8C565855-0A54-4F4B-A0F3-65DF34DA1634,Jl. Kefamenanu - Atambua KM. 18 (Maubesi... Maubesi Kec. Insana Tengah Kab. Timor Tengah Utara Prov. Nusa Tenggara Timur,Kab. Timor Tengah Utara,,Nusa Tenggara Timur
10258246,SMA NEGERI 1 TELUKDALAM,https://sekolah.data.kemdikbud.go.id/index.php/Chome/profil/57311FBB-1DC1-44D7-BC94-65E252E949C2,JL. PENDIDIKAN NO. 13 TELUKDALAM Pasar Teluk Dalam Kec. Teluk Dalam Kab. Nias Selatan Prov. Sumatera Utara,Kab. Nias Selatan,,Sumatera Utara
40301564,SMAN 3 TAKALAR,https://sekolah.data.kemdikbud.go.id/index.php/Chome/profil/34A60E5D-7BEC-4C23-8486-65E6571436BB,JL. ABDUL JALAL DG LEO NO.2 Kalabbirang Kec. Pattallassang Kab. Takalar Prov. Sulawesi Selatan,Kab. Takalar,,Sulawesi Selatan
20212956,SMA NEGERI 2 KUNINGAN,https://sekolah.data.kemdikbud.go.id/index.php/Chome/profil/0AC38802-BEB5-4444-8E64-65E92056B0FA,JL. ARUJI KARTAWINATA NO. 16 Kuningan Kec. Kuningan Kab. Kuningan Prov. Jawa Barat,Kab. Kuningan,,Jawa Barat
60403402,SMA NEGERI 6 KABUPATEN SORONG,https://sekolah.data.kemdikbud.go.id/index.php/Chome/profil/8D8A88D5-77D0-4BC8-AE91-65EE02C63B46,JL. TRIKORA Seget Kec. Seget Kab. Sorong Prov. Papua Barat Daya,Kab. Sorong,,Papua Barat Daya
20521731,SMAN 1 SUKOSARI,https://sekolah.data.kemdikbud.go.id/index.php/Chome/profil/27071197-F709-455C-8699-65F41EA176CF,JL. KAWAH IJEN-SUKOSARI Sukosari Lor Kec. Sukosari Kab. Bondowoso Prov. Jawa Timur,Kab. Bondowoso,,Jawa Timur
60401959,SMAS MUHAMMADIYAH BINTUNI,https://sekolah.data.kemdikbud.go.id/index.php/Chome/profil/3582CFB1-6BF3-4A2D-8977-65F5E50B876F,JL. RAYA BINTUNI RT. 01 RW. 02 Bintuni Timur Kec. Bintuni Kab. Teluk Bintuni Prov. Papua Barat,Kab. Teluk Bintuni,,Papua Barat
20564168,SMAS TERPADU AL MAARIF,https://sekolah.data.kemdikbud.go.id/index.php/Chome/profil/A910500B-B080-44BF-8B11-65F8268096B0,JL. JAYA MAKMUR Pangarengan Kec. Pangarengan Kab. Sampang Prov. Jawa Timur,Kab. Sampang,,Jawa Timur
10504557,SMAS MUHAMMADIYAH,https://sekolah.data.kemdikbud.go.id/index.php/Chome/profil/F93C97D7-EAE9-4F5A-9718-65FDE92804AB,JL. KAPTEN PATIMURA Simpang Iv Sipin Kec. Telanai Pura Kota Jambi Prov. Jambi,,Kota Jambi,Jambi
10400853,SMAN 5 MANDAU,https://sekolah.data.kemdikbud.go.id/index.php/Chome/profil/0EF9FF7B-4B04-43FE-897B-65FFEB026529,JL.SIDOREJO Harapan Baru Kec. Mandau Kab. Bengkalis Prov. Riau,Kab. Bengkalis,,Riau
20331704,SMAS MA ARIF WADASLINTANG,https://sekolah.data.kemdikbud.go.id/index.php/Chome/profil/7664A9E2-D849-45B0-B76D-6601B1017C36,JL. WADASLINTANG - PREMBUN KM. 01 Wadaslintang Kec. Wadaslintang Kab. Wonosobo Prov. Jawa Tengah,Kab. Wonosobo,,Jawa Tengah
50303424,SMAS ST THOMAS AQUINAS,https://sekolah.data.kemdikbud.go.id/index.php/Chome/profil/8AB7083E-B944-4B37-85EA-6602AF909C3E,"Jln. Nuri, Nekang Watu Kec. Langke Rembong Kab. Manggarai Prov. Nusa Tenggara Timur",Kab. Manggarai,,Nusa Tenggara Timur
10505086,SMAN 15 TANJUNG JABUNG  BARAT,https://sekolah.data.kemdikbud.go.id/index.php/Chome/profil/5B488D7F-9FCD-435B-8F47-6602AFF778C1,JL. SILATURRAHMI KM. 04 TEBING TINGGI TEBING TINGGI Kec. Tebing Tinggi Kab. Tanjung Jabung Barat Prov. Jambi,Kab. Tanjung Jabung Barat,,Jambi
10802974,SMAS SLAMET RIYADI,https://sekolah.data.kemdikbud.go.id/index.php/Chome/profil/BEB3E4DB-748D-46B9-BDD7-66036392F7F4,"JL. MANGGABESAR SUKUNG, KELURAHAN TANJUN... Tanjung Harapan Kec. Kotabumi Selatan Kab. Lampung Utara Prov. Lampung",Kab. Lampung Utara,,Lampung
70001150,SMAIT AL-QUDWAH,https://sekolah.data.kemdikbud.go.id/index.php/Chome/profil/C09F7183-B0A3-4D21-81E2-660E25B8F47B,Jl. Diponegoro Dusun 3. Y Ngadirejo Ngadirejo Kec. Tugu Mulyo Kab. Musi Rawas Prov. Sumatera Selatan,Kab. Musi Rawas,,Sumatera Selatan
20100211,SMAN 4 JAKARTA,https://sekolah.data.kemdikbud.go.id/index.php/Chome/profil/E91E6EDA-08BD-44E7-A4A5-660E40BAF0E3,JL. BATU NO. 3 GAMBIR Gambir Kec. Gambir Kota Adm. Jakarta Pusat Prov. D.K.I. Jakarta,,Kota Adm. Jakarta Pusat,D.K.I. Jakarta
69931913,SMA BINA NUSA PURWAJAYA,https://sekolah.data.kemdikbud.go.id/index.php/Chome/profil/189E492D-7662-49DD-9B74-660FC19B4556,Kp. Babakan RT 01/002 Purwajaya Kec. Peundeuy Kab. Garut Prov. Jawa Barat,Kab. Garut,,Jawa Barat
50219668,SMA IT Putri Abu Hurairah Mataram,https://sekolah.data.kemdikbud.go.id/index.php/Chome/profil/466841BF-24D1-48EA-8341-66142F4D66CD,JL. MAJAPAHIT NO 54B PUNIA MATARAM Punia Kec. Mataram Kota Mataram Prov. Nusa Tenggara Barat,,Kota Mataram,Nusa Tenggara Barat
69758396,SMAN 8 KOTA SERANG,https://sekolah.data.kemdikbud.go.id/index.php/Chome/profil/3740879A-6D60-4268-BEED-66154DEB8436,Jl.Kalodran-Sidapurna  Kel. Teritih Kec.... Teritih Kec. Walantaka Kota Serang Prov. Banten,,Kota Serang,Banten
20339076,SMA SRI MUKTI CILACAP,https://sekolah.data.kemdikbud.go.id/index.php/Chome/profil/EB5C89C0-2EF2-4335-9CA3-66156C42FFAE,Jalan Bawean No. 293 Cilacap Gunungsimping Kec. Cilacap Tengah Kab. Cilacap Prov. Jawa Tengah,Kab. Cilacap,,Jawa Tengah
30404228,SMAN 4 BERAU,https://sekolah.data.kemdikbud.go.id/index.php/Chome/profil/902C4031-E5F3-4A0A-AB30-66181F83571F,JL. BUKIT BERBUNGA KM.01 RT.03 Sambaliung Kec. Sambaliung Kab. Berau Prov. Kalimantan Timur,Kab. Berau,,Kalimantan Timur
20219760,SMAS ADVENT CIMINDI BANDUNG,https://sekolah.data.kemdikbud.go.id/index.php/Chome/profil/FFB86AB9-5D5F-4BF6-8F63-661C035FA7CD,JL. RAYA CIMINDI NO. 74 Campaka Kec. Andir Kota Bandung Prov. Jawa Barat,,Kota Bandung,Jawa Barat
69760883,SMAS MIFTAHUL ULUM,https://sekolah.data.kemdikbud.go.id/index.php/Chome/profil/BFAFA14C-03C6-486C-9CE6-66202F142FCF,JL. KH. Abd. Aziz Bengkok 01 Pangeraan Dabung Kec. Geger Kab. Bangkalan Prov. Jawa Timur,Kab. Bangkalan,,Jawa Timur
10505852,SMAN 15 TEBO,https://sekolah.data.kemdikbud.go.id/index.php/Chome/profil/D689325A-0D72-4982-8F66-66213E4BEF18,Jl. Yogyakarta Sekutur Jaya Kec. Serai Serumpun Kab. Tebo Prov. Jambi,Kab. Tebo,,Jambi
30304273,SMAN 3 BANJARMASIN,https://sekolah.data.kemdikbud.go.id/index.php/Chome/profil/83CE59F8-315D-43A7-979F-662C93AABB2E,JL. VETERAN NO. 381 Sungai Bilu Kec. Banjarmasin Timur Kota Banjarmasin Prov. Kalimantan Selatan,,Kota Banjarmasin,Kalimantan Selatan
20231708,SMAS ISLAM DARUSALAM,https://sekolah.data.kemdikbud.go.id/index.php/Chome/profil/C9CF3309-E643-4EB9-B3FF-6632DBEA1B09,JL. CIKUNIR RAYANO.  2A JAKA MULYA Jaka Mulya Kec. Bekasi Selatan Kota Bekasi Prov. Jawa Barat,,Kota Bekasi,Jawa Barat
20533628,SMA IBNU SINA,https://sekolah.data.kemdikbud.go.id/index.php/Chome/profil/44F74B9D-4FB3-4E67-9905-6632F93243E8,JL. LA.  ADI SUCIPTO 334 B Pandanwangi Kec. Blimbing Kota Malang Prov. Jawa Timur,,Kota Malang,Jawa Timur
69990578,SMA Swasta Abdi Pusaka Indonesia,https://sekolah.data.kemdikbud.go.id/index.php/Chome/profil/05194197-7362-48AC-AC4E-6641A2B419EE,Desa Umbu Umbu Kec. Gido Kab. Nias Prov. Sumatera Utara,Kab. Nias,,Sumatera Utara
10301590,SMAN 1 BUKIT SUNDI,https://sekolah.data.kemdikbud.go.id/index.php/Chome/profil/468B264A-1A71-473C-80F5-664E3CBAEE7F,"JL. MUARA PANAS,CUPAK MUARO PANEH Kec. Bukit Sundi Kab. Solok Prov. Sumatera Barat",Kab. Solok,,Sumatera Barat
69862405,SMA SWASTA DWI TUNGGAL,https://sekolah.data.kemdikbud.go.id/index.php/Chome/profil/A9DD97B3-14E4-4853-9D9C-6650DC7A9607,"JL. MEDAN-TANJUNG MORAWA KM 14,5 Bangun Sari Baru Kec. Tanjung Morawa Kab. Deli Serdang Prov. Sumatera Utara",Kab. Deli Serdang,,Sumatera Utara
69947493,SMA NEGERI 2 MAWASANGKA TIMUR,https://sekolah.data.kemdikbud.go.id/index.php/Chome/profil/D5421D03-AFE2-44D1-9526-665600BAEBED,Jl. La Ode Abdul Kahar Wambuloli Kec. Mawasangka Timur Kab. Buton Tengah Prov. Sulawesi Tenggara,Kab. Buton Tengah,,Sulawesi Tenggara
40312013,SMAN 12 MAKASSAR,https://sekolah.data.kemdikbud.go.id/index.php/Chome/profil/D388DB54-AD78-4EB0-BA8F-665B79C59243,JL.MOHA LASULORO 57 ANTANG Antang Kec. Manggala Kota Makassar Prov. Sulawesi Selatan,,Kota Makassar,Sulawesi Selatan
10112849,SMA NEGERI 2 SERUWAY,https://sekolah.data.kemdikbud.go.id/index.php/Chome/profil/07050E45-E466-4C2A-83C6-665B8152F4B4,JL. PURWODADI Sei Kuruk Ii Kec. Seruway Kab. Aceh Tamiang Prov. Aceh,Kab. Aceh Tamiang,,Aceh
30208705,SMA NEGERI 3 LAUNG TUHUP,https://sekolah.data.kemdikbud.go.id/index.php/Chome/profil/FA86C468-788B-4B77-9940-6662ED85ACE9,BATU BUA I Batu Bua I Kec. Laung Tuhup Kab. Murung Raya Prov. Kalimantan Tengah,Kab. Murung Raya,,Kalimantan Tengah
30105204,SMAN 8 PONTIANAK,https://sekolah.data.kemdikbud.go.id/index.php/Chome/profil/04531D4B-7A11-4B2D-B063-6664362CE129,JL. AMPERA Sungai Jawi Kec. Pontianak Kota Kota Pontianak Prov. Kalimantan Barat,,Kota Pontianak,Kalimantan Barat
30202756,SMAN 1 PULAU MALAN,https://sekolah.data.kemdikbud.go.id/index.php/Chome/profil/08D469C9-CC24-4B27-80E5-6671E837CCB3,JL.PADAT KARYA NO.2 Buntut Bali Kec. Pulau Malan Kab. Katingan Prov. Kalimantan Tengah,Kab. Katingan,,Kalimantan Tengah
10102284,SMA NEGERI 7 TAKENGON,https://sekolah.data.kemdikbud.go.id/index.php/Chome/profil/AC28D23A-42E9-4676-8451-6672A051D8FF,JL. TAKENGON - BINTANG Kuala I Kec. Bintang Kab. Aceh Tengah Prov. Aceh,Kab. Aceh Tengah,,Aceh
10258259,SMA SWASTA AFORE SUSUA,https://sekolah.data.kemdikbud.go.id/index.php/Chome/profil/F4FF51CA-E4FD-4208-A54F-66760ECB7E79,DESA FONDRAKORAYA Fondrakoraya Kec. Ulususua Kab. Nias Selatan Prov. Sumatera Utara,Kab. Nias Selatan,,Sumatera Utara
69966501,SMA NEGERI 2 LINTANG KANAN,https://sekolah.data.kemdikbud.go.id/index.php/Chome/profil/CBE27847-17B3-438E-9420-667DB1163963,Jl. Raya Desa Umojati Umojati Kec. Lintang Kanan Kab. Empat Lawang Prov. Sumatera Selatan,Kab. Empat Lawang,,Sumatera Selatan
70005101,SMA Swasta IT Daarul Istiqlal,https://sekolah.data.kemdikbud.go.id/index.php/Chome/profil/6468D3D9-0EAF-4040-8BBC-667E29A1A5EE,Jl. Pantai Rambung Gg. Cakra II Pasar II... Marindal Satu Kec. Patumbak Kab. Deli Serdang Prov. Sumatera Utara,Kab. Deli Serdang,,Sumatera Utara
10501834,SMAN 5 TANJUNG JABUNG  BARAT,https://sekolah.data.kemdikbud.go.id/index.php/Chome/profil/D675E20E-4632-4FB6-9C37-667FBF5A2163,JL. SULTAN THAHA NO.42 TELUK NILAU Teluk Nilau Kec. Pengabuan Kab. Tanjung Jabung Barat Prov. Jambi,Kab. Tanjung Jabung Barat,,Jambi
69727587,SMAS TAMPO,https://sekolah.data.kemdikbud.go.id/index.php/Chome/profil/1C2B48FF-5423-4420-BDB6-6686358E998F,JL. LA ALAMUNA Tampo Kec. Napabalano Kab. Muna Prov. Sulawesi Tenggara,Kab. Muna,,Sulawesi Tenggara
