kode,nama,link_profil,alamat,kabupaten,kota,provinsi
69899009,SMA BUDI BAKTI 2,https://sekolah.data.kemdikbud.go.id/index.php/Chome/profil/27D76290-4273-4E71-BDE8-72144E9F4DDC,KP.Gabungan Ds.Mekarjaya Mekarjaya Kec. Cidaun Kab. Cianjur Prov. Jawa Barat,Kab. Cianjur,,Jawa Barat
30304281,SMAN 10 BANJARMASIN,https://sekolah.data.kemdikbud.go.id/index.php/Chome/profil/7EFB4D7E-E9ED-4A07-A71D-721978F421F7,Jalan Lingkar Dalam Selatan No.51 RT 28 Kelayan Selatan Kec. Banjarmasin Selatan Kota Banjarmasin Prov. Kalimantan Selatan,,Kota Banjarmasin,Kalimantan Selatan
69912321,SMA BANJARWANGI SATU,https://sekolah.data.kemdikbud.go.id/index.php/Chome/profil/DEF94F4F-C088-4757-BA91-721AFC0EC65D,Kp. Empang RT 03 RW 03 Wangunjaya Kec. Banjarwangi Kab. Garut Prov. Jawa Barat,Kab. Garut,,Jawa Barat
40300669,SMAS DDI PANGKAJENE,https://sekolah.data.kemdikbud.go.id/index.php/Chome/profil/88102092-29AE-46AD-9536-721C505F25A4,JL. SULTAN HASANUDDIN NO.68 Bonto Perak Kec. Pangkajene Kab. Pangkajene Dan Kepulauan Prov. Sulawesi Selatan,Kab. Pangkajene Dan Kepulauan,,Sulawesi Selatan
30302134,SMAN 3 BARABAI,https://sekolah.data.kemdikbud.go.id/index.php/Chome/profil/182F5DC4-B494-4F32-8D13-721E1D68E423,JL. GRILYA HASAN BASERI NO. 4 Birayang Kec. Batang Alai Selatan Kab. Hulu Sungai Tengah Prov. Kalimantan Selatan,Kab. Hulu Sungai Tengah,,Kalimantan Selatan
20571688,SMAS AL KHAIRIYAH,https://sekolah.data.kemdikbud.go.id/index.php/Chome/profil/66015D18-05CA-4157-8311-7221767ADD96,JL.Panglima Sudirman Sumberlele Kraksaan Sumberlele Kec. Kraksaan Kab. Probolinggo Prov. Jawa Timur,Kab. Probolinggo,,Jawa Timur
70047426,SMA NEGERI 1 ULILIN,https://sekolah.data.kemdikbud.go.id/index.php/Chome/profil/437376A8-28A6-4B50-A11E-7221A67A371B,Kampung Nggayu Nggayu Kec. Ulilin Kab. Merauke Prov. Papua Selatan,Kab. Merauke,,Papua Selatan
20235620,SMAN 2 CIMALAKA,https://sekolah.data.kemdikbud.go.id/index.php/Chome/profil/D6E22825-3910-4FBC-B3E2-7225DC279594,JL. MARGAMUKTI NO.96 LICIN Licin Kec. Cimalaka Kab. Sumedang Prov. Jawa Barat,Kab. Sumedang,,Jawa Barat
20536296,SMAN 3 PROBOLINGGO,https://sekolah.data.kemdikbud.go.id/index.php/Chome/profil/84D24A42-4063-4B52-9946-7235AC7B32C4,JL. JERUK 66-68 Jrebeng Kidul Kec. Wonoasih Kota Probolinggo Prov. Jawa Timur,,Kota Probolinggo,Jawa Timur
20517815,SMAS ISLAM AL-HIKMAH TAJINAN,https://sekolah.data.kemdikbud.go.id/index.php/Chome/profil/67A58D4D-A313-4E39-8490-72383B51A3B2,JL. RAYA NO. 127 TAJINAN Tajinan Kec. Tajinan Kab. Malang Prov. Jawa Timur,Kab. Malang,,Jawa Timur
20270776,SMAN 2 GUNUNG PUTRI,https://sekolah.data.kemdikbud.go.id/index.php/Chome/profil/8154DB21-C95D-4807-936F-72517140E9E3,Jl. Boulevard Utama Kota Wisata Cibubur Ciangsana Kec. Gunungputri Kab. Bogor Prov. Jawa Barat,Kab. Bogor,,Jawa Barat
10805039,SMAS 17 PAGELARAN,https://sekolah.data.kemdikbud.go.id/index.php/Chome/profil/542AD272-DA61-4150-90CE-7258F8EBE201,JL. KESEHATAN NO. 17 Patoman Kec. Pagelaran Kab. Pringsewu Prov. Lampung,Kab. Pringsewu,,Lampung
69960860,SMA ISLAM TERPADU AL - HADAYA,https://sekolah.data.kemdikbud.go.id/index.php/Chome/profil/F3381743-0ED4-4B65-B815-72686924D217,CAHAYA BARU CAHAYA BARU Kec. Mandah Kab. Indragiri Hilir Prov. Riau,Kab. Indragiri Hilir,,Riau
69927116,SMA I SIRAJUL AKHYAR,https://sekolah.data.kemdikbud.go.id/index.php/Chome/profil/F6BB424F-F4D2-4B5A-88E9-726D3DAE97A1,ALASMALANG Alasmalang Kec. Ra as Kab. Sumenep Prov. Jawa Timur,Kab. Sumenep,,Jawa Timur
10809592,SMAS PERINTIS 2 BANDAR LAMPUNG,https://sekolah.data.kemdikbud.go.id/index.php/Chome/profil/2B6FD28F-EA3F-4611-982C-726FF2648D37,JL.KHAIRIL ANWAR N0.106 Durian Payung Kec. Tanjung Karang Pusat Kota Bandar Lampung Prov. Lampung,,Kota Bandar Lampung,Lampung
40305152,SMAN 2 PINRANG,https://sekolah.data.kemdikbud.go.id/index.php/Chome/profil/5DD8AB24-2DD2-4958-8537-7270D2512C73,JL. POROS PINRANG POLMAS Lampa Kec. Duampanua Kab. Pinrang Prov. Sulawesi Selatan,Kab. Pinrang,,Sulawesi Selatan
69853535,SMA ISLAM NURUS SHOBAH,https://sekolah.data.kemdikbud.go.id/index.php/Chome/profil/ADEF2B0B-947A-415E-A630-72753C8A90F2,DESA TAMBAK SARI RUBARU TAMBAK SARI Kec. Rubaru Kab. Sumenep Prov. Jawa Timur,Kab. Sumenep,,Jawa Timur
40102416,SMAS KOSGORO MAUMBI,https://sekolah.data.kemdikbud.go.id/index.php/Chome/profil/3D50B399-1D49-41F5-A157-7282D72FD5E5,MAUMBI Maumbi Kec. Kalawat Kab. Minahasa Utara Prov. Sulawesi Utara,Kab. Minahasa Utara,,Sulawesi Utara
10805983,SMAS MUHAMMADIYAH PURBOLINGGO,https://sekolah.data.kemdikbud.go.id/index.php/Chome/profil/3A118008-6146-49F6-A0EB-72830ADD7660,JL. RAWA PATAH NO 34 Toto Harjo Kec. Purbolinggo Kab. Lampung Timur Prov. Lampung,Kab. Lampung Timur,,Lampung
10645013,SMA PUSPITA,https://sekolah.data.kemdikbud.go.id/index.php/Chome/profil/3FAC137B-A6E8-4898-A4E1-7285E2F49393,Jl. Inpres Dusun IV Cintamanis Baru KM X... Cinta Manis Baru Kec. Air Kumbang Kab. Banyuasin Prov. Sumatera Selatan,Kab. Banyuasin,,Sumatera Selatan
70054947,SMAS ISLAM IMAM NAWAWI,https://sekolah.data.kemdikbud.go.id/index.php/Chome/profil/7D7A51B2-7583-4370-A42F-7285EFE66B2B,"Jl. Tjilik Riwut Km. 8, Gg. Gajah Mada R... Bukit Tunggal Kec. Jekan Raya Kota Palangka Raya Prov. Kalimantan Tengah",,Kota Palangka Raya,Kalimantan Tengah
69762588,SMAN APUI,https://sekolah.data.kemdikbud.go.id/index.php/Chome/profil/3F8F06C2-45C6-4EFD-BE56-728A5BA774D5,APUI Kelaisi Timur Kec. Alor Selatan Kab. Alor Prov. Nusa Tenggara Timur,Kab. Alor,,Nusa Tenggara Timur
70046505,SMA SAINS AL-QURAN AR-RIDHO,https://sekolah.data.kemdikbud.go.id/index.php/Chome/profil/88E99DB5-2D24-4881-A2F6-72941F732537,"Jl. Ujan Mas, Uman Agung, Bandar Mataram Uman Agung Kec. Bandar Mataram Kab. Lampung Tengah Prov. Lampung",Kab. Lampung Tengah,,Lampung
20402041,SMA DOMINIKUS WONOSARI,https://sekolah.data.kemdikbud.go.id/index.php/Chome/profil/6543B99F-251A-43D4-AA23-72965CAA6D0D,Jl. Mgr. Sugiyopranoto No 29 Wonosari Gu... Baleharjo Kec. Wonosari Kab. Gunungkidul Prov. D.I. Yogyakarta,Kab. Gunungkidul,,D.I. Yogyakarta
69995755,SMAN 24 KONAWE SELATAN,https://sekolah.data.kemdikbud.go.id/index.php/Chome/profil/1D74E0E8-4669-49B3-BD24-729A5B98136A,Desa Lainea Lainea Kec. Lainea Kab. Konawe Selatan Prov. Sulawesi Tenggara,Kab. Konawe Selatan,,Sulawesi Tenggara
60101543,SMA Negeri 6 Seram Bagian Barat,https://sekolah.data.kemdikbud.go.id/index.php/Chome/profil/26C8AFA8-2C3E-49BC-89C0-729BDD8B5BDD,"KATAPANG,HUAMUAL SERAM BARAT DESA LOKKI Kec. Huamual Kab. Seram Bagian Barat Prov. Maluku",Kab. Seram Bagian Barat,,Maluku
20326500,SMAS ISLAM TAALAMUL HUDA BUMIAYU,https://sekolah.data.kemdikbud.go.id/index.php/Chome/profil/C3E52DC1-E42C-4999-964A-729F98637635,JL. KH. Ahmad Dahlan no.99 Kalierang Bum... Kalierang Kec. Bumiayu Kab. Brebes Prov. Jawa Tengah,Kab. Brebes,,Jawa Tengah
20510144,SMAN 1 BUNGKAL,https://sekolah.data.kemdikbud.go.id/index.php/Chome/profil/EFD85990-E521-43B1-99FD-72A0464C4853,JL. AHMAD YANI 21 Bancar Kec. Bungkal Kab. Ponorogo Prov. Jawa Timur,Kab. Ponorogo,,Jawa Timur
70025364,SMA KATOLIK ST. JOSEF FREINADEMETZ,https://sekolah.data.kemdikbud.go.id/index.php/Chome/profil/B2F90E88-F8F6-47A9-B203-72A222BD586E,Jalan Bandara Tambolaka PAYOLA UMBU Kec. Loura Kab. Sumba Barat Daya Prov. Nusa Tenggara Timur,Kab. Sumba Barat Daya,,Nusa Tenggara Timur
10100541,SMA NEGERI 1 SIGLI,https://sekolah.data.kemdikbud.go.id/index.php/Chome/profil/E5980419-17A4-4261-9C97-72A79C286FF6,JL. BANDA ACEH - MEDAN KM. 115 SIGLI Blok Sawah Kec. Kota Sigli Kab. Pidie Prov. Aceh,Kab. Pidie,,Aceh
20540165,SMA AL HIKMAH MUNCAR,https://sekolah.data.kemdikbud.go.id/index.php/Chome/profil/3DA85942-B4E7-49A6-A8D2-72A9131475B4,JL.ABDUL MANAN KM.02 Sumberberas Kec. Muncar Kab. Banyuwangi Prov. Jawa Timur,Kab. Banyuwangi,,Jawa Timur
70038405,SMA AL-MANAR,https://sekolah.data.kemdikbud.go.id/index.php/Chome/profil/A4E179FC-F3A6-4401-B4B8-72AB8E4B35F1,Jl. Raya Cibarusah No. 67 Cibarusahjaya Kec. Cibarusah Kab. Bekasi Prov. Jawa Barat,Kab. Bekasi,,Jawa Barat
10205376,SMA MUHAMMADIYAH 9 KUALUH HULU,https://sekolah.data.kemdikbud.go.id/index.php/Chome/profil/493E5E29-A635-4B8D-AE30-72BABFD49194,JL. GAZALI SINAGA NO.3 Aek Kanopan Kec. Kualuh Hulu Kab. Labuhanbatu Utara Prov. Sumatera Utara,Kab. Labuhanbatu Utara,,Sumatera Utara
69901053,SMA SWASTA SANTA THERESIA,https://sekolah.data.kemdikbud.go.id/index.php/Chome/profil/F4B07D3F-69F6-42E4-88EB-72BC550E7230,Jln. Piere Tandean Tanjung Gading Kec. Pasir Penyu Kab. Indragiri Hulu Prov. Riau,Kab. Indragiri Hulu,,Riau
50300270,SMA NEGERI 1 AMARASI BARAT,https://sekolah.data.kemdikbud.go.id/index.php/Chome/profil/FA6EE2DE-B1A2-4173-B4BC-72BD5C4A2092,JL. H.R. KOROH Niukbaun Kec. Amarasi Barat Kab. Kupang Prov. Nusa Tenggara Timur,Kab. Kupang,,Nusa Tenggara Timur
69775314,SMAN 2 SOYO JAYA,https://sekolah.data.kemdikbud.go.id/index.php/Chome/profil/0F0EFAF7-B172-475D-8B56-72C160C8D68A,Jl. Poros Malino No 001 Panca Makmur Kec. Soyo Jaya Kab. Morowali Utara Prov. Sulawesi Tengah,Kab. Morowali Utara,,Sulawesi Tengah
69822731,SMA NEGERI 3 TANAH SIANG,https://sekolah.data.kemdikbud.go.id/index.php/Chome/profil/B900E3D4-E836-4466-821B-72C4C64B4CCC,"JL BELAWAN, RT III. NO 01 Belawan Kec. Tanah Siang Kab. Murung Raya Prov. Kalimantan Tengah",Kab. Murung Raya,,Kalimantan Tengah
69824455,SMA SWASTA PERGURUAN KRISTEN METHODIST INDONESIA SIDIKALANG,https://sekolah.data.kemdikbud.go.id/index.php/Chome/profil/84DAFDBF-9811-41D1-ADE0-72C89961EE27,JL.SENTOSA Kalang Simbara Kec. Sidikalang Kab. Dairi Prov. Sumatera Utara,Kab. Dairi,,Sumatera Utara
10506150,SMAS IT AL- AZHAR,https://sekolah.data.kemdikbud.go.id/index.php/Chome/profil/349B7F25-6041-4DC3-A23D-72CD60D6BDF4,JL. KOL. AMIR HAMZAH NO.32 Simpang Iv Sipin Kec. Telanai Pura Kota Jambi Prov. Jambi,,Kota Jambi,Jambi
69959951,SMAS TAHFIDZ AL-QURAN AL-MUMINUN,https://sekolah.data.kemdikbud.go.id/index.php/Chome/profil/9E1626F1-D899-4654-B18A-72D1A6A4DCBE,JL. POROS MAKASSAR - PALOPO Tellesang Kec. Pitumpanua Kab. Wajo Prov. Sulawesi Selatan,Kab. Wajo,,Sulawesi Selatan
69988075,SMA NEGERI KOTOLIN,https://sekolah.data.kemdikbud.go.id/index.php/Chome/profil/E0C7F138-5397-4627-8E6C-72D20DA31F05,Kotolin Kotolin Kec. Kot`Olin Kab. Timor Tengah Selatan Prov. Nusa Tenggara Timur,Kab. Timor Tengah Selatan,,Nusa Tenggara Timur
50308302,SMAN 1 WOLOWAE,https://sekolah.data.kemdikbud.go.id/index.php/Chome/profil/8B2571E2-4843-4430-AE76-72D7C92E522B,JL. PANTURA JUR. MBAY- MAUMERE Tenda Kinde Kec. Wolowae Kab. Nagekeo Prov. Nusa Tenggara Timur,Kab. Nagekeo,,Nusa Tenggara Timur
10214174,SMA SWASTA METHODIST TANJUNG MORAWA,https://sekolah.data.kemdikbud.go.id/index.php/Chome/profil/D698BD47-ADC6-4723-B7D0-72DB3EF1E57C,JL. IRIAN NO.239 Tanjung Morawa Pekan Kec. Tanjung Morawa Kab. Deli Serdang Prov. Sumatera Utara,Kab. Deli Serdang,,Sumatera Utara
60301003,SMAS MUHAMMADIYAH,https://sekolah.data.kemdikbud.go.id/index.php/Chome/profil/64766FE0-87C0-4318-8917-72DBFACEA34B,JL. ABEPANTAI NO.25 ABEPURA Awiyo Kec. Abepura Kota Jayapura Prov. Papua,,Kota Jayapura,Papua
70025497,SMA Swasta Pusaka Bandar Klippa,https://sekolah.data.kemdikbud.go.id/index.php/Chome/profil/BA3BEC98-140A-4D01-954A-72DE9C7087DC,Jl. Perdamean Gg. Perdamaian No. 14 Bandar Klippa Kec. Percut Sei Tuan Kab. Deli Serdang Prov. Sumatera Utara,Kab. Deli Serdang,,Sumatera Utara
69767582,SMAS NURUL ARAFAH,https://sekolah.data.kemdikbud.go.id/index.php/Chome/profil/12E99393-026E-4D82-AD2A-72E3B98D0A5F,JLN. SIMPANG PANTEU BREUH KM. 1 Meunasah Bujok Kec. Baktiya Kab. Aceh Utara Prov. Aceh,Kab. Aceh Utara,,Aceh
10702877,SMA NEGERI 6 REJANG LEBONG,https://sekolah.data.kemdikbud.go.id/index.php/Chome/profil/8AEBE0C6-E851-4A5F-BC8E-72EAEEA5368E,Jln. RAYA DESA SENTRAL BARU Sentral Baru Kec. Bermani Ulu Kab. Rejang Lebong Prov. Bengkulu,Kab. Rejang Lebong,,Bengkulu
20306205,SMAS WIDYA KUTOARJO,https://sekolah.data.kemdikbud.go.id/index.php/Chome/profil/40B2FECB-38C6-4A57-93AB-72EF2A0F344B,JL. SAWUNGGALIH  NO. 70 Semawung Daleman Kec. Kutoarjo Kab. Purworejo Prov. Jawa Tengah,Kab. Purworejo,,Jawa Tengah
70048300,SMA ISLAM HUSNUL KHOTIMAH JIKEN,https://sekolah.data.kemdikbud.go.id/index.php/Chome/profil/4E9CBB13-C38C-4FB9-B1E3-72EFEA25912F,Jl. Raya Rarang Tengah RARANG TENGAH Kec. Terara Kab. Lombok Timur Prov. Nusa Tenggara Barat,Kab. Lombok Timur,,Nusa Tenggara Barat
10110790,SMA FAJAR HIDAYAH,https://sekolah.data.kemdikbud.go.id/index.php/Chome/profil/1C75DDCB-521E-48BD-97D7-72F2FE969E9F,"JL. BANDARA SIM KM. 14,5 Cot Mon Raya Kec. Blang Bintang Kab. Aceh Besar Prov. Aceh",Kab. Aceh Besar,,Aceh
10806032,SMAS CATURSAKTI MARGATIGA,https://sekolah.data.kemdikbud.go.id/index.php/Chome/profil/C08AFF87-7EED-40C9-AC4F-72F3D78B2C5E,JL. TRANS POLRI JAYAGUNA I Sukaraja Tiga Kec. Margatiga Kab. Lampung Timur Prov. Lampung,Kab. Lampung Timur,,Lampung
10211710,SMAS SURYA,https://sekolah.data.kemdikbud.go.id/index.php/Chome/profil/A35D77F7-E24E-4CF6-B9FE-72F8EE621020,JL. DALIL TANI NO. 55 Tomuan Kec. Siantar Timur Kota Pematangsiantar Prov. Sumatera Utara,,Kota Pematangsiantar,Sumatera Utara
60102025,SMAN 9 AMBON,https://sekolah.data.kemdikbud.go.id/index.php/Chome/profil/9D5B8BED-A275-4C62-9F59-72FB2E704FF5,JL. NAPU Waiheru Kec. Baguala Kota Ambon Prov. Maluku,,Kota Ambon,Maluku
69952949,SMA LENTERA HARAPAN TOMOHON,https://sekolah.data.kemdikbud.go.id/index.php/Chome/profil/C814B557-2C5C-4EF7-B8B8-72FB613BE755,Jalan Makmur-Lingkar Timur Paslaten Satu Kec. Tomohon Timur Kota Tomohon Prov. Sulawesi Utara,,Kota Tomohon,Sulawesi Utara
30101895,SMAN 3 SANGGAU,https://sekolah.data.kemdikbud.go.id/index.php/Chome/profil/58553E3B-E6C5-46A8-B410-7302F14AF355,JL. H. ABAS NO. 41 Ilir Kota Kec. Kapuas Kab. Sanggau Prov. Kalimantan Barat,Kab. Sanggau,,Kalimantan Barat
70036829,SMA Bina Bangsa School Balikpapan,https://sekolah.data.kemdikbud.go.id/index.php/Chome/profil/36E62C83-4B29-4AF4-84B7-730A03F89B4C,Jl. Jend. Sudirman Balikpapan Superblock... Gunung Bahagia Kec. Balikpapan Selatan Kota Balikpapan Prov. Kalimantan Timur,,Kota Balikpapan,Kalimantan Timur
50103172,SMAS PGRI 4 DENPASAR,https://sekolah.data.kemdikbud.go.id/index.php/Chome/profil/FEDA3B95-A4ED-4083-AE51-730B6F1A9213,JL. KENYERI G 27 DENPASAR Dangin Puri Kangin Kec. Denpasar Utara Kota Denpasar Prov. Bali,,Kota Denpasar,Bali
70050893,SMA STELLA GRACIA,https://sekolah.data.kemdikbud.go.id/index.php/Chome/profil/A1A2DD4E-95A1-41E5-A60A-730D6C7A8495,JL. Kh. Ahmad Dahlan No. 99 Kupang Teba Kec. Teluk Betung Utara Kota Bandar Lampung Prov. Lampung,,Kota Bandar Lampung,Lampung
20265284,SMAS YOS SUDARSO,https://sekolah.data.kemdikbud.go.id/index.php/Chome/profil/B326F30B-DF5A-4582-8D11-73137549BB58,JL. BELAKANG PASAR NO. 14 Nagasari Kec. Karawang Barat Kab. Karawang Prov. Jawa Barat,Kab. Karawang,,Jawa Barat
69977465,SMAN 23 KONAWE SELATAN,https://sekolah.data.kemdikbud.go.id/index.php/Chome/profil/670C4304-8E6F-4CE6-B2AE-731599CD6B90,JALAN REGA Anggondara Kec. Palangga Kab. Konawe Selatan Prov. Sulawesi Tenggara,Kab. Konawe Selatan,,Sulawesi Tenggara
40303697,SMAN 7 SOPPENG,https://sekolah.data.kemdikbud.go.id/index.php/Chome/profil/827CFD7C-AC7B-433C-B9DB-7318EC592605,JL.POROS SENGKANG Ujung Kec. Lili Rilau Kab. Soppeng Prov. Sulawesi Selatan,Kab. Soppeng,,Sulawesi Selatan
50202394,SMAS DANA NW BAGEK NYALA,https://sekolah.data.kemdikbud.go.id/index.php/Chome/profil/CDD8C762-E4F6-4678-AF57-731BE9CE96CB,Jalan TGH. Tajuddin Ahmad MONTONG BETER Kec. Sakra Barat Kab. Lombok Timur Prov. Nusa Tenggara Barat,Kab. Lombok Timur,,Nusa Tenggara Barat
20328929,SMA Laboratorium UPGRIS,https://sekolah.data.kemdikbud.go.id/index.php/Chome/profil/EE6E1E58-F501-48CA-8828-732408C854B6,Jl. Gajah Raya No. 40 Siwalan Kec. Gayamsari Kota Semarang Prov. Jawa Tengah,,Kota Semarang,Jawa Tengah
70048527,SMA TAHFIDH YANBUUL QURAN 5 TEGAL,https://sekolah.data.kemdikbud.go.id/index.php/Chome/profil/4C05B10F-B194-4498-BC9F-732A847C4697,Jl Garuda No. 143 Bumiharja Kec. Tarub Kab. Tegal Prov. Jawa Tengah,Kab. Tegal,,Jawa Tengah
40205119,SMAN 1 PARIGI TENGAH,https://sekolah.data.kemdikbud.go.id/index.php/Chome/profil/8A0F9B64-79B1-4A5E-A62D-73311691F675,JL. TIMBALUKA Pelawa Baru Kec. Parigi Tengah Kab. Parigi Moutong Prov. Sulawesi Tengah,Kab. Parigi Moutong,,Sulawesi Tengah
70006135,SMA Kristen Rajawali,https://sekolah.data.kemdikbud.go.id/index.php/Chome/profil/0E000133-4C4E-4D34-BD47-73316AF5A0DB,Jl. Raya Hawai No.05 Sentani Nendali Kec. Sentani Timur Kab. Jayapura Prov. Papua,Kab. Jayapura,,Papua
69947454,SMA Negeri 61 Maluku Tengah,https://sekolah.data.kemdikbud.go.id/index.php/Chome/profil/5853387A-8D9F-41E6-86C0-7336E54CE14D,Jl. Lintas Seram Waipia Usliapan Kec. Teon Nila Serua Kab. Maluku Tengah Prov. Maluku,Kab. Maluku Tengah,,Maluku
20613518,SMAN 9 KOTA TANGERANG SELATAN,https://sekolah.data.kemdikbud.go.id/index.php/Chome/profil/6E00EC40-AB3D-4507-B127-7337EB8278C7,Jl. Hidup Baru No. 31 Sarua Kec. Ciputat Kota Tangerang Selatan Prov. Banten,,Kota Tangerang Selatan,Banten
10495715,SMA NEGERI 2 TAMBUSAI UTARA,https://sekolah.data.kemdikbud.go.id/index.php/Chome/profil/06EB1003-5C91-4590-9F36-73395387A6B8,JL.PELAJAR NO. 2  MAHATO Mahato Kec. Tambusai Utara Kab.  Rokan Hulu Prov. Riau,Kab.  Rokan Hulu,,Riau
20107325,SMAS PERG CIKINI JAKARTA,https://sekolah.data.kemdikbud.go.id/index.php/Chome/profil/8B252C9B-C50E-4709-AF27-73416C260F5A,JL. DUREN TIGA RAYA No.1 Duren Tiga Kec. Pancoran Kota Adm. Jakarta Selatan Prov. D.K.I. Jakarta,,Kota Adm. Jakarta Selatan,D.K.I. Jakarta
69774631,SMA AL-ITSBATIYAH DARUL ULUM BANYUANYAR,https://sekolah.data.kemdikbud.go.id/index.php/Chome/profil/3816BADD-86AC-40E7-A95F-7342A37DD609,Dsn. Ponpes Banyuanyar Potoan Daja Kec. Palengaan Kab. Pamekasan Prov. Jawa Timur,Kab. Pamekasan,,Jawa Timur
69991774,SMA Pelita Hati,https://sekolah.data.kemdikbud.go.id/index.php/Chome/profil/9E5DDA1F-4058-45C0-AFB2-734967C829AD,Jl.. Mayjend. Sutoyo RT 56 No.21-23 Klandasan Ilir Kec. Balikpapan Selatan Kota Balikpapan Prov. Kalimantan Timur,,Kota Balikpapan,Kalimantan Timur
10306090,SMA S MUHAMMADIYAH UJUNG GADING,https://sekolah.data.kemdikbud.go.id/index.php/Chome/profil/DE5F4AEE-C9A0-4089-93A0-73569ACF416D,JL. NUSANTARA TIMUR NO.81 UJUANG GADIANG Kec. Lembah Melintang Kab. Pasaman Barat Prov. Sumatera Barat,Kab. Pasaman Barat,,Sumatera Barat
20319326,SMAS AL MAARIF DEMAK,https://sekolah.data.kemdikbud.go.id/index.php/Chome/profil/E116576A-2611-4E57-92B6-735CA5230816,JL. SULTAN HADIWIJAYA Mangunjiwan Kec. Demak Kab. Demak Prov. Jawa Tengah,Kab. Demak,,Jawa Tengah
50203308,SMAN 1 MOYO HULU,https://sekolah.data.kemdikbud.go.id/index.php/Chome/profil/12C6EE30-3685-4702-BB15-735EB9C18473,JL. RAYA SUMBAWA BESAR-SEMAMUNG Marga Karya Kec. Moyo Hulu Kab. Sumbawa Prov. Nusa Tenggara Barat,Kab. Sumbawa,,Nusa Tenggara Barat
70050561,SMA SHINE HIGH SCHOOL SORONG,https://sekolah.data.kemdikbud.go.id/index.php/Chome/profil/0C9BFC3D-5156-41B8-87A6-73672D75326D,JL. BASUKI RAHMAT KM.9 Kladufu Kec. Sorong Timur Kota Sorong Prov. Papua Barat Daya,,Kota Sorong,Papua Barat Daya
10644256,SMAN 1 ULU MUSI,https://sekolah.data.kemdikbud.go.id/index.php/Chome/profil/A6D36586-FBEA-4F5E-9759-7369357B3F15,Jl. Pasemah Air Keruh Desa Padang Tepong Padang Tepong Kec. Ulu Musi Kab. Empat Lawang Prov. Sumatera Selatan,Kab. Empat Lawang,,Sumatera Selatan
20532382,SMAS ATMA WIDYA,https://sekolah.data.kemdikbud.go.id/index.php/Chome/profil/E4460968-2A80-429C-A8A7-736A51428094,JL. KAPASARI 3-5 Kapasari Kec. Genteng Kota Surabaya Prov. Jawa Timur,,Kota Surabaya,Jawa Timur
20103231,SMAS MALAHAYATI,https://sekolah.data.kemdikbud.go.id/index.php/Chome/profil/41CCC768-EBC5-4502-90F8-736B5DFEDAE5,JL. BIMA NO.3 Cijantung Kec. Pasar Rebo Kota Adm. Jakarta Timur Prov. D.K.I. Jakarta,,Kota Adm. Jakarta Timur,D.K.I. Jakarta
50303809,SMA MUHAMMADIYAH WAINGAPU,https://sekolah.data.kemdikbud.go.id/index.php/Chome/profil/DF147705-8FBD-4F86-868E-736E999063C0,JL. TRITURA NO. 26 WAINGAPU Kamalaputi Kec. Kota Waingapu Kab. Sumba Timur Prov. Nusa Tenggara Timur,Kab. Sumba Timur,,Nusa Tenggara Timur
20227465,SMAN 12 GARUT,https://sekolah.data.kemdikbud.go.id/index.php/Chome/profil/F8E82619-5731-4792-A08C-7371A5950C06,Jl Raya Cisewu No. 35 Cisewu Garut 44166 Cisewu Kec. Cisewu Kab. Garut Prov. Jawa Barat,Kab. Garut,,Jawa Barat
69752430,SMAN 2 Gaung,https://sekolah.data.kemdikbud.go.id/index.php/Chome/profil/E735AB1E-CCD9-4EB3-9B88-7375CC3DD050,JL. RAWA SARI No.1 Belantaraya Kec. Gaung Kab. Indragiri Hilir Prov. Riau,Kab. Indragiri Hilir,,Riau
10259651,SMAN 1 SILANGKITANG,https://sekolah.data.kemdikbud.go.id/index.php/Chome/profil/60E195D1-30BA-4AD1-8317-73778F1F4304,JL. BESAR SILANGKITANG Aek Goti Kec. Silangkitang Kab. Labuhanbatu Selatan Prov. Sumatera Utara,Kab. Labuhanbatu Selatan,,Sumatera Utara
20253130,SMAS IT AL BINAA,https://sekolah.data.kemdikbud.go.id/index.php/Chome/profil/FC8CC8C5-C3E0-4A1C-BC6F-7378345A894D,JL. RAYA PEBAYURAN KABUPATEN BEKASI Kertasari Kec. Pebayuran Kab. Bekasi Prov. Jawa Barat,Kab. Bekasi,,Jawa Barat
20605102,SMAN 1 CIOMAS,https://sekolah.data.kemdikbud.go.id/index.php/Chome/profil/014008B8-5FC7-4097-B007-737EC10E143F,JL. RAYA PASAR CIOMAS Sukabares Kec. Ciomas Kab. Serang Prov. Banten,Kab. Serang,,Banten
10810787,SMAS TUNAS BANGSA,https://sekolah.data.kemdikbud.go.id/index.php/Chome/profil/9C79E959-C467-4740-97B6-7383AB0FB35C,JL. FLAMBOYAN Tanjung Harapan Kec. Merbau Mataram Kab. Lampung Selatan Prov. Lampung,Kab. Lampung Selatan,,Lampung
10505085,SMAN 12 BUNGO,https://sekolah.data.kemdikbud.go.id/index.php/Chome/profil/CB6BA949-E7F6-4FF5-B59F-738FB1E6EFD9,JL. RANGKAYO HITAM KELURAHAN CADIKA Kec. Rimbo Tengah Kab. Bungo Prov. Jambi,Kab. Bungo,,Jambi
40101997,SMA NEGERI 1 RATAHAN,https://sekolah.data.kemdikbud.go.id/index.php/Chome/profil/C2B80676-FBAA-4E1E-91E1-739768C08ED5,JL. WENAS TOSURAYA BARAT Kec. Ratahan Kab. Minahasa Tenggara Prov. Sulawesi Utara,Kab. Minahasa Tenggara,,Sulawesi Utara
50204488,SMAS SARASWATI MATARAM,https://sekolah.data.kemdikbud.go.id/index.php/Chome/profil/300362B3-63FA-4175-BC1A-73A112079BFB,JL. KALI BRANTAS KR. SUKUN Mataram Timur Kec. Mataram Kota Mataram Prov. Nusa Tenggara Barat,,Kota Mataram,Nusa Tenggara Barat
20605110,SMAN 1 PABUARAN,https://sekolah.data.kemdikbud.go.id/index.php/Chome/profil/AE19E564-5B7A-446D-BAE1-73A367E5BA75,JL. RAYA PALKA KM 08 Pasanggrahan Kec. Pabuaran Kab. Serang Prov. Banten,Kab. Serang,,Banten
20549614,SMAS DARUL MUSTOFA,https://sekolah.data.kemdikbud.go.id/index.php/Chome/profil/D4C58C21-681C-424A-81E1-73A5E092BE17,JL. KH. MOH. CHOLIL 1 Tonjung Kec. Burneh Kab. Bangkalan Prov. Jawa Timur,Kab. Bangkalan,,Jawa Timur
10404008,SMAS PGRI,https://sekolah.data.kemdikbud.go.id/index.php/Chome/profil/4FBD23D6-7690-4DC4-AAF5-73AE911B0CD8,JL.BRIGJEND KATAMSO NO. 44 Tengkerang Utara Kec. Bukit Raya Kota Pekanbaru Prov. Riau,,Kota Pekanbaru,Riau
69754608,SMAS HUDAYA,https://sekolah.data.kemdikbud.go.id/index.php/Chome/profil/71AA7652-C8E3-4DCD-A1B0-73B18E1E4DB2,LIMAU MANIS Limau Manis Kec. Pauh Kota Padang Prov. Sumatera Barat,,Kota Padang,Sumatera Barat
10600236,SMAN 2 SEKAYU,https://sekolah.data.kemdikbud.go.id/index.php/Chome/profil/2C68183E-1EA2-4FF1-84A1-73B63D6FF34A,JL. Bupati Oesman Bakar LK I Kel. Kayuar... Kayuara Kec. Sekayu Kab. Musi Banyuasin Prov. Sumatera Selatan,Kab. Musi Banyuasin,,Sumatera Selatan
69862591,SMA N 2 SUMATERA BARAT,https://sekolah.data.kemdikbud.go.id/index.php/Chome/profil/8BF13821-4346-41BE-A4B7-73B895FB91F5,JL. LINTAS SUMATERA - KOTO GAEK GUGUK KOTO GAEK GUGUAK Kec. Gunung Talang Kab. Solok Prov. Sumatera Barat,Kab. Solok,,Sumatera Barat
20223031,SMAS SANTA MARIA MONICA,https://sekolah.data.kemdikbud.go.id/index.php/Chome/profil/12006C75-C605-40F9-AD25-73BBA95CB36C,JL. KARANG SATRIA NO. 1 KP. CEREWET Duren Jaya Kec. Bekasi Timur Kota Bekasi Prov. Jawa Barat,,Kota Bekasi,Jawa Barat
40203342,SMAN 1 ULUBONGKA,https://sekolah.data.kemdikbud.go.id/index.php/Chome/profil/90752871-6641-4654-BFA3-73C0DEDFFE98,JL. TRANS SULAWESI Bonevoto Kec. Ulubongka Kab. Tojo Una Una Prov. Sulawesi Tengah,Kab. Tojo Una Una,,Sulawesi Tengah
20400381,SMA NEGERI 2 BANTUL,https://sekolah.data.kemdikbud.go.id/index.php/Chome/profil/F8AE9B6F-DD52-486C-940D-73C5D91AF16A,"JL. RA. KARTINI, TRIRENGGO, BANTUL Trirenggo Kec. Bantul Kab. Bantul Prov. D.I. Yogyakarta",Kab. Bantul,,D.I. Yogyakarta
11002027,SMAN 3 KARIMUN,https://sekolah.data.kemdikbud.go.id/index.php/Chome/profil/4F12E112-2043-42F2-8459-73C9FD8C8BD4,JL. LETJEND SUPRAPTO SEI. RAYA PARIT BENUT Kec. Meral Kab. Karimun Prov. Kepulauan Riau,Kab. Karimun,,Kepulauan Riau
30105205,SMAN 7 PONTIANAK,https://sekolah.data.kemdikbud.go.id/index.php/Chome/profil/BBEF08A2-8AB4-4B2D-92EC-73CDC113526D,JL. SULAWESI DALAM NO. 10 PONTIANAK Akcaya Kec. Pontianak Selatan Kota Pontianak Prov. Kalimantan Barat,,Kota Pontianak,Kalimantan Barat
60101330,SMA Negeri 1 Kepulauan Tanimbar,https://sekolah.data.kemdikbud.go.id/index.php/Chome/profil/12CC63A5-CA91-41F7-BA74-73CE6BEA5A9F,JL. AWEDA ATAS-WATURU Waturu Kec. Nirun Mas Kab. Kepulauan Tanimbar Prov. Maluku,Kab. Kepulauan Tanimbar,,Maluku
69970677,SMA NEGERI 3 SOROMANDI,https://sekolah.data.kemdikbud.go.id/index.php/Chome/profil/EED61FDE-0595-4983-842F-73CF791BC225,Jl. Lintas Pantai Utara Kananta Kec. Soromandi Kab. Bima Prov. Nusa Tenggara Barat,Kab. Bima,,Nusa Tenggara Barat
20247147,SMAS PESANTREN UNGGUL AL BAYAN,https://sekolah.data.kemdikbud.go.id/index.php/Chome/profil/6CCC3808-C5D3-49AA-B0A3-73D22F358D01,Jl. Al Bayan No. 100 Sekarwangi Kec. Cibadak Kab. Sukabumi Prov. Jawa Barat,Kab. Sukabumi,,Jawa Barat
10400843,SMAN 2 BENGKALIS,https://sekolah.data.kemdikbud.go.id/index.php/Chome/profil/B1BEA4A4-DBA2-4040-B5EE-73D5AE0AAE83,JL. PRAMUKA  BENGKALIS Air Putih Kec. Bengkalis Kab. Bengkalis Prov. Riau,Kab. Bengkalis,,Riau
70055445,Sekolah Rakyat Menengah Atas 31 Pekanbaru,https://sekolah.data.kemdikbud.go.id/index.php/Chome/profil/B3EB20F7-7E6B-4A06-87B5-73EBFE52A3C6,Jl. Mekar Sari Kelurahan Tangkerang Sela... Tengkerang Selatan Kec. Bukit Raya Kota Pekanbaru Prov. Riau,,Kota Pekanbaru,Riau
