kode,nama,link_profil,alamat,kabupaten,kota,provinsi
20505006,SMAS NURUL ANWAR MONTONG,https://sekolah.data.kemdikbud.go.id/index.php/Chome/profil/1259F356-7607-442E-94D8-DB07082F4436,JL. PAKEL-SUMURGUNG NO. 15 MONTONG Pakel Kec. Montong Kab. Tuban Prov. Jawa Timur,Kab. Tuban,,Jawa Timur
20314895,SMA NEGERI 2 BLORA,https://sekolah.data.kemdikbud.go.id/index.php/Chome/profil/AACF50A5-8561-47FC-A7D1-DB0F327E4977,JL. REMBANG KM. 4 BLORA Karangjati Kec. Kota Blora Kab. Blora Prov. Jawa Tengah,Kab. Blora,,Jawa Tengah
20600462,SMAN 8 PANDEGLANG,https://sekolah.data.kemdikbud.go.id/index.php/Chome/profil/A6CE4697-9B4B-4CFF-84EB-DB114DC52489,JL. MANDALAWANGI KM. 7 Mandalasari Kec. Kaduhejo Kab. Pandeglang Prov. Banten,Kab. Pandeglang,,Banten
20503618,SMA PGRI 1 JOMBANG,https://sekolah.data.kemdikbud.go.id/index.php/Chome/profil/7289CC8D-A903-4214-B004-DB14F4D7288F,JL. PATIMURA V / 73 JOMBANG Sengon Kec. Jombang Kab. Jombang Prov. Jawa Timur,Kab. Jombang,,Jawa Timur
10646265,SMA MUHAMMADIYAH 4 KURIPAN,https://sekolah.data.kemdikbud.go.id/index.php/Chome/profil/360679CF-B0BB-40EB-90AC-DB176411C6B4,JL. KABUPATEN Kuripan Kec. Rambang Niru Kab. Muara Enim Prov. Sumatera Selatan,Kab. Muara Enim,,Sumatera Selatan
40306550,SMAN 8 TANA TORAJA,https://sekolah.data.kemdikbud.go.id/index.php/Chome/profil/C8CC59EA-3E1E-4F20-9B4D-DB1B7F8B0A0B,JL. RAYA REMBON ULUSALU Lembang Ratte Talonge Kec. Saluputti Kab. Tana Toraja Prov. Sulawesi Selatan,Kab. Tana Toraja,,Sulawesi Selatan
60201921,SMAS KRISTEN NEHEMIA GALELA,https://sekolah.data.kemdikbud.go.id/index.php/Chome/profil/7A93CCE4-7720-4895-A36E-DB1EC7433A4E,Jln. Waringin Desa Duma Galela Barat Duma Kec. Galela Barat Kab. halmahera Utara Prov. Maluku Utara,Kab. halmahera Utara,,Maluku Utara
10113363,SMA NEGERI 1 SIMPANG TIGA,https://sekolah.data.kemdikbud.go.id/index.php/Chome/profil/DB9B8F97-3DA3-4B51-8CA4-DB1ED7E3079A,JL. TGK. CHIEK EMPEE TRIENG Krueng Mak Kec. Simpang Tiga Kab. Aceh Besar Prov. Aceh,Kab. Aceh Besar,,Aceh
20219800,SMAS MAARIF BANDUNG,https://sekolah.data.kemdikbud.go.id/index.php/Chome/profil/A62A4E29-2320-4EA7-BF28-DB1FD5ED6F16,JL. GALUNGGUNG NO. 9 Lingkar Selatan Kec. Lengkong Kota Bandung Prov. Jawa Barat,,Kota Bandung,Jawa Barat
40311942,SMAS LPP YBW UMI MAKASSAR,https://sekolah.data.kemdikbud.go.id/index.php/Chome/profil/AA886083-6F07-498E-B1FC-DB20B9A03EC1,JL. KAKATUA II NO. 28 MAKASSAR Pabatang Kec. Mamajang Kota Makassar Prov. Sulawesi Selatan,,Kota Makassar,Sulawesi Selatan
10504570,SMAS NUSANTARA,https://sekolah.data.kemdikbud.go.id/index.php/Chome/profil/2F6010A7-1970-49AD-AA44-DB270CAA6965,JL. KOL. ABUNJANI NO. 57 Selamat Kec. Danau Sipin Kota Jambi Prov. Jambi,,Kota Jambi,Jambi
69947033,SMAN 3 MANDREHE UTARA,https://sekolah.data.kemdikbud.go.id/index.php/Chome/profil/D064F2A8-60C9-4703-B999-DB29C2530A15,Dusun I Balodano Balodano Kec. Mandrehe Utara Kab. Nias Barat Prov. Sumatera Utara,Kab. Nias Barat,,Sumatera Utara
70040089,SMA IT AL-MANSHUR,https://sekolah.data.kemdikbud.go.id/index.php/Chome/profil/0FA13514-2C0E-4EA9-9EDE-DB2C9D9D7322,"Jl. Bantarujeg-Malausma, KM. 08, Blok Ci... Malausma Kec. Malausma Kab. Majalengka Prov. Jawa Barat",Kab. Majalengka,,Jawa Barat
69947784,SMA Negeri 1 Kodi Balaghar,https://sekolah.data.kemdikbud.go.id/index.php/Chome/profil/49596D6A-72E7-4C59-B538-DB33C7D77E34,SMA Negeri 1 Kodi Balaghar Waimaringi Kec. Kodi Balaghar Kab. Sumba Barat Daya Prov. Nusa Tenggara Timur,Kab. Sumba Barat Daya,,Nusa Tenggara Timur
69859740,SMA ISLAM SABILILLAH,https://sekolah.data.kemdikbud.go.id/index.php/Chome/profil/03856BBE-7589-41AF-BF4C-DB390B31D53E,JL. IKAN KAKAP 1-B Tunjungsekar Kec. Lowokwaru Kota Malang Prov. Jawa Timur,,Kota Malang,Jawa Timur
20331893,SMA AGUS SALIM,https://sekolah.data.kemdikbud.go.id/index.php/Chome/profil/7FFB469E-2B08-487A-9B07-DB3C1A7C90E8,Jl. Beruang Raya No. 50 Semarang Gayamsari Kec. Gayamsari Kota Semarang Prov. Jawa Tengah,,Kota Semarang,Jawa Tengah
10220224,SMAS SUMATERA TJ MORAWA,https://sekolah.data.kemdikbud.go.id/index.php/Chome/profil/155242FC-1CAB-4BDD-AE8A-DB3EBCD2FD23,JL. SULTAN SERDANG PASAR VIII Buntu Bedimbar Kec. Tanjung Morawa Kab. Deli Serdang Prov. Sumatera Utara,Kab. Deli Serdang,,Sumatera Utara
20400395,SMA PATRIA BANTUL,https://sekolah.data.kemdikbud.go.id/index.php/Chome/profil/9991D30E-7515-4CCC-9E29-DB40616A3650,"JL. PARANGTRITIS KM 11, SABDODADI, BANTU... Sabdodadi Kec. Bantul Kab. Bantul Prov. D.I. Yogyakarta",Kab. Bantul,,D.I. Yogyakarta
10300299,SMA NEGERI 1 AMPEK ANGKEK,https://sekolah.data.kemdikbud.go.id/index.php/Chome/profil/CCD9C491-887B-4B9A-9F28-DB44022D2AE6,JL. LAMBAH BIARO Lambah Kec. Ampek Angkek Kab. Agam Prov. Sumatera Barat,Kab. Agam,,Sumatera Barat
69763270,SMAS IT BAITUL MUSLIM,https://sekolah.data.kemdikbud.go.id/index.php/Chome/profil/41B675D4-6151-4805-B2F6-DB44557D20A9,DESA LABUHAN RATU lll Labuhan Ratu Kec. Labuhan Ratu Kab. Lampung Timur Prov. Lampung,Kab. Lampung Timur,,Lampung
10212763,SMAN 1 LOLOFITU MOI,https://sekolah.data.kemdikbud.go.id/index.php/Chome/profil/E4538D5C-ECE9-4062-A921-DB472A7B6BEB,JL. NIAS TENGAH KM 44 DESA SISOBAWINO II Ehosakhozi Kec. Lolofitu Moi Kab. Nias Barat Prov. Sumatera Utara,Kab. Nias Barat,,Sumatera Utara
69870679,SMA NEGERI 12 REJANG LEBONG,https://sekolah.data.kemdikbud.go.id/index.php/Chome/profil/EB2FADEB-0746-47FD-B123-DB48E9D4CC07,"JALAN RAYA BENGKO, KEC. SINDANG DATARAN,... Bengko Kec. Sindang Dataran Kab. Rejang Lebong Prov. Bengkulu",Kab. Rejang Lebong,,Bengkulu
20506312,SMAS EMPAT LIMA 1 BABAT,https://sekolah.data.kemdikbud.go.id/index.php/Chome/profil/7145D594-1B09-46B0-94CD-DB4B930DC941,JL. RAYA BEDAHAN NO. 89  DESA BEDAHAN KE... Bedahan Kec. Babat Kab. Lamongan Prov. Jawa Timur,Kab. Lamongan,,Jawa Timur
10701185,SMA NEGERI 2 MUKOMUKO,https://sekolah.data.kemdikbud.go.id/index.php/Chome/profil/14FE47BD-A32D-44A2-A3BC-DB4D81A0DC32,Jalan Lintas Barat Sumatra Km 171 Desa Pulai Payung Kec. Ipuh Kab. Mukomuko Prov. Bengkulu,Kab. Mukomuko,,Bengkulu
20101621,SMAN 23 JAKARTA,https://sekolah.data.kemdikbud.go.id/index.php/Chome/profil/92C0C81F-1F23-43B3-A806-DB506CBDEF07,JL. MANDALA UTARA NO.6 Tomang Kec. Grogol Petamburan Kota Adm. Jakarta Barat Prov. D.K.I. Jakarta,,Kota Adm. Jakarta Barat,D.K.I. Jakarta
40311947,SMA NASIONAL MAKASSAR,https://sekolah.data.kemdikbud.go.id/index.php/Chome/profil/5B83624F-92CE-4064-B105-DB52662F83F6,JL. DR. RATULANGI NO. 84 Makassar Mario Kec. Mariso Kota Makassar Prov. Sulawesi Selatan,,Kota Makassar,Sulawesi Selatan
50101684,SMA Negeri 2 Mengwi,https://sekolah.data.kemdikbud.go.id/index.php/Chome/profil/0BEE04E0-B032-4760-B41D-DB5A5C9E72E7,JL. RAYA MUNGGU - TANAH LOT Munggu Kec. Mengwi Kab. Badung Prov. Bali,Kab. Badung,,Bali
10644910,SMAS BABUSSALAM,https://sekolah.data.kemdikbud.go.id/index.php/Chome/profil/FAFD9328-26FB-48AC-9120-DB5C97584C3D,Jl. Lintas Sukakarya DHARMA SAKTI Kec. Tuah Negeri Kab. Musi Rawas Prov. Sumatera Selatan,Kab. Musi Rawas,,Sumatera Selatan
20302167,SMA NEGERI 3 PURWOKERTO,https://sekolah.data.kemdikbud.go.id/index.php/Chome/profil/648A3C56-32CC-4B94-91FA-DB650AABD379,JL. KAMANDAKA BARAT NO. 3 Karangsalam  Kec. Kedung Banteng Kab. Banyumas Prov. Jawa Tengah,Kab. Banyumas,,Jawa Tengah
10102744,SMA NEGERI UNGGUL TAPAKTUAN,https://sekolah.data.kemdikbud.go.id/index.php/Chome/profil/03882330-E950-4BC2-B867-DB6999914E41,JL. GUNUNG DURIAN 2 KEL. LHOK BENGKUANG ... Lhok Bengkuang Timur Kec. Tapak Tuan Kab. Aceh Selatan Prov. Aceh,Kab. Aceh Selatan,,Aceh
30404439,SMAN 1 BATU AMPAR,https://sekolah.data.kemdikbud.go.id/index.php/Chome/profil/E22BE89A-A53E-4E40-8D5C-DB88CC1FCF70,JL. BENGKIRAI Rt. 02 Batu Timbau Kec. Batu Ampar Kab. Kutai Timur Prov. Kalimantan Timur,Kab. Kutai Timur,,Kalimantan Timur
69881315,SMA ISLAM AL-QODIR,https://sekolah.data.kemdikbud.go.id/index.php/Chome/profil/ED0194BA-8296-4223-B477-DB8C17DCED25,"DUSUN JABON, DESA DRENGES, KERTOSONO Drenges Kec. Kertosono Kab. Nganjuk Prov. Jawa Timur",Kab. Nganjuk,,Jawa Timur
69888445,SMA PLUS KEMBANG KUNING,https://sekolah.data.kemdikbud.go.id/index.php/Chome/profil/FC39C7FB-0722-4C7B-92D0-DB9033C4B10F,Kampung Kembang Kuning RT 03/06 Munjul Kec. Ciambar Kab. Sukabumi Prov. Jawa Barat,Kab. Sukabumi,,Jawa Barat
20306193,SMAS DARUL HIKMAH,https://sekolah.data.kemdikbud.go.id/index.php/Chome/profil/4D187517-4410-4EB4-BD71-DB940E983238,"JL. S. PARMAN, KUTOARJO Kutoarjo Kec. Kutoarjo Kab. Purworejo Prov. Jawa Tengah",Kab. Purworejo,,Jawa Tengah
40305526,SMAN 3 SIDENRENG RAPPANG,https://sekolah.data.kemdikbud.go.id/index.php/Chome/profil/A2B8AE20-D552-4D68-916A-DBA0B2897D92,JL. NEGARA POROS PARE-SENGKANG Salo Mallori Kec. Dua Pitue Kab. Sidenreng Rappang Prov. Sulawesi Selatan,Kab. Sidenreng Rappang,,Sulawesi Selatan
20100613,SMAS TARAKANITA 2,https://sekolah.data.kemdikbud.go.id/index.php/Chome/profil/2215C6A3-4086-4DB6-95AB-DBA751637ED3,JL. PLUIT PERMAI DALAM I / 10 Pluit Kec. Penjaringan Kota Adm. Jakarta Utara Prov. D.K.I. Jakarta,,Kota Adm. Jakarta Utara,D.K.I. Jakarta
20622147,SMAS PLUS PERMATA INSANI ISLAMIC SCHOOL,https://sekolah.data.kemdikbud.go.id/index.php/Chome/profil/75369D4C-41E8-4722-A38B-DBA86B595A6B,PERUM VILLA PERMATA BLOK G1 Sindang Sari Kec. Pasar Kemis Kab. Tangerang Prov. Banten,Kab. Tangerang,,Banten
70051643,SMA STELLA GRACIA PEKANBARU,https://sekolah.data.kemdikbud.go.id/index.php/Chome/profil/B6B6DE5B-E31D-46C7-B8E5-DBA90DAD99A9,Jl. Harapan Utama No. 08 Delima Kec. Binawidya Kota Pekanbaru Prov. Riau,,Kota Pekanbaru,Riau
10609620,SMA AL-AMALUL KHAIR PALEMBANG,https://sekolah.data.kemdikbud.go.id/index.php/Chome/profil/09964BA1-8088-472B-9592-DBA91AC468C2,JL. LUNJUK JAYA RT. 48 Lorok Pakjo Kec. Ilir Barat I Kota Palembang Prov. Sumatera Selatan,,Kota Palembang,Sumatera Selatan
40203023,SMA MUHAMMADIYAH PARIGI,https://sekolah.data.kemdikbud.go.id/index.php/Chome/profil/D9261310-C6CB-4EF9-B7EF-DBACD95FC76A,JL. TONIKOTA No. 99 Loji Kec. Parigi Kab. Parigi Moutong Prov. Sulawesi Tengah,Kab. Parigi Moutong,,Sulawesi Tengah
10305568,SMAN 1 V KOTO TIMUR,https://sekolah.data.kemdikbud.go.id/index.php/Chome/profil/BDED7476-02C5-49F3-A4BF-DBAFED5C811F,JL. RAYA PARIAMAN  - P ALAI LIMAU PURUIK Kec. V Koto Timur Kab. Padang Pariaman Prov. Sumatera Barat,Kab. Padang Pariaman,,Sumatera Barat
69968325,SMA KUN KARIMA,https://sekolah.data.kemdikbud.go.id/index.php/Chome/profil/A2E0176B-C2D2-4BFC-AD70-DBB3E2AEB796,Jl Stasiun Kadomas Rt. 01/10 Karaton Kec. Majasari Kab. Pandeglang Prov. Banten,Kab. Pandeglang,,Banten
60301004,SMAS MANDALA TRIKORA,https://sekolah.data.kemdikbud.go.id/index.php/Chome/profil/E176A918-1732-4341-AE0A-DBB668E00E42,JL. DIPONEGORO NO. 14 Gurabesi Kec. Jayapura Utara Kota Jayapura Prov. Papua,,Kota Jayapura,Papua
30200289,SMA NEGERI 1 TAMBAN CATUR,https://sekolah.data.kemdikbud.go.id/index.php/Chome/profil/ACB93F1B-B77D-4650-B5CB-DBBA3C3604B3,TAMBAN BARU KM 20 KD POS 73583 Tamban Baru Tengah Kec. Tamban Catur Kab. Kapuas Prov. Kalimantan Tengah,Kab. Kapuas,,Kalimantan Tengah
20107249,SMA BUDI MULIA,https://sekolah.data.kemdikbud.go.id/index.php/Chome/profil/B23BA337-BAA7-489C-925D-DBBFDDCF528E,JL. MANGGA BESAR RAYA 135 Mangga Dua Selatan Kec. Sawah Besar Kota Adm. Jakarta Pusat Prov. D.K.I. Jakarta,,Kota Adm. Jakarta Pusat,D.K.I. Jakarta
10609693,SMA TAMAN SISWA PALEMBANG,https://sekolah.data.kemdikbud.go.id/index.php/Chome/profil/3F52948B-303E-4430-8081-DBBFE4D36946,JL. TAMANSISWA NO. 261 PLG 20 Ilir I Kec. Ilir Timur I Kota Palembang Prov. Sumatera Selatan,,Kota Palembang,Sumatera Selatan
69859728,SMAN 1 SIANTAN UTARA,https://sekolah.data.kemdikbud.go.id/index.php/Chome/profil/578F2573-5253-4573-98E7-DBC1E1B23557,MUBUR Mubur Kec. Siantan Utara Kab. Kepulauan Anambas Prov. Kepulauan Riau,Kab. Kepulauan Anambas,,Kepulauan Riau
20534307,SMAS BRAWIJAYA KEDIRI,https://sekolah.data.kemdikbud.go.id/index.php/Chome/profil/97DF9F31-AF33-405A-92E0-DBC33EB0DC5B,JL. AHMAD YANI 8 Banjaran Kec. Kota Kediri Kota Kediri Prov. Jawa Timur,,Kota Kediri,Jawa Timur
20540166,SMAS BHAKTI NEGARA,https://sekolah.data.kemdikbud.go.id/index.php/Chome/profil/CF6C470F-B519-4D54-A4C2-DBC94FC6AB99,JL.RAYA PURWOHARJO  NO.22 Kradenan Kec. Purwoharjo Kab. Banyuwangi Prov. Jawa Timur,Kab. Banyuwangi,,Jawa Timur
20313033,SMA NEGERI 1 SAMBUNGMACAN,https://sekolah.data.kemdikbud.go.id/index.php/Chome/profil/D79F5FAF-42FA-4546-B2A9-DBCBDD7CE646,JL. RAYA TIMUR KM. 15 BANARAN Kec. Sambungmacan Kab. Sragen Prov. Jawa Tengah,Kab. Sragen,,Jawa Tengah
20222358,SMAS TELKOM SEKAR KEMUNING,https://sekolah.data.kemdikbud.go.id/index.php/Chome/profil/6A804FC8-B0DF-4EB9-8F3A-DBD4B7ADDF97,JL.SEKAR KEMUNING NO.36 Karyamulya Kec. Kesambi Kota Cirebon Prov. Jawa Barat,,Kota Cirebon,Jawa Barat
70055599,SMA NEGERI 2 LEMBAH GUMANTI,https://sekolah.data.kemdikbud.go.id/index.php/Chome/profil/7F5D9A02-862A-4B7C-A3FD-DBD78CB591BD,"Aie Baluluak, Jorong Pasa SUNGAI NANAM Kec. Lembah Gumanti Kab. Solok Prov. Sumatera Barat",Kab. Solok,,Sumatera Barat
10405125,SMAS CIKDITIRO,https://sekolah.data.kemdikbud.go.id/index.php/Chome/profil/65F6386C-DF88-4F88-B977-DBDAFCCF5BF9,"JL. UTAMA, GG. TELKOM Pulauhalang Muka Kec. Kubu Babussalam Kab.  Rokan Hilir Prov. Riau",Kab.  Rokan Hilir,,Riau
40401157,SMAN 1 BATAUGA,https://sekolah.data.kemdikbud.go.id/index.php/Chome/profil/02E1FBA8-AD79-4603-9295-DBDDD82A1539,Jalan Gajah Mada Lakambau Kec. Batauga Kab. Buton Selatan Prov. Sulawesi Tenggara,Kab. Buton Selatan,,Sulawesi Tenggara
69812104,SMAS Integral Hidayatullah,https://sekolah.data.kemdikbud.go.id/index.php/Chome/profil/846A8D00-02F4-4B26-9A4C-DBDEFC435910,Jl. Poros Mapurujaya KM 9 Kadun Jaya Kec. Wania Kab. Mimika Prov. Papua Tengah,Kab. Mimika,,Papua Tengah
10644265,SMAN 1 TANJUNG SAKTI PUMU,https://sekolah.data.kemdikbud.go.id/index.php/Chome/profil/55BD7991-C443-4917-B300-DBE09FD4DB2B,JLN. TUGU PERJUANGAN DESA BATU RANCING Batu Rancing Kec. Tanjung Sakti Pumu Kab. Lahat Prov. Sumatera Selatan,Kab. Lahat,,Sumatera Selatan
20613868,SMAN 1 SAJIRA,https://sekolah.data.kemdikbud.go.id/index.php/Chome/profil/36A00C49-986E-4C61-8088-DBE14CF9B6EE,JL. RAYA CIPANAS KM. 17 SAJIRA LEBAK Mekarsari Kec. Sajira Kab. Lebak Prov. Banten,Kab. Lebak,,Banten
10220295,SMAN 1 SIPAHUTAR,https://sekolah.data.kemdikbud.go.id/index.php/Chome/profil/56B229C3-9E48-46AA-BAE8-DBE7B840CECC,JL. PANGARIBUAN SIPAHUTAR Siabal Abal Ii Kec. Sipahutar Kab. Tapanuli Utara Prov. Sumatera Utara,Kab. Tapanuli Utara,,Sumatera Utara
60101660,SMAS MUHAMMADIYAH ATIAHU,https://sekolah.data.kemdikbud.go.id/index.php/Chome/profil/213BE688-2A9A-447D-96BA-DBE88BE6EF67,JL.LINTAS SERAM Ds. ATIAHU ATIAHU Kec. Siwalalat Kab. Seram Bagian Timur Prov. Maluku,Kab. Seram Bagian Timur,,Maluku
10814057,SMAN 1 SEKAMPUNG UDIK,https://sekolah.data.kemdikbud.go.id/index.php/Chome/profil/DF711313-E871-4376-B551-DBF27C929CAF,JL. IR. SUTAMI KM.36 Gunung Pasir Jaya Kec. Sekampung Udik Kab. Lampung Timur Prov. Lampung,Kab. Lampung Timur,,Lampung
10609305,SMAN 1 AIR SUGIHAN,https://sekolah.data.kemdikbud.go.id/index.php/Chome/profil/F428655E-F2DD-4FAD-A3EF-DBF2BCDF4C7D,Jalur 27 Air Sugihan Kerta Mukti Kec. Air Sugihan Kab. Ogan Komering Ilir Prov. Sumatera Selatan,Kab. Ogan Komering Ilir,,Sumatera Selatan
70037893,SMA ANNUR WAHID,https://sekolah.data.kemdikbud.go.id/index.php/Chome/profil/EF527067-BF66-484F-8305-DBF2E5CE00EE,KP. Cikapundung RT 002 RW 008 Cihaurkuning Kec. Cisompet Kab. Garut Prov. Jawa Barat,Kab. Garut,,Jawa Barat
20103185,SMAS WIJAYA KUSUMA,https://sekolah.data.kemdikbud.go.id/index.php/Chome/profil/61B785EC-CA99-4083-80BE-DBF367F0B71C,JL. MUJAHIDIN NO. 17A RAMBUTAN. JAKTIM Rambutan Kec. Ciracas Kota Adm. Jakarta Timur Prov. D.K.I. Jakarta,,Kota Adm. Jakarta Timur,D.K.I. Jakarta
40601851,UPTD SMAN 1 PASANGKAYU,https://sekolah.data.kemdikbud.go.id/index.php/Chome/profil/BAAC43D9-0385-46FA-9A2B-DBF4E818C644,JL. ANDI DEPU Pasangkayu Kec. Pasangkayu Kab. Pasangkayu Prov. Sulawesi Barat,Kab. Pasangkayu,,Sulawesi Barat
10505204,SMAN 9 SAROLANGUN,https://sekolah.data.kemdikbud.go.id/index.php/Chome/profil/2BCE6E9C-2909-467D-B32F-DBFBA36EFB3F,JL. TANAH LAPANG Jernih Kec. Air Hitam Kab. Sarolangun Prov. Jambi,Kab. Sarolangun,,Jambi
70050781,SMA Daaruttashihah,https://sekolah.data.kemdikbud.go.id/index.php/Chome/profil/52B18E4A-107E-48E4-B230-DBFBB1BB7D4D,Jl. Ir. Soetami KM. 10 Kp. Cilaja Tanaha... Citeras Kec. Rangkasbitung Kab. Lebak Prov. Banten,Kab. Lebak,,Banten
20529963,SMA NEGERI 1 MASALEMBU SUMENEP,https://sekolah.data.kemdikbud.go.id/index.php/Chome/profil/AA1CDEDD-C179-418B-81AE-DBFE611DC90D,JL. TANJUNG BATU Massalima Kec. Masalembu Kab. Sumenep Prov. Jawa Timur,Kab. Sumenep,,Jawa Timur
69830102,SMA UNGGULAN DARUL HIKMAH NGIMBANG,https://sekolah.data.kemdikbud.go.id/index.php/Chome/profil/93720427-BE08-4BDB-BDAE-DBFFA1B47989,Desa Purwokerto Purwokerto Kec. Ngimbang Kab. Lamongan Prov. Jawa Timur,Kab. Lamongan,,Jawa Timur
20216197,SMAS P MKGR KERTASEMAYA,https://sekolah.data.kemdikbud.go.id/index.php/Chome/profil/FB6F97F0-E16E-464D-99CD-DC059DD2E3EE,JL. KH. HASBULLAH TENAJAR LOR Tenajar Lor Kec. Kertasemaya Kab. Indramayu Prov. Jawa Barat,Kab. Indramayu,,Jawa Barat
20541250,SMAS PGRI NGASEM,https://sekolah.data.kemdikbud.go.id/index.php/Chome/profil/C216906A-ECC3-4855-B624-DC116C60C826,JL. RAYA NGASEM NO.038 Kolong Kec. Ngasem Kab. Bojonegoro Prov. Jawa Timur,Kab. Bojonegoro,,Jawa Timur
20511006,SMAN 1 NGADIROJO,https://sekolah.data.kemdikbud.go.id/index.php/Chome/profil/E4F9776B-2E20-4613-9B49-DC170A72C3FA,Jln. Raya Lorok Trenggalek No 39 Desa Ha... Hadiluwih Kec. Ngadirojo Kab. Pacitan Prov. Jawa Timur,Kab. Pacitan,,Jawa Timur
69790721,SMAN 2 MONTA,https://sekolah.data.kemdikbud.go.id/index.php/Chome/profil/FAA0A0B6-2D0F-4B77-B05F-DC18D3D7E55C,Jl. Lintas Tente - Wane Ds. Sondo Sondo Kec. Monta Kab. Bima Prov. Nusa Tenggara Barat,Kab. Bima,,Nusa Tenggara Barat
20534126,SMAS TAMAN MADYA,https://sekolah.data.kemdikbud.go.id/index.php/Chome/profil/A23BF8B5-762C-4D9B-B3D6-DC1AB85E9768,JL. KALIMANTAN NO.1 MADIUN Kartoharjo Kec. Kartoharjo Kota Madiun Prov. Jawa Timur,,Kota Madiun,Jawa Timur
30400182,SMAN 1 BATU SOPANG,https://sekolah.data.kemdikbud.go.id/index.php/Chome/profil/5321F98E-0F1B-452B-A3B8-DC22C77667F2,JL. RAYA KM. 144 SONGKA Kec. Batu Sopang Kab. Paser Prov. Kalimantan Timur,Kab. Paser,,Kalimantan Timur
40403875,SMA NEGERI 2 TONGKUNO,https://sekolah.data.kemdikbud.go.id/index.php/Chome/profil/65B81D80-C0B0-4E79-9A99-DC3AC9E688C6,JL. PERMANDIAN MOKO DESA OEMPU Oempu Kec. Tongkuno Kab. Muna Prov. Sulawesi Tenggara,Kab. Muna,,Sulawesi Tenggara
10403426,SMAN 1 MINAS,https://sekolah.data.kemdikbud.go.id/index.php/Chome/profil/CD333E4C-80D7-4EDD-BFD3-DC3C88229C86,JL.SUMAN HS. JAYA Minas Jaya Kec. Minas Kab. Siak Prov. Riau,Kab. Siak,,Riau
20330280,SMA NEGERI 1 BULUSPESANTREN,https://sekolah.data.kemdikbud.go.id/index.php/Chome/profil/AA879C11-B89C-4CA8-B050-DC3EC1108161,JL. DS. WALUYO Waluyo Kec. Buluspesantren Kab. Kebumen Prov. Jawa Tengah,Kab. Kebumen,,Jawa Tengah
60304064,SMAN 1 ATSY,https://sekolah.data.kemdikbud.go.id/index.php/Chome/profil/B7CAF9B5-B7F3-48B5-A8E2-DC40D4D2F02A,JL. YONAS WADER ATSY Kec. Atsj Kab. Asmat Prov. Papua Selatan,Kab. Asmat,,Papua Selatan
10302402,SMAN 2 RAMBATAN,https://sekolah.data.kemdikbud.go.id/index.php/Chome/profil/24E234E3-B106-4135-96AA-DC4193EFA067,JORONG KOTO GADANG SIMAWANG Kec. Rambatan Kab. Tanah Datar Prov. Sumatera Barat,Kab. Tanah Datar,,Sumatera Barat
69880583,SMA BOYAN PERMAI,https://sekolah.data.kemdikbud.go.id/index.php/Chome/profil/D84FD870-C542-4BC5-9E09-DC4B520BDF10,JALAN SUNGAI TUI Riam Mengelai Kec. Boyan Tanjung Kab. Kapuas Hulu Prov. Kalimantan Barat,Kab. Kapuas Hulu,,Kalimantan Barat
10702417,SMAS SINT CAROLUS,https://sekolah.data.kemdikbud.go.id/index.php/Chome/profil/5B344B1F-192B-4AAF-9CB9-DC4FDCB0B28D,JL. KAPUAS RAYA NO. 73 Jalan Gedang Kec. Gading Cempaka Kota Bengkulu Prov. Bengkulu,,Kota Bengkulu,Bengkulu
30402808,SMAS K ST GABRIEL NUNUKAN,https://sekolah.data.kemdikbud.go.id/index.php/Chome/profil/0115C3A3-9D9E-42EA-8345-DC5DDDCF45A7,JL. FATAHILLAH RT.10 Nunukan Tengah Kec. Nunukan Kab. Nunukan Prov. Kalimantan Utara,Kab. Nunukan,,Kalimantan Utara
20302181,SMA NEGERI 1 PATIKRAJA,https://sekolah.data.kemdikbud.go.id/index.php/Chome/profil/07D4C7C0-053D-48A1-95F5-DC5E42A8847A,JL. ADIPURA NO. 3 PATIKRAJA Patikraja Kec. Patikraja Kab. Banyumas Prov. Jawa Tengah,Kab. Banyumas,,Jawa Tengah
10208655,SMAN 1 SIGUNUNG,https://sekolah.data.kemdikbud.go.id/index.php/Chome/profil/EE8A8959-7BF0-4E46-86B2-DC5EDAE368B7,JL. KUTA ONAN Kaban Tengah Kec. Sitelutali Urang Jehe Kab. Pakpak Bharat Prov. Sumatera Utara,Kab. Pakpak Bharat,,Sumatera Utara
69909519,SMAN 13 LUWU TIMUR,https://sekolah.data.kemdikbud.go.id/index.php/Chome/profil/DE7FAAD4-7962-4AA9-B4CB-DC6114AA37BB,UPT. SP.I MAHALONA LIBUKAN MANDIRI Kec. Towuti Kab. Luwu Timur Prov. Sulawesi Selatan,Kab. Luwu Timur,,Sulawesi Selatan
20521460,SMAN 1 TEMPEH,https://sekolah.data.kemdikbud.go.id/index.php/Chome/profil/2050DF92-52AC-4A8E-8525-DC66F9CF62E5,"JL. SOEKARNO HATTA, NO.130 Tempeh Tengah Kec. Tempeh Kab. Lumajang Prov. Jawa Timur",Kab. Lumajang,,Jawa Timur
