kode,nama,link_profil,alamat,kabupaten,kota,provinsi
10208532,SMAN 1 SILAEN,https://sekolah.data.kemdikbud.go.id/index.php/Chome/profil/2E626DB1-8C93-4B4B-8B4A-92DA660E88C8,JL. Parsoburan Desa Hutanamora Kecamatan... Huta Namora Kec. Silaen Kab. Toba Prov. Sumatera Utara,Kab. Toba,,Sumatera Utara
70039488,SMA ROSO,https://sekolah.data.kemdikbud.go.id/index.php/Chome/profil/FFCE100C-B27A-4C35-8F4E-92DAB79765D8,Jln. Kawango Hari Kawango Hari Kec. Kodi Kab. Sumba Barat Daya Prov. Nusa Tenggara Timur,Kab. Sumba Barat Daya,,Nusa Tenggara Timur
69786404,SMAN 1 BENTIAN BESAR,https://sekolah.data.kemdikbud.go.id/index.php/Chome/profil/75715831-E349-4E4C-B1F0-92E9B92F8D56,Jl. Raden Bojer RT. 3 Dilang Puti Dilang Puti Kec. Bentian Besar Kab. Kutai Barat Prov. Kalimantan Timur,Kab. Kutai Barat,,Kalimantan Timur
20539254,SMAS HIDAYATUL UMMAH,https://sekolah.data.kemdikbud.go.id/index.php/Chome/profil/0A5CF870-D1E2-40B4-A12C-92EAC470CB80,JL. MULYOREJO NO.92 Mulyorejo Kec. Mulyorejo Kota Surabaya Prov. Jawa Timur,,Kota Surabaya,Jawa Timur
69972487,SMAIT Nurul Fikri Boarding School Aceh,https://sekolah.data.kemdikbud.go.id/index.php/Chome/profil/5726B5ED-EA8C-4937-9320-92EED8E706BA,Jalan Darul Fikri Jawie Kec. Seulimeum Kab. Aceh Besar Prov. Aceh,Kab. Aceh Besar,,Aceh
40403560,SMAN 1 ULUIWOI,https://sekolah.data.kemdikbud.go.id/index.php/Chome/profil/2147CAFA-16F2-4F0E-B7F0-92F009D25D3B,JL. PEMBANGUNAN NO. 7 Sanggona KEC. ULUIWOI Kab. Kolaka Timur Prov. Sulawesi Tenggara,Kab. Kolaka Timur,,Sulawesi Tenggara
20303249,SMA NEGERI 1 PURBALINGGA,https://sekolah.data.kemdikbud.go.id/index.php/Chome/profil/B2794DBC-0E95-4546-9299-92F502849C47,JL. LETJEND. MT HARYONO Purbalingga Kulon Kec. Purbalingga Kab. Purbalingga Prov. Jawa Tengah,Kab. Purbalingga,,Jawa Tengah
20211562,SMAS PLUS MULTAZAM,https://sekolah.data.kemdikbud.go.id/index.php/Chome/profil/6A2CD542-1AEA-4874-B894-930C1C82C2FE,Jalan Pesantren Sindangsari Dusun Sindan... Nagarajaya Kec. Panawangan Kab. Ciamis Prov. Jawa Barat,Kab. Ciamis,,Jawa Barat
70055047,SMA Islam Qurrata A’yun Kandangan,https://sekolah.data.kemdikbud.go.id/index.php/Chome/profil/29DA6D28-89EF-476D-ADB7-93112A862D12,Jl. A. Yani Parincahan RT.09 LK 05 Kandangan Barat Kec. Kandangan Kab. Hulu Sungai Selatan Prov. Kalimantan Selatan,Kab. Hulu Sungai Selatan,,Kalimantan Selatan
60302055,SMAN 2 SARMI,https://sekolah.data.kemdikbud.go.id/index.php/Chome/profil/7937F5F3-C814-4780-9D37-93121BEF407C,JL.TRANS SARMI Upt-Sp V / Tamar Sari Kec. Bonggo Timur Kab. Sarmi Prov. Papua,Kab. Sarmi,,Papua
10648903,SMA IT AL FURQON PALEMBANG,https://sekolah.data.kemdikbud.go.id/index.php/Chome/profil/F4BA6E5A-1319-43AE-8167-9312FA286BF1,JL. HBR MOTIK KM 8 RT.48 RW.08 Karya Baru Kec. Alang-Alang Lebar Kota Palembang Prov. Sumatera Selatan,,Kota Palembang,Sumatera Selatan
50204730,SMAN 3 KOTA BIMA,https://sekolah.data.kemdikbud.go.id/index.php/Chome/profil/388A203D-F950-4C34-A4F4-931600986ADB,JL. ANGGUR NO. 1 Rabadompu Barat Kec. Raba Kota Bima Prov. Nusa Tenggara Barat,,Kota Bima,Nusa Tenggara Barat
50302952,SMAS ST CLEMENS BOAWAE,https://sekolah.data.kemdikbud.go.id/index.php/Chome/profil/2A38A6A9-0AC9-4381-A713-9317671AC56C,JL. TRANS BAJAWA -  ENDE NATANAGE TIMUR Kec. Boawae Kab. Nagekeo Prov. Nusa Tenggara Timur,Kab. Nagekeo,,Nusa Tenggara Timur
20532158,SMA PAMARDI PUTRA,https://sekolah.data.kemdikbud.go.id/index.php/Chome/profil/F1A2EC1B-1E8C-4FCF-B8CD-93183FA38747,JL. DUKUH PAKIS NO. 40 Dukuh Pakis Kec. Dukuh Pakis Kota Surabaya Prov. Jawa Timur,,Kota Surabaya,Jawa Timur
69759178,SMAS DIRGANTARA,https://sekolah.data.kemdikbud.go.id/index.php/Chome/profil/E4E72167-5AAF-4D2F-8839-931AFD79E4B9,DUSUN HARUM SARI Suka Jaya Kec. Besitang Kab. Langkat Prov. Sumatera Utara,Kab. Langkat,,Sumatera Utara
40303984,SMAN 3 BANTAENG,https://sekolah.data.kemdikbud.go.id/index.php/Chome/profil/D4D80859-EA3F-4F29-9580-9321589E9FBF,"JL. Poros Bantaeng-Bulukumba, Tanetea Nipa-Nipa Kec. Pa`jukukang Kab. Bantaeng Prov. Sulawesi Selatan",Kab. Bantaeng,,Sulawesi Selatan
50309608,SMAN 1 WEWEWA SELATAN,https://sekolah.data.kemdikbud.go.id/index.php/Chome/profil/6BBD0693-3A14-4066-A6F6-93349A0259CA,TENA TEKE Tena Teke Kec. Wewewa Selatan Kab. Sumba Barat Daya Prov. Nusa Tenggara Timur,Kab. Sumba Barat Daya,,Nusa Tenggara Timur
20103166,SMAS PERGURUAN RAKYAT 2 JAKARTA,https://sekolah.data.kemdikbud.go.id/index.php/Chome/profil/16E44CA3-4B13-4842-B8CD-9336E6C31CE8,JL. AD. LAMPIRI RAYA NO. 28 Pondok Kelapa Kec. Duren Sawit Kota Adm. Jakarta Timur Prov. D.K.I. Jakarta,,Kota Adm. Jakarta Timur,D.K.I. Jakarta
10404026,SMAS SETIA DHARMA,https://sekolah.data.kemdikbud.go.id/index.php/Chome/profil/4204D0C1-F8D2-472D-ACA0-93372166B320,JL.PROF. M. YAMIN SH. NO. 67 Padang Bulan Kec. Senapelan Kota Pekanbaru Prov. Riau,,Kota Pekanbaru,Riau
20102576,SMAN RAGUNAN JAKARTA,https://sekolah.data.kemdikbud.go.id/index.php/Chome/profil/B2AB6FA7-CB26-4DE6-81AB-9339A334A934,JL.KOMPLEK GOR RAGUNAN Ragunan Kec. Pasar Minggu Kota Adm. Jakarta Selatan Prov. D.K.I. Jakarta,,Kota Adm. Jakarta Selatan,D.K.I. Jakarta
10814587,SMAN 2 TEGINENENG,https://sekolah.data.kemdikbud.go.id/index.php/Chome/profil/C5FAC15F-8978-4D54-A0B8-933F6C4EF91C,JL. NGUDI ILMU NO. 25 Trimulyo Kec. Tegineneng Kab. Pesawaran Prov. Lampung,Kab. Pesawaran,,Lampung
30104506,SMAN 1 SENGAH TEMILA,https://sekolah.data.kemdikbud.go.id/index.php/Chome/profil/085B96FA-C8A6-4CCC-A50A-933FA95EED49,JL. RAYA SENAKIN Senakin Kec. Sengah Temila Kab. Landak Prov. Kalimantan Barat,Kab. Landak,,Kalimantan Barat
70046268,SMA Daarut Tauhiid Boarding School Batam,https://sekolah.data.kemdikbud.go.id/index.php/Chome/profil/661DB288-DCD0-480D-8BBC-934330DD10A2,Jln. Trans Barelang KM.03 RT.03 RW.025 Tembesi Kec. Sagulung Kota Batam Prov. Kepulauan Riau,,Kota Batam,Kepulauan Riau
69942478,SMA MULTI ISTIQLAL,https://sekolah.data.kemdikbud.go.id/index.php/Chome/profil/700A688D-F4D4-4195-A3FA-93498F862436,Kp. Pulo Rt.004 Rw.036 Sumberjaya Kec. Tambun Selatan Kab. Bekasi Prov. Jawa Barat,Kab. Bekasi,,Jawa Barat
20506334,SMA NUSANTARA 1 DEKET,https://sekolah.data.kemdikbud.go.id/index.php/Chome/profil/92C94B10-2D76-45D0-A8DE-934AD2AEF033,JL. RAYA DEKET KULON - DEKET Deket Kulon Kec. Deket Kab. Lamongan Prov. Jawa Timur,Kab. Lamongan,,Jawa Timur
69822717,SMAN 1 SALING,https://sekolah.data.kemdikbud.go.id/index.php/Chome/profil/A72E99FB-1A19-4841-B31C-934E40BAF0BE,JL. LINTAS SUMATERA Tanjung ning simpang Kec. Saling Kab. Empat Lawang Prov. Sumatera Selatan,Kab. Empat Lawang,,Sumatera Selatan
30400218,SMA NEGERI 1 SAMBOJA,https://sekolah.data.kemdikbud.go.id/index.php/Chome/profil/91E8E90E-081D-475E-A125-9356E158FCC9,JL. GUNUNG PASIR RT 5 KAMPUNG LAMA Kec. Samboja Kab. Kutai Kartanegara Prov. Kalimantan Timur,Kab. Kutai Kartanegara,,Kalimantan Timur
69902674,SMA NEGERI 1 WULANGGITANG,https://sekolah.data.kemdikbud.go.id/index.php/Chome/profil/C8CA9DED-6FED-4C68-B439-93575360DF6D,"DESA HEWA, KECAMATAN WULANG GITANG, KAB.... Hewa Kec. Wulang Gitang Kab. Flores Timur Prov. Nusa Tenggara Timur",Kab. Flores Timur,,Nusa Tenggara Timur
20506300,SMA MUHAMMADIYAH 2 PACIRAN,https://sekolah.data.kemdikbud.go.id/index.php/Chome/profil/DB1C9906-8856-4861-B00C-9358A09623CA,JL. H. M. JA`FAR ADENAN NO. 05 DUSUN KEB... Blimbing Kec. Paciran Kab. Lamongan Prov. Jawa Timur,Kab. Lamongan,,Jawa Timur
20603366,SMAN 9 KABUPATEN TANGERANG,https://sekolah.data.kemdikbud.go.id/index.php/Chome/profil/3520E134-C015-46B3-9257-9359C2EE3900,Jl. Pasar Baru No. 1 Kronjo Kronjo Kec. Kronjo Kab. Tangerang Prov. Banten,Kab. Tangerang,,Banten
20607924,SMAN 15 Tangerang,https://sekolah.data.kemdikbud.go.id/index.php/Chome/profil/5E48A845-7490-4371-8032-935C7F1271A0,JL. VILLA TANGERANG REGENSI Periuk Kec. Periuk Kota Tangerang Prov. Banten,,Kota Tangerang,Banten
69947231,SMA NEGERI 2 PULAU MAYA,https://sekolah.data.kemdikbud.go.id/index.php/Chome/profil/17A30337-0FDA-4B67-89C2-935F4888B991,"Dusun Sukamandi, Kemboja Kemboja Kec. Pulau Maya Kab. Kayong Utara Prov. Kalimantan Barat",Kab. Kayong Utara,,Kalimantan Barat
69861172,SMA NEGERI 1 PANCA JAYA,https://sekolah.data.kemdikbud.go.id/index.php/Chome/profil/1E9C53FE-3396-42C0-B5B4-9360EC7B4726,KOMPLEK SEKOLAH TERPADU MESUJI Mukti Karya Kec. Panca Jaya Kab. Mesuji Prov. Lampung,Kab. Mesuji,,Lampung
30303305,SMAN 1 KELUMPANG SELATAN,https://sekolah.data.kemdikbud.go.id/index.php/Chome/profil/1BFE8A3F-32CE-4ED8-9B10-936122D1C536,JL. HAJI ABDULLAH Sungai Nipah Kec. Kelumpang Selatan Kab. Kotabaru Prov. Kalimantan Selatan,Kab. Kotabaru,,Kalimantan Selatan
10800690,SMAN 1 GEDONG TATAAN,https://sekolah.data.kemdikbud.go.id/index.php/Chome/profil/9E700C98-2001-4885-8478-9374BEDEEF40,JL. SWADAYA Sukaraja Kec. Gedung Tataan Kab. Pesawaran Prov. Lampung,Kab. Pesawaran,,Lampung
50306572,SMA NEGERI 1 TAKARI,https://sekolah.data.kemdikbud.go.id/index.php/Chome/profil/9703ED3F-2E3F-4F3C-996A-93771F7AD226,JL. TIMOR RAYA KM. 68 Takari Kec. Takari Kab. Kupang Prov. Nusa Tenggara Timur,Kab. Kupang,,Nusa Tenggara Timur
30400557,SMAN 1 PENYINGGAHAN,https://sekolah.data.kemdikbud.go.id/index.php/Chome/profil/8C580BF0-41C4-4A44-9DDD-937E503F6E36,JL. KI HAJAR DEWANTARA RT 03 Penyinggahan Ilir Kec. Penyinggahan Kab. Kutai Barat Prov. Kalimantan Timur,Kab. Kutai Barat,,Kalimantan Timur
10805995,SMAN 1 LABUHAN MARINGGAI,https://sekolah.data.kemdikbud.go.id/index.php/Chome/profil/0A0D1E07-20F8-4597-AA4E-9383492F6485,JL. PASIKAN Labuhan Maringai Kec. Labuhan Maringgai Kab. Lampung Timur Prov. Lampung,Kab. Lampung Timur,,Lampung
50103149,SMAS TAMAN RAMA,https://sekolah.data.kemdikbud.go.id/index.php/Chome/profil/0F16C9FA-8EF9-4601-8846-938430C22177,JL. COKROAMINOTO NO. 382 DENPASAR Ubung Kaja Kec. Denpasar Utara Kota Denpasar Prov. Bali,,Kota Denpasar,Bali
20506335,SMA NUSANTARA 2 BRONDONG,https://sekolah.data.kemdikbud.go.id/index.php/Chome/profil/F0F24B9E-78EE-48F6-92A6-93866511978F,Jl. Raya Nomor 100 Dsn. Pambon Desa Bren... Brengkok Kec. Brondong Kab. Lamongan Prov. Jawa Timur,Kab. Lamongan,,Jawa Timur
30400560,SMAN 1 SILUQ NGURAI,https://sekolah.data.kemdikbud.go.id/index.php/Chome/profil/FB2C5629-3A40-49A9-A219-938BEDF7F32F,JL. TRANS KALIMANTAN RT. 003 Muhur Kec. Siluq Ngurai Kab. Kutai Barat Prov. Kalimantan Timur,Kab. Kutai Barat,,Kalimantan Timur
70039091,SMA TERPADU BINA BANGSA PATI,https://sekolah.data.kemdikbud.go.id/index.php/Chome/profil/9415A8E2-7019-4B2C-9D78-9394F28BEC61,Jl. Raya Pati KM. 13 Ketanen RT 001 RW 0... Mojoagung Kec. Trangkil Kab. Pati Prov. Jawa Tengah,Kab. Pati,,Jawa Tengah
70007466,SMA ANNIDA,https://sekolah.data.kemdikbud.go.id/index.php/Chome/profil/FBFCBDD2-EFA0-419D-86F1-939CFDCF7642,JL. H. Lubis No. 90 Dusun Tegal Lega Karang Anyar Kec. Jati Agung Kab. Lampung Selatan Prov. Lampung,Kab. Lampung Selatan,,Lampung
50204322,SMA NEGERI 1 TALIWANG,https://sekolah.data.kemdikbud.go.id/index.php/Chome/profil/285E2A65-1BE3-4E8E-A05B-93A14393E2E0,JL. TELAGA BIRU NO. 1 Telaga Bertong Kec. Taliwang Kab. Sumbawa Barat Prov. Nusa Tenggara Barat,Kab. Sumbawa Barat,,Nusa Tenggara Barat
70028289,SMA DAAR-RUHAMA,https://sekolah.data.kemdikbud.go.id/index.php/Chome/profil/A95F348B-02DF-46D6-9193-93A21173632A,Jl. Raya Mandalawangi KM 7 Kp. Cilanggar... Kadumadang Kec. Cimanuk Kab. Pandeglang Prov. Banten,Kab. Pandeglang,,Banten
69900814,SMA Negeri Walea Besar,https://sekolah.data.kemdikbud.go.id/index.php/Chome/profil/E39EA834-8AAA-4F00-8EDE-93A90327A0F9,Desa Pasokan Pasokan Kec. Walea Besar Kab. Tojo Una Una Prov. Sulawesi Tengah,Kab. Tojo Una Una,,Sulawesi Tengah
60203360,SMA NEGERI 27 HALMAHERA SELATAN,https://sekolah.data.kemdikbud.go.id/index.php/Chome/profil/5855F55C-32BB-495E-9707-93A9E8CC23C1,Jln. Tanah Gusur Gane Dalam Kec. Gane Barat Selatan Kab. Halmahera Selatan Prov. Maluku Utara,Kab. Halmahera Selatan,,Maluku Utara
60100977,SMA NEGERI 5 BURU,https://sekolah.data.kemdikbud.go.id/index.php/Chome/profil/F150AEBD-C6C5-44BE-9776-93B0E51C72D3,JL. KURNAMA INDAH Sawa Kec. Lilialy Kab. Buru Prov. Maluku,Kab. Buru,,Maluku
40306081,SMAN 9 LUWU,https://sekolah.data.kemdikbud.go.id/index.php/Chome/profil/6C5AD3FA-67E1-4335-A77E-93B73C371597,JL. POROS PALOPO-MASAMBA KM. 25 Bosso Kec. Walenrang Utara Kab. Luwu Prov. Sulawesi Selatan,Kab. Luwu,,Sulawesi Selatan
10102248,SMA NEGERI 2 TAKENGON,https://sekolah.data.kemdikbud.go.id/index.php/Chome/profil/06897859-CB7F-450D-ABA7-93C067C9BADF,JL. UJUNG TEMETAS Pinangan Kec. Kebayakan Kab. Aceh Tengah Prov. Aceh,Kab. Aceh Tengah,,Aceh
70033364,SMA TRI JAYA NUSANTARA,https://sekolah.data.kemdikbud.go.id/index.php/Chome/profil/6680866C-4FFA-428C-8B23-93C17FF62D70,KP. Sampora RT. 01 RW. 05 Sampora Kec. Cikidang Kab. Sukabumi Prov. Jawa Barat,Kab. Sukabumi,,Jawa Barat
40402335,SMAN 1 BINONGKO,https://sekolah.data.kemdikbud.go.id/index.php/Chome/profil/8DF57517-10AC-4DBB-918C-93CB3CE0BAB1,JL. MURHUM NO. 1 RUKUWA Palahidu Kec. Binongko Kab. Wakatobi Prov. Sulawesi Tenggara,Kab. Wakatobi,,Sulawesi Tenggara
69759157,SMA NEGERI 1 PIRAK TIMU,https://sekolah.data.kemdikbud.go.id/index.php/Chome/profil/E8BFEB19-F203-4012-AD18-93CBDED400C1,JLN. CUT MEUTIA Alue Bungkoh Kec. Pirak Timu Kab. Aceh Utara Prov. Aceh,Kab. Aceh Utara,,Aceh
10106277,SMA NEGERI 2 SEUNUDDON,https://sekolah.data.kemdikbud.go.id/index.php/Chome/profil/B3DAE87D-76C2-44D9-9BAA-93CC77B366E5,JL. BLANG GLUMPANG Cot Trueng Kec. Seunuddon Kab. Aceh Utara Prov. Aceh,Kab. Aceh Utara,,Aceh
69752763,SMAS TELADAN JAYA,https://sekolah.data.kemdikbud.go.id/index.php/Chome/profil/D5392581-35FD-42B8-A8E5-93CF8B1F22F0,JL. KENANGA DESA MUARA BURNAI II Muara Burnai Ii Kec. Lempuing Jaya Kab. Ogan Komering Ilir Prov. Sumatera Selatan,Kab. Ogan Komering Ilir,,Sumatera Selatan
30205287,SMAS BINA ILMU,https://sekolah.data.kemdikbud.go.id/index.php/Chome/profil/11F6E8B9-02CF-4DFD-99FE-93D2FEEF6DD3,"JL. Pemuda Rt.07/Rw.03, Desa Rangga Ilun... Rangga Ilung Kec. Jenamas Kab. Barito Selatan Prov. Kalimantan Tengah",Kab. Barito Selatan,,Kalimantan Tengah
40403186,SMAS KARYA PURN,https://sekolah.data.kemdikbud.go.id/index.php/Chome/profil/2F92F670-81CC-4D53-8109-93D470ECE51D,JL.MEKAR Kec Kadia Baruga Kec. Baruga Kota Kendari Prov. Sulawesi Tenggara,,Kota Kendari,Sulawesi Tenggara
69829547,SMA SWASTA GEMA BUWANA,https://sekolah.data.kemdikbud.go.id/index.php/Chome/profil/C5B8DCDE-7326-4386-843C-93D562D8FA4D,Jl. Gambir Psr VIII Gg. Adil Sei Rotan Kec. Percut Sei Tuan Kab. Deli Serdang Prov. Sumatera Utara,Kab. Deli Serdang,,Sumatera Utara
20212939,SMA NEGERI 1 CIAWIGEBANG,https://sekolah.data.kemdikbud.go.id/index.php/Chome/profil/33E3043E-2215-404E-8247-93D776E7ED8E,JL. SILIWANGI NO. 106 Ciawigebang Kec. Ciawigebang Kab. Kuningan Prov. Jawa Barat,Kab. Kuningan,,Jawa Barat
40313786,SMAN 13 LUWU UTARA,https://sekolah.data.kemdikbud.go.id/index.php/Chome/profil/5D0C0056-4C3F-4DE4-90A2-93D92964DAE5,JL.VETERAN NO.1 Padang Balua Kec. Seko Kab. Luwu Utara Prov. Sulawesi Selatan,Kab. Luwu Utara,,Sulawesi Selatan
70025225,SMA LANGITAN,https://sekolah.data.kemdikbud.go.id/index.php/Chome/profil/5A3343ED-556B-4598-B24B-93DC10324306,Jl. Cimancueri Kampung Gaga Kidurin RT.0... Pagedangan Ilir Kec. Kronjo Kab. Tangerang Prov. Banten,Kab. Tangerang,,Banten
40209808,SMAS CHAIRUL AMIN,https://sekolah.data.kemdikbud.go.id/index.php/Chome/profil/35BE6D2C-E23D-4510-AB66-93E04D7CF4D0,JL. JEND. SUDIRMAN NO. 96 Bailo Kec. Ampana Kota Kab. Tojo Una Una Prov. Sulawesi Tengah,Kab. Tojo Una Una,,Sulawesi Tengah
10262159,SMA SWASTA BUDDHIS JAYANTI,https://sekolah.data.kemdikbud.go.id/index.php/Chome/profil/41B5C94D-1F73-4F3C-92BC-93E0D3BC55DB,Jl. Gatot Subroto No. 12-14 Rantauprapat Cendana Kec. Rantau Utara Kab. Labuhanbatu Prov. Sumatera Utara,Kab. Labuhanbatu,,Sumatera Utara
40313814,SMAN 12 MAROS,https://sekolah.data.kemdikbud.go.id/index.php/Chome/profil/6656A443-D974-4E11-A699-93EC288FF3BC,JL. POROS CAMBA MAROS Limam Poccoe Kec. Cenrana Kab. Maros Prov. Sulawesi Selatan,Kab. Maros,,Sulawesi Selatan
50202499,SMAN 2 SELONG,https://sekolah.data.kemdikbud.go.id/index.php/Chome/profil/49FBEF05-6576-498A-839C-93ED618D5A02,JL. TGKH. M. ZAINUDDIN ABDUL MAJID NO. 1 Pancor Kec. Selong Kab. Lombok Timur Prov. Nusa Tenggara Barat,Kab. Lombok Timur,,Nusa Tenggara Barat
69881555,SMA IT NURUL ISLAM,https://sekolah.data.kemdikbud.go.id/index.php/Chome/profil/C2A00156-2F7F-493B-94CA-93EE8A92CF81,JL BABAKAN PESANTREN DS KUBANG Kubang Kec. Sukaresmi Kab. Cianjur Prov. Jawa Barat,Kab. Cianjur,,Jawa Barat
20575415,SMAS ISLAM ULUL ALBAB,https://sekolah.data.kemdikbud.go.id/index.php/Chome/profil/B7C74FD4-6C52-4766-A2F2-93F288B10D11,Jl. Pekalen Gg. Kusuma Maron Kidul Kec. Maron Kab. Probolinggo Prov. Jawa Timur,Kab. Probolinggo,,Jawa Timur
20252154,SMAS PERJUANGAN DWI WARNA,https://sekolah.data.kemdikbud.go.id/index.php/Chome/profil/1B806D47-9F67-4D3A-8905-93FA41C29B25,JL. BY PASS KLIWED NO. 155 Kliwed Kec. Kertasemaya Kab. Indramayu Prov. Jawa Barat,Kab. Indramayu,,Jawa Barat
69893381,SMA NURUL ILMI,https://sekolah.data.kemdikbud.go.id/index.php/Chome/profil/2EF2EE82-793F-4A63-9113-93FD53E64DD2,JALAN PALEMBANG - BETUNG  KM.18 Sukamoro Kec. Talang Kelapa Kab. Banyuasin Prov. Sumatera Selatan,Kab. Banyuasin,,Sumatera Selatan
30311507,SMAS MUJAHIDIN TJ LALAK,https://sekolah.data.kemdikbud.go.id/index.php/Chome/profil/4DDA29F7-20EA-4134-9280-94017C79F474,JL.PENDIDIKAN Tanjung Lalak Utara Kec. Pulau Laut Kepulauan Kab. Kotabaru Prov. Kalimantan Selatan,Kab. Kotabaru,,Kalimantan Selatan
50220506,SMA NEGERI 2 TALIWANG,https://sekolah.data.kemdikbud.go.id/index.php/Chome/profil/2F659D82-B3B0-4B25-96E9-9404582F1DE9,JL. BRANG REA NO.7 Menala Kec. Taliwang Kab. Sumbawa Barat Prov. Nusa Tenggara Barat,Kab. Sumbawa Barat,,Nusa Tenggara Barat
20219725,SMA KARTIKA XIX-2,https://sekolah.data.kemdikbud.go.id/index.php/Chome/profil/0370DF78-76C8-421C-8FD3-940D3AD6B14E,JL. PAK GATOT RAYA NO. 73 KPAD GEGERKALO... Gegerkalong Kec. Sukasari Kota Bandung Prov. Jawa Barat,,Kota Bandung,Jawa Barat
20220520,SMAS BHAKTI INSANI,https://sekolah.data.kemdikbud.go.id/index.php/Chome/profil/64AACFAF-7DE8-482A-91CC-94114B77C165,JL. BATUTULIS NV. SIDIK NO.5 C Batutulis Kec. Kota Bogor Selatan Kota Bogor Prov. Jawa Barat,,Kota Bogor,Jawa Barat
20300731,SMA NEGERI 1 MAOS,https://sekolah.data.kemdikbud.go.id/index.php/Chome/profil/BC9FB3F8-F3A7-4C6F-BA41-941AB17FE53C,JL. RAYA MAOS NO.484 RT.01/RW.05 Klapagada Kec. Maos Kab. Cilacap Prov. Jawa Tengah,Kab. Cilacap,,Jawa Tengah
40402556,SMAN 11 KENDARI,https://sekolah.data.kemdikbud.go.id/index.php/Chome/profil/F865BD03-BD1B-499D-AE20-9426143F469D,JL. WULELE NO. 99 Bonggoeya Kec. Wua-Wua Kota Kendari Prov. Sulawesi Tenggara,,Kota Kendari,Sulawesi Tenggara
20541225,SMAS MUHAMMADIYAH 3 KEDUNGADEM,https://sekolah.data.kemdikbud.go.id/index.php/Chome/profil/2CEA951D-F62E-4B52-B9C2-9429DE7CCB15,Jl. Ronggolawe Kedungadem Kedungadem Kec. Kedungadem Kab. Bojonegoro Prov. Jawa Timur,Kab. Bojonegoro,,Jawa Timur
10501842,SMAN 13 TANJUNG JABUNG  BARAT,https://sekolah.data.kemdikbud.go.id/index.php/Chome/profil/1E37000D-F11F-412A-869A-943024482F79,JL. PEMUDA SUNGAI RAMBAI SUNGAI RAMBAI Kec. Senyerang Kab. Tanjung Jabung Barat Prov. Jambi,Kab. Tanjung Jabung Barat,,Jambi
10900238,SMAN 1 BELINYU,https://sekolah.data.kemdikbud.go.id/index.php/Chome/profil/382452AF-FF79-437B-89B9-94326FC1E867,JL. M. SYAFRI RACHMAN BELINYU KUTO PANJI Kec. Belinyu Kab. Bangka Prov. Kepulauan Bangka Belitung,Kab. Bangka,,Kepulauan Bangka Belitung
20338496,SMAS PGRI PURWAREJA KLAMPOK,https://sekolah.data.kemdikbud.go.id/index.php/Chome/profil/A6D58F47-60A3-4138-84C8-9438A849D71E,JL. PEKIRINGAN KLAMPOK Klampok Kec. Purwareja Klampok Kab. Banjarnegara Prov. Jawa Tengah,Kab. Banjarnegara,,Jawa Tengah
60403473,SMAN 1 WONDAMA,https://sekolah.data.kemdikbud.go.id/index.php/Chome/profil/A0506B45-C181-42C4-825D-9443F5ADED0B,MIEI Maniwak Kec. Wasior Kab. Teluk Wondama Prov. Papua Barat,Kab. Teluk Wondama,,Papua Barat
69848997,SMAN 1 PLERED,https://sekolah.data.kemdikbud.go.id/index.php/Chome/profil/2D847951-5F72-4A03-8C43-944945F5EE4E,Jl. Sempur RT 09/05 Cibogohilir Kec. Plered Kab. Purwakarta Prov. Jawa Barat,Kab. Purwakarta,,Jawa Barat
20103191,SMAS TRISOKO JAKARTA,https://sekolah.data.kemdikbud.go.id/index.php/Chome/profil/511CD393-ECDF-442E-8A60-9449FAF2B4FF,JL. RAYA PONDOK GEDE DUKUH II/IV Dukuh Kec. Kramat Jati Kota Adm. Jakarta Timur Prov. D.K.I. Jakarta,,Kota Adm. Jakarta Timur,D.K.I. Jakarta
60102712,SMA Negeri 8 Seram Bagian Barat,https://sekolah.data.kemdikbud.go.id/index.php/Chome/profil/DCBB039A-359D-45DF-A26D-9450BD0C19E2,TANAH GOYANG DESA LOKKI Kec. Huamual Kab. Seram Bagian Barat Prov. Maluku,Kab. Seram Bagian Barat,,Maluku
69918146,SMAN 4 CIBINONG,https://sekolah.data.kemdikbud.go.id/index.php/Chome/profil/14D5F67B-654D-4316-A5FC-94578ED97E00,Jl. BOJONG KONENG RT 01 RW 01 Cibinong Kec. Cibinong Kab. Bogor Prov. Jawa Barat,Kab. Bogor,,Jawa Barat
60301895,SMA Negeri 2 Nabire,https://sekolah.data.kemdikbud.go.id/index.php/Chome/profil/30546827-BCC5-4BEF-8814-945883210549,Jl. Poros Bumi Mulia - Wanggar - Nabire ... Bumi Mulia Kec. Wanggar Kab. Nabire Prov. Papua Tengah,Kab. Nabire,,Papua Tengah
20103171,SMAS PGRI 24 JAKARTA,https://sekolah.data.kemdikbud.go.id/index.php/Chome/profil/39DB51B4-DC24-4398-9BBD-9459A31AC15A,JL. Al-Baidho Gg. Karya Lubang Buaya Kec. Cipayung Kota Adm. Jakarta Timur Prov. D.K.I. Jakarta,,Kota Adm. Jakarta Timur,D.K.I. Jakarta
70011748,SMA NEGERI 2 MAGINTI,https://sekolah.data.kemdikbud.go.id/index.php/Chome/profil/94AE690C-95FF-4DA4-A64D-94709C67EAA0,Pulau Maginti KANGKUNAWE Kec. Maginti Kab. Muna Barat Prov. Sulawesi Tenggara,Kab. Muna Barat,,Sulawesi Tenggara
69989458,SMA KRISTEN AIR HIDUP,https://sekolah.data.kemdikbud.go.id/index.php/Chome/profil/12B595B6-2875-4690-B562-9475D9CF20C7,"Jln. Pintu Batu, No.1, RT. 01, RW.02 Omba Rade Kec. Wewewa Tengah Kab. Sumba Barat Daya Prov. Nusa Tenggara Timur",Kab. Sumba Barat Daya,,Nusa Tenggara Timur
20339024,SMA NEGERI 3 PATI,https://sekolah.data.kemdikbud.go.id/index.php/Chome/profil/EC1303F9-DB53-4A11-A707-9479BF20D5EE,JL. P. SUDIRMAN NO. 1A PATI Puri Kec. Pati Kab. Pati Prov. Jawa Tengah,Kab. Pati,,Jawa Tengah
70000957,SMA IRSYAADUL IBAAD,https://sekolah.data.kemdikbud.go.id/index.php/Chome/profil/3852827E-60A2-4739-9083-947ECFC4C518,Jl. Sidomukti Mekar Sari Kec. Pasir Sakti Kab. Lampung Timur Prov. Lampung,Kab. Lampung Timur,,Lampung
50205207,SMAS AL MA ARIF SINAH PENGEMBUR,https://sekolah.data.kemdikbud.go.id/index.php/Chome/profil/BAE06BBC-2354-4BBF-9FD1-948107FEFD8C,PENGEMBUR Pengembur Kec. Pujut Kab. Lombok Tengah Prov. Nusa Tenggara Barat,Kab. Lombok Tengah,,Nusa Tenggara Barat
10259031,SMAN 1 ALASA,https://sekolah.data.kemdikbud.go.id/index.php/Chome/profil/660E0450-2299-402D-8B74-9488473859F1,JL. PRAMUKA Ombolata Kec. Alasa Kab. Nias Utara Prov. Sumatera Utara,Kab. Nias Utara,,Sumatera Utara
69787073,SMAS CITRA BERKAT,https://sekolah.data.kemdikbud.go.id/index.php/Chome/profil/DEBCD56C-5A04-41E4-90F2-949325A3D2CA,Jl.RAYA BUKIT PALMA NO. 2 CITRALAND UTAR... Babat Jerawat Kec. Pakal Kota Surabaya Prov. Jawa Timur,,Kota Surabaya,Jawa Timur
10646224,SMAS ISLAM DARUSSALAM,https://sekolah.data.kemdikbud.go.id/index.php/Chome/profil/F75CFED7-01AE-4F52-A67E-94993715DCD6,JL. LINTAS TIMUR TUGUMULYO Tugumulyo Kec. Lempuing Kab. Ogan Komering Ilir Prov. Sumatera Selatan,Kab. Ogan Komering Ilir,,Sumatera Selatan
10507428,SMA EL MUNDO,https://sekolah.data.kemdikbud.go.id/index.php/Chome/profil/5B5EB876-B2EA-4B69-BEF4-94A609507339,JL.UD Sarkawi (Ki Bajuri) No. 01 Talang Bakung Kec. Paal Merah Kota Jambi Prov. Jambi,,Kota Jambi,Jambi
69959186,SMA NEGERI 4 KANDIS,https://sekolah.data.kemdikbud.go.id/index.php/Chome/profil/D950D148-E87B-4694-B06D-94AAEF1D7901,KAMPUNG LIBO JAYA KECAMATAN KANDIS LIBO JAYA Kec. Kandis Kab. Siak Prov. Riau,Kab. Siak,,Riau
50100851,SMAS DIPONOGORO,https://sekolah.data.kemdikbud.go.id/index.php/Chome/profil/35B49A4C-84C4-4C6A-AA8A-94AC4C630A08,JL. UDAYANA NO. 333 NEGARA Kaliakah Kec. Negara Kab. Jembrana Prov. Bali,Kab. Jembrana,,Bali
20235626,SMAS PGRI PARAKAN MUNCANG,https://sekolah.data.kemdikbud.go.id/index.php/Chome/profil/EC223225-3A25-4181-810D-94B25FAEE325,JL. PARAKAN MUNCANG  SIMPANG KM. 23 CIMA... Sindangpakuon Kec. Cimanggung Kab. Sumedang Prov. Jawa Barat,Kab. Sumedang,,Jawa Barat
70037894,SMA PLUS AL-HIKMAH,https://sekolah.data.kemdikbud.go.id/index.php/Chome/profil/A615D1CE-97A3-4C2C-9AB9-94B939EB9266,Jl. Joglo Kp. Cibeureum Pasir RT. 005 RW... Sukamekar Kec. Sukaraja Kab. Sukabumi Prov. Jawa Barat,Kab. Sukabumi,,Jawa Barat
50300257,SMAS IKARASI OEKABITI,https://sekolah.data.kemdikbud.go.id/index.php/Chome/profil/A7EBA833-3CAC-4644-9493-94BB94559BBA,JL. JURUSAN BURAEN Nonbes Kec. Amarasi Kab. Kupang Prov. Nusa Tenggara Timur,Kab. Kupang,,Nusa Tenggara Timur
10645825,SMAN 1 RANTAU BAYUR,https://sekolah.data.kemdikbud.go.id/index.php/Chome/profil/3D1D8840-46CC-4BC4-B56A-94CAED69B2DB,JL. RAYA PENGUMBUK Tebing Abang Kec. Rantau Bayur Kab. Banyuasin Prov. Sumatera Selatan,Kab. Banyuasin,,Sumatera Selatan
69900824,SMA SWASTA PONTREN AL-IHSAN,https://sekolah.data.kemdikbud.go.id/index.php/Chome/profil/EAB644E4-BE97-4003-AD20-94CF4FDEB86F,Jalan Balai Desa Ujung No. 22 Sidua Dua Kec. Kualuh Selatan Kab. Labuhanbatu Utara Prov. Sumatera Utara,Kab. Labuhanbatu Utara,,Sumatera Utara
10258317,SMAN 1 MANDREHE,https://sekolah.data.kemdikbud.go.id/index.php/Chome/profil/4706A91E-944D-41FC-B50E-94D29C02834D,"Jln. Prof. Moh. Yamin, SH - , Kec. Mandr... Tuho Owo Kec. Mandrehe Kab. Nias Barat Prov. Sumatera Utara",Kab. Nias Barat,,Sumatera Utara
40403968,SMAN 1 OHEO,https://sekolah.data.kemdikbud.go.id/index.php/Chome/profil/8915A319-3B0D-4FD4-9F1F-94DC60DBB9E6,JL. PENDIDIKAN DESA WALANDAWE KEC. OHEO WALANDAWE Kec. Oheo Kab. Konawe Utara Prov. Sulawesi Tenggara,Kab. Konawe Utara,,Sulawesi Tenggara
