kode,nama,link_profil,alamat,kabupaten,kota,provinsi
30404584,SMAN 9 BALIKPAPAN UTARA,https://sekolah.data.kemdikbud.go.id/index.php/Chome/profil/1873FB43-15CA-489C-9B56-171BE2732A09,JL. SOEKARNO HATTA KM.16 Karang Joang Kec. Balikpapan Utara Kota Balikpapan Prov. Kalimantan Timur,,Kota Balikpapan,Kalimantan Timur
50310683,SMAS SEMINARI MARIA BUNDA SEGALA BANGSA,https://sekolah.data.kemdikbud.go.id/index.php/Chome/profil/B91FDC5E-D2AC-4DF0-B6BE-172154322646,JL. KIMANG BULENG NO. 5 Kota Uneng Kec. Alok Kab. Sikka Prov. Nusa Tenggara Timur,Kab. Sikka,,Nusa Tenggara Timur
69775303,SMAN 2 TULANG BAWANG UDIK,https://sekolah.data.kemdikbud.go.id/index.php/Chome/profil/B220FB7A-A957-4263-B231-17283E2241F3,DS. MARGA KENCANA Marga Kencana Kec. Tulang Bawang Udik Kab. Tulang Bawang Barat Prov. Lampung,Kab. Tulang Bawang Barat,,Lampung
10497509,SMAN 1 PELANGIRAN,https://sekolah.data.kemdikbud.go.id/index.php/Chome/profil/DADBC5A2-FB5D-4EF9-9FF0-17292AB9E000,JL. TANJUNG BEKAUAN Pelangiran Kec. Pelangiran Kab. Indragiri Hilir Prov. Riau,Kab. Indragiri Hilir,,Riau
69760844,SMA NEGERI 12 BOMBANA,https://sekolah.data.kemdikbud.go.id/index.php/Chome/profil/33E58B59-D25C-4E34-A41F-172AAAE897B1,DESA LANTARI Lantari Kec. Lantari Jaya Kab. Bombana Prov. Sulawesi Tenggara,Kab. Bombana,,Sulawesi Tenggara
70025273,SMA ALAM BAHRIATUL ULUM,https://sekolah.data.kemdikbud.go.id/index.php/Chome/profil/CFCFC9EA-B5EA-43AD-BDDB-172C5B5B4B34,Komplek Cahaya mandiri Rt/Rw 03/02 Sukaratu Kec. Majasari Kab. Pandeglang Prov. Banten,Kab. Pandeglang,,Banten
10204244,SMAN 1 AEK KUASAN,https://sekolah.data.kemdikbud.go.id/index.php/Chome/profil/ADDC51F5-8401-4C75-878E-172EFD7E160F,JL. AEK LOBA AFD. 1 Aek Loba Afdeling I Kec. Aek Kuasan Kab. Asahan Prov. Sumatera Utara,Kab. Asahan,,Sumatera Utara
20227453,SMAS SETIA BHAKTI CILAWU,https://sekolah.data.kemdikbud.go.id/index.php/Chome/profil/4E70FB3F-0633-4502-AF4C-172FC57932C2,JL. Plamboyant ngamplang Ngamplang Kec. Cilawu Kab. Garut Prov. Jawa Barat,Kab. Garut,,Jawa Barat
20268809,SMAS IT NURURRAHMAN,https://sekolah.data.kemdikbud.go.id/index.php/Chome/profil/BDB6EDB6-8E04-42BF-BADE-173028B2F001,JL. RAYA SAWANGAN KM 2 Pancoran Mas Kec. Pancoran Mas Kota Depok Prov. Jawa Barat,,Kota Depok,Jawa Barat
20551885,SMAS ISLAM DARUNNAJAH,https://sekolah.data.kemdikbud.go.id/index.php/Chome/profil/B18BEC8F-0D37-40F7-A774-1730A0E974C1,JL. KM. HUSNI NAWAWI Gadu Timur Kec. Ganding Kab. Sumenep Prov. Jawa Timur,Kab. Sumenep,,Jawa Timur
20232526,SMAS ISLAM TERPADU RAFLESIA,https://sekolah.data.kemdikbud.go.id/index.php/Chome/profil/EE3E5DB1-15AE-4832-A19F-1734B11A3A18,MAHKOTA RAYA NO. 32 B PONDOK DUTA Tugu Kec. Cimanggis Kota Depok Prov. Jawa Barat,,Kota Depok,Jawa Barat
69922862,SMA SWASTA RAUDHATUL HASANAH,https://sekolah.data.kemdikbud.go.id/index.php/Chome/profil/68C23CBD-D4AD-4761-BF6B-173B4A72D7A9,Semadam Simpang Semadam Kec. Semadam Kab. Aceh Tenggara Prov. Aceh,Kab. Aceh Tenggara,,Aceh
70052635,SMA IT AN NUR,https://sekolah.data.kemdikbud.go.id/index.php/Chome/profil/D2227593-74DB-4992-9B3F-173E63CCE869,Alamat. Jl. Ruko Sentra Niaga No. 01 Cik... Jayamukti Kec. Cikarang Pusat Kab. Bekasi Prov. Jawa Barat,Kab. Bekasi,,Jawa Barat
10604728,SMAN 6 OGAN KOMERING ULU,https://sekolah.data.kemdikbud.go.id/index.php/Chome/profil/BDA9D1ED-5842-49F8-B7DC-1743EC0B82D5,JL.LINTAS SUMATERA KM 45 Semanding Kec. Pengandonan Kab. Ogan Komering Ulu Prov. Sumatera Selatan,Kab. Ogan Komering Ulu,,Sumatera Selatan
20245860,SMAN 1 PABUARAN,https://sekolah.data.kemdikbud.go.id/index.php/Chome/profil/D7BF9007-A789-43BB-A985-174A17F2C153,JL. RAYA PABUARAN Kadawung Kec. Pabuaran Kab. Subang Prov. Jawa Barat,Kab. Subang,,Jawa Barat
10108058,SMA NEGERI 1 DARUL MAKMUR,https://sekolah.data.kemdikbud.go.id/index.php/Chome/profil/018498FB-7B19-4A91-B704-174CBADBA179,JL. NASIONAL KUTA TRIENG Kuta Trieng Kec. Darul Makmur Kab. Nagan Raya Prov. Aceh,Kab. Nagan Raya,,Aceh
20502725,SMAN 1 NGORO,https://sekolah.data.kemdikbud.go.id/index.php/Chome/profil/50A85661-694D-4BE2-BB2F-1750034123F6,JL. CANDI JOLOTUNDO Kutogirang Kec. Ngoro Kab. Mojokerto Prov. Jawa Timur,Kab. Mojokerto,,Jawa Timur
70040176,SMAN 4 SUNGAI KAKAP,https://sekolah.data.kemdikbud.go.id/index.php/Chome/profil/B68DF1D3-756E-425A-BF4E-175270BAE14C,Jl. Raya Kalimas Kalimas Kec. Sungai Kakap Kab. Kubu Raya Prov. Kalimantan Barat,Kab. Kubu Raya,,Kalimantan Barat
20600469,SMAN 14 PANDEGLANG,https://sekolah.data.kemdikbud.go.id/index.php/Chome/profil/06DD31CD-CB28-4182-B780-1753C71798EC,JL. RAYA MAJA CIBIUK KM. 7 BANJAR Cibodas Kec. Banjar Kab. Pandeglang Prov. Banten,Kab. Pandeglang,,Banten
69960754,SMA MUHAMMADIYAH PATINEA,https://sekolah.data.kemdikbud.go.id/index.php/Chome/profil/53235B4A-8304-4D96-B9FC-175B442FEA44,Jl. Pantai Wisata Dusun Patinia Negeri Kawa Kec. Seram Barat Kab. Seram Bagian Barat Prov. Maluku,Kab. Seram Bagian Barat,,Maluku
50202418,SMAS NWDI PANCOR,https://sekolah.data.kemdikbud.go.id/index.php/Chome/profil/D9966903-B177-4983-AA2E-175D311F1E5B,JLN. KH. ZAINUDDIN ABDUL MAJID PANCOR Pancor Kec. Selong Kab. Lombok Timur Prov. Nusa Tenggara Barat,Kab. Lombok Timur,,Nusa Tenggara Barat
20523829,SMAN PLUS SUKOWONO,https://sekolah.data.kemdikbud.go.id/index.php/Chome/profil/0DEDDAB6-558A-4A0A-BBF5-1760D524E5F6,JL. Sumberkalong Sumberwaru Kec. Sukowono Kab. Jember Prov. Jawa Timur,Kab. Jember,,Jawa Timur
10810205,SMA NEGERI 2 WAYTENONG,https://sekolah.data.kemdikbud.go.id/index.php/Chome/profil/2F94349F-B247-4ECD-AC9F-17640EB4E9C3,JL. LINTAS LIWA PEKON SUKANANTI Sukananti Kec. Waytenong Kab. Lampung Barat Prov. Lampung,Kab. Lampung Barat,,Lampung
10220225,SMAS YAPIM BIRU-BIRU,https://sekolah.data.kemdikbud.go.id/index.php/Chome/profil/42631B2E-CF65-42B6-BA68-176410FCCFDD,JL. BIRU-BIRU Sidomulyo Kec. Sibiru-biru Kab. Deli Serdang Prov. Sumatera Utara,Kab. Deli Serdang,,Sumatera Utara
30101067,SMAS ADISUCIPTO SUNGAI RAYA,https://sekolah.data.kemdikbud.go.id/index.php/Chome/profil/C351E036-CDAF-4CD2-BB99-176521B0A838,JL. ADISUCIPTO KM 10.7 TELUK MULUS Teluk Kapuas Kec. Sungai Raya Kab. Kubu Raya Prov. Kalimantan Barat,Kab. Kubu Raya,,Kalimantan Barat
60303066,SMA  UREI FAISEI,https://sekolah.data.kemdikbud.go.id/index.php/Chome/profil/3FAC2EEA-EEED-4AC1-9CDA-176BBFC40AD2,JL.Trans Waropen RORISI Kec. Ureifaisei Kab. Waropen Prov. Papua,Kab. Waropen,,Papua
20206144,SMAN 1 CIPATAT,https://sekolah.data.kemdikbud.go.id/index.php/Chome/profil/C690395C-6729-44D6-9BEA-176CB68FA9DB,JL. DESA CIPTAHARJA NO. 35 Ciptaharja Kec. Cipatat Kab. Bandung Barat Prov. Jawa Barat,Kab. Bandung Barat,,Jawa Barat
50308361,SMAN 1 SANO NGGOANG,https://sekolah.data.kemdikbud.go.id/index.php/Chome/profil/71A080FA-B3C6-4042-AF56-177270A591AF,INDRONG Golo Leleng Kec. Sano Nggoang Kab. Manggarai Barat Prov. Nusa Tenggara Timur,Kab. Manggarai Barat,,Nusa Tenggara Timur
10500779,SMAN 1 BUNGO,https://sekolah.data.kemdikbud.go.id/index.php/Chome/profil/15AB62E2-AE13-487B-B316-1773F1B8E921,"JL. PROF. DR. SRI SUDEWI, SH NO.20 KELURAHAN PASIR PUTIH Kec. Rimbo Tengah Kab. Bungo Prov. Jambi",Kab. Bungo,,Jambi
20104424,SMAS KRISTEN IPEKA TOMANG,https://sekolah.data.kemdikbud.go.id/index.php/Chome/profil/05DEE697-E1BB-4FD8-8B1B-1775AB4E3C0D,GREEN VILLE BLOK D Duri Kepa Kec. Kebon Jeruk Kota Adm. Jakarta Barat Prov. D.K.I. Jakarta,,Kota Adm. Jakarta Barat,D.K.I. Jakarta
20317490,SMA TASYWIQUTH THULLAB SALAFIYAH (TBS) KERAMAT KUDUS,https://sekolah.data.kemdikbud.go.id/index.php/Chome/profil/559B15D2-8F10-49BE-B198-17794FCB9372,JL. PATIMURA NO. 45 KUDUS Jepang Pakis Kec. Jati Kab. Kudus Prov. Jawa Tengah,Kab. Kudus,,Jawa Tengah
10105604,SMA NEGERI MODAL BANGSA ARUN,https://sekolah.data.kemdikbud.go.id/index.php/Chome/profil/5F3DFF11-0C9F-4344-80B5-177E15D9EA49,"Jalan Bontang, Komplek Perumahan PT. Aru... Batuphat Barat Kec. Muara Satu Kota Lhokseumawe Prov. Aceh",,Kota Lhokseumawe,Aceh
69888847,SMA MUHAMMAD CHENGHO,https://sekolah.data.kemdikbud.go.id/index.php/Chome/profil/20D21B25-319C-4C87-A74C-17857CD23607,JL.RAYA DUNGKEK Bicabi Kec. Dungkek Kab. Sumenep Prov. Jawa Timur,Kab. Sumenep,,Jawa Timur
69788550,SMA RAUDLATUL AMIEN,https://sekolah.data.kemdikbud.go.id/index.php/Chome/profil/773DB1E8-1171-4EEA-B2B4-17863317148B,JL. PELABUHAN BATU PAYUNG Kangayan Kec. Kangayan Kab. Sumenep Prov. Jawa Timur,Kab. Sumenep,,Jawa Timur
20533638,SMA SWASTA KATOLIK COR JESU,https://sekolah.data.kemdikbud.go.id/index.php/Chome/profil/C97FED0C-AB04-4156-BE50-178EB858F676,JL. JA. SUPRAPTO 55 Samaan Kec. Klojen Kota Malang Prov. Jawa Timur,,Kota Malang,Jawa Timur
10500238,SMAN 8 BATANG HARI,https://sekolah.data.kemdikbud.go.id/index.php/Chome/profil/C9AE3404-DC5A-4099-834D-179050694E10,JLN. JAMBI - MA.BULIAN KM.37 Jembatan Mas Kec. Pemayung Kab. Batanghari Prov. Jambi,Kab. Batanghari,,Jambi
70052908,SMA ATTAUFIQIYYAH,https://sekolah.data.kemdikbud.go.id/index.php/Chome/profil/935173C8-251C-4BB4-AF83-1796F0816857,Kp. Gulusur RT.02 RW.09 Gunung Sindur Kec. Gunung Sindur Kab. Bogor Prov. Jawa Barat,Kab. Bogor,,Jawa Barat
20606833,SMA Strada St. Thomas Aquino,https://sekolah.data.kemdikbud.go.id/index.php/Chome/profil/27B5A635-AABF-4606-BD60-179972A8D53C,JL KAPLING SURYA PABUARAN Pabuaran Kec. Karawaci Kota Tangerang Prov. Banten,,Kota Tangerang,Banten
20607866,SMAN 1 CIBEBER,https://sekolah.data.kemdikbud.go.id/index.php/Chome/profil/984C8EBB-60E4-4A6C-A107-179E16742A94,JL. WARUNGKADU NO. 49 CIBEBER Cikotok Kec. Cibeber Kab. Lebak Prov. Banten,Kab. Lebak,,Banten
20325301,SMA NEGERI 1 MARGASARI,https://sekolah.data.kemdikbud.go.id/index.php/Chome/profil/7C726ECC-CA3D-406D-9581-179FCD6990AA,"JL. RAYA KESAMBI, PRUPUK SELATAN, MARGAS... Prupuk Selatan Kec. Margasari Kab. Tegal Prov. Jawa Tengah",Kab. Tegal,,Jawa Tengah
20613820,SMAS NURUL HIDAYAH,https://sekolah.data.kemdikbud.go.id/index.php/Chome/profil/48B6B659-3553-4DE3-8949-17A4B6E9E606,Jl. Raya Cikupa - Pasarkemis Pasir Gadung Kec. Cikupa Kab. Tangerang Prov. Banten,Kab. Tangerang,,Banten
10900459,SMAN 1 TANJUNG PANDAN,https://sekolah.data.kemdikbud.go.id/index.php/Chome/profil/1D45E5B9-B23A-4956-8DBD-17ABC58EE5AD,JL. GATOT SUBROTO TANJUNGPANDAN Tanjung Pendam Kec. Tanjung Pandan Kab. Belitung Prov. Kepulauan Bangka Belitung,Kab. Belitung,,Kepulauan Bangka Belitung
20219782,SMA PGII 1,https://sekolah.data.kemdikbud.go.id/index.php/Chome/profil/32CC905B-278E-411C-90E1-17B147A14EED,Jl. Panatayuda No. 2 Lebak Gede Kec. Coblong Kota Bandung Prov. Jawa Barat,,Kota Bandung,Jawa Barat
20100197,SMAS TARSISIUS 1 JAKARTA,https://sekolah.data.kemdikbud.go.id/index.php/Chome/profil/CD782D53-E494-4546-B3E3-17BCD003CDCD,JL. KH. HASYIM ASHARI 26 Petojo Utara Kec. Gambir Kota Adm. Jakarta Pusat Prov. D.K.I. Jakarta,,Kota Adm. Jakarta Pusat,D.K.I. Jakarta
40500458,SMAN 2 LIMBOTO,https://sekolah.data.kemdikbud.go.id/index.php/Chome/profil/4A8C4054-1FAD-40DF-91F0-17BD46CD00E3,JL. KASMAT LAHAY  NO. 102 Hunggaluwa Kec. Limboto Kab. Gorontalo Prov. Gorontalo,Kab. Gorontalo,,Gorontalo
40203343,SMAN 1 TOJO,https://sekolah.data.kemdikbud.go.id/index.php/Chome/profil/4D5DB373-6582-43F4-B55B-17C24739FDD4,JL. TRANS SULAWESI NO.117 Uekuli Kec. Tojo Kab. Tojo Una Una Prov. Sulawesi Tengah,Kab. Tojo Una Una,,Sulawesi Tengah
30404269,SMAS Nabil Husein Samarinda,https://sekolah.data.kemdikbud.go.id/index.php/Chome/profil/1D764560-9B1B-49E3-BF6B-17C6255D5A97,Jl. Rapak Indah Karang Asam Ulu Kec. Sungai Kunjang Kota Samarinda Prov. Kalimantan Timur,,Kota Samarinda,Kalimantan Timur
20219277,SMAS YAS BANDUNG,https://sekolah.data.kemdikbud.go.id/index.php/Chome/profil/D715550B-73C8-4C5E-8EB1-17C7FE27E63A,JL. P.H.H. MUSTAPA NO. 115 Sukapada Kec. Cibeunying Kidul Kota Bandung Prov. Jawa Barat,,Kota Bandung,Jawa Barat
60103737,SMA Negeri 32 Maluku Tengah,https://sekolah.data.kemdikbud.go.id/index.php/Chome/profil/17D93BD6-DC2B-4AD0-8204-17CD04335A2F,JLN. WAILOLU Hatu Kec. Tehoru Kab. Maluku Tengah Prov. Maluku,Kab. Maluku Tengah,,Maluku
30400461,SMAS DARMA BAKTI,https://sekolah.data.kemdikbud.go.id/index.php/Chome/profil/655E3AD6-800D-4811-A457-17CD9CEFCA14,PELITA KANAAN Pelita Kanaan Kec. Malinau Kota Kab. Malinau Prov. Kalimantan Utara,Kab. Malinau,,Kalimantan Utara
40301036,SMAN 7 GOWA,https://sekolah.data.kemdikbud.go.id/index.php/Chome/profil/BE9D2287-0315-4400-8975-17CE24F77B7D,JL.CIKORO Cikoro Kec. Tompobulu Kab. Gowa Prov. Sulawesi Selatan,Kab. Gowa,,Sulawesi Selatan
30303307,SMAS GARUDA KOTABARU,https://sekolah.data.kemdikbud.go.id/index.php/Chome/profil/222488B1-C25D-4ADC-87AB-17D329B2DABE,JL. BIMA NO. 134 Baharu Utara Kec. Pulaulaut Sigam Kab. Kotabaru Prov. Kalimantan Selatan,Kab. Kotabaru,,Kalimantan Selatan
69943865,SMA NEGERI 3 KULISUSU UTARA,https://sekolah.data.kemdikbud.go.id/index.php/Chome/profil/E3FC3BC8-70CD-4AF9-B93E-17D3ED59B700,Jln. Porakea Bira Kec. Kulisusu Utara Kab. Buton Utara Prov. Sulawesi Tenggara,Kab. Buton Utara,,Sulawesi Tenggara
10900458,SMAN 2 TANJUNG PANDAN,https://sekolah.data.kemdikbud.go.id/index.php/Chome/profil/1732FC5C-6746-430F-88A4-17D57F9F0430,JL. JEND. SUDIRMAN KM.7 PERAWAS TG. PAND... Perawas Kec. Tanjung Pandan Kab. Belitung Prov. Kepulauan Bangka Belitung,Kab. Belitung,,Kepulauan Bangka Belitung
70023653,SMA Swasta Maitreyawira Deli Serdang,https://sekolah.data.kemdikbud.go.id/index.php/Chome/profil/643BAB0B-19B6-434C-8FFD-17D7F6B1E6FB,Jl. Cemara Boulevard Utara No. 8 Komplek... Sampali Kec. Percut Sei Tuan Kab. Deli Serdang Prov. Sumatera Utara,Kab. Deli Serdang,,Sumatera Utara
10644162,SMAN PLUS 2 BANYUASIN III,https://sekolah.data.kemdikbud.go.id/index.php/Chome/profil/8B126939-1D97-44A6-9939-17D84477F617,JL. K.H. SULAIMAN PKL. BALAI Pangkalan Balai Kec. Banyuasin III Kab. Banyuasin Prov. Sumatera Selatan,Kab. Banyuasin,,Sumatera Selatan
20302165,SMAN 2 PURWOKERTO,https://sekolah.data.kemdikbud.go.id/index.php/Chome/profil/FE572352-6F41-4F12-A745-17D95C9F7741,JL. GATOT SUBROTO NO. 69 PWT Sokanegara Kec. Purwokerto Timur Kab. Banyumas Prov. Jawa Tengah,Kab. Banyumas,,Jawa Tengah
10403425,SMAN 1 TUALANG,https://sekolah.data.kemdikbud.go.id/index.php/Chome/profil/29BF3AB7-CF76-446E-8501-17DDA4CC2AB3,JL.SULTAN ALAMUDDINSYAH KM.7 Perawang Barat Kec. Tualang Kab. Siak Prov. Riau,Kab. Siak,,Riau
20257336,SMAS IT DARUSSUUD TANJUNGSIANG,https://sekolah.data.kemdikbud.go.id/index.php/Chome/profil/5F64572C-79B2-4979-99CC-17E44571871D,JL. PASIRLAJA PAKU HAJI TANJUNGSIANG Pakuhaji Kec. Cisalak Kab. Subang Prov. Jawa Barat,Kab. Subang,,Jawa Barat
50101124,SMA Negeri 1 Kediri,https://sekolah.data.kemdikbud.go.id/index.php/Chome/profil/ACA3C4C4-FD7A-46E0-A74F-17E6274511D5,JL. BINGIN AMBE Banjar Anyar Kec. Kediri Kab. Tabanan Prov. Bali,Kab. Tabanan,,Bali
69971027,SMAS SYAFANA ISLAMIC SCHOOL,https://sekolah.data.kemdikbud.go.id/index.php/Chome/profil/965934C2-A61B-46ED-A9ED-17E65A5494C6,"Jalan Lengkong Kyai, BSD City Lengkong Kulon Kec. Pagedangan Kab. Tangerang Prov. Banten",Kab. Tangerang,,Banten
69856205,SMA IT AL MUCHTAR,https://sekolah.data.kemdikbud.go.id/index.php/Chome/profil/FFEF7BF0-13FF-4568-AD0E-17E6E3C2F601,JL. KH. MUCHTAR THABRANI NO. 32 Perwira Kec. Bekasi Utara Kota Bekasi Prov. Jawa Barat,,Kota Bekasi,Jawa Barat
40304247,SMAN 3 BULUKUMBA,https://sekolah.data.kemdikbud.go.id/index.php/Chome/profil/5681F24E-1856-4ED4-AEB5-17E74B5B0A42,JL. TANAHBERU Tanah Beru Kec. Bontobahari Kab. Bulukumba Prov. Sulawesi Selatan,Kab. Bulukumba,,Sulawesi Selatan
20227864,SMA MUHAMMADIYAH 6 KERTASARI,https://sekolah.data.kemdikbud.go.id/index.php/Chome/profil/EA824E24-E526-4A4C-A395-17F082CFE85E,JL. LAPANGSARI CIBEUREUM NO.7 KERTASARI Cibeureum Kec. Kertasari Kab. Bandung Prov. Jawa Barat,Kab. Bandung,,Jawa Barat
10105272,SMAN 2 SABANG,https://sekolah.data.kemdikbud.go.id/index.php/Chome/profil/15748598-8C9C-4E80-95D0-17F9C814D590,JL. TINJAU ALAM Aneuk Laot Kec. Sukakarya Kota Sabang Prov. Aceh,,Kota Sabang,Aceh
30401496,SMAS PATRA DHARMA,https://sekolah.data.kemdikbud.go.id/index.php/Chome/profil/4F602621-87FF-4C1A-B33D-17FADF95AEE2,JL. WARUKIN III PANORAMA Karang Jati Kec. Balikpapan Tengah Kota Balikpapan Prov. Kalimantan Timur,,Kota Balikpapan,Kalimantan Timur
69864644,SMAS PANGUDI LUHUR BERNARDUS,https://sekolah.data.kemdikbud.go.id/index.php/Chome/profil/FAB1221F-5A6F-4055-B253-17FAFB4727F1,Kota Deltamas Jl. Tol Jakarta - Cikampek... Hegarmukti Kec. Cikarang Pusat Kab. Bekasi Prov. Jawa Barat,Kab. Bekasi,,Jawa Barat
70037236,SMA NASIONAL 3 BAHASA BUDI LUHUR,https://sekolah.data.kemdikbud.go.id/index.php/Chome/profil/0101CA01-06BE-4F29-8338-17FDC58C8D7F,JL. Lalu Mesir Babakan Kec. Sandubaya Kota Mataram Prov. Nusa Tenggara Barat,,Kota Mataram,Nusa Tenggara Barat
40201706,SMAN 1 BALANTAK,https://sekolah.data.kemdikbud.go.id/index.php/Chome/profil/27CE1014-3DAD-4292-9B0C-17FE83A2BFB6,JL. MERDEKA NO.1 BALANTAK BALANTAK Kec. Balantak Kab. Banggai Prov. Sulawesi Tengah,Kab. Banggai,,Sulawesi Tengah
30301492,SMAN 1 CANDI LARAS SELATAN,https://sekolah.data.kemdikbud.go.id/index.php/Chome/profil/232BFE02-7DC6-4C69-A04E-1800F8223551,JL. MARGASARI KM. 27 Marampiau Hilir Kec. Candi Laras Selatan Kab. Tapin Prov. Kalimantan Selatan,Kab. Tapin,,Kalimantan Selatan
10800691,SMAN 1 KALIANDA,https://sekolah.data.kemdikbud.go.id/index.php/Chome/profil/5B4AD97B-AD65-4493-B27D-18106901BCC2,Jl. Zainal Abidin Pagar Alam No. 149 Wayurang Kec. Kalianda Kab. Lampung Selatan Prov. Lampung,Kab. Lampung Selatan,,Lampung
10204226,SMAS HARAPAN LOBU RAPPA BDR PL,https://sekolah.data.kemdikbud.go.id/index.php/Chome/profil/5365F967-C66A-44FA-9D41-181340C3BC7D,JL. SIGURA-GURA KM 10 DOLOK MARAJA Lobu Rappa Kec. Aek Songsongan Kab. Asahan Prov. Sumatera Utara,Kab. Asahan,,Sumatera Utara
70028651,SMA NEGERI 2 SOA,https://sekolah.data.kemdikbud.go.id/index.php/Chome/profil/48D71A97-9972-4D81-8827-1813754944C5,JL.Soa-Riung TARAWALI Kec. Soa Kab. Ngada Prov. Nusa Tenggara Timur,Kab. Ngada,,Nusa Tenggara Timur
40300692,SMAN 1 PANGKAJENE DAN KEPULAUAN,https://sekolah.data.kemdikbud.go.id/index.php/Chome/profil/73C48DE8-F723-4901-880F-181B128E74E9,JL. A. MAURAGA NO. 1 PANGKAJENE Jagong Kec. Pangkajene Kab. Pangkajene Dan Kepulauan Prov. Sulawesi Selatan,Kab. Pangkajene Dan Kepulauan,,Sulawesi Selatan
20227840,SMAS HARAPAN CIPONGKOR,https://sekolah.data.kemdikbud.go.id/index.php/Chome/profil/95DD2E88-2776-4986-B00A-18243A8A4D41,JL. SAGULING NO. 3 CITALEM CIPONGKOR Citalem Kec. Cipongkor Kab. Bandung Barat Prov. Jawa Barat,Kab. Bandung Barat,,Jawa Barat
40313282,SMAS PGRI SUNGGUMINASA,https://sekolah.data.kemdikbud.go.id/index.php/Chome/profil/7151C918-817E-45C2-AF8B-182693CFE8F7,JL. MANGKA DG BOMBONG NO. 31 SUNGGUMINAS... Paccinongan Kec. Somba Opu Kab. Gowa Prov. Sulawesi Selatan,Kab. Gowa,,Sulawesi Selatan
20107371,SMAS CAHAYA KUDUS JAKARTA,https://sekolah.data.kemdikbud.go.id/index.php/Chome/profil/8337EBBE-79AE-4750-83AB-1827A6902B51,JL.  MUARA KARANG B IX NO. 129 Pluit Kec. Penjaringan Kota Adm. Jakarta Utara Prov. D.K.I. Jakarta,,Kota Adm. Jakarta Utara,D.K.I. Jakarta
10807058,SMAN 12 BANDAR LAMPUNG,https://sekolah.data.kemdikbud.go.id/index.php/Chome/profil/2F534D49-89AE-4C7C-BB66-182CDC5864CD,JL. LETK. HENDRO SURATMIN Sukarame Kec. Sukarame Kota Bandar Lampung Prov. Lampung,,Kota Bandar Lampung,Lampung
20330277,SMAS PGRI 1 PREMBUN,https://sekolah.data.kemdikbud.go.id/index.php/Chome/profil/D14E1405-6F13-4BDD-83AD-18383B672B9A,JL. RAYA PREMBUN PO BOX NO. 9 Prembun Kec. Prembun Kab. Kebumen Prov. Jawa Tengah,Kab. Kebumen,,Jawa Tengah
69937940,SMA Negeri 54 Maluku Tengah,https://sekolah.data.kemdikbud.go.id/index.php/Chome/profil/4E7124BC-B0BC-47AD-9110-18409679B830,Jl. Trans Seram Samasuru SAMASURU Kec. Teluk Elpaputih Kab. Maluku Tengah Prov. Maluku,Kab. Maluku Tengah,,Maluku
70051486,SMA IT SERAMBI MEKKAH AL AZIZIYAH KABUPATEN SAROLANGUN,https://sekolah.data.kemdikbud.go.id/index.php/Chome/profil/2EFBC357-062B-4D04-A92F-1840E2AFB8E5,Jl. Lintas Sumatera PELAWAN JAYA Kec. Pelawan Kab. Sarolangun Prov. Jambi,Kab. Sarolangun,,Jambi
10113050,SMA NEGERI 2 BANDAR DUA,https://sekolah.data.kemdikbud.go.id/index.php/Chome/profil/E96E6104-F31B-4700-8009-1842AB30DB25,JL ULEE GLE BARAT GP BLANG KUTA Blang Kuta Kec. Bandar Dua Kab. Pidie Jaya Prov. Aceh,Kab. Pidie Jaya,,Aceh
60203640,SMA NEGERI 5 HALMAHERA BARAT,https://sekolah.data.kemdikbud.go.id/index.php/Chome/profil/AC5903D1-2A7D-4E96-9146-18442BD1BD23,JLN. TRANS HALMAHERA LIKATA DODINGA Bobaneigo Kec. Jailolo Selatan Kab. Halmahera Barat Prov. Maluku Utara,Kab. Halmahera Barat,,Maluku Utara
70014387,SMA AL-BAYYINAH,https://sekolah.data.kemdikbud.go.id/index.php/Chome/profil/C2F03265-4A9E-4DEC-BFAE-184579800080,"Jl. Cisoka - Taman Adiyasa, Kp. Bunar RT... Sukatani Kec. Cisoka Kab. Tangerang Prov. Banten",Kab. Tangerang,,Banten
69768296,SMAN 2 KUPANG TENGAH,https://sekolah.data.kemdikbud.go.id/index.php/Chome/profil/C454550A-CD8B-418F-896A-184A3942CBB5,JL TILONG DAM Oelnasi Kec. Kupang Tengah Kab. Kupang Prov. Nusa Tenggara Timur,Kab. Kupang,,Nusa Tenggara Timur
10212217,SMAN 2 PADANG SIDEMPUAN,https://sekolah.data.kemdikbud.go.id/index.php/Chome/profil/802B0F92-4BA1-48D5-9EBC-1852FFD308E9,JL. SUDIRMAN NO. 186 Wek I Kec. Padang Sidimpuan Utara Kota Padang Sidempuan Prov. Sumatera Utara,,Kota Padang Sidempuan,Sumatera Utara
69878868,SMA YPPGI Waghete,https://sekolah.data.kemdikbud.go.id/index.php/Chome/profil/A7442B84-3142-4922-962A-1854ACA92140,Waghete Waghete I Kec. Tigi Kab. Deiyai Prov. Papua Tengah,Kab. Deiyai,,Papua Tengah
20313027,SMA NEGERI 3 SRAGEN,https://sekolah.data.kemdikbud.go.id/index.php/Chome/profil/3611BC33-F5FC-4CCF-84E5-186795997536,JL. DR. SUTOMO NO. 2 SRAGEN Sragen Kulon Kec. Sragen Kab. Sragen Prov. Jawa Tengah,Kab. Sragen,,Jawa Tengah
40400240,SMAN 1 PONDIDAHA,https://sekolah.data.kemdikbud.go.id/index.php/Chome/profil/42697383-2F41-486B-BE61-186B1CA5A724,Jl. Poros Kendari - Unaaha Km. 46 Kel. P... Pondidaha Kec. Pondidaha Kab. Konawe Prov. Sulawesi Tenggara,Kab. Konawe,,Sulawesi Tenggara
10257750,SMA SWASTA GELORA PANCASILA,https://sekolah.data.kemdikbud.go.id/index.php/Chome/profil/3C32CB3A-1AD3-4446-A67E-186C392E7A4A,JL. DUSUN HARAPAN I Pegajahan Kec. Pegajahan Kab. Serdang Bedagai Prov. Sumatera Utara,Kab. Serdang Bedagai,,Sumatera Utara
40102621,SMAN 3 MANADO,https://sekolah.data.kemdikbud.go.id/index.php/Chome/profil/B68483A3-B10C-486D-AF8C-1874FC57EA49,JL. POGIDON NO.13 Tumumpa Satu Kec. Tuminting Kota Manado Prov. Sulawesi Utara,,Kota Manado,Sulawesi Utara
10205389,SMAN 1 NA IX-X,https://sekolah.data.kemdikbud.go.id/index.php/Chome/profil/53F47C70-1392-4A15-B487-1878E6D1BF41,JL. SMA AEK KOTA BATU Aek Kota Batu Kec. Na. IX-X Kab. Labuhanbatu Utara Prov. Sumatera Utara,Kab. Labuhanbatu Utara,,Sumatera Utara
70013634,SMA NEGERI NOEBEBA,https://sekolah.data.kemdikbud.go.id/index.php/Chome/profil/CCCD4308-1DB4-4CDB-A593-187B2B244F64,"RT.08/RW.04, DESA TEAS, KECAMATAN NOEBEB... Teas Kec. Noebeba Kab. Timor Tengah Selatan Prov. Nusa Tenggara Timur",Kab. Timor Tengah Selatan,,Nusa Tenggara Timur
69788704,SMAN 1 TONGKUNO SELATAN,https://sekolah.data.kemdikbud.go.id/index.php/Chome/profil/CCAB5B9C-7F9D-4978-936B-187DB7556A96,DESA LABASA Labasa Kec. Tongkuno Selatan Kab. Muna Prov. Sulawesi Tenggara,Kab. Muna,,Sulawesi Tenggara
10201335,SMAN 1 STABAT,https://sekolah.data.kemdikbud.go.id/index.php/Chome/profil/303AB579-11AA-4C50-B49B-187DFF7DFB24,JL. PROKLAMASI KWALA BINGAI STABAT Kwala Bingai Kec. Stabat Kab. Langkat Prov. Sumatera Utara,Kab. Langkat,,Sumatera Utara
20339008,SMA MURIA PATI,https://sekolah.data.kemdikbud.go.id/index.php/Chome/profil/60340C3E-6AC6-4D52-987F-1882F1B0654D,JL. PRATOMO PATI Muktiharjo Kec. Margorejo Kab. Pati Prov. Jawa Tengah,Kab. Pati,,Jawa Tengah
69966572,SMAN 3 KILO,https://sekolah.data.kemdikbud.go.id/index.php/Chome/profil/BEF39537-B288-496E-AD0B-188470C14EA2,DESA KIWU KECAMATAN KILO KAB. DOMPU K I W U Kec. Kilo Kab. Dompu Prov. Nusa Tenggara Barat,Kab. Dompu,,Nusa Tenggara Barat
20311310,SMAS PANGUDI LUHUR GIRIWOYO,https://sekolah.data.kemdikbud.go.id/index.php/Chome/profil/C065164F-DEEB-49DF-A1D6-18848C60FD4F,JL. DESA SEJATI Sejati Kec. Giriwoyo Kab. Wonogiri Prov. Jawa Tengah,Kab. Wonogiri,,Jawa Tengah
10102510,SMA MUHAMMADIYAH 6 MEULABOH,https://sekolah.data.kemdikbud.go.id/index.php/Chome/profil/EF088E81-FAEB-4FD5-87A7-18861D7381F5,JL. TGK DIRUNDENG MEULABOH Rundeng Kec. Johan Pahlawan Kab. Aceh Barat Prov. Aceh,Kab. Aceh Barat,,Aceh
40100343,SMA NEGERI 3 KOTAMOBAGU,https://sekolah.data.kemdikbud.go.id/index.php/Chome/profil/CD82A9B3-607B-4D21-BAF8-189152F2AA15,JL. A. YANI NO 35 KOTAMOBAGU Kotamobagu Kec. Kotamobagu Barat Kota Kotamobagu Prov. Sulawesi Utara,,Kota Kotamobagu,Sulawesi Utara
60202101,SMA NEGERI 3 KEPULAUAN SULA,https://sekolah.data.kemdikbud.go.id/index.php/Chome/profil/8799E287-2EB2-4FAD-A18C-18A081CE70F5,JL. SANGADJI FATAHA Waitina Kec. Mangoli Timur Kab. Kepulauan Sula Prov. Maluku Utara,Kab. Kepulauan Sula,,Maluku Utara
70031342,SMA BUAHATI ISLAMIC SCHOOL YOGYAKARTA,https://sekolah.data.kemdikbud.go.id/index.php/Chome/profil/F8BF0DCE-5F0F-4E89-96A4-18AED690F3FB,"Ngasemrejo, RT.18 RW.02 Ngawu Playen Gun... Ngawu Kec. Playen Kab. Gunungkidul Prov. D.I. Yogyakarta",Kab. Gunungkidul,,D.I. Yogyakarta
70027313,SMAS AL AZZA JAYA,https://sekolah.data.kemdikbud.go.id/index.php/Chome/profil/A07EE8C0-1623-496F-A325-18AEECF88C02,Desa Renda Renda Kec. Towea Kab. Muna Prov. Sulawesi Tenggara,Kab. Muna,,Sulawesi Tenggara
70048951,SMAN 1 Batulicin,https://sekolah.data.kemdikbud.go.id/index.php/Chome/profil/2FCBADDE-414E-4CB1-B03F-18B24982B4D3,Jl.Pendidikan RT.02 RW.01 GUNUNG TINGGI Kec. Batu Licin Kab. Tanah Bumbu Prov. Kalimantan Selatan,Kab. Tanah Bumbu,,Kalimantan Selatan
30313819,SMAN 1 HAMPANG,https://sekolah.data.kemdikbud.go.id/index.php/Chome/profil/F331E6F5-2383-4CCC-8D5E-18B2C3813246,Jl.Antuin Rt.1 Hampang Kec. Hampang Kab. Kotabaru Prov. Kalimantan Selatan,Kab. Kotabaru,,Kalimantan Selatan
