kode,nama,link_profil,alamat,kabupaten,kota,provinsi
10303610,SMAN 2 PADANG PANJANG,https://sekolah.data.kemdikbud.go.id/index.php/Chome/profil/16DAF9B2-48F0-42E4-918A-4F1A87FE0379,JL. BUNDO KANDUNG NO.2 Guguk Malintang Kec. Padang Panjang Timur Kota Padang Panjang Prov. Sumatera Barat,,Kota Padang Panjang,Sumatera Barat
70012744,SMA NEGERI SALBAIT,https://sekolah.data.kemdikbud.go.id/index.php/Chome/profil/B1A774A9-B8A7-4660-AC65-4F1C1AEDA6A4,"RT.001/RW.001, DUSUN I DESA SALBAIT Salbait Kec. Mollo Barat Kab. Timor Tengah Selatan Prov. Nusa Tenggara Timur",Kab. Timor Tengah Selatan,,Nusa Tenggara Timur
10308546,SMAN 5 PARIAMAN,https://sekolah.data.kemdikbud.go.id/index.php/Chome/profil/0B30351D-AC66-4653-8E16-4F2807833E15,JL. Kayu Gadang Pakasai Pakasai Kec. Pariaman Timur Kota Pariaman Prov. Sumatera Barat,,Kota Pariaman,Sumatera Barat
69786946,SMA RAUDLATUL ULUM,https://sekolah.data.kemdikbud.go.id/index.php/Chome/profil/54A9C4C3-1DD3-4156-B4F1-4F29C1D3EDCB,JL. ASAM RAYA KOTALON BATAH TIMUR Batah Timur Kec. Kwanyar Kab. Bangkalan Prov. Jawa Timur,Kab. Bangkalan,,Jawa Timur
10403694,SMAN 1 GUNUNG TOAR,https://sekolah.data.kemdikbud.go.id/index.php/Chome/profil/4A485C20-996B-4E21-8743-4F32B552F0B4,JL. Jendral Sudirman NO 99 Petapahan Petapahan Kec. Gunung Toar Kab. Kuantan Singingi Prov. Riau,Kab. Kuantan Singingi,,Riau
60301696,SMAN 6 SKOUW JAYAPURA,https://sekolah.data.kemdikbud.go.id/index.php/Chome/profil/1270D170-C7D8-4E04-879E-4F338E22AC54,"JL. RAYA PERBATASAN RI-PNG, KAMPUNG SKOU... Skow Mabo Kec. Muara Tami Kota Jayapura Prov. Papua",,Kota Jayapura,Papua
10807038,SMAS PANGUDI LUHUR,https://sekolah.data.kemdikbud.go.id/index.php/Chome/profil/5316031D-3FD7-4DAD-8B70-4F34CD95AC62,JL. RATU DIBALAU NO. 176 Tanjung Senang Kec. Tanjung Senang Kota Bandar Lampung Prov. Lampung,,Kota Bandar Lampung,Lampung
69968912,SMA IT AL - FARABI,https://sekolah.data.kemdikbud.go.id/index.php/Chome/profil/4CFAF949-6AFC-4BDD-8BDF-4F3BB3DAE04C,Jln. Branti Raya Halangan Ratu Kec. Negeri Katon Kab. Pesawaran Prov. Lampung,Kab. Pesawaran,,Lampung
10810741,SMAS MIFTAHUL ULUM,https://sekolah.data.kemdikbud.go.id/index.php/Chome/profil/8A43238E-43DA-4108-9125-4F3BFABD3CEF,Jln. Pasar Mahabang Mahabang Kec. Dente Teladas Kab. Tulang Bawang Prov. Lampung,Kab. Tulang Bawang,,Lampung
10610049,SMA BSI PALEMBANG,https://sekolah.data.kemdikbud.go.id/index.php/Chome/profil/DD080328-B635-4863-A890-4F3CA0E1FFBC,JL. HM RYACUDU NO 24 8 Ulu Kec. Seberang Ulu I Kota Palembang Prov. Sumatera Selatan,,Kota Palembang,Sumatera Selatan
20212958,SMA NEGERI 1 MANDIRANCAN,https://sekolah.data.kemdikbud.go.id/index.php/Chome/profil/CEE855AD-4E9D-40DE-977A-4F3D124C4A8A,JL. Siliwangi No. 1A Mandirancan Kec. Mandirancan Kab. Kuningan Prov. Jawa Barat,Kab. Kuningan,,Jawa Barat
69954764,SMA IT DAARUL HAMDI,https://sekolah.data.kemdikbud.go.id/index.php/Chome/profil/D1985586-45E5-4134-AE16-4F3EA1043845,Dusun Way Andak Sukadana Tengah SUKADANA TENGAH Kec. Sukadana Kab. Lampung Timur Prov. Lampung,Kab. Lampung Timur,,Lampung
10303467,SMAS DON BOSCO,https://sekolah.data.kemdikbud.go.id/index.php/Chome/profil/5AE61E0A-4635-47EC-A22C-4F3FCD2D795D,JL. KHAIRIL ANWAR NO 8 Belakang Tangsi Kec. Padang Barat Kota Padang Prov. Sumatera Barat,,Kota Padang,Sumatera Barat
50100389,SMA Negeri 1 Busungbiu,https://sekolah.data.kemdikbud.go.id/index.php/Chome/profil/A529610D-B6C4-4711-A1F0-4F40C690F404,JL. AMERTA NO. XX Busungbiu Kec. Busungbiu Kab. Buleleng Prov. Bali,Kab. Buleleng,,Bali
10104274,SMA NEGERI 1 KARANG BARU,https://sekolah.data.kemdikbud.go.id/index.php/Chome/profil/1ED91F80-213C-42CD-8A22-4F4256EC31FB,JL. DESA MEDANG ARA Medang Ara Kec. Karang Baru Kab. Aceh Tamiang Prov. Aceh,Kab. Aceh Tamiang,,Aceh
20503417,SMA YPM 3 SUMOBITO,https://sekolah.data.kemdikbud.go.id/index.php/Chome/profil/63BB3762-9AF5-4806-BEC3-4F4444C1DF32,Jl. Kauman 19 Sumobito Jombang Sumobito Kec. Sumobito Kab. Jombang Prov. Jawa Timur,Kab. Jombang,,Jawa Timur
40405054,SMAN 19 KONAWE SELATAN,https://sekolah.data.kemdikbud.go.id/index.php/Chome/profil/0E7CEF4D-832A-4F30-BA72-4F45DAD8330F,JL. TENGGIRI NO. 1 MOOLO INDAH Kec. Tinanggea Kab. Konawe Selatan Prov. Sulawesi Tenggara,Kab. Konawe Selatan,,Sulawesi Tenggara
20607867,SMAN 1 CILOGRANG,https://sekolah.data.kemdikbud.go.id/index.php/Chome/profil/489E52FC-6250-47CF-90CB-4F463E38BA04,JL. BAYAH CIBARENO KM. 25 CILOGRANG Gunungbatu Kec. Cilograng Kab. Lebak Prov. Banten,Kab. Lebak,,Banten
60402040,SMAS MUHAMMADIYAH AL-AMIN,https://sekolah.data.kemdikbud.go.id/index.php/Chome/profil/13D1DC7E-A6FD-4646-8DC3-4F486E81923C,JL Sungai Remu Kelurahan Klabulu Kec. Malaimsimsa Kota Sorong Prov. Papua Barat Daya,,Kota Sorong,Papua Barat Daya
70024112,SMA Swasta IT Al Ahmad Batubara,https://sekolah.data.kemdikbud.go.id/index.php/Chome/profil/D8E8C05B-BCFB-4601-8102-4F4F4BD492B2,Jl. Dusun Sono Tengah Bandar Sono Kec. Nibung Hangus Kab. Batu Bara Prov. Sumatera Utara,Kab. Batu Bara,,Sumatera Utara
20310419,SMA NEGERI 1 WERU,https://sekolah.data.kemdikbud.go.id/index.php/Chome/profil/B5E1F708-31DD-42A9-80DD-4F5205819581,"KARANGTENGAH, WERU, SUKOHARJO Karangtengah Kec. Weru Kab. Sukoharjo Prov. Jawa Tengah",Kab. Sukoharjo,,Jawa Tengah
70049470,SMA MATAHARI,https://sekolah.data.kemdikbud.go.id/index.php/Chome/profil/FF51D2A2-E034-4B55-8195-4F528A2E5E76,Dusun Mangempang Moncongloe Kec. Moncongloe Kab. Maros Prov. Sulawesi Selatan,Kab. Maros,,Sulawesi Selatan
10108099,SMA NEGERI 1 NISAM ANTARA,https://sekolah.data.kemdikbud.go.id/index.php/Chome/profil/E6EAE232-E70B-40EB-B133-4F53ADCDD8A8,JL. ALUE DUA - BLANG RIMEH Alue Dua Kec. Nisam Antara Kab. Aceh Utara Prov. Aceh,Kab. Aceh Utara,,Aceh
10404007,SMAS BUDI LUHUR,https://sekolah.data.kemdikbud.go.id/index.php/Chome/profil/AEC48885-1523-409D-950C-4F5627FA9FCC,JL.PAUS LIMBUNGAN BARU Limbungan Baru Kec. Rumbai Kota Pekanbaru Prov. Riau,,Kota Pekanbaru,Riau
60724708,SMA Negeri 14 Kepulauan Tanimbar,https://sekolah.data.kemdikbud.go.id/index.php/Chome/profil/07ACC96B-C7A0-48D7-8FAA-4F59003E8F8E,ADODO MOLU ADODO MOLU Kec. Molu Maru Kab. Kepulauan Tanimbar Prov. Maluku,Kab. Kepulauan Tanimbar,,Maluku
50200380,SMAN 1 NARMADA,https://sekolah.data.kemdikbud.go.id/index.php/Chome/profil/4971DE90-7B1A-407A-8A49-4F5C0E979A56,JL.SURANADI NO.51 Nyur Lembang Kec. Narmada Kab. Lombok Barat Prov. Nusa Tenggara Barat,Kab. Lombok Barat,,Nusa Tenggara Barat
40302661,SMAN 4 BONE,https://sekolah.data.kemdikbud.go.id/index.php/Chome/profil/98476D12-4F16-41D3-BC44-4F67D296EAFB,Jln. Jend. Ahmad Yani Pompanua Pompanua Kec. Ajangale Kab. Bone Prov. Sulawesi Selatan,Kab. Bone,,Sulawesi Selatan
70046328,SMAS ISLAM AL-AMIN SEMOYANG,https://sekolah.data.kemdikbud.go.id/index.php/Chome/profil/0D33C6DB-ED29-42F7-A6F4-4F6DB88A7EFC,Jln. Tibu Lepang Semoyang Kec. Praya Timur Kab. Lombok Tengah Prov. Nusa Tenggara Barat,Kab. Lombok Tengah,,Nusa Tenggara Barat
60301371,SMA YASUKA ANSUS,https://sekolah.data.kemdikbud.go.id/index.php/Chome/profil/23DEF523-ED16-4396-956F-4F7088C177FE,JL. Unemi Ansus Inowa Kec. Yapen Barat Kab. Kepulauan Yapen Prov. Papua,Kab. Kepulauan Yapen,,Papua
69862660,SMA AL-FATH,https://sekolah.data.kemdikbud.go.id/index.php/Chome/profil/03459F4B-E0C6-4F0B-A222-4F71CF0BB81C,Jl. Sunan Ampel Link. Kubang Menyawak Rt... Warnasari Kec. Citangkil Kota Cilegon Prov. Banten,,Kota Cilegon,Banten
10643845,SMA JAMIYAH ISLAMIYAH,https://sekolah.data.kemdikbud.go.id/index.php/Chome/profil/C00C78C7-358F-4144-A4A3-4F761F258764,JL. MERDEKA NO.28 TG. PINANG Tanjung Pinang Ii Kec. Tanjung Batu Kab. Ogan Ilir Prov. Sumatera Selatan,Kab. Ogan Ilir,,Sumatera Selatan
10259034,SMA NEGERI 2 GUNUNGSITOLI,https://sekolah.data.kemdikbud.go.id/index.php/Chome/profil/3AA5E267-DFB2-45D6-A168-4F78A03E8799,"JL.ARAH AWAI KM.8,5 GUNUNG SITOLI BAWODESOLO Kec. Gunungsitoli Kota Gunungsitoli Prov. Sumatera Utara",,Kota Gunungsitoli,Sumatera Utara
10810802,SMAS MIF ULUM SEPUTIH SURABAYA,https://sekolah.data.kemdikbud.go.id/index.php/Chome/profil/C41D2434-A65A-4CA2-B305-4F7A2BD0E44D,JL. KY. HASYIM ASYARI Mataram Ilir Kec. Seputih Surabaya Kab. Lampung Tengah Prov. Lampung,Kab. Lampung Tengah,,Lampung
10700298,SMA NEGERI 5 BENGKULU UTARA,https://sekolah.data.kemdikbud.go.id/index.php/Chome/profil/3BB1F623-4B53-4320-A89C-4F7D8A6C9F7F,JALAN BUKIT INDAH NO.01 Pasar Ketahun Kec. Ketahun Kab. Bengkulu Utara Prov. Bengkulu,Kab. Bengkulu Utara,,Bengkulu
69956644,SMA OLAHRAGA PEMBANGUNAN JAYA RAYA,https://sekolah.data.kemdikbud.go.id/index.php/Chome/profil/32093F2D-F129-4362-BDD4-4F7F510939D1,CBD Sawah Baru Blok B7/P-03 A Kel. Sawah... Sawah Kec. Ciputat Kota Tangerang Selatan Prov. Banten,,Kota Tangerang Selatan,Banten
10402077,SMAN 1 GAUNG ANAK SERKA,https://sekolah.data.kemdikbud.go.id/index.php/Chome/profil/DB18E1FF-12E4-4C2E-80FF-4F8587996D35,JL. MERDEKA TIMUR NO.90 TELUK PINANG Teluk Pinang Kec. Gaung Anak Serka Kab. Indragiri Hilir Prov. Riau,Kab. Indragiri Hilir,,Riau
69986952,SMA NEGERI 2 AMPANA KOTA,https://sekolah.data.kemdikbud.go.id/index.php/Chome/profil/C1278979-DAD3-41F2-BD6A-4F8861AFABBE,Jl. Delima DONDO BARAT Kec. Ampana Kota Kab. Tojo Una Una Prov. Sulawesi Tengah,Kab. Tojo Una Una,,Sulawesi Tengah
20227813,SMA AL AMANAH CIWIDEY,https://sekolah.data.kemdikbud.go.id/index.php/Chome/profil/5A24A9AB-5086-4AF5-B40A-4F896DF778FC,JL.KOMPLEK MASJID BESAR CIWIDEY Ciwidey Kec. Ciwidey Kab. Bandung Prov. Jawa Barat,Kab. Bandung,,Jawa Barat
20505055,SMAS MAARIF 45 PLUMPANG,https://sekolah.data.kemdikbud.go.id/index.php/Chome/profil/ACFFA740-0857-43EA-9B2A-4F8A0FB895CD,Jl. Masjid No. 07 Plumpang Plumpang Kec. Plumpang Kab. Tuban Prov. Jawa Timur,Kab. Tuban,,Jawa Timur
30200794,SMAN 1 DUSUN HILIR,https://sekolah.data.kemdikbud.go.id/index.php/Chome/profil/FCA2BF8A-CE31-46B1-8E6B-4F8AECEF3F00,JL. KELURAHAN NO. 29 Mengkatip Kec. Dusun Hilir Kab. Barito Selatan Prov. Kalimantan Tengah,Kab. Barito Selatan,,Kalimantan Tengah
30200728,SMAS PGRI BUNTOK,https://sekolah.data.kemdikbud.go.id/index.php/Chome/profil/BFB7E1E8-030C-4276-B018-4F8DBDBA89F1,JL. PELITA IV BUNTOK Hilir Sper Kec. Dusun Selatan Kab. Barito Selatan Prov. Kalimantan Tengah,Kab. Barito Selatan,,Kalimantan Tengah
69946702,SMA Negeri 2 Kluet Timur,https://sekolah.data.kemdikbud.go.id/index.php/Chome/profil/D586A96A-19CF-4A5B-8CF6-4F9672D86676,"Jl. Pendidikan, Gampong Pucuk Lembang, K... Pucuk Lembang Kec. Kluet Timur Kab. Aceh Selatan Prov. Aceh",Kab. Aceh Selatan,,Aceh
10302009,SMAN 1 BAYANG,https://sekolah.data.kemdikbud.go.id/index.php/Chome/profil/71383E25-18FC-4A79-802E-4F97F120BD79,JL. RANAH PANJANG Koto Barapak Kec. Bayang Kab. Pesisir Selatan Prov. Sumatera Barat,Kab. Pesisir Selatan,,Sumatera Barat
30407801,SMAN 9 BERAU,https://sekolah.data.kemdikbud.go.id/index.php/Chome/profil/68A42788-50C2-44ED-AF16-4F9E7747452F,JL. RAYA PAYUNG - PAYUNG Maratua Payung-Payung Kec. Pulau Maratua Kab. Berau Prov. Kalimantan Timur,Kab. Berau,,Kalimantan Timur
20510142,SMAS BAKTI PONOROGO,https://sekolah.data.kemdikbud.go.id/index.php/Chome/profil/5371A879-C485-4DD4-B258-4FA288D727FE,JL. BOTOROKATONG Nologaten Kec. Ponorogo Kab. Ponorogo Prov. Jawa Timur,Kab. Ponorogo,,Jawa Timur
20227861,SMA MUHAMMADIYAH 3 CIPARAY,https://sekolah.data.kemdikbud.go.id/index.php/Chome/profil/B0CCCF91-0DEA-458B-AF4C-4FA4E31F1136,JL.RAYA LASWI NO.597 CIPARAY Serangmekar Kec. Ciparay Kab. Bandung Prov. Jawa Barat,Kab. Bandung,,Jawa Barat
69775747,SMA NEGERI 3 SIMEULUE TENGAH,https://sekolah.data.kemdikbud.go.id/index.php/Chome/profil/3CB7607E-1878-4469-8465-4FA8F70594FD,Jln. Tgk. Diujung Kec. Simeulue Tengah K... Lambaya Kec. Simeulue Tengah Kab. Simeulue Prov. Aceh,Kab. Simeulue,,Aceh
30101088,SMAN 1 TOHO,https://sekolah.data.kemdikbud.go.id/index.php/Chome/profil/6C18A4D9-2773-4EC0-993F-4FA9C8479E09,Jln. Raya Toho KM. 74 Pak Laheng Kec. Toho Kab. Mempawah Prov. Kalimantan Barat,Kab. Mempawah,,Kalimantan Barat
20102230,SMAN 108 JAKARTA,https://sekolah.data.kemdikbud.go.id/index.php/Chome/profil/16AAA975-7041-453F-B9B7-4FAF8EFCC2CB,Jl. Kesadaran Ulujami Raya Rt.06/Rw.01 Pesanggrahan Kec. Pesanggrahan Kota Adm. Jakarta Selatan Prov. D.K.I. Jakarta,,Kota Adm. Jakarta Selatan,D.K.I. Jakarta
20256637,SMA AL-QONAAH BALEENDAH,https://sekolah.data.kemdikbud.go.id/index.php/Chome/profil/1D78E156-3A2B-4DC1-9A0C-4FB2BB1BAC37,Jl. Babakan Irigasi RT. 004 RW. 001 Jelekong Kec. Baleendah Kab. Bandung Prov. Jawa Barat,Kab. Bandung,,Jawa Barat
20232304,SMAS AL BASYARIAH,https://sekolah.data.kemdikbud.go.id/index.php/Chome/profil/7F4C60BC-7B9F-4860-A51D-4FB4E797D446,JL. RAYA PABUARAN GG. LANGGAR DS. RAWA P... Rawa Panjang Kec. Bojong Gede Kab. Bogor Prov. Jawa Barat,Kab. Bogor,,Jawa Barat
69944311,SMA KUMNAMU,https://sekolah.data.kemdikbud.go.id/index.php/Chome/profil/997BB620-C4D0-4838-B678-4FB770F2796A,Jln Palem Raja III No 6 Panunggangan Bar... Panunggangan Barat Kec. Cibodas Kota Tangerang Prov. Banten,,Kota Tangerang,Banten
60301889,SMA Advent Nabire,https://sekolah.data.kemdikbud.go.id/index.php/Chome/profil/EE9E1558-8BD5-4D87-A701-4FB9D39C3F92,Jl. Kusuma bangsa Nabarua Kec. Nabire Kab. Nabire Prov. Papua Tengah,Kab. Nabire,,Papua Tengah
70054874,SMA AN NAHL ISLAMIC SCHOOL,https://sekolah.data.kemdikbud.go.id/index.php/Chome/profil/7EE44109-A970-4D37-B899-4FBE03675C3D,Jl. Raya Ciangsana KM. 7 Ciangsana Kec. Gunungputri Kab. Bogor Prov. Jawa Barat,Kab. Bogor,,Jawa Barat
40100323,SMA NEGERI 2 KOTAMOBAGU,https://sekolah.data.kemdikbud.go.id/index.php/Chome/profil/0AD4CBC2-382C-4200-B208-4FBF3D700C28,JL. AMAL NO 39 KOTAMOBAGU Mogolaing Kec. Kotamobagu Barat Kota Kotamobagu Prov. Sulawesi Utara,,Kota Kotamobagu,Sulawesi Utara
70025125,SMA IT Dayah Mulia,https://sekolah.data.kemdikbud.go.id/index.php/Chome/profil/60E08EA3-E7EA-48B1-91CA-4FC0B005A8EF,Gampong Teupin Batee Teupin Batee Kec. Blang Bintang Kab. Aceh Besar Prov. Aceh,Kab. Aceh Besar,,Aceh
20214988,SMAN 1 WALED,https://sekolah.data.kemdikbud.go.id/index.php/Chome/profil/DFB94915-964E-4269-8D8D-4FC23ABCBC85,JL. RAYA DEWI SARTIKA Waled Kota Kec. Waled Kab. Cirebon Prov. Jawa Barat,Kab. Cirebon,,Jawa Barat
60400346,SMAS YPK 2,https://sekolah.data.kemdikbud.go.id/index.php/Chome/profil/2C5CBF23-E4B4-43A2-811E-4FC3EB307B6B,JL. CENDRAWASIH REMU UTARA KLAWUMUK Kec. Sorong Kota Sorong Prov. Papua Barat Daya,,Kota Sorong,Papua Barat Daya
69966097,SMA KHOLILURROHMAN,https://sekolah.data.kemdikbud.go.id/index.php/Chome/profil/F0C4092C-D803-4312-BC81-4FC406AF0C1D,Jl. Kembang Putih Genteng Kec. Konang Kab. Bangkalan Prov. Jawa Timur,Kab. Bangkalan,,Jawa Timur
69963051,SMA IQRO AMAHOLU,https://sekolah.data.kemdikbud.go.id/index.php/Chome/profil/6BD165DF-EBEA-467F-B19E-4FC88A155473,"Jl. Pendidikan Pattimura, Dusun Amaholu Desa Luhu Kec. Huamual Kab. Seram Bagian Barat Prov. Maluku",Kab. Seram Bagian Barat,,Maluku
20247169,SMAS TERPADU DARUL AMAL,https://sekolah.data.kemdikbud.go.id/index.php/Chome/profil/B8DEF89E-B7AC-4060-9658-4FD18C6852E0,JL. CIKASO-CINAGEN KP.SELAJATI RT 02/01 Bojong Genteng Kec. Jampang Kulon Kab. Sukabumi Prov. Jawa Barat,Kab. Sukabumi,,Jawa Barat
69787070,SMAS TERPADU DARUL MUTTAQIN,https://sekolah.data.kemdikbud.go.id/index.php/Chome/profil/3842D508-2F33-41B4-A3B5-4FD54146583A,Jln. Lhok Seutuy - Krueng Lingka Lhok Seutui Kec. Baktiya Kab. Aceh Utara Prov. Aceh,Kab. Aceh Utara,,Aceh
50304405,SMAN 1 NUBATUKAN,https://sekolah.data.kemdikbud.go.id/index.php/Chome/profil/2C5ED04C-6E58-4716-8075-4FD55B11848A,LEWOLEBA LEWOLEBA SELATAN Kec. Nubatukan Kab. Lembata Prov. Nusa Tenggara Timur,Kab. Lembata,,Nusa Tenggara Timur
10202772,SMA SWASTA TELADAN BANGUN,https://sekolah.data.kemdikbud.go.id/index.php/Chome/profil/B998DCEB-1AE1-4606-A1AA-4FD67674424E,JL. ASAHAN KM. 17 BANGUN Bangun Kec. Gunung Malela Kab. Simalungun Prov. Sumatera Utara,Kab. Simalungun,,Sumatera Utara
69765071,SMAN 1 BALANTAK SELATAN,https://sekolah.data.kemdikbud.go.id/index.php/Chome/profil/336AB068-D888-4309-821E-4FD8B60A9592,Jl. Laginda No. 1 Resarna Kec. Balantak Selatan Kab. Banggai Prov. Sulawesi Tengah,Kab. Banggai,,Sulawesi Tengah
40405284,SMAN 2 MAWASANGKA,https://sekolah.data.kemdikbud.go.id/index.php/Chome/profil/BA8BF2FD-B644-465A-B8DD-4FDA697009D3,JALAN POROS DESA NAPA - WASILOMATA NO.3 ... Napa Kec. Mawasangka Kab. Buton Tengah Prov. Sulawesi Tenggara,Kab. Buton Tengah,,Sulawesi Tenggara
10604544,SMAN 2 PRABUMULIH,https://sekolah.data.kemdikbud.go.id/index.php/Chome/profil/1FBC4614-1080-49D3-8D1D-4FDBA5172FE6,JL. BASUKI RAHMAT Tanjung Raman Kec. Prabumulih Selatan Kota Prabumulih Prov. Sumatera Selatan,,Kota Prabumulih,Sumatera Selatan
69900980,SMA Negeri 2 KAIMANA,https://sekolah.data.kemdikbud.go.id/index.php/Chome/profil/EF52C047-368C-4885-89AB-4FDCCF0CA837,JL. UTARUM AIR MERAH KAIMANA PAPUA BARAT K R O Y Kec. Kaimana Kab. Kaimana Prov. Papua Barat,Kab. Kaimana,,Papua Barat
10648296,SMA Negeri 1 Jayapura,https://sekolah.data.kemdikbud.go.id/index.php/Chome/profil/7016A6C3-7FAD-4690-BB65-4FDECFE9141C,JAYAPURA Bunga Mayang Kec. Jayapura Kab. Ogan Komering Ulu Timur Prov. Sumatera Selatan,Kab. Ogan Komering Ulu Timur,,Sumatera Selatan
70042240,SMA NEGERI 3 ROKAN IV KOTO,https://sekolah.data.kemdikbud.go.id/index.php/Chome/profil/899531A4-20AD-4933-A94E-4FE44077D338,Jl. Kabupaten Banjar Datar - Tandikat Cipang Kiri Hilir Kec. Rokan IV Koto Kab.  Rokan Hulu Prov. Riau,Kab.  Rokan Hulu,,Riau
20605364,SMAS PGRI 2 KOTA SERANG,https://sekolah.data.kemdikbud.go.id/index.php/Chome/profil/18D25A04-7035-4A60-86D7-4FF0DF127247,JL. KH FATAH HASAN 17/B SERANG Cipare Kec. Serang Kota Serang Prov. Banten,,Kota Serang,Banten
30314342,SMAN 2 PARINGIN,https://sekolah.data.kemdikbud.go.id/index.php/Chome/profil/BE75E84C-B766-4B5B-89A0-4FF13EF85709,JL. A. YANI KOMPLEK PENDIDIKAN TERPADU K... HARAPAN BARU Kec. Paringin Selatan Kab. Balangan Prov. Kalimantan Selatan,Kab. Balangan,,Kalimantan Selatan
70031768,SMA NEGERI 3 KAYAN HILIR,https://sekolah.data.kemdikbud.go.id/index.php/Chome/profil/8AF4AF88-DE2E-4AC6-B0BD-4FF8E432D4F4,JL. LINTAS SINTANG NANGA MAU Nanga Tikan Kec. Kayan Hilir Kab. Sintang Prov. Kalimantan Barat,Kab. Sintang,,Kalimantan Barat
40312010,SMAN 1 MAKASSAR,https://sekolah.data.kemdikbud.go.id/index.php/Chome/profil/0126D309-49CE-4FC7-BD3B-4FFA6972E12E,JL. GUNUNG BAWAKARAENG NO. 53 Gaddong Kec. Bontoala Kota Makassar Prov. Sulawesi Selatan,,Kota Makassar,Sulawesi Selatan
40503114,SMAN 1 PAGUYAMAN PANTAI,https://sekolah.data.kemdikbud.go.id/index.php/Chome/profil/DBAAB035-6A98-4140-A40C-4FFC127D84BC,JL. SISWA Limbatihu Kec. Paguyaman Pantai Kab. Boalemo Prov. Gorontalo,Kab. Boalemo,,Gorontalo
20616006,SMAS KUTABUMI,https://sekolah.data.kemdikbud.go.id/index.php/Chome/profil/EE186391-89EC-48A5-8E50-500A0B48A6A4,JL. RAYA CADAS KUKUN KM 2.5 KUTABARU KEC... Kuta Baru Kec. Pasar Kemis Kab. Tangerang Prov. Banten,Kab. Tangerang,,Banten
20339007,SMA MUHAMMADIYAH 1 PATI,https://sekolah.data.kemdikbud.go.id/index.php/Chome/profil/BE6D6D39-0862-4E1F-BB8C-500AA37B1371,JL. RAYA PATI - TAYU KM. 4 Tambaharjo Kec. Pati Kab. Pati Prov. Jawa Tengah,Kab. Pati,,Jawa Tengah
69879191,SMAN Saengga,https://sekolah.data.kemdikbud.go.id/index.php/Chome/profil/4CF132BD-1EBC-4D53-950B-500BE7246F5B,Saengga Simuri / Saengga Kec. Sumuri Kab. Teluk Bintuni Prov. Papua Barat,Kab. Teluk Bintuni,,Papua Barat
70035596,SMA Kristen Villa Taman Bandara,https://sekolah.data.kemdikbud.go.id/index.php/Chome/profil/475BE94E-8FB5-4B6F-8AD6-50186473C5F3,Jl. Perum Villa Taman Bandara Blok B 8 /... D A D A P Kec. Kosambi Kab. Tangerang Prov. Banten,Kab. Tangerang,,Banten
70002765,SMAN 17 BOMBANA,https://sekolah.data.kemdikbud.go.id/index.php/Chome/profil/3CBA89F3-C374-4C25-BAF0-5018D511579E,JALAN POROS LEMO BAMBAEA Lemo Kec. Poleang Tenggara Kab. Bombana Prov. Sulawesi Tenggara,Kab. Bombana,,Sulawesi Tenggara
50220503,SMAS AL MASYHUDIEN NW KAWO,https://sekolah.data.kemdikbud.go.id/index.php/Chome/profil/06A3F225-57EB-4F48-9DF6-502599F839C1,Jln.Pariwisata Bumi Gora Kawo Kec. Pujut Kab. Lombok Tengah Prov. Nusa Tenggara Barat,Kab. Lombok Tengah,,Nusa Tenggara Barat
69946658,SMAN 2 MORO O,https://sekolah.data.kemdikbud.go.id/index.php/Chome/profil/9FC1AAA5-0D13-4B24-9195-502D6F4DEED1,Jalan Ir. Soekarno No. 01 Sitolu Ewali Kec. Moro o Kab. Nias Barat Prov. Sumatera Utara,Kab. Nias Barat,,Sumatera Utara
20312170,SMAN MOJOGEDANG,https://sekolah.data.kemdikbud.go.id/index.php/Chome/profil/F13186E6-60D1-4736-A814-5032149B6032,JL. GROMPOL JAMBANGAN Kedungjeruk Kec. Mojogedang Kab. Karanganyar Prov. Jawa Tengah,Kab. Karanganyar,,Jawa Tengah
50310684,SMAN 6 BORONG,https://sekolah.data.kemdikbud.go.id/index.php/Chome/profil/BF3D5DD4-A758-4F03-B425-503DAB465DB8,PUNTU Torok Golo Kec. Rana Mese Kab. Manggarai Timur Prov. Nusa Tenggara Timur,Kab. Manggarai Timur,,Nusa Tenggara Timur
20520816,SMAS KRISTEN YBPK TEMPURSARI,https://sekolah.data.kemdikbud.go.id/index.php/Chome/profil/47CEC8A7-1DA0-4059-B6D9-50402C82F89E,JL. GEREJA NO. 42 TEMPURSARI Tempursari Kec. Tempursari Kab. Lumajang Prov. Jawa Timur,Kab. Lumajang,,Jawa Timur
20613519,SMAN 22 KABUPATEN TANGERANG,https://sekolah.data.kemdikbud.go.id/index.php/Chome/profil/6195D864-C569-47C3-8C51-50423767786D,JL. Bumi Puspiptek Asri Sektor I Pagedangan Kec. Pagedangan Kab. Tangerang Prov. Banten,Kab. Tangerang,,Banten
20520821,SMAN 1 LUMAJANG,https://sekolah.data.kemdikbud.go.id/index.php/Chome/profil/78B0279A-69D8-4153-9ECB-50456A17E0B3,JL. JEND. A. YANI NO. 7 LUMAJANG Kepuharjo Kec. Lumajang Kab. Lumajang Prov. Jawa Timur,Kab. Lumajang,,Jawa Timur
69726059,SMAN 3 SATAR MESE,https://sekolah.data.kemdikbud.go.id/index.php/Chome/profil/0156B8D8-CAD1-4C6B-A274-5048917A928A,"PONGKOR, DESA PONGKOR KECAMATAN SATAR ME... PONGKOR Kec. Satarmese Kab. Manggarai Prov. Nusa Tenggara Timur",Kab. Manggarai,,Nusa Tenggara Timur
10814713,SMA NEGERI 1 DENTE TELADAS,https://sekolah.data.kemdikbud.go.id/index.php/Chome/profil/7E6E02C2-0A88-4BE7-A88F-5048CC1FD092,Jalan Poros Kampung Way Dente WAY DENTE Kec. Dente Teladas Kab. Tulang Bawang Prov. Lampung,Kab. Tulang Bawang,,Lampung
20603347,SMAS KATOLIK RICCI II,https://sekolah.data.kemdikbud.go.id/index.php/Chome/profil/D4A7D8A3-B6BB-4705-BC7F-504B60ED6EDD,JL.UTAMA II NO.1-2 Pondok Karya Kec. Pondok Aren Kota Tangerang Selatan Prov. Banten,,Kota Tangerang Selatan,Banten
70049881,SMA NEGERI SEREMUK,https://sekolah.data.kemdikbud.go.id/index.php/Chome/profil/08D1F1AA-842F-4584-B039-504ECD67847F,Kampung Haha Distrik Seremuk Haha Kec. Seremuk Kab. Sorong Selatan Prov. Papua Barat Daya,Kab. Sorong Selatan,,Papua Barat Daya
10601959,SMAN RUPIT (B),https://sekolah.data.kemdikbud.go.id/index.php/Chome/profil/43197873-76FB-4132-A888-505701830050,JL. DEPATI KECIK NO. 404 MUARA RUPIT Kec. Rupit Kab. Musi Rawas Utara Prov. Sumatera Selatan,Kab. Musi Rawas Utara,,Sumatera Selatan
70047627,SMA Negeri 9 Padangsidimpuan,https://sekolah.data.kemdikbud.go.id/index.php/Chome/profil/BDB72C67-26E6-411D-8814-5062543B588A,Desa Joring Natobang Joring Natobang Kec. Angkola Julu Kota Padang Sidempuan Prov. Sumatera Utara,,Kota Padang Sidempuan,Sumatera Utara
70055505,Sekolah Rakyat Menengah Atas Terintegrasi 22 Polewali Mandar,https://sekolah.data.kemdikbud.go.id/index.php/Chome/profil/FCC47A6A-3A4F-4D35-BC17-506D68A9D8B1,Jl. Poros Rea Km 4 Kecamatan Binuang Kab... Binuang Kec. Binuang Kab. Tapin Prov. Kalimantan Selatan,Kab. Tapin,,Kalimantan Selatan
20219312,SMAN 4 BANDUNG,https://sekolah.data.kemdikbud.go.id/index.php/Chome/profil/1405D8D7-BB36-4BC4-8507-506F9FFF0489,JL. GARDUJATI NO. 20 Kebon Jeruk Kec. Andir Kota Bandung Prov. Jawa Barat,,Kota Bandung,Jawa Barat
40206563,SMAN 1 SOYO JAYA,https://sekolah.data.kemdikbud.go.id/index.php/Chome/profil/00450D9D-948A-4D8F-BA85-5070C94DFEE4,LEMBAH SUMARA Lembah Sumara Kec. Soyo Jaya Kab. Morowali Utara Prov. Sulawesi Tengah,Kab. Morowali Utara,,Sulawesi Tengah
30404227,SMAS MUHAMADIYAH TANJUNG REDEB,https://sekolah.data.kemdikbud.go.id/index.php/Chome/profil/DC1089CA-916E-4367-A9DD-507461868B66,JL. JENDERAL SUDIRMAN Bugis Kec. Tanjung Redeb Kab. Berau Prov. Kalimantan Timur,Kab. Berau,,Kalimantan Timur
69822733,SMA NEGERI 2 PANDIH BATU,https://sekolah.data.kemdikbud.go.id/index.php/Chome/profil/B9F59636-46BB-4D6F-B5C3-507CFF8F903D,"Cut Nyak Dhien, Desa Belanti Siam, Kec. ... Belanti Siam Kec. Pandih Batu Kab. Pulang Pisau Prov. Kalimantan Tengah",Kab. Pulang Pisau,,Kalimantan Tengah
20330035,SMA MUHAMMADIYAH RANDUBLATUNG,https://sekolah.data.kemdikbud.go.id/index.php/Chome/profil/A3DAA72D-7D44-49EF-9BB9-508540203D85,JL MENDEN KM 1 RANDUBLATUNG Pilang Kec. Randublatung Kab. Blora Prov. Jawa Tengah,Kab. Blora,,Jawa Tengah
69864676,SMA NEGERI 1 PENANGGALAN,https://sekolah.data.kemdikbud.go.id/index.php/Chome/profil/A6DA8540-5892-48B2-8E51-5088DAEB1042,Jln. Lae Raso Sikelang Kec. Penanggalan Kota Subulussalam Prov. Aceh,,Kota Subulussalam,Aceh
40601852,UPTD SMAN 1 BAMBALAMUTU,https://sekolah.data.kemdikbud.go.id/index.php/Chome/profil/2171AF0D-3CC2-44DE-9676-508BA68C59EB,JL. SAWI BAMBALAMOTU Bambalamotu Kec. Bambalamutu Kab. Pasangkayu Prov. Sulawesi Barat,Kab. Pasangkayu,,Sulawesi Barat
10404970,SMAN 2 TUALANG,https://sekolah.data.kemdikbud.go.id/index.php/Chome/profil/E2C45FC0-35E9-4043-A4B1-50901013E719,JL.WAJA WANGSA Tualang Kec. Tualang Kab. Siak Prov. Riau,Kab. Siak,,Riau
30202576,SMAN - 1 PANTAI LUNCI,https://sekolah.data.kemdikbud.go.id/index.php/Chome/profil/325F2979-1078-4F24-A4E5-50984D0FE582,JL. PEMBANGUNAN Sungai Cabang Barat Kec. Pantai Lunci Kab. Sukamara Prov. Kalimantan Tengah,Kab. Sukamara,,Kalimantan Tengah
70055456,Sekolah Rakyat Menengah Atas 42 Sarmi,https://sekolah.data.kemdikbud.go.id/index.php/Chome/profil/2548381C-32F2-4868-B0A5-509CB0A894F6,"Jl. Baru Petam, Kasukwe, Distrik Sarmi S... Kasukwe Kec. Sarmi Selatan Kab. Sarmi Prov. Papua",Kab. Sarmi,,Papua
20102219,SMAN 109 JAKARTA,https://sekolah.data.kemdikbud.go.id/index.php/Chome/profil/E98C921B-8736-4AB0-9E8E-509E5A140B0E,Jl. Gardu No. 31 Srengseng Sawah Kec. Jagakarsa Kota Adm. Jakarta Selatan Prov. D.K.I. Jakarta,,Kota Adm. Jakarta Selatan,D.K.I. Jakarta
