kode,nama,link_profil,alamat,kabupaten,kota,provinsi
10258027,SMAS HARAPAN BATANG SERANGAN,https://sekolah.data.kemdikbud.go.id/index.php/Chome/profil/A6C873D4-6B97-4131-AA4E-D50DAF544F33,JL.Kwala Sawit Dusun Bandar Pulo Batang ... Kuala Musam Kec. Batang Serangan Kab. Langkat Prov. Sumatera Utara,Kab. Langkat,,Sumatera Utara
69950912,SMA NEGERI 3 TAHUNA BARAT,https://sekolah.data.kemdikbud.go.id/index.php/Chome/profil/A64C2D9F-DD53-4489-B76C-D50DDC9216D5,Kolongan Mitung Mitung Kec. Tahuna Barat Kab. Kepulauan Sangihe Prov. Sulawesi Utara,Kab. Kepulauan Sangihe,,Sulawesi Utara
40206570,SMAN 2 TOTIKUM,https://sekolah.data.kemdikbud.go.id/index.php/Chome/profil/0AEF7914-3337-4672-A377-D5149F3D0701,Jln. Trans Peling Desa Kombutokan Kombutokan Kec. Totikum Kab. Banggai Kepulauan Prov. Sulawesi Tengah,Kab. Banggai Kepulauan,,Sulawesi Tengah
50303423,SMAS ST FRANSISKUS XAVERIUS,https://sekolah.data.kemdikbud.go.id/index.php/Chome/profil/8ABE6352-2693-4FB8-BFAC-D5152B2EBA9F,JL PELITA NO. 3 RUTENG Watu Kec. Langke Rembong Kab. Manggarai Prov. Nusa Tenggara Timur,Kab. Manggarai,,Nusa Tenggara Timur
20219247,SMAN 25 BANDUNG,https://sekolah.data.kemdikbud.go.id/index.php/Chome/profil/22D4E55C-E335-4F16-9BFB-D5165AA55BDB,JL. BATURADEN VIII NO. 21 MEKAR JAYA Kec. Rancasari Kota Bandung Prov. Jawa Barat,,Kota Bandung,Jawa Barat
20323502,SMA NEGERI 1 SRAGI,https://sekolah.data.kemdikbud.go.id/index.php/Chome/profil/58587B5E-F909-4881-B476-D51C76655A88,Jl. Raya Bulakpelem Bulakpelem Kec. Sragi Kab. Pekalongan Prov. Jawa Tengah,Kab. Pekalongan,,Jawa Tengah
70042243,SMA NEGERI 2 BONAI DARUSSALAM,https://sekolah.data.kemdikbud.go.id/index.php/Chome/profil/2C53C309-C01B-4FF5-820E-D51CF7F58CFD,Jl. Lintas Bonai-Kota Tengah Kasang Padang Kec. Bonai Darussalam Kab.  Rokan Hulu Prov. Riau,Kab.  Rokan Hulu,,Riau
30401489,SMAN 3 BALIKPAPAN,https://sekolah.data.kemdikbud.go.id/index.php/Chome/profil/A0CDE9D2-217E-4990-ACBE-D51D8448FFC7,JL. WOLTER MONGINSIDI BARU NO 1 RT 53 Baru Ulu Kec. Balikpapan Barat Kota Balikpapan Prov. Kalimantan Timur,,Kota Balikpapan,Kalimantan Timur
10257886,SMA ISLAM AL-ULUM TERPADU MEDAN,https://sekolah.data.kemdikbud.go.id/index.php/Chome/profil/AB9866DD-E9A7-4526-909F-D521D51B2C35,JL.TUASAN NO. 35 MEDAN Sidorejo Hilir Kec. Medan Tembung Kota Medan Prov. Sumatera Utara,,Kota Medan,Sumatera Utara
10100196,SMA NEGERI 1 INDRAPURI,https://sekolah.data.kemdikbud.go.id/index.php/Chome/profil/56EE346A-E8D2-4603-A4C8-D52B9B8209AD,"JL. BANDA ACEH-MEDAN KM 27,4 Lampanah Ranjo Kec. Indrapuri Kab. Aceh Besar Prov. Aceh",Kab. Aceh Besar,,Aceh
60102960,SMA Negeri 10 Seram Bagian Timur,https://sekolah.data.kemdikbud.go.id/index.php/Chome/profil/448D0D1F-C938-48D7-A515-D52BC7F493BF,Jln. Pendidikan Kota Sirih Kec. Gorom Timur Kab. Seram Bagian Timur Prov. Maluku,Kab. Seram Bagian Timur,,Maluku
40402194,SMAN 1 LASUSUA,https://sekolah.data.kemdikbud.go.id/index.php/Chome/profil/CB81E1F9-CBB7-4F32-B5F5-D52F1F894A69,Jl. Pendidikan Watuliwu Kec. Lasusua Kab. Kolaka Utara Prov. Sulawesi Tenggara,Kab. Kolaka Utara,,Sulawesi Tenggara
10495792,SMAS ANA MUSLIM,https://sekolah.data.kemdikbud.go.id/index.php/Chome/profil/8AFB5C64-8065-48E5-8EF8-D5352F835039,DESA KOTA BARU Kota Baru Kec. Kunto Darussalam Kab.  Rokan Hulu Prov. Riau,Kab.  Rokan Hulu,,Riau
20548721,SMAS UNGGULAN BPPT AL FATTAH,https://sekolah.data.kemdikbud.go.id/index.php/Chome/profil/619EEF1D-8C5C-41A2-8402-D539627B06D7,JL. PONPES AL FATTAH DESA SIMAN KECAMATA... Siman Kec. Sekaran Kab. Lamongan Prov. Jawa Timur,Kab. Lamongan,,Jawa Timur
69949194,SMA Islam Al Fattah,https://sekolah.data.kemdikbud.go.id/index.php/Chome/profil/FA525BE1-156D-47E5-933B-D53A93B6F2EA,Kampung Tanjung Tiga Kecamatan Rebang Ta... Tanjung Tiga Kec. Rebang Tangkas Kab. Way Kanan Prov. Lampung,Kab. Way Kanan,,Lampung
70005948,SMA Negeri 2 Liae,https://sekolah.data.kemdikbud.go.id/index.php/Chome/profil/068EEAF3-8A1F-4C5B-994E-D53DEE2B6887,Jln Trans Eikare-Merabbu Raerobo Kec. Sabu Liae Kab. Sabu Raijua Prov. Nusa Tenggara Timur,Kab. Sabu Raijua,,Nusa Tenggara Timur
10806077,SMAN 1 WAY JEPARA,https://sekolah.data.kemdikbud.go.id/index.php/Chome/profil/957E1FF8-405A-4C27-A1E6-D5427C11EB91,JL. PRAMUKA LABUHAN RATU I Labuhan Ratu Satu Kec. Way Jepara Kab. Lampung Timur Prov. Lampung,Kab. Lampung Timur,,Lampung
30203967,SMAN 1 GUNUNG TIMANG,https://sekolah.data.kemdikbud.go.id/index.php/Chome/profil/78BB60B1-75EA-4BA6-A431-D545D65EBEF8,JL. PEMUDA RT IV KOMP JAPUS Kandui Kec. Gunung Timang Kab. Barito Utara Prov. Kalimantan Tengah,Kab. Barito Utara,,Kalimantan Tengah
40304258,SMAN 7 BULUKUMBA,https://sekolah.data.kemdikbud.go.id/index.php/Chome/profil/A57CE65F-A94A-4AA2-BD62-D546002AF636,JL. H. ALLU NO. 121 A BONTOSUNGGU Bonto Sunggu Kec. Gantarang Kab. Bulukumba Prov. Sulawesi Selatan,Kab. Bulukumba,,Sulawesi Selatan
20502720,SMAN 1 DAWARBLANDONG,https://sekolah.data.kemdikbud.go.id/index.php/Chome/profil/24AD3392-981C-4B6F-9688-D550659E4944,JL. JON DJAROT  SUBIANTORO Dawarblandong Kec. Dawar Blandong Kab. Mojokerto Prov. Jawa Timur,Kab. Mojokerto,,Jawa Timur
10207082,SMAN 1 ANGKOLA SELATAN,https://sekolah.data.kemdikbud.go.id/index.php/Chome/profil/FB9411EA-6782-41E4-A1E7-D55553332F92,MARPINGGAN KELURAHAN NAPA Kec. Angkola Selatan Kab. Tapanuli Selatan Prov. Sumatera Utara,Kab. Tapanuli Selatan,,Sumatera Utara
69941988,SMA ISLAM TERPADU AR-RISALAH PAOK LOMBOK,https://sekolah.data.kemdikbud.go.id/index.php/Chome/profil/CE47B52F-D4CD-49DC-93A0-D5582D4C3A3B,SMA ISLAM TERPADU AR-RISALAH PAOK LOMBOK PAOK LOMBOK Kec. Suralaga Kab. Lombok Timur Prov. Nusa Tenggara Barat,Kab. Lombok Timur,,Nusa Tenggara Barat
40600210,SMAS BUDI MULIA,https://sekolah.data.kemdikbud.go.id/index.php/Chome/profil/5CF50C64-F026-4A99-BC5A-D5620554F392,JL. VETERAN KALUKKU Kalukku Kec. Kalukku Kab. Mamuju Prov. Sulawesi Barat,Kab. Mamuju,,Sulawesi Barat
20255782,SMAS YADIKA KALIJATI,https://sekolah.data.kemdikbud.go.id/index.php/Chome/profil/D14993E0-8E88-4D13-B6D2-D569DE89599A,JL. RAYA KALIJATI PURWADADI Kaliangsana Kec. Kalijati Kab. Subang Prov. Jawa Barat,Kab. Subang,,Jawa Barat
20579489,SMAS DARUL FALAH,https://sekolah.data.kemdikbud.go.id/index.php/Chome/profil/93463A67-723B-4D57-90BA-D57A5728CBA5,DUSUN SUMBER BULU Batoporo Timur Kec. Kedungdung Kab. Sampang Prov. Jawa Timur,Kab. Sampang,,Jawa Timur
20251786,SMAS PGRI LEMBANG,https://sekolah.data.kemdikbud.go.id/index.php/Chome/profil/B9F71063-FA96-4B84-8A8E-D57D69FC1E78,JL. BARU LAKSANA NO. 65 LEMBANG Jayagiri Kec. Lembang Kab. Bandung Barat Prov. Jawa Barat,Kab. Bandung Barat,,Jawa Barat
70006224,SMA JAGAKARSA,https://sekolah.data.kemdikbud.go.id/index.php/Chome/profil/E3E2D303-4F56-4DAD-ADBD-D582E1202776,"Jl. Kramat No. 1, RT. 008, RW. 007 Jagakarsa Kec. Jagakarsa Kota Adm. Jakarta Selatan Prov. D.K.I. Jakarta",,Kota Adm. Jakarta Selatan,D.K.I. Jakarta
30104501,SMAN 1 MANDOR,https://sekolah.data.kemdikbud.go.id/index.php/Chome/profil/562376ED-FB5F-4142-B67F-D58E79F7AD7B,JL. RAYA MANDOR Mandor Kec. Mandor Kab. Landak Prov. Kalimantan Barat,Kab. Landak,,Kalimantan Barat
50205209,SMAS ATTOHIRIYAH BODAK,https://sekolah.data.kemdikbud.go.id/index.php/Chome/profil/7CDAC752-C52B-40F7-8C00-D594AF6ED61A,JL. PRAYA-MANTANG Montong Terep Kec. Praya Kab. Lombok Tengah Prov. Nusa Tenggara Barat,Kab. Lombok Tengah,,Nusa Tenggara Barat
69830661,SMA NEGERI 10 KABUPATEN SORONG,https://sekolah.data.kemdikbud.go.id/index.php/Chome/profil/2E006A17-D7CD-4B39-931A-D595C11575BE,Jl. Kasuari No. 1 MALAMAS Kec. Segun Kab. Sorong Prov. Papua Barat Daya,Kab. Sorong,,Papua Barat Daya
20325306,SMAS PGRI SLAWI,https://sekolah.data.kemdikbud.go.id/index.php/Chome/profil/AA5AA058-94BC-4651-9554-D59D23E137EF,JL. SUPRIYADI TRAYEMAN Trayeman Kec. Slawi Kab. Tegal Prov. Jawa Tengah,Kab. Tegal,,Jawa Tengah
10214157,SMAS METHODIST KUTALIMBARU,https://sekolah.data.kemdikbud.go.id/index.php/Chome/profil/6C8C38CD-AA1E-4931-AA9F-D59E9C14B16D,PERUM BUMI TUNTUNGAN Lau Bakeri Kec. KutaIimbaru Kab. Deli Serdang Prov. Sumatera Utara,Kab. Deli Serdang,,Sumatera Utara
20320241,SMA NEGERI 2 UNGARAN,https://sekolah.data.kemdikbud.go.id/index.php/Chome/profil/FE0097B0-5DAD-42C5-90E7-D5B0BA84F7AC,Jalan Diponegoro 277 Ungaran Candirejo Kec. Ungaran Barat Kab. Semarang Prov. Jawa Tengah,Kab. Semarang,,Jawa Tengah
40102617,SMAS WOLTER MONGINSIDI,https://sekolah.data.kemdikbud.go.id/index.php/Chome/profil/5EF888E1-8F38-4450-B061-D5BAF15C6BCE,JL. PANDU Mapanget Barat Kec. Mapanget Kota Manado Prov. Sulawesi Utara,,Kota Manado,Sulawesi Utara
69984841,SMA SWASTA HAFIDZ TERPADU DARUL MUKLASIN,https://sekolah.data.kemdikbud.go.id/index.php/Chome/profil/7F26960B-EFB6-4A09-9C1F-D5BCC67AC070,Jln. Takengon-Bireuen Km. 57 Alur Gading Kec. Pintu Rime Gayo Kab. Bener Meriah Prov. Aceh,Kab. Bener Meriah,,Aceh
10257742,SMAN 2 PERBAUNGAN,https://sekolah.data.kemdikbud.go.id/index.php/Chome/profil/E3FEDA16-6570-43F0-A700-D5C1B5CE54DB,Jl. Duku Melati II Melati Dua Kec. Perbaungan Kab. Serdang Bedagai Prov. Sumatera Utara,Kab. Serdang Bedagai,,Sumatera Utara
50303773,SMA NEGERI 2 WAINGAPU,https://sekolah.data.kemdikbud.go.id/index.php/Chome/profil/A7161FAD-F30E-464F-A240-D5C47C803F66,JL. JEND. SOEHARTO WAINGAPU Hambala Kec. Kota Waingapu Kab. Sumba Timur Prov. Nusa Tenggara Timur,Kab. Sumba Timur,,Nusa Tenggara Timur
10301575,SMAN 1 LEMBANG JAYA,https://sekolah.data.kemdikbud.go.id/index.php/Chome/profil/6131E174-306B-42CD-92A3-D5C6EECDD63A,JL. RAYA KOTO ANAU BUKIT SILEH KOTO ANAU Kec. Lembang Jaya Kab. Solok Prov. Sumatera Barat,Kab. Solok,,Sumatera Barat
69768552,SMA NEGERI 2 JORONG,https://sekolah.data.kemdikbud.go.id/index.php/Chome/profil/6DDEC5CE-DFE8-4E34-B4F5-D5D5B71EB9DB,. A. Yani KM. 121 Desa Sungai Baru RT 10... SIMPANG EMPAT SUNGAI BARU Kec. Jorong Kab. Tanah Laut Prov. Kalimantan Selatan,Kab. Tanah Laut,,Kalimantan Selatan
10108199,SMA SWASTA MUHAMMADIYAH GUNUNG MERIAH,https://sekolah.data.kemdikbud.go.id/index.php/Chome/profil/69FBE2B7-9E23-4724-A783-D5DAE737B98C,JLN. CUT MEUTIA DESA TULAAN TULAAN Kec. Gunung Mariah Kab. Aceh Singkil Prov. Aceh,Kab. Aceh Singkil,,Aceh
10646139,SMA NEGERI 2 MUARA KUANG,https://sekolah.data.kemdikbud.go.id/index.php/Chome/profil/46A9D72F-28B5-43F8-BEB4-D5DE6D708386,DESA MUNGGU KEC. M. KUANG Munggu Kec. Muara Kuang Kab. Ogan Ilir Prov. Sumatera Selatan,Kab. Ogan Ilir,,Sumatera Selatan
69993043,SMA IT AWJA,https://sekolah.data.kemdikbud.go.id/index.php/Chome/profil/EA51D8D4-3BC6-432C-BD20-D5E006597306,Jl. Kayee Kunyet Kec. Blang Bintang Kab.... Kayee Kunyet Kec. Blang Bintang Kab. Aceh Besar Prov. Aceh,Kab. Aceh Besar,,Aceh
69967196,SMA NEGERI 2 MEMPAWAH HULU,https://sekolah.data.kemdikbud.go.id/index.php/Chome/profil/C24D3541-FA80-44E5-B5DA-D5E2239F53A5,"Jl. Raya Caong, Dusun Pakan C A O N G Kec. Mempawah Hulu Kab. Landak Prov. Kalimantan Barat",Kab. Landak,,Kalimantan Barat
50307299,SMAN KUANFATU,https://sekolah.data.kemdikbud.go.id/index.php/Chome/profil/B9576829-819B-491D-BF02-D5E85062CE63,Jl. Tutwuri No. 3 B Kuanfatu Kuanfatu Kec. Kuanfatu Kab. Timor Tengah Selatan Prov. Nusa Tenggara Timur,Kab. Timor Tengah Selatan,,Nusa Tenggara Timur
69970000,SMA NEGERI 11 KEPULAUAN SULA,https://sekolah.data.kemdikbud.go.id/index.php/Chome/profil/090BBB70-49AF-48F9-B440-D5EA7DEE4FAB,Jln. Raya Waiman No 1 Waiman Kec. Sula Besi Tengah Kab. Kepulauan Sula Prov. Maluku Utara,Kab. Kepulauan Sula,,Maluku Utara
69938150,SMA ISLAM AR-RAUDHAH,https://sekolah.data.kemdikbud.go.id/index.php/Chome/profil/4ECA72AC-2C9C-4EC2-B6A1-D5F2210DF898,JL. LINGKAR BARAT NO. 08 Gedungan Kec. Batuan Kab. Sumenep Prov. Jawa Timur,Kab. Sumenep,,Jawa Timur
10308464,SMAS YAPPHI BATANG ANAI,https://sekolah.data.kemdikbud.go.id/index.php/Chome/profil/934F4FEA-F53E-407E-9B02-D5F60D282EE4,Jl. Raya Padang - Bukit Tinggi KM. 26 Pa... SUNGAI BULUH Kec. Batang Anai Kab. Padang Pariaman Prov. Sumatera Barat,Kab. Padang Pariaman,,Sumatera Barat
20508478,SMAS KARYA PEMBANGUNAN PARON,https://sekolah.data.kemdikbud.go.id/index.php/Chome/profil/070955D5-CC48-4FB6-BAA1-D5FC87BA9E46,JL. RAYA PARON NGAWI NO. 30 Paron Kec. Paron Kab. Ngawi Prov. Jawa Timur,Kab. Ngawi,,Jawa Timur
10303468,SMAS ABDULLAH AHMAD,https://sekolah.data.kemdikbud.go.id/index.php/Chome/profil/28EE2C51-3C7B-4348-B77F-D5FC97A86A44,JL. DR.H.ABDULLAH AHMAD NO.8 Sawahan Kec. Padang Timur Kota Padang Prov. Sumatera Barat,,Kota Padang,Sumatera Barat
69859552,SMAN 19 PANGKAJENE DAN KEPULAUAN,https://sekolah.data.kemdikbud.go.id/index.php/Chome/profil/CF742BAB-5DD4-4900-89C4-D5FE1A9C0493,DESA TOMPOBULU Tompo Bulu Kec. Balocci Kab. Pangkajene Dan Kepulauan Prov. Sulawesi Selatan,Kab. Pangkajene Dan Kepulauan,,Sulawesi Selatan
10404572,SMAN TUAH GEMILANG,https://sekolah.data.kemdikbud.go.id/index.php/Chome/profil/E4B35068-30B4-4B60-B55E-D60095AA5019,JL. BATANG TUAKA SUNGAI PIRING Kec. Batang Tuaka Kab. Indragiri Hilir Prov. Riau,Kab. Indragiri Hilir,,Riau
20506308,SMA AL-KAUTSAR SEKARAN,https://sekolah.data.kemdikbud.go.id/index.php/Chome/profil/8EC40CB9-FD56-4D12-8E55-D6026154836E,JL. KOMPLEK AL-KAUTSAR DESA MANYAR KEC. ... Manyar Kec. Sekaran Kab. Lamongan Prov. Jawa Timur,Kab. Lamongan,,Jawa Timur
70013307,SMA NEGERI MATPUNU,https://sekolah.data.kemdikbud.go.id/index.php/Chome/profil/F3C43862-A97A-4917-A37B-D60BDB9A993E,JL. Kono Oematan Taneotop Kec. Nunbena Kab. Timor Tengah Selatan Prov. Nusa Tenggara Timur,Kab. Timor Tengah Selatan,,Nusa Tenggara Timur
10703157,SMA NEGERI 6 KEPAHIANG,https://sekolah.data.kemdikbud.go.id/index.php/Chome/profil/F4069155-CD90-4179-B5A2-D60BE548BB02,JLN. LINTAS KEPAHIANG - CURUP Taba Mulan Kec. Merigi Kab. Kepahiang Prov. Bengkulu,Kab. Kepahiang,,Bengkulu
70047718,SMA Islam Terpadu Auladi Islami,https://sekolah.data.kemdikbud.go.id/index.php/Chome/profil/6DE7C283-E1F7-4964-BB43-D60EBBA59DC7,Perumahan Rajeg Terrace Suka Manah Kec. Rajeg Kab. Tangerang Prov. Banten,Kab. Tangerang,,Banten
70039707,SMA IT AL-MULTAZAM,https://sekolah.data.kemdikbud.go.id/index.php/Chome/profil/6050BD38-5975-454D-A22E-D61D3D7578B4,Jl. Raya Bandung-Garut KM.27 Kp. Cukang ... Tenjolaya Kec. Cicalengka Kab. Bandung Prov. Jawa Barat,Kab. Bandung,,Jawa Barat
20214980,SMAN 1 GEGESIK,https://sekolah.data.kemdikbud.go.id/index.php/Chome/profil/5D5D256A-9139-41AF-8099-D61E1B3F4CF5,JL. NAKULA SADEWA Gegesik Kidul Kec. Gegesik Kab. Cirebon Prov. Jawa Barat,Kab. Cirebon,,Jawa Barat
40404263,SMAN 1 LAMBANDIA,https://sekolah.data.kemdikbud.go.id/index.php/Chome/profil/7B1F8526-68F5-4EF3-B55C-D61F0206D8D2,Jl. Taman Siswa No. 08 Wonuambuteo KEC. LAMBANDIA Kab. Kolaka Timur Prov. Sulawesi Tenggara,Kab. Kolaka Timur,,Sulawesi Tenggara
30401068,SMA Negeri 11 Samarinda,https://sekolah.data.kemdikbud.go.id/index.php/Chome/profil/B1479184-21EF-4F69-B7F9-D62633DC88AF,Jl. Pelita IV Sambutan Sambutan Kec. Sambutan Kota Samarinda Prov. Kalimantan Timur,,Kota Samarinda,Kalimantan Timur
69757251,SMA ISLAM AN-NUR,https://sekolah.data.kemdikbud.go.id/index.php/Chome/profil/19A4BD65-BBA0-4171-9A4E-D626C24DD74A,JL. KM CHOLIL ANWAR Sana Tengah Kec. Pasean Kab. Pamekasan Prov. Jawa Timur,Kab. Pamekasan,,Jawa Timur
20223042,SMAN 7 BEKASI,https://sekolah.data.kemdikbud.go.id/index.php/Chome/profil/64E167AC-E38C-47B0-A051-D62751636AEB,JL. LINGKAR TATA KOTA JATISAMPURNA Jatisampurna Kec. Jati Sampurna Kota Bekasi Prov. Jawa Barat,,Kota Bekasi,Jawa Barat
20517822,SMAS PGRI LAWANG,https://sekolah.data.kemdikbud.go.id/index.php/Chome/profil/DA61AD33-2341-4077-8E5E-D629D064B929,JL. Indrokilo Selatan No.1A Desa Bedali Bedali Kec. Lawang Kab. Malang Prov. Jawa Timur,Kab. Malang,,Jawa Timur
69990743,SMA ISLAM TERPADU AL MUSTHAFAWIYAH,https://sekolah.data.kemdikbud.go.id/index.php/Chome/profil/A7F9F14B-B5F7-4870-B910-D62E116175F9,Jl. Cikopo Selatan KM. 06 RT. 001 RW. 00... Sukakarya Kec. Megamendung Kab. Bogor Prov. Jawa Barat,Kab. Bogor,,Jawa Barat
30102995,SMAN 1 SELIMBAU,https://sekolah.data.kemdikbud.go.id/index.php/Chome/profil/07993E4D-0F11-4E5D-986C-D63505681108,Jln. Mungguk Batu Ds. Gudang Hulu Gudang Hulu Kec. Selimbau Kab. Kapuas Hulu Prov. Kalimantan Barat,Kab. Kapuas Hulu,,Kalimantan Barat
69947674,SMA - IT NURUL MUHAJIRIN,https://sekolah.data.kemdikbud.go.id/index.php/Chome/profil/FDA44E27-96AB-4C42-A92B-D63F0DDA489C,Jalan Masjid  Nurul Muhajirin Kota Negara Kec. Sungkai Utara Kab. Lampung Utara Prov. Lampung,Kab. Lampung Utara,,Lampung
40203607,SMAN 8 PALU,https://sekolah.data.kemdikbud.go.id/index.php/Chome/profil/AF09D769-BE02-4E90-9C8A-D63F67FDB209,JL. Ragigau No. 3 Palu Kelurahan Tipo Kec. Ulujadi Kota Palu Prov. Sulawesi Tengah,,Kota Palu,Sulawesi Tengah
69786596,SMAN 4 LAIS,https://sekolah.data.kemdikbud.go.id/index.php/Chome/profil/E7BF6793-80AE-4E82-9312-D6431D72D13B,DESA TANJUNG AGUNG TANJUNG AGUNG BARAT Kec. Lais Kab. Musi Banyuasin Prov. Sumatera Selatan,Kab. Musi Banyuasin,,Sumatera Selatan
20209236,SMAN 13 GARUT,https://sekolah.data.kemdikbud.go.id/index.php/Chome/profil/F1122510-CBA8-4F59-9A13-D64A8D229255,JL. RAYA SELAAWI - BL. LIMBANGAN Dunguswiru Kec. Blubur Limbangan Kab. Garut Prov. Jawa Barat,Kab. Garut,,Jawa Barat
10609760,SMA AL-IKHLAS LUBUKLINGGAU,https://sekolah.data.kemdikbud.go.id/index.php/Chome/profil/116B6B76-C036-4AC7-94EC-D64D67901ECE,JL. YOS SUDARSO RT.2 NO. 86 Watervang Kec. Lubuk Linggau Timur I Kota Lubuk Linggau Prov. Sumatera Selatan,,Kota Lubuk Linggau,Sumatera Selatan
50100824,SMA Negeri 2 Negara,https://sekolah.data.kemdikbud.go.id/index.php/Chome/profil/879AB497-4200-4608-9802-D64FB0525A0A,"Jl. Merak, Komplek Civic Centre Dauhwaru Kec. Jembrana Kab. Jembrana Prov. Bali",Kab. Jembrana,,Bali
20107291,SMAS DARUL MAARIF JAKARTA,https://sekolah.data.kemdikbud.go.id/index.php/Chome/profil/242A8E36-7603-4DF9-892D-D650E55A7579,JL. RS. FATMAWATI NO.45 Cipete Selatan Kec. Cilandak Kota Adm. Jakarta Selatan Prov. D.K.I. Jakarta,,Kota Adm. Jakarta Selatan,D.K.I. Jakarta
70051006,SMA BUANA SISWA,https://sekolah.data.kemdikbud.go.id/index.php/Chome/profil/0E1E726B-9522-4C63-9787-D657BA9CFC5A,JL. PLUIT KARANG BARAT BLOK. G6B NO.29 Pluit Kec. Penjaringan Kota Adm. Jakarta Utara Prov. D.K.I. Jakarta,,Kota Adm. Jakarta Utara,D.K.I. Jakarta
20529967,SMA NEGERI 1 AMBUNTEN SUMENEP,https://sekolah.data.kemdikbud.go.id/index.php/Chome/profil/0FF976D5-D481-4936-9557-D66068502E22,JL. RAYA AMBUNTEN Ambunten Timur Kec. Ambunten Kab. Sumenep Prov. Jawa Timur,Kab. Sumenep,,Jawa Timur
20102563,SMAN 90 JAKARTA,https://sekolah.data.kemdikbud.go.id/index.php/Chome/profil/4CE61472-53C6-4A7C-9F37-D665546F60FF,Jl. Sabar Petukangan Petukangan Selatan Kec. Pesanggrahan Kota Adm. Jakarta Selatan Prov. D.K.I. Jakarta,,Kota Adm. Jakarta Selatan,D.K.I. Jakarta
20202258,SMAN 1 SIMPENAN,https://sekolah.data.kemdikbud.go.id/index.php/Chome/profil/B25D9A95-3193-49BC-8C92-D6669F980407,JL. Bhina Karya Cidadap Kec. Simpenan Kab. Sukabumi Prov. Jawa Barat,Kab. Sukabumi,,Jawa Barat
10605575,SMAS BINA BANGSA PP AL FALAH,https://sekolah.data.kemdikbud.go.id/index.php/Chome/profil/846570B9-C17D-4BDA-A0C3-D66C3A5CA8FE,Jl. Palembang-Jambi Km.105 Suka Maju Kec. Babat Supat Kab. Musi Banyuasin Prov. Sumatera Selatan,Kab. Musi Banyuasin,,Sumatera Selatan
60300874,SMAS PEMBANGUNAN 6 YAPIS KEEROM,https://sekolah.data.kemdikbud.go.id/index.php/Chome/profil/AE99F59B-D9D1-412A-A7B3-D66C5F1EE888,JL. POROS ARSO III Jaifuri Kec. Skanto Kab. Keerom Prov. Papua,Kab. Keerom,,Papua
10259405,SMAN 3 PANYABUNGAN,https://sekolah.data.kemdikbud.go.id/index.php/Chome/profil/AE9336D3-099C-4BE5-AEE4-D66EFD942A53,KOMPLEK STAIN PANYABUNGAN Pidoli Lombang Kec. Panyabungan Kab. Mandailing Natal Prov. Sumatera Utara,Kab. Mandailing Natal,,Sumatera Utara
20313829,SMAS MUHAMMADIYAH GUBUG,https://sekolah.data.kemdikbud.go.id/index.php/Chome/profil/83A4C3B2-56F5-406D-BE4E-D6767BB3F26A,JL. PEMUDA NO. 92  GUBUG Gubug Kec. Gubug Kab. Grobogan Prov. Jawa Tengah,Kab. Grobogan,,Jawa Tengah
20208391,SMAN SITURAJA,https://sekolah.data.kemdikbud.go.id/index.php/Chome/profil/34826DF7-7C4B-4F0A-8277-D67D9673AEAC,JL. KAUM  NO. 14 SITURAJA - SUMEDANG 453... Situraja Kec. Situraja Kab. Sumedang Prov. Jawa Barat,Kab. Sumedang,,Jawa Barat
10644267,SMAN 1 PULAU PINANG,https://sekolah.data.kemdikbud.go.id/index.php/Chome/profil/38B53216-DA45-4600-9E3B-D67E3563EB32,JLN. RAYA LAHAT - PAGARALAM DESA JATI Km... Jati Kec. Pulau Pinang Kab. Lahat Prov. Sumatera Selatan,Kab. Lahat,,Sumatera Selatan
40502029,SMAN 1 BUNTULIA,https://sekolah.data.kemdikbud.go.id/index.php/Chome/profil/CF7840BC-86E0-4ADA-AC5A-D67F58F322D5,JL. KAWAH NO. 125 SIPATANA Kec. Buntulia Kab. Pohuwato Prov. Gorontalo,Kab. Pohuwato,,Gorontalo
20551893,SMA ISLAM AL-FANISA,https://sekolah.data.kemdikbud.go.id/index.php/Chome/profil/0AB07B10-0DF2-41E8-B509-D68004E5F373,JL. RAYA BRAKAS NO.02 Brakas Kec. Ra as Kab. Sumenep Prov. Jawa Timur,Kab. Sumenep,,Jawa Timur
20534754,SMAS THOMAS AQUINO,https://sekolah.data.kemdikbud.go.id/index.php/Chome/profil/C1ED6B97-6F4E-4885-B334-D6909194E5D3,JL. NIAGA NO. 15 Sentanan Kec. Magersari Kota Mojokerto Prov. Jawa Timur,,Kota Mojokerto,Jawa Timur
40314430,SMAN 7 PINRANG,https://sekolah.data.kemdikbud.go.id/index.php/Chome/profil/B4F859D6-D98D-4E1D-8BF6-D691A30158BA,JL. POROS PINRANG PARE KM 8 Manarang Kec. Mattiro Bulu Kab. Pinrang Prov. Sulawesi Selatan,Kab. Pinrang,,Sulawesi Selatan
60102024,SMAS ADVENT MALUKU,https://sekolah.data.kemdikbud.go.id/index.php/Chome/profil/054A02D2-F4CE-4D75-8C66-D69DE0693C2F,JL. DR. J. LEIMENA Hative Besar Kec. Teluk Ambon Kota Ambon Prov. Maluku,,Kota Ambon,Maluku
20103293,SMAN 102 JAKARTA,https://sekolah.data.kemdikbud.go.id/index.php/Chome/profil/37DFF795-5F04-4AA6-8BCB-D6ABE446D1D7,"JL. KAYU TINGGI,CAKUNG JAKARTA TIMUR Cakung Timur Kec. Cakung Kota Adm. Jakarta Timur Prov. D.K.I. Jakarta",,Kota Adm. Jakarta Timur,D.K.I. Jakarta
30305505,SMAN 1 KURIPAN,https://sekolah.data.kemdikbud.go.id/index.php/Chome/profil/D8DFC291-4105-4A6C-B241-D6AC94EAE8F3,KURIPAN KAB BATOLA Rimbun Tulang Kec. Kuripan Kab. Barito Kuala Prov. Kalimantan Selatan,Kab. Barito Kuala,,Kalimantan Selatan
20328935,SMA MUHAMMADIYAH 1,https://sekolah.data.kemdikbud.go.id/index.php/Chome/profil/B3EF3223-6F92-4123-A44D-D6AF10F987E2,Jl. Tentara Pelajar No. 91 Jomblang Kec. Candisari Kota Semarang Prov. Jawa Tengah,,Kota Semarang,Jawa Tengah
10807032,SMAS IMMANUEL BANDAR LAMPUNG,https://sekolah.data.kemdikbud.go.id/index.php/Chome/profil/E0759A03-1450-4C2F-B8EF-D6B48D91BB62,JL. DR. SUSILO NO. 6 Sumur Batu Kec. Teluk Betung Utara Kota Bandar Lampung Prov. Lampung,,Kota Bandar Lampung,Lampung
30106485,SMAS PERMATA KASIH NANGA PINOH,https://sekolah.data.kemdikbud.go.id/index.php/Chome/profil/E280BC1D-9327-4F2E-AEC8-D6BBD59BB2FC,JL. MARHABAN 1 Paal Kec. Nanga Pinoh Kab. Melawi Prov. Kalimantan Barat,Kab. Melawi,,Kalimantan Barat
40300275,SMAS SANUR MONCONGLOE,https://sekolah.data.kemdikbud.go.id/index.php/Chome/profil/04DE00F6-BB2C-4099-A803-D6C01306A26B,JL. DUSUN DICCEKANG Moncongloe Bulu Kec. Moncongloe Kab. Maros Prov. Sulawesi Selatan,Kab. Maros,,Sulawesi Selatan
10204251,SMAS SWADAYA PULAU RAKYAT,https://sekolah.data.kemdikbud.go.id/index.php/Chome/profil/7D59BF0B-50B2-42AB-BF0E-D6CDAF9F3BFA,JL. YASPENDA NO. 37 PULAU RAKYAT PEKAN Pulau Rakyat Pekan Kec. Pulau Rakyat Kab. Asahan Prov. Sumatera Utara,Kab. Asahan,,Sumatera Utara
69867931,SMA IT SINARSARI,https://sekolah.data.kemdikbud.go.id/index.php/Chome/profil/1A3C5543-5B49-4A85-A56F-D6D44BB7C74D,KP. CITEUREUP RT 02 RW 03 Sirnabakti Kec. Pameungpeuk Kab. Garut Prov. Jawa Barat,Kab. Garut,,Jawa Barat
70051326,SMA Enterpreneurship Birul Ulum,https://sekolah.data.kemdikbud.go.id/index.php/Chome/profil/F535240E-86A5-4D54-8FFE-D6D8C630E6D8,Jl. KH Syuhada RT.001 RW.002 Desa CIsait... Cisait Kec. Kragilan Kab. Serang Prov. Banten,Kab. Serang,,Banten
20525864,SMAS PGRI PURWOHARJO,https://sekolah.data.kemdikbud.go.id/index.php/Chome/profil/7DE76B71-2A26-43FA-B011-D6DA4E1CFEF8,Jalan Jajag No. 7 Kradenan Kec. Purwoharjo Kab. Banyuwangi Prov. Jawa Timur,Kab. Banyuwangi,,Jawa Timur
70014623,SMA DARUL FALAH,https://sekolah.data.kemdikbud.go.id/index.php/Chome/profil/E9F15616-8D1D-4092-995F-D6DB21C66ED0,Desa Tulung Sari BK  14 Tulung Sari Kec. Belitang Mulya Kab. Ogan Komering Ulu Timur Prov. Sumatera Selatan,Kab. Ogan Komering Ulu Timur,,Sumatera Selatan
50220494,SMAS AL MALIKI,https://sekolah.data.kemdikbud.go.id/index.php/Chome/profil/DBB978B0-AAF8-40BB-9BE9-D6E1B28865D4,JL. LINTAS TALABIU Penapali Kec. Woha Kab. Bima Prov. Nusa Tenggara Barat,Kab. Bima,,Nusa Tenggara Barat
20211491,SMAN 1 BAREGBEG,https://sekolah.data.kemdikbud.go.id/index.php/Chome/profil/AD93CF4B-3AC3-4967-8840-D6EFBAA6B78F,JL. R.E. MARTADINATA NO.150 CIAMIS Baregbeg Kec. Baregbeg Kab. Ciamis Prov. Jawa Barat,Kab. Ciamis,,Jawa Barat
60101443,SMA Negeri 3 Kepulauan Tanimbar,https://sekolah.data.kemdikbud.go.id/index.php/Chome/profil/43FEF700-8261-4F65-AABC-D6F05A427D86,WATMURI Watmuri Kec. Nirun Mas Kab. Kepulauan Tanimbar Prov. Maluku,Kab. Kepulauan Tanimbar,,Maluku
20227881,SMA SWADAYA KARYA CIWIDEY,https://sekolah.data.kemdikbud.go.id/index.php/Chome/profil/A430E107-536F-4C40-9942-D6F627746E69,JL.CIBADAK CIBUNI RANCABALI Sukaresmi Kec. Rancabali Kab. Bandung Prov. Jawa Barat,Kab. Bandung,,Jawa Barat
20534747,SMAS TARUNA NUSA HARAPAN,https://sekolah.data.kemdikbud.go.id/index.php/Chome/profil/BF9C1CE0-256D-41FE-AB05-D70735473827,JL. LETKOL SUMARJO NO. 67 MR Purwotengah Kec. Magersari Kota Mojokerto Prov. Jawa Timur,,Kota Mojokerto,Jawa Timur
20561783,SMA MARGIE,https://sekolah.data.kemdikbud.go.id/index.php/Chome/profil/E61A5657-4D1A-400B-A469-D70A9C97F95C,JL. GRAHA NATURA (KUWUKAN 24A) Lontar Kec. Sambi Kerep Kota Surabaya Prov. Jawa Timur,,Kota Surabaya,Jawa Timur
20555828,SMAS ISLAM WALISONGO,https://sekolah.data.kemdikbud.go.id/index.php/Chome/profil/46FC9593-C8D9-4C05-9686-D71136657858,JL. BARAT PASAR BRANGKAL NO.460 Kedungmaling Kec. Sooko Kab. Mojokerto Prov. Jawa Timur,Kab. Mojokerto,,Jawa Timur
