kode,nama,link_profil,alamat,kabupaten,kota,provinsi
69830123,SMA AL MIFTAH 4,https://sekolah.data.kemdikbud.go.id/index.php/Chome/profil/94DBBCBE-4D6E-4295-9BA1-50AB0D6ADDAF,Bulu Tengah Ds Campor Kec Proppo Campor Kec. Proppo Kab. Pamekasan Prov. Jawa Timur,Kab. Pamekasan,,Jawa Timur
70051632,SMA SURIA HARAPAN SCHOOL,https://sekolah.data.kemdikbud.go.id/index.php/Chome/profil/3B999EBC-751E-4875-8F04-50ADA868A82C,Jl. Hayam Wuruk Nomor 171 RT. 010 Talang Jauh Kec. Jelutung Kota Jambi Prov. Jambi,,Kota Jambi,Jambi
69982493,SMA HOHIDIAI,https://sekolah.data.kemdikbud.go.id/index.php/Chome/profil/14E3E657-7390-44E8-A67C-50AE914C6859,Jln. Raya Bido Bido Kec. Morotai Utara Kab. Pulau Morotai Prov. Maluku Utara,Kab. Pulau Morotai,,Maluku Utara
70011551,SMAIT BINA PEKERTI,https://sekolah.data.kemdikbud.go.id/index.php/Chome/profil/CD76C042-F49B-4094-BBB9-50AEE966CE4E,"Jl. Raya Leungsir, Kp. Rancagede RT.005 ... Munjul Kec. Solear Kab. Tangerang Prov. Banten",Kab. Tangerang,,Banten
10403241,SMAN 1 BANGKO,https://sekolah.data.kemdikbud.go.id/index.php/Chome/profil/887F5A20-0478-4038-B254-50B56F06C56A,JL. GEDUNG NASIONAL Bagan Barat Kec. Bangko Kab.  Rokan Hilir Prov. Riau,Kab.  Rokan Hilir,,Riau
20227823,SMA ASY-SYUJAIYYAH CIWIDEY,https://sekolah.data.kemdikbud.go.id/index.php/Chome/profil/EE016347-13E4-44AC-A1D2-50B6B01436E6,JL. CIWIDEY - SUKAWENING KM. 04 Sukawening Kec. Ciwidey Kab. Bandung Prov. Jawa Barat,Kab. Bandung,,Jawa Barat
10101189,SMA NEGERI 1 TANAH PASIR,https://sekolah.data.kemdikbud.go.id/index.php/Chome/profil/A56EA47B-E364-4399-9004-50B707614D58,JL. CUT NYAK ASIAH DESA KEUTAPANG Keutapang Kec. Tanah Pasir Kab. Aceh Utara Prov. Aceh,Kab. Aceh Utara,,Aceh
30405322,SMA NURUL YAQIN SEBULU,https://sekolah.data.kemdikbud.go.id/index.php/Chome/profil/20AFCED4-361E-40A0-B5B3-50BAD2312B52,JL. KARYAWAN RT.1 NO.01 Senoni Kec. Sebulu Kab. Kutai Kartanegara Prov. Kalimantan Timur,Kab. Kutai Kartanegara,,Kalimantan Timur
10807028,SMAS BUDAYA,https://sekolah.data.kemdikbud.go.id/index.php/Chome/profil/19C6C8AC-434F-456E-981B-50BBC3B1D4B9,JL.PENDIDIKAN NO.32 Sumber Rejo Kec. Kemiling Kota Bandar Lampung Prov. Lampung,,Kota Bandar Lampung,Lampung
20213895,SMAN 1 LIGUNG,https://sekolah.data.kemdikbud.go.id/index.php/Chome/profil/5BBBD328-0545-4FFC-90D5-50BC1F564451,JL. RAYA BARAT LIGUNG Ligung Kec. Ligung Kab. Majalengka Prov. Jawa Barat,Kab. Majalengka,,Jawa Barat
10104547,SMA NEGERI SERIBU BUKIT,https://sekolah.data.kemdikbud.go.id/index.php/Chome/profil/242B3FC2-A336-4691-8691-50C38CCCF298,JL. KUTAPANJANG-BLANGPEGAYON Cinta Maju Kec. Blang Pegayon Kab. Gayo Lues Prov. Aceh,Kab. Gayo Lues,,Aceh
20328867,SMA NEGERI 1 SEMARANG,https://sekolah.data.kemdikbud.go.id/index.php/Chome/profil/DDB5802F-54CD-48C8-8E8F-50C3EEF902B7,Jl. Taman Menteri Supeno No. 1 Mugassari Kec. Semarang Selatan Kota Semarang Prov. Jawa Tengah,,Kota Semarang,Jawa Tengah
10113429,SMA NEGERI 3 INDRAPURI,https://sekolah.data.kemdikbud.go.id/index.php/Chome/profil/7EEE16E0-B7DA-4DCD-A5B5-50C47C61AA62,Jln. Sultan Alaidin Mahmudsyah Km.2  Jru... Jruek Bak Kreh Kec. Indrapuri Kab. Aceh Besar Prov. Aceh,Kab. Aceh Besar,,Aceh
10209414,SMAS MELATI,https://sekolah.data.kemdikbud.go.id/index.php/Chome/profil/507098AC-E0E5-4C95-AD6D-50D3560163B3,JL. ISTANA DESA KOTA GALUH PERBAUNGAN Kota Galuh Kec. Perbaungan Kab. Serdang Bedagai Prov. Sumatera Utara,Kab. Serdang Bedagai,,Sumatera Utara
20212953,SMA NEGERI 1 CIDAHU,https://sekolah.data.kemdikbud.go.id/index.php/Chome/profil/21081FF1-6FD4-40D8-B357-50D8D6142E09,JL. KERTAWINANGUN NO. 09 Cidahu Kec. Cidahu Kab. Kuningan Prov. Jawa Barat,Kab. Kuningan,,Jawa Barat
20533614,SMAS PGRI 6,https://sekolah.data.kemdikbud.go.id/index.php/Chome/profil/16EF67F8-9D61-4DE2-9DBD-50DB79B2EE2D,JL. S. SUPRIADI 48 Bandungrejosari Kec. Sukun Kota Malang Prov. Jawa Timur,,Kota Malang,Jawa Timur
50305402,SMA KATOLIK TARUNA VIDYA,https://sekolah.data.kemdikbud.go.id/index.php/Chome/profil/5CC81E86-4F37-428B-AADA-50DCDF5851B1,JL. ANGGREK Kel. Paupire Kec. Ende Tengah Kab. Ende Prov. Nusa Tenggara Timur,Kab. Ende,,Nusa Tenggara Timur
20340879,SMA JENDRAL AHMAD YANI KARANGPUCUNG,https://sekolah.data.kemdikbud.go.id/index.php/Chome/profil/F45D1497-1689-485B-999D-50E206D25B08,JL. RAYA KARANGPUCUNG Karangpucung Kec. Karangpucung Kab. Cilacap Prov. Jawa Tengah,Kab. Cilacap,,Jawa Tengah
10605600,SMAS PGRI BABAT TOMAN,https://sekolah.data.kemdikbud.go.id/index.php/Chome/profil/6E3F564A-84AF-4C9C-8B72-50E263B72EF8,Jl. Gotong Royong Lk. IV Kel. Babat Babat Kec. Babat Toman Kab. Musi Banyuasin Prov. Sumatera Selatan,Kab. Musi Banyuasin,,Sumatera Selatan
69991334,SMA TAHFIDZUL QURAN ISLAM TERPADU SAHABAT CENDIKIA,https://sekolah.data.kemdikbud.go.id/index.php/Chome/profil/37DBD034-C4D2-425E-9D25-50E54569BC6C,Jl. Lareh Muhammad Ali No. 03 Ujung Batung Kec. Pariaman Tengah Kota Pariaman Prov. Sumatera Barat,,Kota Pariaman,Sumatera Barat
10107931,SMA NEGERI 3 UNGGUL SIGLI,https://sekolah.data.kemdikbud.go.id/index.php/Chome/profil/D2A4A36A-9655-4EC2-BAF7-50E88FD99D41,Jln.Lingkar Blang Paseh - Sigli Lampeudeu Baroh Kec. Pidie Kab. Pidie Prov. Aceh,Kab. Pidie,,Aceh
20603312,SMAN 5 Kota Tangerang Selatan,https://sekolah.data.kemdikbud.go.id/index.php/Chome/profil/961E8830-F787-49DC-8605-50EC57E0E8C5,PURI BINTARO HIJAU BLOK F IV Pondok Aren Kec. Pondok Aren Kota Tangerang Selatan Prov. Banten,,Kota Tangerang Selatan,Banten
69822787,SMAN 1 SULAMU,https://sekolah.data.kemdikbud.go.id/index.php/Chome/profil/C0B1897D-D0F4-4AED-A5BC-50EF8A148F14,SULAMU Sulamu Kec. Sulamu Kab. Kupang Prov. Nusa Tenggara Timur,Kab. Kupang,,Nusa Tenggara Timur
30312217,SMAS ITP TARJUN,https://sekolah.data.kemdikbud.go.id/index.php/Chome/profil/FFF6926A-2CBF-4056-B87C-50F09815D900,JL.KOMPLEK ITP TARJUN  P12 Tarjun Kec. Kelumpang Hilir Kab. Kotabaru Prov. Kalimantan Selatan,Kab. Kotabaru,,Kalimantan Selatan
10700677,SMAS XAVERIUS CURUP,https://sekolah.data.kemdikbud.go.id/index.php/Chome/profil/D52C8522-A383-4FCA-80B6-50F0F7E58CD4,JL..D.I.PANJAITAN NO. 17 Jalan Baru Kec. Curup Kab. Rejang Lebong Prov. Bengkulu,Kab. Rejang Lebong,,Bengkulu
69899309,SMA SANTO YOSEPH TANAH MERAH,https://sekolah.data.kemdikbud.go.id/index.php/Chome/profil/DF9FF3B3-F14B-40A6-9B5A-50F6CF9DFDE9,Jalan Trans Papua Km. 06 Tanah Merah - M... Persatuan Kec. Mandobo Kab. Boven Digoel Prov. Papua Selatan,Kab. Boven Digoel,,Papua Selatan
69979825,SMAN 14 SAROLANGUN,https://sekolah.data.kemdikbud.go.id/index.php/Chome/profil/1EC5A1FC-A832-4DB3-BF6A-50FCD294B620,Jln. Raya Bukit Bulan Desa Moenti Moenti Kec. Limun Kab. Sarolangun Prov. Jambi,Kab. Sarolangun,,Jambi
60101437,SMA Negeri 2 Maluku Barat Daya,https://sekolah.data.kemdikbud.go.id/index.php/Chome/profil/C2A0F89E-B958-4022-A69B-51017F8C6CF6,JL. ERMUALY WULUR Kec. Damer Kab. Maluku Barat Daya Prov. Maluku,Kab. Maluku Barat Daya,,Maluku
10107096,SMA NEGERI 1 SIMPANG MAMPLAM,https://sekolah.data.kemdikbud.go.id/index.php/Chome/profil/98257CCD-C81E-4F4C-889E-510246B869A7,Jln. Banda Aceh-Medan Km.183 Simpang Mam... Blang Teumulek Kec. Simpang Mamplam Kab. Bireuen Prov. Aceh,Kab. Bireuen,,Aceh
69987800,SMA RIYADUL ULUM,https://sekolah.data.kemdikbud.go.id/index.php/Chome/profil/7091CB08-AEA8-4B07-B00A-510619219C99,Jl. Majapahit No.01 Sukoharjo Kec. Abung Surakarta Kab. Lampung Utara Prov. Lampung,Kab. Lampung Utara,,Lampung
70014909,SMA AT-TIBYAN,https://sekolah.data.kemdikbud.go.id/index.php/Chome/profil/50207643-D89A-4930-840D-510934FF5F1F,Jl. Surabaya-Malang km 42 dusun Arcopodo Kepulungan Kec. Gempol Kab. Pasuruan Prov. Jawa Timur,Kab. Pasuruan,,Jawa Timur
20562214,SMAS ISLAM ZAINUL HIKAM,https://sekolah.data.kemdikbud.go.id/index.php/Chome/profil/4EA0E148-127D-451A-A5DB-510FAFB86F76,JL.PAHLAWAN II No.86 Leces Kec. Leces Kab. Probolinggo Prov. Jawa Timur,Kab. Probolinggo,,Jawa Timur
10204055,SMAN 1 TANJUNG BALAI,https://sekolah.data.kemdikbud.go.id/index.php/Chome/profil/430284D1-90EB-424F-AC39-511811DD519C,JL. SYECH ISMAIL ABD. WAHAB Bagan Asahan Kec. Tanjung Balai Kab. Asahan Prov. Sumatera Utara,Kab. Asahan,,Sumatera Utara
60403781,SMA NEGERI 3 RAJA AMPAT,https://sekolah.data.kemdikbud.go.id/index.php/Chome/profil/EF06966A-BA3B-42EA-82E2-511A5E4A5B53,KAMPUNG DEER Deer Kec. Kofiau Kab. Raja Ampat Prov. Papua Barat Daya,Kab. Raja Ampat,,Papua Barat Daya
40203875,SMAN 9 PALU,https://sekolah.data.kemdikbud.go.id/index.php/Chome/profil/08BED9B5-0E2A-43C1-A837-511E01168A75,JL HI. PATILA Kelurahan Pantoloan Kec. Tawaeli Kota Palu Prov. Sulawesi Tengah,,Kota Palu,Sulawesi Tengah
50101706,SMA Negeri 1 Kuta Selatan,https://sekolah.data.kemdikbud.go.id/index.php/Chome/profil/EE05ED84-AD08-4061-B52A-511F1EA31B1A,JL. KETUT JETUNG Kutuh Kec. Kuta Selatan Kab. Badung Prov. Bali,Kab. Badung,,Bali
20511962,SMA PSM PLEMAHAN KEDIRI,https://sekolah.data.kemdikbud.go.id/index.php/Chome/profil/27DAE2FC-3A4F-468A-8027-5122CA13B69C,JL. BLK  Ds. Kayen Lor Kec. Plemahan Kayen Lor Kec. Plemahan Kab. Kediri Prov. Jawa Timur,Kab. Kediri,,Jawa Timur
10261473,SMAS GLOBAL PRIMA,https://sekolah.data.kemdikbud.go.id/index.php/Chome/profil/956EB396-7900-498E-BB27-5127C55D1344,Jl. Brigjen Katamso No. 282-283 Medan Sei Mati Kec. Medan Maimun Kota Medan Prov. Sumatera Utara,,Kota Medan,Sumatera Utara
20101322,SMAS PELITA 2,https://sekolah.data.kemdikbud.go.id/index.php/Chome/profil/97C7A3BD-9E80-43C5-B88A-512D16195916,JL. MACAN NO.23-29 DAAN MOGOT Duri Kepa Kec. Kebon Jeruk Kota Adm. Jakarta Barat Prov. D.K.I. Jakarta,,Kota Adm. Jakarta Barat,D.K.I. Jakarta
30311505,SMAN 1 SAMPANAHAN,https://sekolah.data.kemdikbud.go.id/index.php/Chome/profil/D695DD84-C1F2-4AC4-A806-513079411D80,JL. BUMBU RAYA Sampanahan Kec. Sampanahan Kab. Kotabaru Prov. Kalimantan Selatan,Kab. Kotabaru,,Kalimantan Selatan
20229165,SMAS MUHAMMADIYAH SAWANGAN,https://sekolah.data.kemdikbud.go.id/index.php/Chome/profil/4B612365-D489-4507-9153-51313DE3E1C9,JL. ABDUL WAHAB NO. 19 Sawangan Lama Kec. Sawangan Kota Depok Prov. Jawa Barat,,Kota Depok,Jawa Barat
20208425,SMAS PGRI SITURAJA,https://sekolah.data.kemdikbud.go.id/index.php/Chome/profil/81EA6939-FE1E-4950-8B15-513A39C895CC,JL. SAWAH MENAK - JATIMEKAR -  SITURAJA ... Jatimekar Kec. Situraja Kab. Sumedang Prov. Jawa Barat,Kab. Sumedang,,Jawa Barat
69788581,SMAN 2 SINGAPARNA,https://sekolah.data.kemdikbud.go.id/index.php/Chome/profil/832854DE-9E84-4B28-BD35-513D7DD9C9DA,Kp. PAMEUNGPEUK RT 03 RW 06 Cikunir Kec. Singaparna Kab. Tasikmalaya Prov. Jawa Barat,Kab. Tasikmalaya,,Jawa Barat
60102238,SMAS AL - HILAAL TEHORU,https://sekolah.data.kemdikbud.go.id/index.php/Chome/profil/2DF8971E-CF11-41C4-A4F7-514B952858CC,JLN.NUNUMAHU Tehoru Kec. Tehoru Kab. Maluku Tengah Prov. Maluku,Kab. Maluku Tengah,,Maluku
30400325,SMA NEGERI 2 LOA JANAN,https://sekolah.data.kemdikbud.go.id/index.php/Chome/profil/C5FDCD3A-64ED-4EE7-A716-5156A1E165EC,JL. EX. PT. CITA Bakungan Kec. Loa Janan Kab. Kutai Kartanegara Prov. Kalimantan Timur,Kab. Kutai Kartanegara,,Kalimantan Timur
20306176,SMA NEGERI 2 PURWOREJO,https://sekolah.data.kemdikbud.go.id/index.php/Chome/profil/718431DC-126A-4DD1-96F4-515A2E00DDDF,JL.May.Jend. S.Parman Kutoarjo Kabupaten... Bandung Kec. Kutoarjo Kab. Purworejo Prov. Jawa Tengah,Kab. Purworejo,,Jawa Tengah
30107642,SMAN 1 TAYAN HULU,https://sekolah.data.kemdikbud.go.id/index.php/Chome/profil/59A110C9-98FF-4545-B3EA-51620F09DF07,JL. RAYA SOSOK-TAYAN Menyabo Kec. Tayan Hulu Kab. Sanggau Prov. Kalimantan Barat,Kab. Sanggau,,Kalimantan Barat
40500913,SMAN 1 BONEPANTAI,https://sekolah.data.kemdikbud.go.id/index.php/Chome/profil/853766BC-2A6A-45C3-9AB9-5163039FC20B,JL. SISWA NO. 25 Bilungala Utara Kec. Bonepantai Kab. Bone Bolango Prov. Gorontalo,Kab. Bone Bolango,,Gorontalo
10104039,SMA NEGERI 1 SINGKIL,https://sekolah.data.kemdikbud.go.id/index.php/Chome/profil/2D7F023F-67B2-423E-BE42-516E01C0A157,JL. UTAMA NO. 2 PULO SAROK Kec. Singkil Kab. Aceh Singkil Prov. Aceh,Kab. Aceh Singkil,,Aceh
10500219,SMAN 4 BATANG HARI,https://sekolah.data.kemdikbud.go.id/index.php/Chome/profil/1C096191-5F7C-4D44-AF64-5172D5D84B08,JL. JAMBI  - MA .BUNGO Pematang Gadung Kec. Mersam Kab. Batanghari Prov. Jambi,Kab. Batanghari,,Jambi
60303065,SMAN WAREN,https://sekolah.data.kemdikbud.go.id/index.php/Chome/profil/F8ECE353-8D33-4761-959D-5173295E218D,DESA URI Uri Kec. Waropen Bawah Kab. Waropen Prov. Papua,Kab. Waropen,,Papua
20615027,SMAS BINA MACHMUD,https://sekolah.data.kemdikbud.go.id/index.php/Chome/profil/CD725BD9-4416-41DC-80B7-5174BE58C31E,KP. KADUKACAPI Tanjungsari Kec. Pabuaran Kab. Serang Prov. Banten,Kab. Serang,,Banten
10814031,SMAS MUHAMMADIYAH 1 SRIBHAWONO,https://sekolah.data.kemdikbud.go.id/index.php/Chome/profil/D9786441-0F87-4284-8DCC-5177AA0D69D2,JL. KH. A  DAHLAN NO. 4 Sri Menanti Kec. Bandar Sribhawono Kab. Lampung Timur Prov. Lampung,Kab. Lampung Timur,,Lampung
70040605,SMA ISLAM AN-NAJWA KHATULISTIWA,https://sekolah.data.kemdikbud.go.id/index.php/Chome/profil/3D71B21F-1031-4598-A9C9-51791D1E47E1,"Jl. Sungai Raya Dalam, Srikandi II, Pari... SUNGAI RAYA DALAM Kec. Sungai Raya Kab. Kubu Raya Prov. Kalimantan Barat",Kab. Kubu Raya,,Kalimantan Barat
20326487,SMAN 1 BANTARKAWUNG,https://sekolah.data.kemdikbud.go.id/index.php/Chome/profil/96E1804B-6A40-4166-B3DA-517C5BB9E95A,JL. RAYA BANTARKAWUNG NO. 15 Pangebatan Kec. Bantarkawung Kab. Brebes Prov. Jawa Tengah,Kab. Brebes,,Jawa Tengah
69954846,UPTD SMAN 1 TABULAHAN,https://sekolah.data.kemdikbud.go.id/index.php/Chome/profil/56C4A9E8-881E-411B-8BFE-5180B63C5DBC,Jl. Poros Lakahang Utama Lakahang Utama Kec. Tabulahan Kab. Mamasa Prov. Sulawesi Barat,Kab. Mamasa,,Sulawesi Barat
69799876,SMA NEGERI 3 SAMPOLAWA,https://sekolah.data.kemdikbud.go.id/index.php/Chome/profil/72CAF6E6-3F85-4EE3-820D-5181ECB28AFD,"JLN. POROS BAHARI , DESA BAHARI Bahari Kec. Sampolawa Kab. Buton Selatan Prov. Sulawesi Tenggara",Kab. Buton Selatan,,Sulawesi Tenggara
20310421,SMA NEGERI 3 SUKOHARJO,https://sekolah.data.kemdikbud.go.id/index.php/Chome/profil/F00028AA-12C7-4496-8714-518976B69712,JL. JEND. SUDIRMAN NO. 197 Jombor Kec. Bendosari Kab. Sukoharjo Prov. Jawa Tengah,Kab. Sukoharjo,,Jawa Tengah
20505054,SMA MIGAS SENORI,https://sekolah.data.kemdikbud.go.id/index.php/Chome/profil/076C2F5D-327C-4396-852B-518B14D24643,Jl. Raya Pertamina Desa Banyuurip Kec. S... Banyuurip Kec. Senori Kab. Tuban Prov. Jawa Timur,Kab. Tuban,,Jawa Timur
69954464,SMAS IT TAHFIDZ AL IMAN,https://sekolah.data.kemdikbud.go.id/index.php/Chome/profil/8790A7A7-7281-46E1-AC1C-518F23B3A1D3,Dusun Genengan RT. 01 RW. 15 Banjaragung Kec. Puri Kab. Mojokerto Prov. Jawa Timur,Kab. Mojokerto,,Jawa Timur
69947931,SMA ISLAM PLUS HIDAYATUT THULLAB,https://sekolah.data.kemdikbud.go.id/index.php/Chome/profil/90297048-5A8B-484C-A20C-5191B370A619,Dsn. Petuk Kec. Semen Kab. Kediri Puhrubuh Kec. Semen Kab. Kediri Prov. Jawa Timur,Kab. Kediri,,Jawa Timur
50205597,SMA NEGERI 1 SETELUK,https://sekolah.data.kemdikbud.go.id/index.php/Chome/profil/D02C55BA-C8A9-4E4D-B85E-5193CB4FDAF0,JL. A. YANI NO. 50 SETELUK Seteluk Tengah Kec. Seteluk Kab. Sumbawa Barat Prov. Nusa Tenggara Barat,Kab. Sumbawa Barat,,Nusa Tenggara Barat
20308615,SMA NEGERI 1 KLEGO,https://sekolah.data.kemdikbud.go.id/index.php/Chome/profil/9B7FD948-95C5-4EF3-BBBF-5198E48064FC,Desa Jaten Kec. Klego Boyolali Kode Pos ... Jaten Kec. Klego Kab. Boyolali Prov. Jawa Tengah,Kab. Boyolali,,Jawa Tengah
20200587,SMAN 1 JASINGA,https://sekolah.data.kemdikbud.go.id/index.php/Chome/profil/B4BC18A1-7564-492F-AE77-519D01F82558,JL. SUKAMANAH NO. 3 RT. 04/02 Setu Kec. Jasinga Kab. Bogor Prov. Jawa Barat,Kab. Bogor,,Jawa Barat
10110349,SMAN 1 LAWE BULAN,https://sekolah.data.kemdikbud.go.id/index.php/Chome/profil/FB168FAB-A7EC-4821-A5DB-51A0C28A0EB2,JL. MANUNGGAL Kuta Bantil Kec. Lawe Bulan Kab. Aceh Tenggara Prov. Aceh,Kab. Aceh Tenggara,,Aceh
20600452,SMAN 10 PANDEGLANG,https://sekolah.data.kemdikbud.go.id/index.php/Chome/profil/AE241018-A9D4-4AFD-848A-51A10777FF81,JL. RAYA. LABUAN KM. 24 Pasireurih Kec. Cisata Kab. Pandeglang Prov. Banten,Kab. Pandeglang,,Banten
20209377,SMAS BAITUL HIKMAH TAROGONG KALER,https://sekolah.data.kemdikbud.go.id/index.php/Chome/profil/862EA051-D55B-4176-94ED-51B66B13D0E6,JL. OTTO ISKANDARDINATA NO.66 Langensari Kec. Tarogong Kaler Kab. Garut Prov. Jawa Barat,Kab. Garut,,Jawa Barat
20229153,SMAS ISLAM AN NIZHOMIYAH,https://sekolah.data.kemdikbud.go.id/index.php/Chome/profil/D3010902-98E8-4A85-90FA-51B9F3AF3D0B,JL. MADRASAH NO. 14 Kalibaru Kec. Cilodong Kota Depok Prov. Jawa Barat,,Kota Depok,Jawa Barat
10113240,SMA NEGERI 1 SUKA MAKMUE,https://sekolah.data.kemdikbud.go.id/index.php/Chome/profil/30D20F2E-DA5F-48D7-9C57-51BC7E3B60AA,JL. TGK PUTIK KOMPLEK PERKANTORAN SUKA M... Cot Kuta Kec. Suka Makmue Kab. Nagan Raya Prov. Aceh,Kab. Nagan Raya,,Aceh
50309283,SMAN 3 POCO RANAKA,https://sekolah.data.kemdikbud.go.id/index.php/Chome/profil/F9FB8B75-9E92-40B4-85DE-51C0CA93AE21,PANDANG Arus Kec. Lamba Leda Timur (Poco Ranaka Timur) Kab. Manggarai Timur Prov. Nusa Tenggara Timur,Kab. Manggarai Timur,,Nusa Tenggara Timur
69761959,SMAS DCC GLOBAL SCHOOL,https://sekolah.data.kemdikbud.go.id/index.php/Chome/profil/A9AB095C-ED04-4371-9AD0-51C0CB07EDDA,JL. PAGAR ALAM - MATA INTAN Segala Mider  Kec. Tanjung Karang Barat Kota Bandar Lampung Prov. Lampung,,Kota Bandar Lampung,Lampung
50102094,SMAN 1 TEGALLALANG,https://sekolah.data.kemdikbud.go.id/index.php/Chome/profil/32D34B5D-BB0C-4DF6-842E-51C21FAA01B6,"JL. I WAYAN LUNGA, TEGALLALANG Tegallalang Kec. Tegallalang Kab. Gianyar Prov. Bali",Kab. Gianyar,,Bali
20247157,SMAS AL FARDIYATUSSAADAH,https://sekolah.data.kemdikbud.go.id/index.php/Chome/profil/969CF47D-EC78-481E-BF55-51C6DA1096F0,Jalan Swadaya Nomor 1 Citepus RT 02/14 Citepus Kec. Pelabuhan Ratu Kab. Sukabumi Prov. Jawa Barat,Kab. Sukabumi,,Jawa Barat
10303905,SMAN 2 PAYAKUMBUH,https://sekolah.data.kemdikbud.go.id/index.php/Chome/profil/8C062DF9-768C-461D-877C-51C7891A3724,JL. MERANTI NO. 20 BUKIT SITABUR PADANG TANGAH PAYOBADA Kec. Payakumbuh Timur Kota Payakumbuh Prov. Sumatera Barat,,Kota Payakumbuh,Sumatera Barat
10210802,SMAS BINA BERSAUDARA,https://sekolah.data.kemdikbud.go.id/index.php/Chome/profil/C99869F2-DBFC-4B59-A377-51C96437E027,"JL. B. KATAMSO, T.KUNING NO. 43 Titi Kuning Kec. Medan Johor Kota Medan Prov. Sumatera Utara",,Kota Medan,Sumatera Utara
69947401,SMA ASSALAM,https://sekolah.data.kemdikbud.go.id/index.php/Chome/profil/18B8FAD9-A4DF-4572-82C2-51CAD6092067,Nglarangan Sidoagung Kec. Tempuran Kab. Magelang Prov. Jawa Tengah,Kab. Magelang,,Jawa Tengah
10100188,SMA NEGERI 1 SEULIMEUM,https://sekolah.data.kemdikbud.go.id/index.php/Chome/profil/96181B38-6A71-46E9-87B2-51CF640D4568,JL. BANDA ACEH-MEDAN KM. 41 Seuneubok Kec. Seulimeum Kab. Aceh Besar Prov. Aceh,Kab. Aceh Besar,,Aceh
30105462,SMAS SANTO IGNASIUS SINGKAWANG,https://sekolah.data.kemdikbud.go.id/index.php/Chome/profil/EC648330-834B-487C-8161-51D2864D5C5E,JL. S.M. TSJAFIOEDDIN SINGKAWANG Pasiran Kec. Singkawang Barat Kota Singkawang Prov. Kalimantan Barat,,Kota Singkawang,Kalimantan Barat
20219776,SMAS PLUS AL GHIFARI BANDUNG,https://sekolah.data.kemdikbud.go.id/index.php/Chome/profil/70F039B8-C453-4B06-8F25-51D3830B75F7,JL. INSPEKSI PENGAIRAN N0.23 RT 04 RW 03 Cisaranten Kulon Kec. Arcamanik Kota Bandung Prov. Jawa Barat,,Kota Bandung,Jawa Barat
20103279,SMAN 9 JAKARTA,https://sekolah.data.kemdikbud.go.id/index.php/Chome/profil/12B1D8B9-35D8-4E64-99C7-51D41F61D63A,Jl. SMU 9 Halim Perdana Kusuma RT. 013/0... Kebon Pala Kec. Makasar Kota Adm. Jakarta Timur Prov. D.K.I. Jakarta,,Kota Adm. Jakarta Timur,D.K.I. Jakarta
10310901,SMAN 2 SUTERA,https://sekolah.data.kemdikbud.go.id/index.php/Chome/profil/F0C130D4-942A-4BDD-9292-51D46FF9C273,KAMPUNG PADANG TAE NAGARI AMPING PARAK AMPING PARAK Kec. Sutera Kab. Pesisir Selatan Prov. Sumatera Barat,Kab. Pesisir Selatan,,Sumatera Barat
20101629,SMAS 5 YADIKA,https://sekolah.data.kemdikbud.go.id/index.php/Chome/profil/9EE05080-BCA1-4A78-AD7F-51EAFEC549BE,JL. JOGLO RAYA NO. 190 Joglo Kec. Kembangan Kota Adm. Jakarta Barat Prov. D.K.I. Jakarta,,Kota Adm. Jakarta Barat,D.K.I. Jakarta
30304468,SMAS KRISTEN KANAAN,https://sekolah.data.kemdikbud.go.id/index.php/Chome/profil/6848601E-19D0-4C99-A2C8-51EC812411FC,JL. KP. TENDEAN NO 50 Gadang Kec. Banjarmasin Tengah Kota Banjarmasin Prov. Kalimantan Selatan,,Kota Banjarmasin,Kalimantan Selatan
69852845,SMA NEGERI 4 TANAH SIANG,https://sekolah.data.kemdikbud.go.id/index.php/Chome/profil/69B3CC67-EC2B-425E-A416-51F0D80ED35F,Desa Dirung Bakung Kec.Tanah Siang Dirung Bakung Kec. Tanah Siang Kab. Murung Raya Prov. Kalimantan Tengah,Kab. Murung Raya,,Kalimantan Tengah
70055707,SMA IT ANOEGERAH AL HAFIDZHAH,https://sekolah.data.kemdikbud.go.id/index.php/Chome/profil/88114F62-5C80-4D62-8CC4-51F731A89593,Jalan Maccini Baji Belakang Pasar Sentra... Empoang Kec. Binamu Kab. Jeneponto Prov. Sulawesi Selatan,Kab. Jeneponto,,Sulawesi Selatan
70039765,SMA NEGERI 1 PADANGGUNI,https://sekolah.data.kemdikbud.go.id/index.php/Chome/profil/0C657C29-BBA0-4501-92B4-51F81005009F,Jl. Poros Alosika No.10 Mekar Jaya Kec. Padangguni Kab. Konawe Prov. Sulawesi Tenggara,Kab. Konawe,,Sulawesi Tenggara
69965180,SMAS Darul Ilmi Sampoang,https://sekolah.data.kemdikbud.go.id/index.php/Chome/profil/D3E24955-B89E-46D3-A5A0-51F936ED0CDD,JL. Poros - Mamuju-Pammulukang Kel. Siny... Sinyonyoi Kec. Kalukku Kab. Mamuju Prov. Sulawesi Barat,Kab. Mamuju,,Sulawesi Barat
70036796,SMA NEGERI TUPAN,https://sekolah.data.kemdikbud.go.id/index.php/Chome/profil/ACD38D46-FB82-4FBF-9D1D-51F93A7ED971,Jl. Sufa Neonane Tuppan Kec. BatuPutih Kab. Timor Tengah Selatan Prov. Nusa Tenggara Timur,Kab. Timor Tengah Selatan,,Nusa Tenggara Timur
20224110,SMA KARTIKA XIX-4,https://sekolah.data.kemdikbud.go.id/index.php/Chome/profil/0DDA7908-CB9F-4181-8948-5201A2104034,JL. DR. SAM RATULANGI D-26 Baros Kec. Cimahi Tengah Kota Cimahi Prov. Jawa Barat,,Kota Cimahi,Jawa Barat
69864668,SMA ISLAM TERPADU AL MAWADDAH WARRAHMAH KOLAKA,https://sekolah.data.kemdikbud.go.id/index.php/Chome/profil/1CDDD87B-C7B7-41EB-904B-5202284262F4,"Jalan Pondok Pesantren, No. 10. Lamokato Kec. Kolaka Kab. Kolaka Prov. Sulawesi Tenggara",Kab. Kolaka,,Sulawesi Tenggara
20501784,SMAN 1 KRIAN,https://sekolah.data.kemdikbud.go.id/index.php/Chome/profil/ED0E8D51-65AE-4D2B-A9AE-5204937ABFAC,JL. SUNANDAR PS NO.  5 Kraton Kec. Krian Kab. Sidoarjo Prov. Jawa Timur,Kab. Sidoarjo,,Jawa Timur
50204515,SMAN 5 MATARAM,https://sekolah.data.kemdikbud.go.id/index.php/Chome/profil/3737FB68-C9EB-4493-8E2F-520EB2B25F3E,JL. UDAYANA NO. 2A MATARAM Mataram Barat Kec. Selaparang Kota Mataram Prov. Nusa Tenggara Barat,,Kota Mataram,Nusa Tenggara Barat
20605093,SMAN 1 KOTA SERANG,https://sekolah.data.kemdikbud.go.id/index.php/Chome/profil/C7A8FA4D-B806-4508-BABE-520F750BE529,JL. A. YANI NO. 39 SERANG Cimuncang Kec. Serang Kota Serang Prov. Banten,,Kota Serang,Banten
50305263,SMAS TELADAN,https://sekolah.data.kemdikbud.go.id/index.php/Chome/profil/4B623015-394A-403A-9B14-5220380312ED,JL. HTI Maulafa Kec. Maulafa Kota Kupang Prov. Nusa Tenggara Timur,,Kota Kupang,Nusa Tenggara Timur
20403143,SMAS KATOLIK SANG TIMUR,https://sekolah.data.kemdikbud.go.id/index.php/Chome/profil/5F0AE181-3EA3-450B-85D3-52248B84AA8A,JL. BATIKAN 7 Pandeyan Kec. Umbulharjo Kota Yogyakarta Prov. D.I. Yogyakarta,,Kota Yogyakarta,D.I. Yogyakarta
40202041,SMA Negeri 2 BIAU,https://sekolah.data.kemdikbud.go.id/index.php/Chome/profil/2C8E5EBF-9211-48E6-B5D7-522BB9FDB5BC,JL. M.A. Turungku 76 Kali Kec. Biau Kab. Buol Prov. Sulawesi Tengah,Kab. Buol,,Sulawesi Tengah
70011254,SMA NEGERI 3 TOBOALI,https://sekolah.data.kemdikbud.go.id/index.php/Chome/profil/C6A0522B-E94C-4AA6-8584-522FD22A57B5,"Jl. Raya Jeriji, Desa Jeriji, Kecamatan ... Jeriji Toboali Kab. Bangka Selatan Prov. Kepulauan Bangka Belitung",Kab. Bangka Selatan,,Kepulauan Bangka Belitung
10210866,SMAS MEDAN PUTRI,https://sekolah.data.kemdikbud.go.id/index.php/Chome/profil/A0BD1D7D-F8A6-4888-9EC7-522FE41B5559,JL. TIMOR UJUNG NO.5 MEDAN Gaharu Kec. Medan Timur Kota Medan Prov. Sumatera Utara,,Kota Medan,Sumatera Utara
69896679,SMA NEGERI 1 SAWO,https://sekolah.data.kemdikbud.go.id/index.php/Chome/profil/08C7EC77-D88D-46BA-B61A-523000806827,DESA SAWO Sawo Kec. Sawo Kab. Nias Utara Prov. Sumatera Utara,Kab. Nias Utara,,Sumatera Utara
20231308,SMAS KORNITA,https://sekolah.data.kemdikbud.go.id/index.php/Chome/profil/23DE595C-0D61-40B1-8C69-52302FE280FF,"JL. TANJUNG KAMPUS IPB BOGOR, DESA BABAK... Babakan Kec. Dramaga Kab. Bogor Prov. Jawa Barat",Kab. Bogor,,Jawa Barat
70011522,SMA IT AL-BURHANY,https://sekolah.data.kemdikbud.go.id/index.php/Chome/profil/7B4D1928-A67A-47CF-A585-5234293EBE6A,Komplek Pondok Pesantren Assalafiyyah Bode Lor Kec. Plumbon Kab. Cirebon Prov. Jawa Barat,Kab. Cirebon,,Jawa Barat
20514347,SMAN 1 SRENGAT,https://sekolah.data.kemdikbud.go.id/index.php/Chome/profil/B2A781B7-42E3-49CA-AEB4-5239304A9A30,JL. MERDEKA BAGELENAN SRENGAT Bagelenan Kec. Srengat Kab. Blitar Prov. Jawa Timur,Kab. Blitar,,Jawa Timur
70012486,SMA IT MAHAD RABBANI 2 KOTA BENGKULU,https://sekolah.data.kemdikbud.go.id/index.php/Chome/profil/5500CE24-7502-4DFD-8489-52454C8E1530,Jalan Rafflesia Regency Bentiring Kec. Muara Bangkahulu Kota Bengkulu Prov. Bengkulu,,Kota Bengkulu,Bengkulu
20227909,SMAN 1 SINDANGKERTA,https://sekolah.data.kemdikbud.go.id/index.php/Chome/profil/E9D9586F-4F37-4374-B427-524BFB932F50,"Jl. Raya Puncaksari, Kec. Sindangkerta Puncaksari Kec. Sindangkerta Kab. Bandung Barat Prov. Jawa Barat",Kab. Bandung Barat,,Jawa Barat
69945702,SMA SWASTA PERINTIS TEBAS,https://sekolah.data.kemdikbud.go.id/index.php/Chome/profil/BD8B03E7-F623-4D79-800E-524C58BAACE1,"JL. RAYA TEBAS, DESA MEKAR SEKUNTUM, DUS... Mekar Sekuntum Kec. Tebas Kab. Sambas Prov. Kalimantan Barat",Kab. Sambas,,Kalimantan Barat
69950236,UPTD SMA NEGERI 1 TUBBI TARAMANU,https://sekolah.data.kemdikbud.go.id/index.php/Chome/profil/CEEA4BE5-5294-43AF-9808-5259730353B6,Padang Mawalle Taramanu Kec. Tubbitaramanu Kab. Polewali Mandar Prov. Sulawesi Barat,Kab. Polewali Mandar,,Sulawesi Barat
