kode,nama,link_profil,alamat,kabupaten,kota,provinsi
70037914,SMA ISLAM TAHFIZHUL QURAN,https://sekolah.data.kemdikbud.go.id/index.php/Chome/profil/6BE2FD16-6E49-4A88-98A5-D90A8BB68CC5,"Jl. Suka Mulia, Komplek Grand Silva Reci... Sungai Jawi Kec. Pontianak Kota Kota Pontianak Prov. Kalimantan Barat",,Kota Pontianak,Kalimantan Barat
69990885,SMA AL QUR AN DARUL MUTTAQIN,https://sekolah.data.kemdikbud.go.id/index.php/Chome/profil/408D329B-2A5D-4CE3-8935-D917CA931007,Desa Karang Melati RT. 007 RW. 004 Karang Melati Kec. Semendawai Timur Kab. Ogan Komering Ulu Timur Prov. Sumatera Selatan,Kab. Ogan Komering Ulu Timur,,Sumatera Selatan
10809706,SMAN 17 BANDAR LAMPUNG,https://sekolah.data.kemdikbud.go.id/index.php/Chome/profil/E50E6016-C21D-4D86-BC7A-D926C410616A,JL.SOEKARNO HATTA Pidada Kec. Panjang Kota Bandar Lampung Prov. Lampung,,Kota Bandar Lampung,Lampung
69946152,SMA MULTAZAM IBS,https://sekolah.data.kemdikbud.go.id/index.php/Chome/profil/8316C4C6-B8B2-476D-8935-D92BE1D6B70D,Griya Payung Indah No. A3 Pudakpayung Kec. Banyumanik Kota Semarang Prov. Jawa Tengah,,Kota Semarang,Jawa Tengah
20506305,SMA KHOZAINUL ULUM KALITENGAH,https://sekolah.data.kemdikbud.go.id/index.php/Chome/profil/B63EE747-285F-4524-BB6C-D92C1592FABF,JL. BOJOASRI RT.02/RW.01  DESA BOJOASRI Bojoasri Kec. Kalitengah Kab. Lamongan Prov. Jawa Timur,Kab. Lamongan,,Jawa Timur
69915812,SMAN 3 CIKAMPEK,https://sekolah.data.kemdikbud.go.id/index.php/Chome/profil/9DB1F553-417A-4F66-B4FE-D93F5926A11E,Jl. Sumur Bandung Kaler No 165 RT. 003/0... Dawuan Timur Kec. Cikampek Kab. Karawang Prov. Jawa Barat,Kab. Karawang,,Jawa Barat
40404059,SMA NEGERI 04 BOMBANA,https://sekolah.data.kemdikbud.go.id/index.php/Chome/profil/327EDDB5-366A-4E84-BB96-D9417757B0CC,JL. KI HAJAR DEWANTARA Bambaea Kec. Poleang Timur Kab. Bombana Prov. Sulawesi Tenggara,Kab. Bombana,,Sulawesi Tenggara
50306157,SMA NEGERI 1 TITEHENA,https://sekolah.data.kemdikbud.go.id/index.php/Chome/profil/4441C131-B5D9-4AA8-962D-D947DD744694,Jln.Raya Larantuka-Maumere Lewolaga Kec. Titehena Kab. Flores Timur Prov. Nusa Tenggara Timur,Kab. Flores Timur,,Nusa Tenggara Timur
69883634,SMA PLUS AT-TAQWA,https://sekolah.data.kemdikbud.go.id/index.php/Chome/profil/C8F934EF-8D5E-474A-A157-D94861A3BFFB,KOMPLEK BTN GRIYA BINONG INDAH BLOK F RT... Cibinong Hilir Kec. Cilaku Kab. Cianjur Prov. Jawa Barat,Kab. Cianjur,,Jawa Barat
40200735,SMAN 2 DAMPELAS,https://sekolah.data.kemdikbud.go.id/index.php/Chome/profil/5A7DB127-575A-4681-B9ED-D94986C89B17,JL. KATIDALE NO. 4 RERANG Kec. Dampelas Kab. Donggala Prov. Sulawesi Tengah,Kab. Donggala,,Sulawesi Tengah
10302787,SMAN 8 SIJUNJUNG,https://sekolah.data.kemdikbud.go.id/index.php/Chome/profil/ACC5E6E9-7792-457B-93B7-D951273232F1,JL.MONUMEN TANJUNG BONAI AUR TANJUNG BONAI AUR Kec. Sumpur Kudus Kab. Sijunjung Prov. Sumatera Barat,Kab. Sijunjung,,Sumatera Barat
30102992,SMAN 2 PUTUSSIBAU,https://sekolah.data.kemdikbud.go.id/index.php/Chome/profil/F2F21CF2-1937-4974-8AA3-D951CE3F8ABB,JL. TANI 1 NO.39 B RT.20/RW.04 Kedamin Hilir Kec. Putussibau Selatan Kab. Kapuas Hulu Prov. Kalimantan Barat,Kab. Kapuas Hulu,,Kalimantan Barat
69899770,SMA S TARUNA AL-MUNIR,https://sekolah.data.kemdikbud.go.id/index.php/Chome/profil/0BE07D7B-DB6A-4308-A92A-D9527954E784,LEMBAH BINUANG AUA KUNIANG Kec. Pasaman Kab. Pasaman Barat Prov. Sumatera Barat,Kab. Pasaman Barat,,Sumatera Barat
50205609,SMAN 1 WERA,https://sekolah.data.kemdikbud.go.id/index.php/Chome/profil/128348C5-430C-498D-8325-D9584D026CA6,JLN. RAYA TAWALI WERA BIMA Tawali Kec. Wera Kab. Bima Prov. Nusa Tenggara Barat,Kab. Bima,,Nusa Tenggara Barat
20606296,SMAS AL KHAIRIYAH 3,https://sekolah.data.kemdikbud.go.id/index.php/Chome/profil/518EA9DE-2AEA-48AA-A91E-D958C3241460,JL. H. ENGGUS ARJA CITANGKIL Citangkil Kec. Citangkil Kota Cilegon Prov. Banten,,Kota Cilegon,Banten
20542505,SMA NEGERI 1 BENDUNGAN,https://sekolah.data.kemdikbud.go.id/index.php/Chome/profil/3238FB93-634D-4DED-BF1E-D9698B0A7BFF,JL. RAYA TRENGGALEK - BENDUNGAN KM. 12 Sumurup Kec. Bendungan Kab. Trenggalek Prov. Jawa Timur,Kab. Trenggalek,,Jawa Timur
40501649,SMAN 1 RANDANGAN,https://sekolah.data.kemdikbud.go.id/index.php/Chome/profil/3BC45301-A712-4874-8D42-D96CB9F143B0,"Jl. Trans Sulawesi, Desa Motolohu Motolohu Kec. Randangan Kab. Pohuwato Prov. Gorontalo",Kab. Pohuwato,,Gorontalo
40403136,SMAN 9 KENDARI,https://sekolah.data.kemdikbud.go.id/index.php/Chome/profil/798F2B14-8173-416F-A784-D97316C2A596,JL. DIPONEGORO NO. 108 Punggaloba Kec. Kendari Barat Kota Kendari Prov. Sulawesi Tenggara,,Kota Kendari,Sulawesi Tenggara
40400244,SMAN 1 WAWOTOBI,https://sekolah.data.kemdikbud.go.id/index.php/Chome/profil/28BA818D-DD53-4AF5-88FF-D9765C09948E,JL. LASANDARA NO. 21 Wawotobi Kec. Wawotobi Kab. Konawe Prov. Sulawesi Tenggara,Kab. Konawe,,Sulawesi Tenggara
30401786,SMAN 1 BONTANG,https://sekolah.data.kemdikbud.go.id/index.php/Chome/profil/DB75C4F2-0226-4370-B97E-D97BDAD8ED30,JL. DI.PANJAITAN GG.PIANO 11 NO.59 BONTANG BARU Kec. Bontang Utara Kota Bontang Prov. Kalimantan Timur,,Kota Bontang,Kalimantan Timur
30205118,SMAN 1 SEBANGAU KUALA,https://sekolah.data.kemdikbud.go.id/index.php/Chome/profil/50BDB7DC-6F31-401C-94AD-D97C82BE22A6,JL. DIPONEGORO No. 155 Mekar Jaya Kec. Sebangau Kuala Kab. Pulang Pisau Prov. Kalimantan Tengah,Kab. Pulang Pisau,,Kalimantan Tengah
20533667,SMA NEGERI 4 KOTA MALANG,https://sekolah.data.kemdikbud.go.id/index.php/Chome/profil/04165D4B-39D6-493F-9340-D9818C8A9301,JL. TUGU UTARA NO. 1 Klojen Kec. Klojen Kota Malang Prov. Jawa Timur,,Kota Malang,Jawa Timur
30300312,SMAS DARUL HIJRAH PUTERI MARTAPURA,https://sekolah.data.kemdikbud.go.id/index.php/Chome/profil/E6086801-9EC9-4FC2-B10D-D982223591F0,JL. BATUNG Cindai Alus Kec. Martapura Kab. Banjar Prov. Kalimantan Selatan,Kab. Banjar,,Kalimantan Selatan
50200385,SMAN 1 KAYANGAN,https://sekolah.data.kemdikbud.go.id/index.php/Chome/profil/EB6ECEB5-3F66-461E-B92A-D990FBDF7519,JL. Pendidikan Kayangan Kayangan Kec. Kayangan Kab. Lombok Utara Prov. Nusa Tenggara Barat,Kab. Lombok Utara,,Nusa Tenggara Barat
40203038,SMAS SARASWATI TOLAI,https://sekolah.data.kemdikbud.go.id/index.php/Chome/profil/A26A6943-F195-4005-86B9-D99366C1AEA1,JL.TRANS SULAWESI Tolai Kec. Torue Kab. Parigi Moutong Prov. Sulawesi Tengah,Kab. Parigi Moutong,,Sulawesi Tengah
40201628,SMAN 1 TOILI,https://sekolah.data.kemdikbud.go.id/index.php/Chome/profil/75B92710-69CF-4E9E-BB16-D9A39A5413D7,JL. TADULAKO NO.1 JAYA KENCANA JAYA KENCANA Kec. Toili Kab. Banggai Prov. Sulawesi Tengah,Kab. Banggai,,Sulawesi Tengah
10806771,SMAN 1 NEGARA BATIN,https://sekolah.data.kemdikbud.go.id/index.php/Chome/profil/4B7B2A1B-3402-424C-B0FF-D9B0459521B6,JL. BGD NEGARA Negara Batin Kec. Negara Batin Kab. Way Kanan Prov. Lampung,Kab. Way Kanan,,Lampung
20615686,SMAS PLUS DOWA AL ISLAMI,https://sekolah.data.kemdikbud.go.id/index.php/Chome/profil/8B62F29B-38E2-4FC9-B8A5-D9B828674218,JL. DOWA WANAYASA Kec. Pontang Kab. Serang Prov. Banten,Kab. Serang,,Banten
10259859,SMA SWASTA BERDIKARI,https://sekolah.data.kemdikbud.go.id/index.php/Chome/profil/B40D8A96-50CB-431C-AEBD-D9BAD55D3282,JL. KUALA TANJUNG Perdagangan I Kec. Bandar Kab. Simalungun Prov. Sumatera Utara,Kab. Simalungun,,Sumatera Utara
20613553,SMAN 10 Kota Tangerang Selatan,https://sekolah.data.kemdikbud.go.id/index.php/Chome/profil/D68B517E-68D6-4D56-AC2D-D9BC5E854E10,Jl. Raya Tegal Rotan  Bintaro Sektor 9 S... Sawah Baru Kec. Ciputat Kota Tangerang Selatan Prov. Banten,,Kota Tangerang Selatan,Banten
10302978,SMAN 1 SIBERUT SELATAN,https://sekolah.data.kemdikbud.go.id/index.php/Chome/profil/4497AA98-ADFF-4D96-A80A-D9BFFAB7899E,Desa Maileppet Maileppet Kec. Siberut Selatan Kab. Kepulauan Mentawai Prov. Sumatera Barat,Kab. Kepulauan Mentawai,,Sumatera Barat
20532113,SMAS WIJAYA PUTRA,https://sekolah.data.kemdikbud.go.id/index.php/Chome/profil/7B10667B-002D-476E-92CF-D9C590168E87,JL. RAYA BENOWO NO. 1-3 SURABAYA Babat Jerawat Kec. Pakal Kota Surabaya Prov. Jawa Timur,,Kota Surabaya,Jawa Timur
10605588,SMAN 1 PLAKAT TINGGI,https://sekolah.data.kemdikbud.go.id/index.php/Chome/profil/A067420D-5349-4922-B61F-D9C5F82D9A4F,DESA SIDORAHAYU SIDO RAHAYU Kec. Plakat Tinggi Kab. Musi Banyuasin Prov. Sumatera Selatan,Kab. Musi Banyuasin,,Sumatera Selatan
50307416,SMAN 1 TAEKAS,https://sekolah.data.kemdikbud.go.id/index.php/Chome/profil/6537984B-EA52-4576-8B54-D9CA1881A96D,MARIA FATIMAH BAEN Taekas Kec. Miomafo Timur Kab. Timor Tengah Utara Prov. Nusa Tenggara Timur,Kab. Timor Tengah Utara,,Nusa Tenggara Timur
50308604,SMAN 2 SAMBI RAMPAS,https://sekolah.data.kemdikbud.go.id/index.php/Chome/profil/2D83025D-B7AE-4886-97FC-D9CB89A680E3,TEMBA LAJAR Nanga Mbaur Kec. Sambi Rampas Kab. Manggarai Timur Prov. Nusa Tenggara Timur,Kab. Manggarai Timur,,Nusa Tenggara Timur
69880763,SMA SABILUSH SHOLIHIN,https://sekolah.data.kemdikbud.go.id/index.php/Chome/profil/AF53C234-CEE6-4519-BD55-D9CBB1FE07B5,JL. RAYA PEDENG Socah Kec. Socah Kab. Bangkalan Prov. Jawa Timur,Kab. Bangkalan,,Jawa Timur
40500759,SMAN 1 MARISA,https://sekolah.data.kemdikbud.go.id/index.php/Chome/profil/4F9EB7C2-5FA6-4802-881A-D9D66F64E4B5,JL. TRANS SULAWESI NO. 20 Teratai Kec. Marisa Kab. Pohuwato Prov. Gorontalo,Kab. Pohuwato,,Gorontalo
10497552,SMA IT AL ITTIHAD,https://sekolah.data.kemdikbud.go.id/index.php/Chome/profil/815FCA7D-9601-4A65-B246-D9E00EC9B87A,KOMPLEK MESJID AL-ITTIHAD Lembah Damai Kec. Rumbai Kota Pekanbaru Prov. Riau,,Kota Pekanbaru,Riau
10302020,SMAN 2 PAINAN,https://sekolah.data.kemdikbud.go.id/index.php/Chome/profil/EC09F990-D736-4350-AF8C-D9E052825359,JL. PERINTIS KEMERDEKAAN PAINAN TIMUR PAINAN Kec. IV Jurai Kab. Pesisir Selatan Prov. Sumatera Barat,Kab. Pesisir Selatan,,Sumatera Barat
70005738,SMA MUHAMMADIYAH 1 BETUNG,https://sekolah.data.kemdikbud.go.id/index.php/Chome/profil/B7E601F7-717E-48DD-87D6-D9E08CF3AD79,RT.02 RW.01 Desa Talang Jaya Mulya Talang Jaya Mulya Kec. Betung Kab. Banyuasin Prov. Sumatera Selatan,Kab. Banyuasin,,Sumatera Selatan
69786222,SMA COKROAMINOTO SUKARESMI,https://sekolah.data.kemdikbud.go.id/index.php/Chome/profil/6E05DDAC-FD17-41B7-8984-D9E22914EE82,JL MARIWATI KM 5 CIPANAS Kawungluwuk Kec. Sukaresmi Kab. Cianjur Prov. Jawa Barat,Kab. Cianjur,,Jawa Barat
20219808,SMAS MEDINA BANDUNG,https://sekolah.data.kemdikbud.go.id/index.php/Chome/profil/F7BE9AD8-A0C0-4A19-90FA-D9E42B3B006A,JL. KH. AHMAD DAHLAN / BANTENG NO. 13-15 Burangrang Kec. Lengkong Kota Bandung Prov. Jawa Barat,,Kota Bandung,Jawa Barat
69799885,SMA BINA SPORA MANDIRI,https://sekolah.data.kemdikbud.go.id/index.php/Chome/profil/5A675A2E-5D28-4986-90EA-D9E694D149C8,Kp. Pasir Menjul RT 02 RW 01 Desa Pasir ... Pasir Jaya Kec. Cigombong Kab. Bogor Prov. Jawa Barat,Kab. Bogor,,Jawa Barat
69888435,SMA BAITURRAHMAN,https://sekolah.data.kemdikbud.go.id/index.php/Chome/profil/935A00FB-3612-44D1-94C5-D9F07A2C97FF,KP. CIHERANG RT 08/05 Cikarae Thoyibah Kec. Cikidang Kab. Sukabumi Prov. Jawa Barat,Kab. Sukabumi,,Jawa Barat
10503230,SMAS BHAKTI WASITA,https://sekolah.data.kemdikbud.go.id/index.php/Chome/profil/51C1B824-2BF1-41A5-82DC-D9F4691DB750,JL RA KARTINI KELURAHAN WIROTHO AGUNG Kec. Rimbo Bujang Kab. Tebo Prov. Jambi,Kab. Tebo,,Jambi
69888731,SMA YPPK St. FRANSISKUS EPOUTO,https://sekolah.data.kemdikbud.go.id/index.php/Chome/profil/7643D7C8-608B-44FF-BC92-D9FBC7E0150D,JL. BUKIT PINUS PPK EPOUTO Wotai Kec. Yatamo Kab. Paniai Prov. Papua Tengah,Kab. Paniai,,Papua Tengah
10603842,SMA NEGERI 05 PALEMBANG,https://sekolah.data.kemdikbud.go.id/index.php/Chome/profil/87284CF7-D59A-4EEE-9E84-D9FCF43BB052,"JL. RE. MARTADINATA, GOTONG ROYONG SUNGA... Sungai Buah Kec. Ilir Timur II Kota Palembang Prov. Sumatera Selatan",,Kota Palembang,Sumatera Selatan
60100348,SMAS MUHAMMADIYAH MASOHI,https://sekolah.data.kemdikbud.go.id/index.php/Chome/profil/8C903422-B965-43F2-9769-D9FD18F195C7,JL. SULTAN HASANUDIN Letwaru Kec. Masohi Kab. Maluku Tengah Prov. Maluku,Kab. Maluku Tengah,,Maluku
20219727,SMAS KARTIKA XIX-1,https://sekolah.data.kemdikbud.go.id/index.php/Chome/profil/05DF362C-84C1-4186-AF77-DA0CFDE7DE74,JL. TAMAN PRAMUKA NO. 163 Cihapit Kec. Bandung Wetan Kota Bandung Prov. Jawa Barat,,Kota Bandung,Jawa Barat
60300873,SMA NEGERI 1 ARSO,https://sekolah.data.kemdikbud.go.id/index.php/Chome/profil/2FAB0AC4-4BF5-4669-893F-DA0DC30E6147,Jl. Ketimun No. 1 Arso Swakarsa Asyaman Kec. Arso Kab. Keerom Prov. Papua,Kab. Keerom,,Papua
69900126,SMA ISLAM AL-ISHLAH,https://sekolah.data.kemdikbud.go.id/index.php/Chome/profil/7B2994B5-D4B5-4574-90F7-DA12F8E7089D,DESA BAKIYONG Bakeyong Kec. Guluk Guluk Kab. Sumenep Prov. Jawa Timur,Kab. Sumenep,,Jawa Timur
20328870,SMA WALISONGO,https://sekolah.data.kemdikbud.go.id/index.php/Chome/profil/EF8C4140-7D79-4854-85B3-DA1447D34CA1,JL. KI MANGUNSARKORO NO. 17 Karangkidul Kec. Semarang Tengah Kota Semarang Prov. Jawa Tengah,,Kota Semarang,Jawa Tengah
30205365,SMAN 2 NANGA BULIK,https://sekolah.data.kemdikbud.go.id/index.php/Chome/profil/0E25A38E-B1BC-4BDB-8C79-DA19EA702396,"Desa Beruta Jalan Eks Korindo KM. 4,5 Beruta Kec. Bulik Kab. Lamandau Prov. Kalimantan Tengah",Kab. Lamandau,,Kalimantan Tengah
10262146,SMA NEGERI 1 SATU ATAP PULAU SIMUK,https://sekolah.data.kemdikbud.go.id/index.php/Chome/profil/3EE5620F-7D08-4595-A2D7-DA1CF0526D96,Desa Gobo Kecamatan Simuk Kabupaten Nias... Gobo Kec. Simuk Kab. Nias Selatan Prov. Sumatera Utara,Kab. Nias Selatan,,Sumatera Utara
10405126,SMAS METHODIST PULAU HALANG MUKA,https://sekolah.data.kemdikbud.go.id/index.php/Chome/profil/2DED8D8D-2012-4A02-819C-DA20D5C2E0A2,PULAU HALANG MUKA Pulauhalang Muka Kec. Kubu Babussalam Kab.  Rokan Hilir Prov. Riau,Kab.  Rokan Hilir,,Riau
70053341,SMAS AZ ZAHRA CITRA BANGSA LIARO,https://sekolah.data.kemdikbud.go.id/index.php/Chome/profil/0989057C-E3D0-407A-8999-DA23A2BA7DAB,Desa Liaro Liaro Kec. Bacan Timur Selatan Kab. Halmahera Selatan Prov. Maluku Utara,Kab. Halmahera Selatan,,Maluku Utara
20600463,SMAN 7 PANDEGLANG,https://sekolah.data.kemdikbud.go.id/index.php/Chome/profil/1A41DBE2-7999-4FE1-85ED-DA24DFC12B7A,JL. RAYA PANIMBANG KM. 1.5 Munjul Kec. Munjul Kab. Pandeglang Prov. Banten,Kab. Pandeglang,,Banten
20252288,SMAS PRESIDEN (BOARDING SCHOOL),https://sekolah.data.kemdikbud.go.id/index.php/Chome/profil/4D9E7A2C-3E92-47F1-950B-DA2A8EF37C66,JABABEKA EDUCATION PARK JL. KI HAJAR DEW... Simpangan Kec. Cikarang Utara Kab. Bekasi Prov. Jawa Barat,Kab. Bekasi,,Jawa Barat
20536297,SMAN 2 PROBOLINGGO,https://sekolah.data.kemdikbud.go.id/index.php/Chome/profil/A2B14CF4-81A6-4BF3-A00F-DA2B43FFF613,JL. KI HAJAR DEWANTARA Kanigaran Kec. Kanigaran Kota Probolinggo Prov. Jawa Timur,,Kota Probolinggo,Jawa Timur
69979980,SMAS METRO SCHOOL MAKASSAR,https://sekolah.data.kemdikbud.go.id/index.php/Chome/profil/FFFED305-5A20-4A82-A7A2-DA34051BD6AA,Jalan Gunung Latimojong No. 129 Maradekaya Kec. Makasar Kota Makassar Prov. Sulawesi Selatan,,Kota Makassar,Sulawesi Selatan
70045463,SMA HIGHFIELD DEPOK,https://sekolah.data.kemdikbud.go.id/index.php/Chome/profil/6DA1BCC3-6AD4-420E-83F8-DA3AF2D693CE,Jl. Ir. H. Juanda Kp. Mentengan No. 72 Kemirimuka Kec. Beji Kota Depok Prov. Jawa Barat,,Kota Depok,Jawa Barat
10210801,SMA SWASTA AR RAHMAN MEDAN,https://sekolah.data.kemdikbud.go.id/index.php/Chome/profil/07F47E04-1DF8-4F32-8365-DA3B82CD57E4,JL. H.A MANAF LUBIS NO. 58 Tanjung Gusta Kec. Medan Helvetia Kota Medan Prov. Sumatera Utara,,Kota Medan,Sumatera Utara
20322738,SMAS ISLAM A YANI BATANG,https://sekolah.data.kemdikbud.go.id/index.php/Chome/profil/9434EAB3-5216-46E9-B704-DA3E6F6002D4,JL. KYAI SURGI PROYONANGGAN SELATAN BATA... Proyonanggan Selatan Kec. Batang Kab. Batang Prov. Jawa Tengah,Kab. Batang,,Jawa Tengah
69849599,SMA NEGERI 1 MOTOLING TIMUR,https://sekolah.data.kemdikbud.go.id/index.php/Chome/profil/CFC9E9ED-6D97-4077-B06B-DA42F72B9039,Jl. DESA TOKIN JAGA 1 Tokin Kec. Motoling Timur Kab. Minahasa Selatan Prov. Sulawesi Utara,Kab. Minahasa Selatan,,Sulawesi Utara
20224124,SMA SANTA MARIA 3,https://sekolah.data.kemdikbud.go.id/index.php/Chome/profil/F01EA21F-C038-4B96-A40F-DA4E2EF7A2A6,JL. GATOT SUBROTO NO. 6 Karangmekar Kec. Cimahi Tengah Kota Cimahi Prov. Jawa Barat,,Kota Cimahi,Jawa Barat
20220337,SMAN 8 BOGOR,https://sekolah.data.kemdikbud.go.id/index.php/Chome/profil/0F22C4CE-EF84-4935-AC9C-DA4EC751E4D8,JL. BTN CIPARIGI NO. 60 Ciparigi Kec. Kota Bogor Utara Kota Bogor Prov. Jawa Barat,,Kota Bogor,Jawa Barat
10205394,SMAN 1 KUALUH HILIR,https://sekolah.data.kemdikbud.go.id/index.php/Chome/profil/F16A8A11-B981-4DC5-8574-DA54231C59E7,JL. PASAR BILAH KAMPUNG MESJID Kampung Mesjid Kec. Kualuh Hilir Kab. Labuhanbatu Utara Prov. Sumatera Utara,Kab. Labuhanbatu Utara,,Sumatera Utara
20527236,SMAN 2 PAMEKASAN,https://sekolah.data.kemdikbud.go.id/index.php/Chome/profil/C457E72B-A1A3-4534-9703-DA6847138D66,JL. JOKOTOLE NO. 234 Barurambat Timur Kec. Pademawu Kab. Pamekasan Prov. Jawa Timur,Kab. Pamekasan,,Jawa Timur
60300808,SMA Bhakti Mandala Nabire,https://sekolah.data.kemdikbud.go.id/index.php/Chome/profil/C85252D2-8773-4FE0-B112-DA6AF571322F,Jl. Gagak Siriwini Kec. Nabire Kab. Nabire Prov. Papua Tengah,Kab. Nabire,,Papua Tengah
50220485,SMAN 1 PARADO,https://sekolah.data.kemdikbud.go.id/index.php/Chome/profil/D9F3F411-BAEB-4299-84B6-DA6FE98BA3C0,JL. SOEKARNO - HATTA NO. 33 PARADO Paradowane Kec. Parado Kab. Bima Prov. Nusa Tenggara Barat,Kab. Bima,,Nusa Tenggara Barat
20603348,SMAS KEBANGSAAN,https://sekolah.data.kemdikbud.go.id/index.php/Chome/profil/7BC752A5-9BB2-4AAA-8FA0-DA7228F97E77,JL.RAYA PONDOK AREN NO. 31 Pondok Aren Kec. Pondok Aren Kota Tangerang Selatan Prov. Banten,,Kota Tangerang Selatan,Banten
20552092,SMAS TAHFIDZ,https://sekolah.data.kemdikbud.go.id/index.php/Chome/profil/58AD32E8-4290-4A35-871A-DA739B6AF6B1,JL. VETERAN  MUDA 1/15 Barurambat Timur Kec. Pademawu Kab. Pamekasan Prov. Jawa Timur,Kab. Pamekasan,,Jawa Timur
69945165,SMA IT FADHILAH,https://sekolah.data.kemdikbud.go.id/index.php/Chome/profil/FADFE21B-D16C-4010-8BF1-DA74E29C7B97,JL. MUHAJIRIN Sidomulyo Barat Kec. Tuahmadani Kota Pekanbaru Prov. Riau,,Kota Pekanbaru,Riau
20515434,SMAN 1 CAMPURDARAT,https://sekolah.data.kemdikbud.go.id/index.php/Chome/profil/DC15CF96-3ED2-41A8-9BB4-DA78BB42E102,JL. POPOH INDAH Ngentrong Kec. Campur Darat Kab. Tulungagung Prov. Jawa Timur,Kab. Tulungagung,,Jawa Timur
10105385,SMA CUT MEUTIA BANDA ACEH,https://sekolah.data.kemdikbud.go.id/index.php/Chome/profil/78DA0B62-AF17-4795-9F0E-DA7C8977D870,JL. TGK. CHIK DITIRO Ateuk Pahlawan Kec. Baiturrahman Kota Banda Aceh Prov. Aceh,,Kota Banda Aceh,Aceh
50304937,SMAS KATOLIK ST CAROLUS,https://sekolah.data.kemdikbud.go.id/index.php/Chome/profil/31E2556F-A585-4B69-8E76-DA8225B2BAD6,JL. ADI SUCIPTO NO. 44 PENFUI-KUPANG Penfui Kec. Maulafa Kota Kupang Prov. Nusa Tenggara Timur,,Kota Kupang,Nusa Tenggara Timur
20570238,SMAS ASSHOMADIYAH,https://sekolah.data.kemdikbud.go.id/index.php/Chome/profil/83D9AFBE-6FBE-4A2F-A1BD-DA833F8579F2,JL. KH. MAKKY SYARBINI 107 Burneh Kec. Burneh Kab. Bangkalan Prov. Jawa Timur,Kab. Bangkalan,,Jawa Timur
70039998,SMA DARUL IKHSAN,https://sekolah.data.kemdikbud.go.id/index.php/Chome/profil/EAD1F533-CD0C-4CDE-8EFA-DA84875C6C5C,Jl. Pangeran Antasari No. 2 Gamer Kec. Pekalongan Timur Kota Pekalongan Prov. Jawa Tengah,,Kota Pekalongan,Jawa Tengah
10400351,SMA NEGERI 2 KUOK,https://sekolah.data.kemdikbud.go.id/index.php/Chome/profil/FF50C02E-2560-492A-8D14-DA863510DFCD,JL. AL-IMAN Lereng Kec. Kuok Kab. Kampar Prov. Riau,Kab. Kampar,,Riau
30304258,SMAS KRISTEN BANJARMASIN,https://sekolah.data.kemdikbud.go.id/index.php/Chome/profil/B97A064D-EFA2-472C-A52F-DA8D01FE9401,JL. S. PARMAN NO.1 RT.1 Antasan Besar Kec. Banjarmasin Tengah Kota Banjarmasin Prov. Kalimantan Selatan,,Kota Banjarmasin,Kalimantan Selatan
70009730,SMA PLUS DARUL FALAH BUMINABUNG,https://sekolah.data.kemdikbud.go.id/index.php/Chome/profil/96862580-EFCC-45D0-9ED8-DA8F6513F41A,"JL. Ki Keramat Lingo, Kampung Bumi Nabun... Bumi Nabung Selatan Kec. Bumi Nabung Kab. Lampung Tengah Prov. Lampung",Kab. Lampung Tengah,,Lampung
69949302,SMAN 9 TORAJA UTARA,https://sekolah.data.kemdikbud.go.id/index.php/Chome/profil/BEC53512-0D07-4E58-9619-DA94B8B32A30,Bassean Allo Lembang Nanna Nanggala Kec. Nanggala Kab. Toraja Utara Prov. Sulawesi Selatan,Kab. Toraja Utara,,Sulawesi Selatan
60725227,SMAN 2 LEUWIDAMAR,https://sekolah.data.kemdikbud.go.id/index.php/Chome/profil/5792DCFE-C1E3-4177-9B3D-DA9929746AE9,JL. Raya Cisimeut Km. 12 Kec. Leuwidamar Cisimeut Kec. Leuwidamar Kab. Lebak Prov. Banten,Kab. Lebak,,Banten
20603371,SMAS PLUS PEMBANGUNAN JAYA,https://sekolah.data.kemdikbud.go.id/index.php/Chome/profil/5CE37E54-C61C-4EF7-8413-DA99E87118C6,Jl. Taman Makam Bahagia ABRI Bintaro Ja... Perigi Kec. Pondok Aren Kota Tangerang Selatan Prov. Banten,,Kota Tangerang Selatan,Banten
10300828,SMAN 1 RAO,https://sekolah.data.kemdikbud.go.id/index.php/Chome/profil/6C27D2BC-E1EE-4139-948A-DA9E56D6656D,TUANKU RAO TARUNG-TARUNG Nagari Taruang-Taruang Kec. Rao Kab. Pasaman Prov. Sumatera Barat,Kab. Pasaman,,Sumatera Barat
50102790,SMA Negeri 1 Amlapura,https://sekolah.data.kemdikbud.go.id/index.php/Chome/profil/93A30928-98DE-468F-B6C0-DAAB78D1C4F3,JL. NGURAH RAI NO 56 AMLAPURA Karangasem Kec. Karangasem Kab. Karangasem Prov. Bali,Kab. Karangasem,,Bali
69864623,SMA NEGERI LIKWATANG,https://sekolah.data.kemdikbud.go.id/index.php/Chome/profil/EC30A485-1A73-4944-AE2D-DAB5591B62B1,Jl. Sibone-Likwatang Likuwatang Kec. Alor Tengah Utara Kab. Alor Prov. Nusa Tenggara Timur,Kab. Alor,,Nusa Tenggara Timur
70034161,SMA RAUDHATUL MUTTAQIN,https://sekolah.data.kemdikbud.go.id/index.php/Chome/profil/57D81AFA-C351-43AB-BB72-DAB6881DD93D,Kp. Sinarjaya RT.02 RW.01 Purasari Kec. Leuwiliang Kab. Bogor Prov. Jawa Barat,Kab. Bogor,,Jawa Barat
69954609,SMAN 21 PANGKEP,https://sekolah.data.kemdikbud.go.id/index.php/Chome/profil/1207BAF3-ABD1-4A84-8BA9-DABEFF96624B,Pulau Satando Desa Mattiro Baji Kec. Liukang Tupabbiring Utara Kab. Pangkajene Dan Kepulauan Prov. Sulawesi Selatan,Kab. Pangkajene Dan Kepulauan,,Sulawesi Selatan
70036994,SMAS ISLAM PLUS AZZAHRA HALMAHERA SELATAN,https://sekolah.data.kemdikbud.go.id/index.php/Chome/profil/07D27F05-B956-4B1A-BEDE-DAC13946B863,Jln Desa Tembal Tembal Kec. Bacan Selatan Kab. Halmahera Selatan Prov. Maluku Utara,Kab. Halmahera Selatan,,Maluku Utara
60104038,SMA Negeri 35 Maluku Tengah,https://sekolah.data.kemdikbud.go.id/index.php/Chome/profil/2DF57479-628A-4AAC-ACD4-DAC7DC6EF1CC,JL. Pendidikan Kobi Mukti Kec. Seram Utara Timur Kobi Kab. Maluku Tengah Prov. Maluku,Kab. Maluku Tengah,,Maluku
70014926,SMA PLUS RAUDHATUL HIKAM NW,https://sekolah.data.kemdikbud.go.id/index.php/Chome/profil/F499C04B-E825-437B-A446-DAC909C4F12B,Jl. Desa Banyu Urip Kec. Praya Barat Kab... Banyu Urip Kec. Praya Barat Kab. Lombok Tengah Prov. Nusa Tenggara Barat,Kab. Lombok Tengah,,Nusa Tenggara Barat
40102002,SMA NEGERI 1 MAESAAN,https://sekolah.data.kemdikbud.go.id/index.php/Chome/profil/FC6E2FD8-20F6-4415-B257-DACA1A9A1CAC,JL. RAYA TUMANI KEC. MAESAAN Tumani Kec. Maesaan Kab. Minahasa Selatan Prov. Sulawesi Utara,Kab. Minahasa Selatan,,Sulawesi Utara
20600445,SMAS AT-TAAWUN TEGALLEGA,https://sekolah.data.kemdikbud.go.id/index.php/Chome/profil/808B59F0-2E63-4996-B7C4-DACBD71AF15F,JL.RAYA LABUAN KM. 08 TEGALLEGA Dahu Kec. Cikedal Kab. Pandeglang Prov. Banten,Kab. Pandeglang,,Banten
30311646,SMAN 1 BARAMBAI,https://sekolah.data.kemdikbud.go.id/index.php/Chome/profil/D93C32F6-32FD-49EC-B76B-DACC863BD44D,Jl. Jenderal Sudirman Barambai Kolam Kiri Kec. Barambai Kab. Barito Kuala Prov. Kalimantan Selatan,Kab. Barito Kuala,,Kalimantan Selatan
20253167,SMAS ISLAM AL-AZHAR 4,https://sekolah.data.kemdikbud.go.id/index.php/Chome/profil/1FF71C14-C4D6-42F0-BD77-DAD72DFDF450,"JL. KEMANG PRATAMA RAYA, KEMANG PRATAMA ... Bojong Rawalumbu Kec. Rawalumbu Kota Bekasi Prov. Jawa Barat",,Kota Bekasi,Jawa Barat
20220329,SMAS KESATUAN,https://sekolah.data.kemdikbud.go.id/index.php/Chome/profil/AD4713BF-143A-49F2-9852-DADDBC8DE381,"JL. PAJAJARAN,KOMP. PULO ARMEN Baranangsiang Kec. Kota Bogor Timur Kota Bogor Prov. Jawa Barat",,Kota Bogor,Jawa Barat
60300479,SMA PGRI SERUI,https://sekolah.data.kemdikbud.go.id/index.php/Chome/profil/16671991-EE75-4FF4-BE81-DADF1B957D56,JLN. MARIADEI Anataurei Kec. Yapen Selatan Kab. Kepulauan Yapen Prov. Papua,Kab. Kepulauan Yapen,,Papua
40310210,SMAS AL BAYAN,https://sekolah.data.kemdikbud.go.id/index.php/Chome/profil/7B53B9EB-C652-40A2-82B5-DAE0C7FB8AAD,JL. POROS TAMALANREA Tamalanrea Kec. Tamalanrea Kota Makassar Prov. Sulawesi Selatan,,Kota Makassar,Sulawesi Selatan
69727960,SMAS NURMILAD BOARDING SCHOOL,https://sekolah.data.kemdikbud.go.id/index.php/Chome/profil/709C527F-B627-4435-98F6-DAE1467D19CE,JL. H.A. BASO PARIA NO. 1 LEMPONG Lempong Kec. Bola Kab. Wajo Prov. Sulawesi Selatan,Kab. Wajo,,Sulawesi Selatan
20562423,SMA NEGERI 1 KURIPAN,https://sekolah.data.kemdikbud.go.id/index.php/Chome/profil/D7EDBF9C-BBB4-4303-80A6-DAE92DA330CA,JL. RAYA  KURIPAN Kedawung Kec. Kuripan Kab. Probolinggo Prov. Jawa Timur,Kab. Probolinggo,,Jawa Timur
10212578,SMAN 6 BINJAI,https://sekolah.data.kemdikbud.go.id/index.php/Chome/profil/19796176-1E9F-4B3C-967A-DAF1D146C97B,JL. ARIF RAHMAN HAKIM NO. 66 A BINJAI Nangka Kec. Binjai Utara Kota Binjai Prov. Sumatera Utara,,Kota Binjai,Sumatera Utara
40202950,SMAN 1 SAUSU,https://sekolah.data.kemdikbud.go.id/index.php/Chome/profil/33BCB7D5-572C-4B27-A8DD-DAF98A563C7D,JL.TRANS SULAWESI NO.176 B SAUSU Sausu Trans Kec. Sausu Kab. Parigi Moutong Prov. Sulawesi Tengah,Kab. Parigi Moutong,,Sulawesi Tengah
30303637,SMAN 1 MANTEWE,https://sekolah.data.kemdikbud.go.id/index.php/Chome/profil/FC01914E-EB05-460E-9A24-DB01E0C826C1,"JL. RAYA TRANSMIGRASI KM.42, Rt. 01 Rw. ... Sukadamai Kec. Mantewe Kab. Tanah Bumbu Prov. Kalimantan Selatan",Kab. Tanah Bumbu,,Kalimantan Selatan
40102019,SMAS ADVENT RATAHAN,https://sekolah.data.kemdikbud.go.id/index.php/Chome/profil/51CC87BD-420D-40AF-9BA0-DB035A8F9901,"JL. Pendidikan, lingkungan 3 Lowu Satu Kec. Ratahan Kab. Minahasa Tenggara Prov. Sulawesi Utara",Kab. Minahasa Tenggara,,Sulawesi Utara
