kode,nama,link_profil,alamat,kabupaten,kota,provinsi
20247182,SMAN 1 SUMBERJAYA,https://sekolah.data.kemdikbud.go.id/index.php/Chome/profil/A088437F-5A66-4F8E-907F-18BA9F9B22B7,JL. DESA RANCAPUTAT Rancaputat Kec. Sumberjaya Kab. Majalengka Prov. Jawa Barat,Kab. Majalengka,,Jawa Barat
20517831,SMAS ISLAM AL-MAARIF SINGOSARI,https://sekolah.data.kemdikbud.go.id/index.php/Chome/profil/A4FA6493-6D9A-4070-A46F-18BABC54B881,JL. MASJID NO. 28 Pagentan Kec. Singosari Kab. Malang Prov. Jawa Timur,Kab. Malang,,Jawa Timur
69786208,SMA NEGERI 1 PULAU BANYAK BARAT,https://sekolah.data.kemdikbud.go.id/index.php/Chome/profil/3838F47A-08AE-4859-A844-18BF7622A36F,JL. Datuk Maharajo Asan Tola Kec. Pulau Banyak Barat Kab. Aceh Singkil Prov. Aceh,Kab. Aceh Singkil,,Aceh
50200375,SMAN 1 GANGGA,https://sekolah.data.kemdikbud.go.id/index.php/Chome/profil/4DB9962A-CAED-4809-9F7C-18C1B192A208,JL. RAYA GONDANG Gondang Kec. Gangga Kab. Lombok Utara Prov. Nusa Tenggara Barat,Kab. Lombok Utara,,Nusa Tenggara Barat
10303481,SMAN 13 PADANG,https://sekolah.data.kemdikbud.go.id/index.php/Chome/profil/0FD20501-24EF-4168-8435-18CA8734DB0A,Tanjung Aur Balai Gadang Kec. Koto Tangah Kota Padang Prov. Sumatera Barat,,Kota Padang,Sumatera Barat
60101015,SMA NEGERI 3 BURU,https://sekolah.data.kemdikbud.go.id/index.php/Chome/profil/33081F9E-AE6A-4142-A9CE-18CB175DCCDC,Jl. Joyoboyo No. 04 Waekerta Kec. Waeapo Kab. Buru Prov. Maluku,Kab. Buru,,Maluku
10204247,SMAS TRIYADIKA YASA,https://sekolah.data.kemdikbud.go.id/index.php/Chome/profil/D835CC63-6CC5-47C0-BA51-18D1BB77E84E,PERK. BANDAR SELAMAT Perkebunan Bandar Selamat Kec. Aek Songsongan Kab. Asahan Prov. Sumatera Utara,Kab. Asahan,,Sumatera Utara
10505291,SMAS PERINTIS BERBAK,https://sekolah.data.kemdikbud.go.id/index.php/Chome/profil/7B1DEB11-F4F5-48B8-8FDC-18D30D098105,JL. LAMONGAN SK.O7 KEC. BERBAK Rantau Makmur Kec. Berbak Kab. Tanjung Jabung Timur Prov. Jambi,Kab. Tanjung Jabung Timur,,Jambi
20238009,SMAS BINA NEGARA,https://sekolah.data.kemdikbud.go.id/index.php/Chome/profil/312F4B89-AFC6-41D2-A944-18D7D5E0AB45,JL. YPI N0. 3 DESA. BANTARSARI KEC. PEBA... Bantarsari Kec. Pebayuran Kab. Bekasi Prov. Jawa Barat,Kab. Bekasi,,Jawa Barat
20107280,SMAS BAKTI IDHATA JAKARTA,https://sekolah.data.kemdikbud.go.id/index.php/Chome/profil/7E3EF1F2-B033-476E-8C56-18DBB7DE9129,JL. MELATI NO. 25 Cilandak Barat Kec. Cilandak Kota Adm. Jakarta Selatan Prov. D.K.I. Jakarta,,Kota Adm. Jakarta Selatan,D.K.I. Jakarta
69932641,SMA ASY-SYIFA DARUSSALAM,https://sekolah.data.kemdikbud.go.id/index.php/Chome/profil/735AC232-4D0C-465B-95D3-18E76FBF9592,"Jl.Simpang Saprodi, Dusun Bumi Rahayu Bumi Agung Marga Kec. Abung Timur Kab. Lampung Utara Prov. Lampung",Kab. Lampung Utara,,Lampung
10107196,SMA NEGERI 12 BANDA ACEH,https://sekolah.data.kemdikbud.go.id/index.php/Chome/profil/6D932266-CFB0-474B-897E-18EBCA4059C2,JL. PANGLIMA NYAK MAKAM Kota Baru Kec. Kuta Alam Kota Banda Aceh Prov. Aceh,,Kota Banda Aceh,Aceh
20603159,SMAS BABUSSALAM TELUKNAGA,https://sekolah.data.kemdikbud.go.id/index.php/Chome/profil/B761F49D-76E5-457C-A2CE-18F572C70687,JL. BABUSSALAM RT.003/05 Teluk Naga Kec. Teluk naga Kab. Tangerang Prov. Banten,Kab. Tangerang,,Banten
20100186,SMAK 2 PENABUR,https://sekolah.data.kemdikbud.go.id/index.php/Chome/profil/DE412D9F-1FA3-41E8-853D-19043412C713,JL. PINTU AIR RAYA NO. 11 Pasar Baru Kec. Sawah Besar Kota Adm. Jakarta Pusat Prov. D.K.I. Jakarta,,Kota Adm. Jakarta Pusat,D.K.I. Jakarta
69799871,SMA ISLAM ASSIROJ,https://sekolah.data.kemdikbud.go.id/index.php/Chome/profil/C1532CA3-D187-4B9E-A531-1905BE9122EC,Jl. Poros Tengah No.1 Desa Sokarame Timu... Sokarame Timur Kec. Nonggunong Kab. Sumenep Prov. Jawa Timur,Kab. Sumenep,,Jawa Timur
10802976,SMAS JAYABAYA KOTABUMI,https://sekolah.data.kemdikbud.go.id/index.php/Chome/profil/01FD32AE-33EB-4C82-8012-19282AE72A7A,JL. JAYABAYA SKIP Tanjung Aman Kec. Kotabumi Selatan Kab. Lampung Utara Prov. Lampung,Kab. Lampung Utara,,Lampung
69759861,SMAS TRI TUNGGAL 45 MAKASSAR,https://sekolah.data.kemdikbud.go.id/index.php/Chome/profil/54596C61-8172-41F3-98A1-192AC2C6330D,BTP JL. KEMULIAAN BANGKALA Tamalanrea Kec. Tamalanrea Kota Makassar Prov. Sulawesi Selatan,,Kota Makassar,Sulawesi Selatan
60403397,SMAS YPK BETHEL AIMAS KABUPATEN SORONG,https://sekolah.data.kemdikbud.go.id/index.php/Chome/profil/815DF6E4-D4F2-4D38-96D4-192C98255B1D,JL. OSOK Aimas Kec. Aimas Kab. Sorong Prov. Papua Barat Daya,Kab. Sorong,,Papua Barat Daya
50300263,SMAS YASMOR PLUS OENONI,https://sekolah.data.kemdikbud.go.id/index.php/Chome/profil/88A79BA5-3252-46CD-9E23-1933C2D14782,JL. LINTAS OEKABITI Oenoni II Kec. Amarasi Kab. Kupang Prov. Nusa Tenggara Timur,Kab. Kupang,,Nusa Tenggara Timur
70006176,SMA ISLAM TERPADU INSAN CENDEKIA MADANI,https://sekolah.data.kemdikbud.go.id/index.php/Chome/profil/3D93A20A-B697-4376-BEF2-193544CE6309,Jl. Muh. Tahir Dg. Liong Mandalle Mandalle Kec. Mandalle Kab. Pangkajene Dan Kepulauan Prov. Sulawesi Selatan,Kab. Pangkajene Dan Kepulauan,,Sulawesi Selatan
10210820,SMA SWASTA BRIGJEN KATAMSO MEDAN,https://sekolah.data.kemdikbud.go.id/index.php/Chome/profil/F7F5C055-F6B9-4D69-98B3-193E57475562,JL. SUNGGAL NO. 370 Sunggal Kec. Medan Sunggal Kota Medan Prov. Sumatera Utara,,Kota Medan,Sumatera Utara
20519284,SMAS MUHAMMADIYAH 4 GEMPOL,https://sekolah.data.kemdikbud.go.id/index.php/Chome/profil/7AC73899-9185-4659-8369-193FF698A6D7,JL. RAYA 146A GEMPOL Gempol Kec. Gempol Kab. Pasuruan Prov. Jawa Timur,Kab. Pasuruan,,Jawa Timur
70043299,SMA NEGERI 1 KLAMIT,https://sekolah.data.kemdikbud.go.id/index.php/Chome/profil/45A8DB87-8F17-4B91-B6B7-19455C8547D4,Kampung Klamit Distrik Salkma Klamit Kec. Salkma Kab. Sorong Selatan Prov. Papua Barat Daya,Kab. Sorong Selatan,,Papua Barat Daya
20307635,SMAS ISLAM SUDIRMAN PAKIS,https://sekolah.data.kemdikbud.go.id/index.php/Chome/profil/1281BBC9-F15C-4452-8CD1-19460C413B32,JL. JEND. SUDIRMAN NO. 17 Pakis Kec. Pakis Kab. Magelang Prov. Jawa Tengah,Kab. Magelang,,Jawa Tengah
20315032,SMAS KATOLIK CEPU,https://sekolah.data.kemdikbud.go.id/index.php/Chome/profil/33E14153-42DC-4D20-A76C-194658F77EC2,JL. RSU NO. 46 CEPU Cepu Kec. Cepu Kab. Blora Prov. Jawa Tengah,Kab. Blora,,Jawa Tengah
70041059,SMA Budi Utomo Kotabaru,https://sekolah.data.kemdikbud.go.id/index.php/Chome/profil/338F750A-4D9B-49B6-9CDD-194D4B31D66D,Jl. Sadewa RT. 4 RW. 2 Sebelimbingan Kec. Pulau Laut Utara Kab. Kotabaru Prov. Kalimantan Selatan,Kab. Kotabaru,,Kalimantan Selatan
20306171,SMA NEGERI 7 PURWOREJO,https://sekolah.data.kemdikbud.go.id/index.php/Chome/profil/A74ABAA6-7B9C-4A23-AEF7-195540F79690,JL. KI MANGUNSARKORO NO. 1 Pangenjuru Tengah Kec. Purworejo Kab. Purworejo Prov. Jawa Tengah,Kab. Purworejo,,Jawa Tengah
10262148,SMA NEGERI 1 ULUSUSUA,https://sekolah.data.kemdikbud.go.id/index.php/Chome/profil/4C0A0C2B-8EB9-44D6-B27E-195F81F2FAE1,Desa Ramba-ramba Ramba-ramba Kec. Ulususua Kab. Nias Selatan Prov. Sumatera Utara,Kab. Nias Selatan,,Sumatera Utara
10219149,SMAS PEMNAS PANTAI LABU,https://sekolah.data.kemdikbud.go.id/index.php/Chome/profil/C6568278-16FD-43E7-9094-19643722388D,DUSUN II BINJAI BAKUNG Binjai Bakung Kec. Pantai Labu Kab. Deli Serdang Prov. Sumatera Utara,Kab. Deli Serdang,,Sumatera Utara
20501701,SMAN 3 SIDOARJO,https://sekolah.data.kemdikbud.go.id/index.php/Chome/profil/A9A829D6-F73B-479A-8781-19683BDE9183,JL. DR. WAHIDIN NO. 130 SIDOARJO Sekardangan Kec. Sidoarjo Kab. Sidoarjo Prov. Jawa Timur,Kab. Sidoarjo,,Jawa Timur
69786628,SMAN 1 TEBING TINGGI,https://sekolah.data.kemdikbud.go.id/index.php/Chome/profil/A0F2E3B5-FBE9-4F86-8ACD-196B7536E650,JL. GUNUNG BATU RAYA  RT. 01 Sungsum Kec. Tebing Tinggi Kab. Balangan Prov. Kalimantan Selatan,Kab. Balangan,,Kalimantan Selatan
69947112,SMAN 1 TOMINI,https://sekolah.data.kemdikbud.go.id/index.php/Chome/profil/59A94474-9141-4C7D-A57A-197F67911BE5,Jl. Pasar Tomini Tomini Kec. Tomini Kab. Parigi Moutong Prov. Sulawesi Tengah,Kab. Parigi Moutong,,Sulawesi Tengah
10258256,SMA SWASTA KAMPUS TELUKDALAM,https://sekolah.data.kemdikbud.go.id/index.php/Chome/profil/836061DB-436C-44EC-97AC-1980EDC428AB,Jl. DIPONEGORO NARI-NARI Pasar Teluk Dalam Kec. Teluk Dalam Kab. Nias Selatan Prov. Sumatera Utara,Kab. Nias Selatan,,Sumatera Utara
69948149,SMA RABBANI ISLAMIC SCHOOL,https://sekolah.data.kemdikbud.go.id/index.php/Chome/profil/86CF5E4F-31A0-4E6C-91C5-1983697EE062,Jl. Lintas Solok - Bukittinggi Km. 12 Jo... KOTO SANI Kec. X Koto Singkarak Kab. Solok Prov. Sumatera Barat,Kab. Solok,,Sumatera Barat
20540304,SMA NEGERI PLANDAAN,https://sekolah.data.kemdikbud.go.id/index.php/Chome/profil/F947A03B-8183-44E9-B701-1983D05F3E8C,JL.BANGSRI NO.38 PLANDAAN JOMBANG Bangsri Kec. Plandaan Kab. Jombang Prov. Jawa Timur,Kab. Jombang,,Jawa Timur
20511950,SMA NEGERI 1 PUNCU KABUPATEN KEDIRI,https://sekolah.data.kemdikbud.go.id/index.php/Chome/profil/FC3FCB70-46B9-4725-B5A7-198BB5156117,DS. ASMOROBANGUN KEC.PUNCU Asmorobangun Kec. Puncu Kab. Kediri Prov. Jawa Timur,Kab. Kediri,,Jawa Timur
40103905,SMA NEGERI 1 MOTOLING BARAT,https://sekolah.data.kemdikbud.go.id/index.php/Chome/profil/461D342E-5929-45EA-9010-198BD021B118,JL. DESA RAANAN BARU II KEC. MOTOLING BA... Raanan Baru Kec. Motoling Barat Kab. Minahasa Selatan Prov. Sulawesi Utara,Kab. Minahasa Selatan,,Sulawesi Utara
20549787,SMAS SUNAN AMPEL,https://sekolah.data.kemdikbud.go.id/index.php/Chome/profil/8F4C2F3C-256A-4575-B355-198C90655375,JL.PONPES DARUSSALAM Langkap Kec. Burneh Kab. Bangkalan Prov. Jawa Timur,Kab. Bangkalan,,Jawa Timur
20306202,SMA NEGERI 1 PURWOREJO,https://sekolah.data.kemdikbud.go.id/index.php/Chome/profil/2DD7FE84-980A-4402-B25E-1992655010EA,JALAN TENTARA PELAJAR NO. 55 PURWOREJO Pangenjuru Tengah Kec. Purworejo Kab. Purworejo Prov. Jawa Tengah,Kab. Purworejo,,Jawa Tengah
10402079,SMAN TUNAS BANGSA,https://sekolah.data.kemdikbud.go.id/index.php/Chome/profil/56A33104-419F-4010-B3EC-19968BB6810B,JL. PROVINSI NO. 1 KECAMATAN PULAU BURUN... Teluk Nibung Kec. Pulau Burung Kab. Indragiri Hilir Prov. Riau,Kab. Indragiri Hilir,,Riau
20231312,SMAS MADANIA,https://sekolah.data.kemdikbud.go.id/index.php/Chome/profil/01541B7C-49FC-4083-9AD3-1997451BF200,"PERUM. TELAGA KAHURIPAN , DS. TEGAL KEC.... Tegal Kec. Kemang Kab. Bogor Prov. Jawa Barat",Kab. Bogor,,Jawa Barat
40300279,SMAN 8 MAROS,https://sekolah.data.kemdikbud.go.id/index.php/Chome/profil/7A84910D-06C5-401F-92FD-199D239003CA,JL.POROS KARIANGO KM.5 Tenrigangkae Kec. Mandai Kab. Maros Prov. Sulawesi Selatan,Kab. Maros,,Sulawesi Selatan
70027600,SMA IT Al-Kautsar,https://sekolah.data.kemdikbud.go.id/index.php/Chome/profil/BA75865B-39D0-48DA-9246-199FA8CDBB97,Jl. Tentara Pelajar RT 20 RW 05 Bayuning Kec. Kadugede Kab. Kuningan Prov. Jawa Barat,Kab. Kuningan,,Jawa Barat
20341281,SMAS MIFTAHUS SA ADAH,https://sekolah.data.kemdikbud.go.id/index.php/Chome/profil/888542DA-D3EC-46FC-9F00-19A0D84BAA7A,JL. RAYA DIPONEGORO KM. 4 TAMBAKSELO WIR... Tambakselo Kec. Wirosari Kab. Grobogan Prov. Jawa Tengah,Kab. Grobogan,,Jawa Tengah
20331907,SMA MASEHI 2 PSAK,https://sekolah.data.kemdikbud.go.id/index.php/Chome/profil/90CB704A-8E9A-4134-888A-19A0FCA6E388,Jl. Gemah Raya No. 8 Gemah Kec. Pedurungan Kota Semarang Prov. Jawa Tengah,,Kota Semarang,Jawa Tengah
40203519,SMAS KARUNA DIPA,https://sekolah.data.kemdikbud.go.id/index.php/Chome/profil/2636D506-4F55-4AE3-8EFC-19A27C26BF60,JL. SUNGAI LARIANG NO 21 Kelurahan Nunu Kec. Tatanga Kota Palu Prov. Sulawesi Tengah,,Kota Palu,Sulawesi Tengah
69753172,SMA ISLAM AL ALY,https://sekolah.data.kemdikbud.go.id/index.php/Chome/profil/B08DEA2A-E940-4580-97AE-19B118CEF544,JL.MASJID NO 19 Mayangrejo Kec. Kalitidu Kab. Bojonegoro Prov. Jawa Timur,Kab. Bojonegoro,,Jawa Timur
20103296,SMAN 39 JAKARTA,https://sekolah.data.kemdikbud.go.id/index.php/Chome/profil/2DBA7119-DD77-4E61-81C7-19B420E16F61,JL. RA FADILAH CIJANTUNG Baru Kec. Pasar Rebo Kota Adm. Jakarta Timur Prov. D.K.I. Jakarta,,Kota Adm. Jakarta Timur,D.K.I. Jakarta
70052127,SMA PLUS AL-FALAH AL-MAKKY,https://sekolah.data.kemdikbud.go.id/index.php/Chome/profil/1B4D23BF-DE2B-4A26-A135-19B47C52E86B,Jl. Raya Putat Lor Putat Lor Kec. Gondanglegi Kab. Malang Prov. Jawa Timur,Kab. Malang,,Jawa Timur
70049407,SMA KRISTEN KASIH BANGSA,https://sekolah.data.kemdikbud.go.id/index.php/Chome/profil/9D6623B2-9230-4D27-9673-19BBBFFD12BC,"Jl. Moh Toha, Anotaurei Anataurei Kec. Yapen Selatan Kab. Kepulauan Yapen Prov. Papua",Kab. Kepulauan Yapen,,Papua
60202074,SMAN 6 TIDORE KEPULAUAN,https://sekolah.data.kemdikbud.go.id/index.php/Chome/profil/4113FA7D-0BE5-41F1-8CE1-19BD9794BB69,Jln. Selawaring - Rum Rum Kec. Tidore Utara Kota Tidore Kepulauan Prov. Maluku Utara,,Kota Tidore Kepulauan,Maluku Utara
20214969,SMAN 1 BABAKAN,https://sekolah.data.kemdikbud.go.id/index.php/Chome/profil/BA393D70-146B-49D6-AC56-19C432F32C77,JL. PANGERAN SUTAJAYA NO. 4 Karangwangun Kec. Babakan Kab. Cirebon Prov. Jawa Barat,Kab. Cirebon,,Jawa Barat
40302557,SMAN 7 BONE,https://sekolah.data.kemdikbud.go.id/index.php/Chome/profil/A8185D4E-1F5A-4EEA-A7EC-19C8BED4FA56,JL. WIYATAMANDALA Lonrae Kec. Tanete Riattang Timur Kab. Bone Prov. Sulawesi Selatan,Kab. Bone,,Sulawesi Selatan
70010974,SMA NEGERI DINGKANAL,https://sekolah.data.kemdikbud.go.id/index.php/Chome/profil/33156429-B704-4D23-901C-19CB43C6752A,"DINGKANAL, RT/RW. 006/003 DUSUN II Kamot Kec. Alor Timur Laut Kab. Alor Prov. Nusa Tenggara Timur",Kab. Alor,,Nusa Tenggara Timur
20546525,SMAS ISLAM RADEN FATAH,https://sekolah.data.kemdikbud.go.id/index.php/Chome/profil/5CE76571-C9C0-4FE4-8C74-19D1ABC39A1C,JL. KRAMAT RT 07 RW 03 Tarokan Kec. Banyuanyar Kab. Probolinggo Prov. Jawa Timur,Kab. Probolinggo,,Jawa Timur
50200366,SMAS PARIWISATA TANJUNG,https://sekolah.data.kemdikbud.go.id/index.php/Chome/profil/19BACE04-72B9-477E-9B88-19D211B9F125,Jl. Raya Tanjung - Senggigi Malaka Kec. Pemenang Kab. Lombok Utara Prov. Nusa Tenggara Barat,Kab. Lombok Utara,,Nusa Tenggara Barat
20327940,SMA BATIK 2 SURAKARTA,https://sekolah.data.kemdikbud.go.id/index.php/Chome/profil/25A4932D-7E4C-4FB9-AFF0-19D9481846C8,JL. SAM RATULANGI NO. 86 Kerten Kec. Laweyan Kota Surakarta Prov. Jawa Tengah,,Kota Surakarta,Jawa Tengah
10302034,SMAN 1 NAGARI IV BAYANG UTARA,https://sekolah.data.kemdikbud.go.id/index.php/Chome/profil/4C0FCCF4-81BE-4EDD-B5FB-19DB8F4122FF,Jln. Pasar Baru - Pc.Tebal KM.15 Asam Ku... PULUIK PULUIK SELATAN Kec. Bayang Utara Kab. Pesisir Selatan Prov. Sumatera Barat,Kab. Pesisir Selatan,,Sumatera Barat
10102738,SMA SWASTA TARBIYAH,https://sekolah.data.kemdikbud.go.id/index.php/Chome/profil/97DF9187-A318-4763-A679-19DFB2A1E153,JL. GUNUNG CUT Lembah Baru Kec. Labuhan Haji Kab. Aceh Selatan Prov. Aceh,Kab. Aceh Selatan,,Aceh
70054485,SMAS Islam Terpadu Faris Abdul Majid,https://sekolah.data.kemdikbud.go.id/index.php/Chome/profil/8A0524A1-3472-4912-953E-19E5FFCAA407,Jln. Loang Maka II Loang Maka Kec. Janapria Kab. Lombok Tengah Prov. Nusa Tenggara Barat,Kab. Lombok Tengah,,Nusa Tenggara Barat
70042733,SMA SMART CIBINONG,https://sekolah.data.kemdikbud.go.id/index.php/Chome/profil/37EFD1F6-DD5A-4195-96D7-19EE9DC64D29,Jl. Raya Narogong Km. 7 Kembang Kuning Kec. Klapanunggal Kab. Bogor Prov. Jawa Barat,Kab. Bogor,,Jawa Barat
20227435,SMAS ASSHIDDIQIYAH,https://sekolah.data.kemdikbud.go.id/index.php/Chome/profil/2620562A-8268-454D-A879-19F4CF44CF9C,JL. PAMEKARAN NO. 668 Sucikaler Kec. Karangpawitan Kab. Garut Prov. Jawa Barat,Kab. Garut,,Jawa Barat
69870894,SMAS ISLAM FATHORRAHMAN,https://sekolah.data.kemdikbud.go.id/index.php/Chome/profil/4CDDC06E-DC10-492A-B97A-19F5E14D446B,JL. PROVINSI DUSUN 2 KARYAWAN SEPAKAT JAYA Kec. Mandah Kab. Indragiri Hilir Prov. Riau,Kab. Indragiri Hilir,,Riau
30303324,SMAN 1 PULAU LAUT BARAT,https://sekolah.data.kemdikbud.go.id/index.php/Chome/profil/B3566BA4-EA90-486A-A281-19F7AB6CFF87,Jl. Transmigrasi Km 02 Lontar Timur Kec.... Lontar Timur Kec. Pulau Laut Barat Kab. Kotabaru Prov. Kalimantan Selatan,Kab. Kotabaru,,Kalimantan Selatan
10648897,SMAN 2 MUARADUA KISAM,https://sekolah.data.kemdikbud.go.id/index.php/Chome/profil/70B2752B-F120-41DB-B6EC-19FF94EA64A5,Jalan Raya Lawang Agung Bayur Tengah Kec. Muaradua Kisam Kab. Ogan Komering Ulu Selatan Prov. Sumatera Selatan,Kab. Ogan Komering Ulu Selatan,,Sumatera Selatan
20307648,SMAS MUHAMMADIYAH MUNGKID,https://sekolah.data.kemdikbud.go.id/index.php/Chome/profil/5EE1D4AD-6AB2-4362-A541-1A0B2ACB1B33,JL. PEMANDIAN  NO.8 BLABAK Mungkid Kec. Mungkid Kab. Magelang Prov. Jawa Tengah,Kab. Magelang,,Jawa Tengah
10400346,SMA NEGERI 2 TAPUNG,https://sekolah.data.kemdikbud.go.id/index.php/Chome/profil/09CAFBFF-CC53-4A1E-801B-1A0CCAA7EF28,JL. GARUDA SAKTI KM. 30 SARI GALUH Sari Galuh Kec. Tapung Kab. Kampar Prov. Riau,Kab. Kampar,,Riau
10505653,SMAN 10 SAROLANGUN,https://sekolah.data.kemdikbud.go.id/index.php/Chome/profil/7A963305-4954-4826-9322-1A10D1195AD3,Jl. Lintas Sumatera Km. 26 Limbur Tembes... Limbur Tembesi Kec. Bathin VIII Kab. Sarolangun Prov. Jambi,Kab. Sarolangun,,Jambi
69888529,SMA NURUD DZOLAM,https://sekolah.data.kemdikbud.go.id/index.php/Chome/profil/174493D0-E78D-4350-9338-1A16E9C89ECE,DESA CAMPOR Campor Kec. Konang Kab. Bangkalan Prov. Jawa Timur,Kab. Bangkalan,,Jawa Timur
50201385,SMAN 1 PUJUT,https://sekolah.data.kemdikbud.go.id/index.php/Chome/profil/7C323B70-23A7-41CB-8982-1A1B494833BF,JL. BUNG KARNO NO.7 Sengkol Kec. Pujut Kab. Lombok Tengah Prov. Nusa Tenggara Barat,Kab. Lombok Tengah,,Nusa Tenggara Barat
70032888,SMA IIBS AZ-ZAHRA,https://sekolah.data.kemdikbud.go.id/index.php/Chome/profil/D110A6E9-1440-4E86-A95B-1A1FF8C5DDEF,Dukuhan Nglorog Kec. Sragen Kab. Sragen Prov. Jawa Tengah,Kab. Sragen,,Jawa Tengah
20315696,SMA NEGERI 1 PAMOTAN,https://sekolah.data.kemdikbud.go.id/index.php/Chome/profil/FE3B0A1C-9BE9-4DAA-8708-1A221301AAA6,JL. LASEM KM. 01 PAMOTAN Pamotan Kec. Pamotan Kab. Rembang Prov. Jawa Tengah,Kab. Rembang,,Jawa Tengah
60404128,SMAS YAPIS KAIMANA,https://sekolah.data.kemdikbud.go.id/index.php/Chome/profil/F91206F1-9DD5-4D9D-B155-1A2A6FB7E74D,JLN. UTARUM AIR MERAH K R O Y Kec. Kaimana Kab. Kaimana Prov. Papua Barat,Kab. Kaimana,,Papua Barat
20212954,SMA NEGERI 1 CIBINGBIN,https://sekolah.data.kemdikbud.go.id/index.php/Chome/profil/45AE28EF-FE68-48BE-925F-1A2E5FF02D7E,JL. SUKAMAJU NO. 34A Sukamaju Kec. Cibingbin Kab. Kuningan Prov. Jawa Barat,Kab. Kuningan,,Jawa Barat
10403430,SMAN 1 BUNGA RAYA,https://sekolah.data.kemdikbud.go.id/index.php/Chome/profil/F5F3D437-4A48-455A-8439-1A35A66C2479,JL.SULTAN SYARIF KASIM DAYANG SURI Kec. Bunga Raya Kab. Siak Prov. Riau,Kab. Siak,,Riau
69757344,SMA HATI BILINGUAL BOARDING SCHOOL,https://sekolah.data.kemdikbud.go.id/index.php/Chome/profil/D38132AE-5C80-4F4B-9064-1A36DDE7CDD5,Jl. KH. Aminuddin Rangkang Kec. Kraksaan Kab. Probolinggo Prov. Jawa Timur,Kab. Probolinggo,,Jawa Timur
40310826,SMAN 11 WAJO,https://sekolah.data.kemdikbud.go.id/index.php/Chome/profil/8AE2F358-1F87-4139-B1F9-1A37CDE500CB,JL. A. MADDAREMMENG NO. 2 Peneki Kec. Takkalala Kab. Wajo Prov. Sulawesi Selatan,Kab. Wajo,,Sulawesi Selatan
30108262,SMAN 1 SUNGAI MELAYU RAYAK,https://sekolah.data.kemdikbud.go.id/index.php/Chome/profil/78223C37-699E-4FA7-991F-1A4100B4DF9A,JL. RAYA PELANG TUMBANG TITI SEI MELAYU Kec. Sungai Melayu Rayak Kab. Ketapang Prov. Kalimantan Barat,Kab. Ketapang,,Kalimantan Barat
20311319,SMA NEGERI 1 PURWANTORO,https://sekolah.data.kemdikbud.go.id/index.php/Chome/profil/097FBA47-68B5-42F6-8CB3-1A41762A128B,JL. RAYA TEGALREJO-PURWANTORO Tegalrejo Kec. Purwantoro Kab. Wonogiri Prov. Jawa Tengah,Kab. Wonogiri,,Jawa Tengah
20605090,SMAN 1 CINANGKA,https://sekolah.data.kemdikbud.go.id/index.php/Chome/profil/38A77085-C8B5-4422-AEF0-1A43D7C32D64,Jl. Raya Karang Bolong Ciparay Sindanglaya Kec. Cinangka Kab. Serang Prov. Banten,Kab. Serang,,Banten
69728683,SMAS IT AN-NAS 2 CENRANA MAROS,https://sekolah.data.kemdikbud.go.id/index.php/Chome/profil/4CF7049E-B1B5-469C-A4BE-1A468D2BBF49,CENRANA CENRANA Kec. Cenrana Kab. Maros Prov. Sulawesi Selatan,Kab. Maros,,Sulawesi Selatan
69946176,SMAN 2 KEC. BUKIK BARISAN,https://sekolah.data.kemdikbud.go.id/index.php/Chome/profil/7A839B05-1115-460E-8069-1A474AE84F61,NAGARI MAEK Maek Kec. Bukik Barisan Kab. Lima Puluh Kota Prov. Sumatera Barat,Kab. Lima Puluh Kota,,Sumatera Barat
30402812,SMA NEGERI 1 SEBUKU,https://sekolah.data.kemdikbud.go.id/index.php/Chome/profil/0F2F01DE-C2D8-4DE9-A076-1A49E6F052E1,JL. TRANS LUMBIS Pembeliangan Kec. Sebuku Kab. Nunukan Prov. Kalimantan Utara,Kab. Nunukan,,Kalimantan Utara
40103581,SMAN 3 TONDANO,https://sekolah.data.kemdikbud.go.id/index.php/Chome/profil/D092D90F-2FF3-4246-AF1E-1A52033AD2DD,JL. Parkir Timur Stadion Maesa Tondano K... Kembuan Kec. Tondano Utara Kab. Minahasa Prov. Sulawesi Utara,Kab. Minahasa,,Sulawesi Utara
50205612,SMAN 1 MONTA,https://sekolah.data.kemdikbud.go.id/index.php/Chome/profil/20505FE9-171F-4B5F-9C98-1A528F24AA0D,JL LINTAS PARADO TANGGA - MONTA - BIMA -... Tangga Kec. Monta Kab. Bima Prov. Nusa Tenggara Barat,Kab. Bima,,Nusa Tenggara Barat
30100391,SMAN 1 TELUK KERAMAT,https://sekolah.data.kemdikbud.go.id/index.php/Chome/profil/43DD0EC8-7830-4BE6-9501-1A56B3B3F074,JL. AMD SEKURA Sekura Kec. Teluk Keramat Kab. Sambas Prov. Kalimantan Barat,Kab. Sambas,,Kalimantan Barat
60303709,SMA NEGERI 4 INSUMBREI,https://sekolah.data.kemdikbud.go.id/index.php/Chome/profil/A0BEFC7C-8CCA-4DA1-928C-1A5FBDCED328,Jln. Raya Insumbrei Insumbrei Kec. Kepulauan Aruri Kab. Supiori Prov. Papua,Kab. Supiori,,Papua
69756576,SMAN 3 PUJUD,https://sekolah.data.kemdikbud.go.id/index.php/Chome/profil/283A8E86-D0D4-4E41-8178-1A628C82AACE,JL. LINTAS TANJUNG MEDAN Tanjung Medan Kec. Pujud Kab.  Rokan Hilir Prov. Riau,Kab.  Rokan Hilir,,Riau
20215977,SMAN 1 SUKAGUMIWANG,https://sekolah.data.kemdikbud.go.id/index.php/Chome/profil/1D24199A-0FCA-40C7-AFC5-1A66742E24AF,JL. BY PASS KERTASEMAYA KM.37 GEDANGAN Kec. Sukagumiwang Kab. Indramayu Prov. Jawa Barat,Kab. Indramayu,,Jawa Barat
20570824,SMAS NURUL HIDAYAH,https://sekolah.data.kemdikbud.go.id/index.php/Chome/profil/47B510AC-38D4-4A6A-8CC7-1A6692B4F0AC,Jl. Pon Pes Nurul Iman Tobai Tengah Soko... Tobai Tengah Kec. Sokobanah Kab. Sampang Prov. Jawa Timur,Kab. Sampang,,Jawa Timur
40404881,SMAN 3 BINONGKO,https://sekolah.data.kemdikbud.go.id/index.php/Chome/profil/FCD9B0E2-B1E5-4B39-B043-1A68E8995A66,JL. POROS WALI JAYA MAKMUR Wali Kec. Binongko Kab. Wakatobi Prov. Sulawesi Tenggara,Kab. Wakatobi,,Sulawesi Tenggara
69786331,SMAS DAARUL ISHLAH ISLAMIC,https://sekolah.data.kemdikbud.go.id/index.php/Chome/profil/D1DA6816-F040-4EA0-82B0-1A6C1E749C57,JL. DAARUL ISHLAH SEMENDARAN Panggung Rawi Kec. Jombang Kota Cilegon Prov. Banten,,Kota Cilegon,Banten
69756067,SMAN 1 AIR SALEH,https://sekolah.data.kemdikbud.go.id/index.php/Chome/profil/22267A23-162B-4CDE-8024-1A74F2CC47B6,Jl. Sultan Agung   Jalur 8 Jembatan 3 Salek Mukti Kec. Air Salek Kab. Banyuasin Prov. Sumatera Selatan,Kab. Banyuasin,,Sumatera Selatan
10105395,SMAS METHODIST,https://sekolah.data.kemdikbud.go.id/index.php/Chome/profil/3011AE63-CA8B-4FC5-819A-1A766EAF6747,"JL. POCUT BAREN NO.3, KEC. KUTA ALAM, KE... Lam Ara Kec. Banda Raya Kota Banda Aceh Prov. Aceh",,Kota Banda Aceh,Aceh
69968950,SMA ADVENT SERUI,https://sekolah.data.kemdikbud.go.id/index.php/Chome/profil/B586997E-AF10-425E-991C-1A853BC35DF1,JL. HASANUDDIN Serui Kota Kec. Yapen Selatan Kab. Kepulauan Yapen Prov. Papua,Kab. Kepulauan Yapen,,Papua
20232383,SMAN 1 SUKAMAKMUR,https://sekolah.data.kemdikbud.go.id/index.php/Chome/profil/27C876C2-8FAB-4FEC-BF96-1A893C85E6AF,Jln. Raya AMD Desa Sukamulya Sukamulya Kec. Sukamakmur Kab. Bogor Prov. Jawa Barat,Kab. Bogor,,Jawa Barat
50201391,SMAN 1 PRAYA,https://sekolah.data.kemdikbud.go.id/index.php/Chome/profil/DAE6C563-DD92-4A3D-889A-1A8B58F5C4F9,JLN. KI HAJAR DEWANTARA 01 PRAYA PRAYA Kec. Praya Kab. Lombok Tengah Prov. Nusa Tenggara Barat,Kab. Lombok Tengah,,Nusa Tenggara Barat
20523840,SMAS UNGGULAN BPPT DARUS SHOLAH JEMBER,https://sekolah.data.kemdikbud.go.id/index.php/Chome/profil/422E4A51-568F-4E4D-8BE6-1A9D4ED61ECC,JL. MOH. YAMIN 25 Tegal Besar Kec. Kaliwates Kab. Jember Prov. Jawa Timur,Kab. Jember,,Jawa Timur
69880471,SMA NU KARANGANYAR,https://sekolah.data.kemdikbud.go.id/index.php/Chome/profil/374B3DDC-62FB-4F66-A04D-1A9FAF8ED4A6,Jalan Patimura Desa Karanganyar Karanganyar Kec. Pasekan Kab. Indramayu Prov. Jawa Barat,Kab. Indramayu,,Jawa Barat
20309674,SMA NEGERI 1 PRAMBANAN,https://sekolah.data.kemdikbud.go.id/index.php/Chome/profil/4628C564-B180-42F1-BDE6-1AABA2678B87,JL. Manisrenggo Kebondalem Kebon Dalem Lor Kec. Prambanan Kab. Klaten Prov. Jawa Tengah,Kab. Klaten,,Jawa Tengah
20107284,SMA AL-KAUTSAR,https://sekolah.data.kemdikbud.go.id/index.php/Chome/profil/9A05ED4D-63AC-455E-84CC-1ABA33AC0166,JL. JEMBATAN SELATAN NO. 6 BLOK A Pulo Kec. Kebayoran Baru Kota Adm. Jakarta Selatan Prov. D.K.I. Jakarta,,Kota Adm. Jakarta Selatan,D.K.I. Jakarta
40311953,SMAN 21 MAKASSAR,https://sekolah.data.kemdikbud.go.id/index.php/Chome/profil/3A850FDF-78C1-40B4-9E72-1ADB5D14EDA4,Jl. Tamalanrea Raya No. 1A BTP Makassar Tamalanrea Kec. Tamalanrea Kota Makassar Prov. Sulawesi Selatan,,Kota Makassar,Sulawesi Selatan
20615529,SMAS RACHMATOELLAH KOTA SRG,https://sekolah.data.kemdikbud.go.id/index.php/Chome/profil/68A569EE-035E-4DF1-8015-1ADB72E8EB62,JL. KH AMIN JASUTA BRIMOB SERANG Lontarbaru Kec. Serang Kota Serang Prov. Banten,,Kota Serang,Banten
50304608,SMAN 1 ROTE TENGAH,https://sekolah.data.kemdikbud.go.id/index.php/Chome/profil/83ECF699-282F-411C-9949-1ADC95CD5FF9,FEAPOPI Onotali Kec. Rote Tengah Kab. Rote Ndao Prov. Nusa Tenggara Timur,Kab. Rote Ndao,,Nusa Tenggara Timur
10113366,SMA NEGERI 1 DARUL IHSAN,https://sekolah.data.kemdikbud.go.id/index.php/Chome/profil/69C9F8B1-A2D5-4A24-90B3-1AE16C295533,JL. IDI-SIMPANG DAMA Keude Dua Kec. Darul Ihsan Kab. Aceh Timur Prov. Aceh,Kab. Aceh Timur,,Aceh
10811216,SMAS ASYAFI YAH,https://sekolah.data.kemdikbud.go.id/index.php/Chome/profil/E67723EF-4582-4DD5-8B45-1AE8CCFF6A17,Seray Seray KEC. PESISIR TENGAH Kab. Pesisir Barat Prov. Lampung,Kab. Pesisir Barat,,Lampung
